id,entry_id,title,push_title,category,city,push_type,push_os,push_entire,test_mode,status,insert_time,operator,Receive/Send,Click/Show
23751,e2f5c7a5_ru,На Украине следствие по делу Савченко продлили на полгода,,Others,,delay,all,False,0,3,2018-04-22 14:34:50,aleksandrak,-/-=-,-/-=-
23753,f23097ca_ru,В Саратове появились памятник и сквер Табакова,,News_Entertainment,,delay,all,False,0,3,2018-04-22 14:38:14,aleksandrak,-/-=-,-/-=-
23756,94305b0_ru,Власти примут меры для борьбы с ураганами,,Others,,delay,all,False,0,3,2018-04-22 14:47:43,aleksandrak,-/-=-,-/-=-
23757,a23feef2_ru,Роскомнадзор сознался в блокировке Google,,Technology,,delay,all,False,0,3,2018-04-22 14:49:03,aleksandrak,-/-=-,-/-=-
23758,d4dde3c4_ru,Нину Дорошину похоронят на Пятницком кладбище 24 апреля,,Others,,delay,all,False,0,3,2018-04-22 14:51:01,aleksandrak,-/-=-,-/-=-
23759,fae71fbd_ru,На торги выставят туфли Майкла Джексона для «лунной походки»,,News_Entertainment,,delay,all,False,0,3,2018-04-22 14:56:54,aleksandrak,-/-=-,-/-=-
23760,c7b1bcdf_ru,Telegram предложил способ поддержать свободный интернет,,Technology,,delay,all,False,0,3,2018-04-22 14:57:53,aleksandrak,-/-=-,-/-=-
23761,aa6c9ba0_ru,Министр обороны ФРГ призвала занимать позицию силы в диалоге с Москвой,,News_Politics,,delay,all,False,0,3,2018-04-23 01:33:05,alexandr,-/-=-,-/-=-
23762,d92c6223_ru,Южная Корея прекращает вещание против КНДР в буферной зоне,,News_Politics,,delay,all,False,0,3,2018-04-23 01:33:32,alexandr,-/-=-,-/-=-
23763,d1b209e0_ru,Россиянка объявила голодовку в американской тюрьме,,Others,,delay,all,False,0,3,2018-04-23 01:33:59,alexandr,-/-=-,-/-=-
23764,87f5a41c_ru,Представители G7 выступили за сохранение антироссийских санкций,,News_Politics,,delay,all,False,0,3,2018-04-23 01:35:08,alexandr,-/-=-,-/-=-
23765,9c154dd6_ru,Раскрыты подробности будущих поставок зенитных комплексов С-300 в Сирию,,Others,,delay,all,False,0,3,2018-04-23 02:11:48,leiz,-/-=-,-/-=-
23766,2b45b806_ru,Беременная женщина отомстила ребенку за пролитый суп и разъярила китайцев,,Others,,delay,all,False,0,3,2018-04-23 02:17:39,leiz,-/-=-,-/-=-
23767,a88a2a56_ru,Число погибших при взрыве в Кабуле возросло до 57,,Others,,delay,all,False,0,3,2018-04-23 02:23:35,leiz,-/-=-,-/-=-
23768,e19a53a5_ru,Моргана Фримена обвинили в сексуальной связи со сводной внучкой,,Others,,delay,all,False,0,3,2018-04-23 02:30:02,leiz,-/-=-,-/-=-
23772,917f1c8b_ru,Роскомнадзор объяснил блокировку некоторых IP-адресов Google,,Technology,,delay,all,False,0,3,2018-04-23 04:48:29,alexandr,-/-=-,-/-=-
23773,962c7985_ru,В Хабаровске назвали дату начала выплат семьям погибших при крушении Ми-8,,Others,,delay,all,False,0,3,2018-04-23 04:53:01,leiz,-/-=-,-/-=-
23774,3acb2714_ru,Три человека пострадали из-за отвалившегося в самолете иллюминатора,,Others,,delay,all,False,0,3,2018-04-23 04:55:39,leiz,74/-=-,-/71=-
23775,60c3f3f9_ru,"Сегодня в Кемерове похоронят семью, погибшую при пожаре в ТЦ «Зимняя вишня»",,Others,,delay,all,False,0,3,2018-04-23 05:00:08,leiz,-/-=-,-/-=-
23782,52134281_ru,Россиянам предложат самим оплатить социальные обещания властей,Повышение НДФЛ близко,News_Politics,,immediately,all,True,0,3,2018-04-23 06:17:42,alexandr,2/-=-,-/2=-
23784,4dada9d6_ru,25 неизвестных фактов о мультфильмах Disney,,Others,,delay,all,False,0,3,2018-04-23 07:36:14,leiz,-/-=-,-/-=-
23785,f05184bc_ru,Россиянам пообещали резкий рост зарплат,,Business,,delay,all,False,0,3,2018-04-23 07:41:01,borisf,-/-=-,-/72=-
23786,a5dde6f8_ru,Глава Минстроя назвал самые благоустроенные регионы России,,News_Politics,,delay,all,False,0,3,2018-04-23 07:42:32,leiz,-/-=-,-/-=-
23787,da2a60d4_ru,Роструд напомнил о шестидневной рабочей неделе,,Others,,delay,all,False,0,3,2018-04-23 07:42:54,borisf,-/-=-,-/-=-
23788,a8e44005_ru,В России похолодает до минус 22 градусов,,Others,,delay,all,False,0,3,2018-04-23 07:44:50,borisf,-/-=-,-/-=-
23789,2f22200_ru,В Челябинске дети получили ожоги из-за бутылки с зажигательной смесью,,Others,,delay,all,False,0,3,2018-04-23 07:45:49,leiz,-/-=-,-/-=-
23790,9dbb4a5e_ru,"Google решила ""убить"" SMS в России и других странах",,Technology,,delay,all,False,0,3,2018-04-23 07:46:58,borisf,-/-=-,-/-=-
23791,5649b840_ru,Определился обладатель Кубка Гагарина,,News_Sports,,delay,all,False,0,3,2018-04-23 07:51:07,borisf,-/-=-,-/-=-
23792,2adc5983_ru,"Стало известно, сколько денег могут привезти болельщики ЧМ-2018 в Россию",,Others,,delay,all,False,0,3,2018-04-23 07:54:13,leiz,-/-=-,-/-=-
23793,de6158df_ru,СМИ узнали детали безвозмездной поставки Сирии российских С-300,,Others,,delay,all,False,0,3,2018-04-23 08:00:55,borisf,-/-=-,-/-=-
23795,569f3ed5_ru,"5 вещей, за которые собаки на нас тайно обижаются",,Others,,delay,all,False,0,3,2018-04-23 08:03:19,borisf,-/-=-,-/-=-
23808,bfde1f4b_ru,В Минфине допустили увеличение внутренних займов до 200 млрд рублей,,Business,,delay,all,False,0,3,2018-04-23 08:29:06,alexandr,-/-=-,-/-=-
23809,6e253567_ru,У россиян началась шестидневная рабочая неделя,,Others,,delay,all,False,0,3,2018-04-23 08:29:14,leiz,-/-=-,-/-=-
23810,f88a150f_ru,В России закроют онлайн-магазины Quelle и Otto,,Others,,delay,all,False,0,3,2018-04-23 08:29:39,alexandr,-/-=-,-/-=-
23811,33029df8_ru,В России появится структура по борьбе с последствиями санкций,,Others,,delay,all,False,0,3,2018-04-23 08:30:06,alexandr,-/-=-,-/-=-
23812,8de6506e_ru,Госпиталь Святой Марии готовится принять роды герцогини Кембриджской,,Others,,delay,all,False,0,3,2018-04-23 08:30:07,borisf,-/-=-,-/-=-
23813,c74819a5_ru,Иностранные туристы смогут арендовать автомобили каршеринга,,Others,,delay,all,False,0,3,2018-04-23 08:30:48,alexandr,-/-=-,-/-=-
23814,e4280649_ru,Госдуме предложат маркировать продукты знаком «Сделано в России»,,Others,,delay,all,False,0,3,2018-04-23 08:31:22,alexandr,-/-=-,-/-=-
23815,6ed5eed3_ru,Почему Ким Чен Ын решил прекратить ядерные испытания?,,News_Politics,,delay,all,False,0,3,2018-04-23 08:31:29,borisf,-/-=-,-/-=-
23816,996b29e0_ru,Около 4 тыс. россиян обратились к врачам с укусами клещей,,Others,,delay,all,False,0,3,2018-04-23 08:32:52,alexandr,-/-=-,-/-=-
23817,2d4f78c1_ru,Нурмагомедов рассказал о выборе следующего соперника,,News_Sports,,delay,all,False,0,3,2018-04-23 08:34:41,alexandr,-/-=-,-/-=-
23818,8dc0d5ba_ru,Источник раскрыл подробности контракта на ремонт крейсера «Адмирал Кузнецов»,,Others,,delay,all,False,0,3,2018-04-23 08:35:16,leiz,-/-=-,-/-=-
23819,10c05565_ru,Рейтинг Путина упал после выборов. Почему?,,News_Politics,,delay,all,False,0,3,2018-04-23 08:36:18,borisf,-/-=-,-/-=-
23820,dbc8e7f7_ru,В РПЦ с пониманием относятся к блокировке Telegram,,Others,,delay,all,False,0,3,2018-04-23 08:37:11,alexandr,-/-=-,-/-=-
23821,c55abccd_ru,В Госдуме предложили лишать мандата за несоответствие доходов и расходов,,Others,,delay,all,False,0,3,2018-04-23 08:37:50,alexandr,-/-=-,-/-=-
23824,edd4ad47_ru,В МИД заявили о готовности России развивать отношения с ЕСПЧ,,Others,,delay,all,False,0,3,2018-04-23 08:42:28,leiz,-/-=-,-/-=-
23825,57bce2ca_ru,Новые детали по делу о смерти Дмитрия Марьянова,,News_Entertainment,,delay,all,False,0,3,2018-04-23 08:44:52,borisf,-/-=-,-/-=-
23826,1b60c19f_ru,Уникальный Mercedes сдали на металлолом за 18 000 рублей,,Others,,delay,all,False,0,3,2018-04-23 08:47:22,borisf,-/-=-,-/-=-
23827,9f99dac1_ru,Обязан ли водитель садиться в машину гаишника при оформлении документов,,Others,,delay,all,False,0,3,2018-04-23 08:48:06,borisf,-/-=-,-/-=-
23828,ca3eb35d_ru,«Великий человек». Как украинская учительница Гитлера поздравляла,,News_Politics,,delay,all,False,0,3,2018-04-23 08:51:00,borisf,-/-=-,-/-=-
23830,893391ae_ru,Современный «Один дома»: мальчик улетел на Бали после ссоры с мамой,,Others,,delay,all,False,0,3,2018-04-23 08:52:59,borisf,-/-=-,-/-=-
23833,c901e988_ru,YouTube частично перестал работать в России,,Technology,,delay,all,False,0,3,2018-04-23 09:17:04,leiz,-/-=-,-/-=-
23834,86516af8_ru,Женщина украла тела толстых моделей и поплатилась,,Others,,delay,all,False,0,3,2018-04-23 09:18:52,leiz,-/-=-,-/-=-
23839,92290f42_ru,Бюст Ельцина открыли в Москве,,News_Politics,,delay,all,False,0,3,2018-04-23 10:22:51,aleksandrak,-/-=-,-/-=-
23840,67c8da47_ru,В России создают ветряк с вертикальной турбиной,,Technology,,delay,all,False,0,3,2018-04-23 10:23:25,aleksandrak,-/-=-,-/-=-
23841,890f6095_ru,Папа Франциск угостит бедных мороженым в день своих именин,,Others,,delay,all,False,0,3,2018-04-23 10:24:30,aleksandrak,-/-=-,-/-=-
23842,890f6095_ru,Папа Франциск угостит бедных мороженым в день своих именин,,Others,,delay,all,False,0,3,2018-04-23 10:24:38,aleksandrak,-/-=-,-/-=-
23843,5aae854_ru,Роскомнадзор предупреждает о фальшивых рассылках от его имени,,Technology,,delay,all,False,0,3,2018-04-23 10:26:05,aleksandrak,-/-=-,-/-=-
23844,4713dfd1_ru,В Ереване люди в форме присоединились к протестующим,,Others,,delay,all,False,0,3,2018-04-23 10:26:47,aleksandrak,-/-=-,-/-=-
23845,42cd4d47_ru,В Красноярском крае полыхает деревоперерабатывающий завод,,Others,,delay,all,False,0,3,2018-04-23 10:27:48,aleksandrak,-/-=-,-/-=-
23848,624221c8_ru,Россиянам напомнили о «бесконечной» неделе,,Others,,delay,all,False,0,3,2018-04-23 10:37:34,aleksandrak,-/-=-,-/-=-
23849,efae04b9_ru,Россия заработает на футболе миллиарды долларов,,Others,,delay,all,False,0,3,2018-04-23 10:40:05,aleksandrak,-/-=-,-/-=-
23850,8783fa59_ru,Ученые записали музыкальный альбом в молекуле ДНК,,Others,,delay,all,False,0,3,2018-04-23 10:48:50,aleksandrak,-/-=-,-/-=-
23852,73b2a6f9_ru,Индия отказалась от истребителя Су-57: самолет разочаровал военных,,Others,,delay,all,False,0,3,2018-04-23 10:55:49,borisf,-/-=-,-/-=-
23855,28663ca8_ru,Алкоголь убивает. Но насколько быстро?,,Others,,delay,all,False,0,3,2018-04-23 11:00:16,aleksandrak,-/-=-,-/-=-
23856,362c1352_ru,"Посмотрите, как работает новый робот для утилизации iPhone",,Others,,delay,all,False,0,3,2018-04-23 11:00:59,aleksandrak,-/-=-,-/-=-
23857,c5b66696_ru,«Большая семерка» определила курс в отношении России,,Others,,delay,all,False,0,3,2018-04-23 11:02:08,aleksandrak,-/-=-,-/-=-
23860,2160383f_ru,Медведь напал на человека в Пермском крае,,Others,,delay,all,False,0,3,2018-04-23 13:32:32,aleksandrak,-/-=-,-/-=-
23861,6cfea341_ru,Россияне определили идеальный уровень дохода,,Others,,delay,all,False,0,3,2018-04-23 13:35:08,aleksandrak,-/-=-,-/-=-
23862,97b9519a_ru,Премьер Армении подал в отставку на фоне массовых протестов,,Others,,delay,all,False,0,3,2018-04-23 13:39:32,borisf,-/-=-,-/-=-
23864,c3038868_ru,Это мальчик: Кейт Миддлтон родила третьего наследника,,News_Entertainment,,delay,all,False,0,3,2018-04-23 13:44:13,borisf,-/-=-,-/-=-
23865,3aedb777_ru,Кейт Миддлтон родила сына,,News_Entertainment,,delay,all,False,0,3,2018-04-23 13:45:09,aleksandrak,-/-=-,-/-=-
23869,b8942df0_ru,Названы книжные предпочтения россиян,,Others,,delay,all,False,0,3,2018-04-23 13:52:09,aleksandrak,-/-=-,-/-=-
23870,714e3366_ru,"В Кремле заявили, что не будут вмешиваться в события в Армении",,News_Politics,,delay,all,False,0,3,2018-04-23 13:53:57,aleksandrak,-/-=-,-/-=-
23872,4640ac24_ru,США захотели исключить Россию из проекта лунной станции из-за отсталости,,Technology,,delay,all,False,0,3,2018-04-23 13:55:56,aleksandrak,-/-=-,-/-=-
23876,5dae2d75_ru,Каждый восьмой вид птиц может исчезнуть,,Science,,delay,all,False,0,3,2018-04-23 14:07:35,aleksandrak,-/-=-,-/-=-
23883,bccd6dba_ru,Как обогнать спорткар на велике: история безумного рекорда скорости,,Others,,delay,all,False,0,3,2018-04-23 16:30:41,alexandr,-/-=-,-/-=-
23884,22eb121d_ru,Почему профессия врача становится опасной?,,Others,,delay,all,False,0,3,2018-04-23 16:31:01,alexandr,-/-=-,-/-=-
23885,15721752_ru,Путин присвоил звание Героя Труда пяти россиянам,,Others,,delay,all,False,0,3,2018-04-23 16:31:57,alexandr,-/-=-,-/-=-
23886,886ff14a_ru,Россияне рассказали о количестве денег для полного счастья,,Others,,delay,all,False,0,3,2018-04-23 16:32:35,alexandr,-/-=-,-/-=-
23892,1d1ec813_ru,Путин после инаугурации примет беспрецедентное решение,,News_Politics,,delay,all,False,0,3,2018-04-23 17:09:46,borisf,123/-=-,-/-=-
23893,88d13f3f_ru,Россияне высказались за введение ответственности врача за качество лечения,,Others,,delay,all,False,0,3,2018-04-24 01:19:32,alexandr,11/-=-,-/-=-
23894,f4ce8e3e_ru,Страны «Большой семерки» оценили поведение КНДР,,Others,,delay,all,False,0,3,2018-04-24 01:21:59,alexandr,-/-=-,-/-=-
23895,d15940a6_ru,В Китае назвали одну из главных задач ШОС,,Others,,delay,all,False,0,3,2018-04-24 03:26:59,alexandr,-/-=-,-/-=-
23896,2b913981_ru,Страны G7 могут ужесточить санкции против РФ из-за ситуации в Донбассе,,Others,,delay,all,False,0,3,2018-04-24 03:27:55,alexandr,2/-=-,-/13=-
23897,ec6f30ff_ru,ГИБДД хочет изменить правила сдачи экзамена на права,«Город» с «площадкой»,Auto,,delay,all,True,0,3,2018-04-24 06:23:43,alexandr,53/-=-,-/45=-
23904,7e476e67_ru,В Москве нашли очаг энцефалита,,Others,,delay,all,False,0,3,2018-04-24 07:54:38,alexandr,-/-=-,-/-=-
23905,2870173f_ru,Месси воспротивился переходу Неймара в «Реал»,,News_Sports,,delay,all,False,0,3,2018-04-24 07:55:46,alexandr,-/-=-,-/-=-
23906,36728286_ru,Россиянам пообещали обвал цен на авиабилеты,,Others,,delay,all,False,0,3,2018-04-24 07:56:12,alexandr,-/-=-,-/-=-
23908,a3ab3d35_ru,Эксперты назвали самое продаваемое в 2017 году лекарство,,Others,,delay,all,False,0,3,2018-04-24 08:49:24,borisf,-/-=-,-/-=-
23909,e29130ac_ru,Перед майскими праздниками заработает новая ловушка для водителей,,Auto,,delay,all,False,0,3,2018-04-24 08:50:24,borisf,-/-=-,-/-=-
23910,d13ecb44_ru,"Росконтроль определил, какое мороженое вредит здоровью",,Others,,delay,all,False,0,3,2018-04-24 08:58:19,borisf,-/-=-,-/-=-
23911,fabba653_ru,Эксперты выбрали тройку идеальных автомобилей для водителей-новичков,,Auto,,delay,all,False,0,3,2018-04-24 09:02:09,borisf,-/-=-,-/-=-
23912,102d3cad_ru,CAS объявил показания Родченкова голословными и бездоказательными,,Others,,delay,all,False,0,3,2018-04-24 09:03:36,borisf,-/-=-,-/-=-
23913,3bab9d8a_ru,В России придумали новое наказание за исполнение санкций США,,Others,,delay,all,False,0,3,2018-04-24 09:06:55,borisf,4/-=-,-/-=-
23914,f94ecbd_ru,36-летний Аршавин зажигает в Казахстане. В России всем наплевать,,News_Sports,,delay,all,False,0,3,2018-04-24 09:08:46,borisf,-/-=-,-/-=-
23915,519609a3_ru,Наказать Россию: «Большая семерка» готовит санкции,,News_Politics,,delay,all,False,0,3,2018-04-24 09:13:39,borisf,-/-=-,-/-=-
23916,26d3e3ef_ru,Россия получила ответы Великобритании по делу Скрипалей,,Others,,delay,all,False,0,3,2018-04-24 09:17:17,borisf,-/-=-,-/-=-
23917,1a9a53e8_ru,"Маленький, но страшный. Россиян атакуют опасные клещи",,Others,,delay,all,False,0,3,2018-04-24 09:24:33,borisf,13/-=-,-/-=-
23929,f38aff62_ru,«Доверенное лицо Путина». Кого на этот раз арестовала Украина?,,News_Politics,,delay,all,False,0,3,2018-04-24 10:06:06,borisf,-/-=-,-/-=-
23930,2eb8cc9a_ru,"""Убейте меня"": подробности о задавившем 10 человек в Торонто психопате",,Others,,delay,all,False,0,3,2018-04-24 10:21:42,borisf,-/-=-,-/-=-
23931,86bfaa44_ru,Канделаки рассказала о романе с Брюсом Уиллисом,,News_Entertainment,,delay,all,False,0,3,2018-04-24 10:32:59,borisf,-/-=-,-/-=-
23932,3f2fdd2_ru,Что Россия проиграла в Армении,,News_Politics,,delay,all,False,0,3,2018-04-24 10:59:45,aleksandrak,-/-=-,-/-=-
23934,34b9db61_ru,В G7 заявили о готовности диалога с Россией,,Others,,delay,all,False,0,3,2018-04-24 11:01:23,aleksandrak,-/-=-,-/-=-
23935,4436a3bf_ru,Улюкаев может отправиться в колонию на следующей неделе,,Others,,delay,all,False,0,3,2018-04-24 11:02:34,aleksandrak,-/-=-,-/-=-
23937,ac4b96ab_ru,Хакеры взломали сайт минэнерго Украины и потребовали криптовалюту,,Others,,delay,all,False,0,3,2018-04-24 11:04:52,aleksandrak,-/-=-,-/-=-
23938,ba497724_ru,В России изменят правила сдачи экзаменов на права,,Others,,delay,all,False,0,3,2018-04-24 11:06:15,aleksandrak,-/-=-,-/-=-
23940,aac80800_ru,В России произошел масштабный сбой YouTube,,Technology,,delay,all,False,0,3,2018-04-24 11:08:09,alexandr,-/-=-,-/-=-
23941,2a1836e4_ru,В этом сезоне клещи укусили уже 4 тысячи россиян,,Others,,delay,all,False,0,3,2018-04-24 11:09:10,aleksandrak,-/-=-,-/-=-
23942,81dc0f17_ru,Кадыров пригрозил посадить Трампа и Меркель,,News_Politics,,delay,all,False,0,3,2018-04-24 11:09:41,alexandr,-/-=-,-/-=-
23943,75536238_ru,Финляндия отказалась раздавать гражданам деньги,,News_Politics,,delay,all,False,0,3,2018-04-24 11:10:18,aleksandrak,-/-=-,-/-=-
23945,ba37d98_ru,Украина хочет добровольно отказаться от Крыма,,News_Politics,,delay,all,False,0,3,2018-04-24 11:12:47,aleksandrak,11/-=-,-/10=-
23948,951c57f3_ru,В Индонезии нашли десятки необычных существ,,Science,,delay,all,False,0,3,2018-04-24 11:14:28,aleksandrak,-/-=-,-/-=-
23950,b74be0b0_ru,"ВЦИОМ выяснил, сколько россиян выступают за сохранение доступа к Telegram",,Technology,,delay,all,False,0,3,2018-04-24 11:15:14,aleksandrak,-/-=-,-/-=-
23953,47305d92_ru,У россиян стало больше «свободных» денег,,Others,,delay,all,False,0,3,2018-04-24 11:21:56,aleksandrak,-/-=-,-/-=-
23954,78e1c78f_ru,Россия посчитала траты на помощь другим странам,,Others,,delay,all,False,0,3,2018-04-24 11:23:01,aleksandrak,-/-=-,-/-=-
23962,1f7509e_ru,Московский победитель олимпиады по химии погиб после проверки ФСБ,,Education,,delay,all,False,0,3,2018-04-24 12:01:56,borisf,-/-=-,-/-=-
23963,de706154_ru,Netflix снимет анимационный сериал по мотивам «Форсажа»,,Others,,delay,all,False,0,3,2018-04-24 13:31:42,alexandr,-/-=-,-/-=-
23964,9225fb23_ru,МВД предлагает ввести бесплатные курсы русского языка для мигрантов,,Others,,delay,all,False,0,3,2018-04-24 13:32:32,alexandr,-/-=-,-/-=-
23965,c88878c1_ru,Российские универсалы Lada Vesta начали продавать в Европе,,Auto,,delay,all,False,0,3,2018-04-24 13:34:09,alexandr,4/-=-,-/-=-
23968,bb8f29d2_ru,«Газпром» допустил транзит газа через Украину после 2019 года,,Others,,delay,all,False,0,3,2018-04-24 13:43:03,alexandr,-/-=-,-/-=-
23969,743f6bb4_ru,"""Дуров, верни 4 рубля"": налоговики ищут основателя Telegram за долги",,Others,,delay,all,False,0,3,2018-04-24 13:43:39,alexandr,-/-=-,-/-=-
23972,377e8c1b_ru,Облака Урана пахнут тухлыми яйцами,,Others,,delay,all,False,0,3,2018-04-24 13:53:58,aleksandrak,-/-=-,-/-=-
23974,d7f0cb0_ru,Пробную перепись населения можно будет пройти на сайте госуслуг,,Others,,delay,all,False,0,3,2018-04-24 13:56:59,aleksandrak,-/-=-,-/-=-
23975,89e94108_ru,Мода на воду. Можно ли выпить слишком много жидкости?,,Others,,delay,all,False,0,3,2018-04-24 13:58:41,aleksandrak,-/-=-,-/-=-
23977,2e5b8ffc_ru,«Аэрофлот» запускает традиционную акцию для ветеранов ВОВ,,Others,,delay,all,False,0,3,2018-04-24 14:00:30,aleksandrak,-/-=-,-/-=-
23978,a64ae8cd_ru,Технологии: 35 прогнозов на 2018 год,,Technology,,delay,all,False,0,3,2018-04-24 14:03:09,aleksandrak,-/-=-,-/-=-
23980,5ca29a74_ru,Украина объявила России речную блокаду,,Others,,delay,all,False,0,3,2018-04-24 14:06:42,aleksandrak,-/-=-,-/-=-
23981,8aaabd44_ru,Путин обойдется без «Кортежа» в день инаугурации,,Others,,delay,all,False,0,3,2018-04-24 14:07:15,aleksandrak,40/-=-,-/38=-
23982,608efed1_ru,С первыми лучами. С каких продуктов лучше начинать свой день,,Others,,delay,all,False,0,3,2018-04-24 14:09:38,aleksandrak,-/-=-,-/-=-
23983,21d4752d_ru,Мать Сержа Саргсяна умерла в день его отставки,,Others,,delay,all,False,0,3,2018-04-24 14:11:19,borisf,-/-=-,-/-=-
23984,1c020311_ru,Журналисты «Фонтанки» выплатили долги Павла Дурова,,Others,,delay,all,False,0,3,2018-04-24 14:13:24,borisf,-/-=-,-/-=-
23985,12bdc6d6_ru,Финнов оставят только с условным доходом,,Technology,,delay,all,False,0,3,2018-04-24 14:15:17,borisf,-/-=-,-/-=-
23986,4059d673_ru,Найдено средство против неизлечимого рака,,Science,,delay,all,False,0,3,2018-04-25 02:03:24,leiz,-/-=-,-/-=-
