id,entry_id,title,push_title,category,city,push_type,push_os,push_entire,test_mode,status,insert_time,operator,Receive/Send,Click/Show
7593,b19fdeb6_in,This is what PM Modi's sister has to say about her brother's work,,News_Politics,,delay,all,False,False,3,2017-10-08 10:29:41,apoorvs,3532512/-=-,57059/3051380=1.87%
7594,1e154cdc_in,101-Year-Old Punjabi Grandma Is A Runner. Find Out Her Fitness Secret,,Health,,delay,all,False,False,3,2017-10-08 10:29:57,apoorvs,258025/-=-,8454/227574=3.715%
7595,f0d42331_in,Farah Khan wishes Gauri Khan on her birthday with an endearing photo,,News_Entertainment,,delay,all,False,False,3,2017-10-08 10:30:11,apoorvs,235769/-=-,4235/228818=1.851%
7596,19c59180_in,Kedarnath First Look: Doesn't Sara Ali Khan Look Just Like Mom Amrita Singh?,,News_Entertainment,,delay,all,False,False,3,2017-10-08 10:30:52,apoorvs,113542/-=-,2668/93972=2.839%
7597,fcec6577_in,"Naseeruddin Shah, Raveena Tandon, Anil Kapoor Attend Kundan Shah's Funeral",,News_Entertainment,,delay,all,False,False,3,2017-10-08 10:31:24,apoorvs,102004/-=-,6492/84744=7.661%
7598,c3daea21_in,"Bigg Boss 11: Arshi rides the bull, Salman grills contestants for their utterly shocking behaviour",,News_Entertainment.TV,,delay,all,False,False,3,2017-10-08 10:32:10,apoorvs,548590/-=-,15760/445417=3.538%
7599,c138aa72_in,Arun Jaitley says demonetisation led to decline in terror activities in Kashmir,,News_Politics,,delay,all,False,False,3,2017-10-08 10:32:43,apoorvs,73675/-=-,3789/68936=5.496%
7600,11290a7f_in,"Meet Karan, First Indian To Get His Eyeballs Tattooed",,Fashion,,delay,all,False,False,3,2017-10-08 10:33:02,apoorvs,118472/-=-,2244/104015=2.157%
7601,4489fc3c_in,Andhra Pradesh: Godman's daughter gets god-like wedding,,Religion,,delay,all,False,False,3,2017-10-08 10:33:49,apoorvs,221763/-=-,6771/185058=3.659%
7602,b1ca711f_in,Over 120 BJP-RSS workers killed since Communists came to power: Amit Shah,,News_Politics,,delay,all,False,False,3,2017-10-08 10:34:30,apoorvs,3402/-=-,93/3073=3.026%
7603,f95d554a_in,यूपी में सामने आया 2100 करोड़ का राशन घोटाला!,,News_Politics,,delay,all,False,False,3,2017-10-08 10:40:41,apoorvs,44705/-=-,1841/40927=4.498%
7604,c32098b6_in,"इस क्रिकेटर पर अटका बॉलीवुड हसीना जरीन खान का दिल, जानिए कौन है वो?",,News_Entertainment,,delay,all,False,False,3,2017-10-08 10:40:54,apoorvs,3106/-=-,117/2817=4.153%
7605,c0f27246_in,"जेतली का कांग्रेस पर हमला, कहा- नेतृत्व संकट से जूझ रही पार्टी",,News_Politics,,delay,all,False,False,3,2017-10-08 10:41:15,apoorvs,1882807/-=-,31580/1800808=1.754%
7606,b2290259_in,BIG BOSS 11: सलमान की डांट के बाद जुबैर ने खाई नींद की गोलियां!,,News_Entertainment.TV,,delay,all,False,False,3,2017-10-08 10:41:30,apoorvs,48456/-=-,1914/36584=5.232%
7607,b58ddc42_in,Sourav's Sacrifice Made MS Dhoni The Cricketer He Is Today: Sehwag,,News_Sports.Cricket,,delay,all,False,False,3,2017-10-08 10:43:11,atharno,162213/-=-,7417/146247=5.072%
7608,74155acd_in,"महाराष्ट्र के यवतमाल में किसानों के लिए मौत बना कीटनाशक, अब तक 20 की गई जान",,Others,,delay,all,False,False,3,2017-10-08 10:43:59,apoorvs,77909/-=-,2843/69737=4.077%
7609,e14010e9_in,"कनॉट प्लेस में BJP की जनरक्षा यात्रा, CPM पर बरसे अमित शाह",,News_Politics,,delay,all,False,False,3,2017-10-08 10:44:11,apoorvs,1518/-=-,73/1156=6.315%
7610,49c578d6_in,"वडनगर में बोले पीएम मोदी, देश के लिए अब पहले से भी ज्यादा मेहनत करूंगा",,News_Politics,,delay,all,False,False,3,2017-10-08 10:44:32,apoorvs,76345/-=-,2418/64477=3.75%
7611,470ecfae_in,"फैंस को नहीं भाया सैफ का 'शेफ' अंदाज, जानें कलेक्शन",,News_Entertainment,,delay,all,False,False,3,2017-10-08 10:44:54,apoorvs,8021/-=-,232/7670=3.025%
7612,f836ac76_in,"दिल्ली: सांसद की कोठी में महिला से रेप, मैनेजर पर आरोप",,Crime,,delay,all,False,False,3,2017-10-08 10:45:21,apoorvs,207883/-=-,12951/174855=7.407%
7613,a656ddc_in,अब AK -47 से निकलेंगी प्लास्टिक की गोलियां,,Others,,delay,all,False,False,3,2017-10-08 10:45:38,apoorvs,4337/-=-,160/3516=4.551%
7614,4fdfaf9d_in,किसी भी शॉर्ट नोटिस पर हम युद्ध के लिए तैयार हैं : वायुसेना प्रमुख बीएस धनोआ,,Others_Terrorism,,delay,all,False,False,3,2017-10-08 10:46:17,apoorvs,1732/-=-,103/1559=6.607%
7615,77604be4_in,"जब 1 मिनट तक आमिर खान मांगते रहे आइक्रीम, हाथ लगा ठेंगा",,News_Entertainment,,delay,all,False,False,3,2017-10-08 10:46:39,apoorvs,7620/-=-,331/7017=4.717%
7616,1984e820_in,"8 दिन में 100 Cr के क्लब में शामिल हुई 'जुड़वां 2', वर्ल्डवाइल्ड कमाई 150 Cr पार",,News_Entertainment,,delay,all,False,False,3,2017-10-08 10:47:02,apoorvs,2333/-=-,73/2179=3.35%
7617,4bf9cf61_in,चेतन भगत को भारी पड़ गई अंग्रेजी की एक भूल...,,News_Entertainment,,delay,all,False,False,3,2017-10-08 10:47:16,apoorvs,35357/-=-,1586/30413=5.215%
7618,6a78de10_in,"जब शाहरुख खान से परेशान होकर गौरी ने कर लिया था ब्रेकअप, पढ़ें लव-स्टोरी",,News_Entertainment,,delay,all,False,False,3,2017-10-08 10:47:33,apoorvs,49913/-=-,1934/45689=4.233%
7619,d14cf21a_in,"प्रेमी के घर के सामने धरना पर बैठी प्रेमिका, बोली- चल अभी कर शादी ...वरना",,Crime,,delay,all,False,False,3,2017-10-08 10:48:01,apoorvs,191967/-=-,6857/201324=3.406%
7620,fbb30521_in,"कोहली ने बाउंड्री से किया 'बुलेट थ्रो', सीधे गिल्ली उड़ी तो धोनी हुए इंप्रेस",,News_Sports.Cricket,,delay,all,False,False,3,2017-10-08 10:48:23,apoorvs,64288/-=-,2596/49826=5.21%
7621,ba3ed2e3_in,Amit Shah's son to file Rs 100 crore criminal defamation suit on The Wire,,News_Politics,,delay,all,False,False,3,2017-10-08 13:43:54,apoorvs,25335/-=-,1375/36859=3.73%
7622,226cae12_in,Karwa Chauth 2017: Lovely photos of women celebrating the festival,,News_Entertainment,,delay,all,False,False,3,2017-10-08 14:35:58,apoorvs,305967/-=-,10512/253130=4.153%
7623,daf8406a_in,Virat Kohli's adorable moments with MS Dhoni's daughter Ziva,,News_Sports.Cricket,,delay,all,False,False,3,2017-10-08 14:36:53,apoorvs,827129/-=-,24817/704367=3.523%
7624,2c9b756a_in,Defence minister Nirmala Sitharaman teaches Chinese soldiers the meaning of Namaste,,News_Politics,,delay,all,False,False,3,2017-10-08 15:24:02,apoorvs,17214/-=-,428/13437=3.185%
7625,84efcf30_in,"Fireworks explosion kills two in Agra, injures three",,Others,,delay,all,False,False,3,2017-10-08 15:37:53,apoorvs,126225/-=-,3352/109821=3.052%
7626,28421450_in,"After Sitharaman Visits Sikkim Border, China Tells India to Abide by The Historic Treaty",,News_Politics,,delay,all,False,False,3,2017-10-08 15:38:32,apoorvs,66345/-=-,1787/50156=3.563%
7627,a458f3f5_in,पत्नी को सजा दिलाने के लिए कर रहा हूं सुसाइड...लिखा 16 पेज का नोट,,Crime,,delay,all,False,False,3,2017-10-08 15:43:20,apoorvs,680812/-=-,52207/605401=8.624%
7628,704c19a8_in,अदनान-उमर अब्दुल्ला कश्मीर में म्यूजिकल कॉन्सर्ट को लेकर twitter पर भिड़े,,News_Politics,,delay,all,False,False,3,2017-10-08 15:46:00,apoorvs,12254/-=-,275/5747=4.785%
7629,4a80397a_in,अमिताभ बच्चन के बर्थडे से पहले आमिर खान का बिग-बी के बारे में बड़ा बयान,,News_Entertainment.Bollywood,,delay,all,False,False,3,2017-10-08 15:53:36,apoorvs,99841/-=-,3025/95576=3.165%
7630,388d3989_in,"अमित शाह के बेटे के बचाव में उतरी मोदी सरकार, 100 करोड़ का मुकदमा",,News_Politics,,delay,all,False,False,3,2017-10-08 15:54:32,apoorvs,467/-=-,19/422=4.502%
7631,3a762f04_in,अडाणी की कोयला खान परियोजना के खिलाफ ऑस्ट्रेलिया में हजारों लोग सड़कों पर उतरे,,Business,,delay,all,False,False,3,2017-10-08 15:54:57,apoorvs,244/-=-,24/218=11.01%
7632,6351cff_in,"धोनी की बेटी के साथ चाचू विराट की मस्ती, वायरल हो रहा है वीडियो",,News_Sports,,delay,all,False,False,3,2017-10-08 15:55:19,apoorvs,71422/-=-,1971/69013=2.856%
7633,9ff6c326_in,"चीन से तनाव के बीच नाथू ला पहुंची रक्षा मंत्री, फोटो ले रहे चीनी सैनिकों को हाथ हिलाकर दिया ये संदेश",,News_Politics,,delay,all,False,False,3,2017-10-08 15:55:53,apoorvs,82/-=-,8/64=12.5%
7634,15f081cb_in,"रेलवे का वीआईपी संस्कृति समाप्त करने पर जोर, 36 साल पुराना एक प्रोटोकॉल हुआ समाप्त",,News_Politics,,delay,all,False,False,3,2017-10-08 15:56:13,apoorvs,26/-=-,4/22=18.18%
7635,28d0f2f1_in,"केरल पहुंचे राष्‍ट्रपति रामनाथ कोविंद, बारिश के बीच बिना छाते के ली सलामी",,News_Politics,,delay,all,False,False,3,2017-10-08 15:56:26,apoorvs,31/-=-,-/29=-
7636,64c76914_in,कुलदीप यादव का सामना करते एरॉन फिंच के साथ हुई ये हैरान कर देने वाली घटना,,News_Sports,,delay,all,False,False,3,2017-10-08 15:56:39,apoorvs,3683/-=-,192/3329=5.767%
7637,ad0e370a_in,"करवा चौथ 2017: सुहागिनों ने चांद देख कर तोड़ा व्रत, जानिए पूजा विधि",,Others,,delay,all,False,False,3,2017-10-08 15:56:54,apoorvs,4727/-=-,242/4563=5.304%
7638,b5487829_in,वडनगर में पीएम मोदी: गृहनगर में रोड शो कर मातृभूमि को किया नमन,,News_Politics,,delay,all,False,False,3,2017-10-08 15:57:11,apoorvs,79/-=-,4/77=5.195%
7639,eaf57a1e_in,इस जगह ने मुझे ज़हर पीना सिखाया: नरेंद्र मोदी,,News_Politics,,delay,all,False,False,3,2017-10-08 15:58:10,apoorvs,1434/-=-,77/1246=6.18%
7640,fd3d68a0_in,"दिल्ली में दिवाली पर दिखेगी गंदगी, MCD के सफाई कर्मचारियों ने हड़ताल का किया एेलान",,Others,,delay,all,False,False,3,2017-10-08 15:58:26,apoorvs,2787/-=-,78/2536=3.076%
7641,93744fd4_in,राइटिंग में बनाना है करियर तो ये टिप्स आएंगे बेहद काम,,Education,,delay,all,False,False,3,2017-10-08 15:58:46,apoorvs,1238/-=-,39/1111=3.51%
7642,699f7fbf_in,"54,000 Petrol Pumps To Go On Strike: Here's Why",No Petrol!,Business,,immediately,all,True,False,3,2017-10-09 03:38:36,utsavm,5176677/-=-,161467/4622125=3.493%
7643,3549826d_in,"WhatsApp से जल्द ही हटने वाला है ये फीचर, जान लें इसके बारे में",Tech Wrap,Technology,,immediately,all,True,False,3,2017-10-09 03:42:02,utsavm,2884918/-=-,144209/2505235=5.756%
7644,63a9e4cc_in,Karwa Chauth 2017: B-Town divas look gorgeous – See photos,,News_Entertainment,,delay,all,False,False,3,2017-10-09 03:42:17,xinyunx,937640/-=-,28552/702817=4.063%
7645,a7280ab9_in,"Bigg Boss कंटेस्‍टेंट जुबैर खान ने दर्ज कराई शिकायत, बोले सलमान ने मुझे धमकाया",,News_Entertainment.TV,,delay,all,False,False,3,2017-10-09 03:42:36,utsavm,25473/-=-,784/21415=3.661%
7646,7b221a77_in,"Army commanders to meet today, discuss Doklam standoff, war preparedness",,News_Politics,,delay,all,False,False,3,2017-10-09 03:42:45,xinyunx,10524/-=-,418/7354=5.684%
7647,ac1cb3ec_in,"GST breather for common man, more items likely to get cheaper",,Business,,delay,all,False,False,3,2017-10-09 03:42:55,xinyunx,10003/-=-,380/6337=5.997%
7648,8cee6bee_in,"हवालात में हनीप्रीत ने रखा करवा चौथ का व्रत, यूं गुजारा पूरा दिन",,Crime,,delay,all,False,False,3,2017-10-09 03:43:00,utsavm,80202/-=-,2929/65577=4.467%
7649,1f9f4a22_in,"8वीं पास के लिए FCI में वैकेंसी, 20 हजार सैलरी",,Education,,delay,all,False,False,3,2017-10-09 03:43:15,utsavm,353685/-=-,16117/346469=4.652%
7650,22c648d8_in,"Arunachal chopper crash: Soldiers' bodies sent in cardboard boxes, Army calls it aberration",,Others,,delay,all,False,False,3,2017-10-09 03:43:25,xinyunx,2408/-=-,60/1781=3.369%
7651,689e187b_in,"इन 5 फिल्मों में रेखा ने निभाए इतने बोल्ड किरदार, आज भी आहें भरते हैं दीवाने",,News_Entertainment,,delay,all,False,False,3,2017-10-09 03:44:16,utsavm,9027/-=-,577/7712=7.482%
7652,9121ea81_in,"शादी से ठीक पहले दूल्हे हो रहे गिरफ्तार, जानें क्या है वजह",,Others,,delay,all,False,False,3,2017-10-09 03:47:19,utsavm,252834/-=-,19013/222831=8.532%
7653,a5919bb5_in,Five PPF Account Benefits You May Not Know About,,Business,,delay,all,False,False,3,2017-10-09 03:48:54,xinyunx,70653/-=-,3098/54094=5.727%
7654,f228a148_in,Government Gold Bond To Be Launched Tomorrow: What You Need To Know,,Business,,delay,all,False,False,3,2017-10-09 03:55:31,utsavm,3392/-=-,32/2449=1.307%
7655,e9e91d1_in,"Unlimited Calling, 1GB Per Day: Reliance Communications Freedom Pack",,Technology,,delay,all,False,False,3,2017-10-09 03:56:36,utsavm,635394/-=-,25700/437391=5.876%
7656,e3720b7e_in,How Sourav Ganguly played his part in making of the legend of MS Dhoni,,News_Sports,,delay,all,False,False,3,2017-10-09 03:58:02,utsavm,684888/-=-,16314/484589=3.367%
7657,d49e7316_in,"'Love Jihad': Two fresh cases reach SC, hearing resumes today",,Crime,,delay,all,False,False,3,2017-10-09 03:58:17,utsavm,21690/-=-,473/15118=3.129%
7658,71b36264_in,90 Lakh Truckers Begin India-wide Chakka Jam Against GST,,Crime,,delay,all,False,False,3,2017-10-09 04:13:42,utsavm,137038/-=-,3481/104810=3.321%
7659,6a1acf18_in,Watch Video: Samsung Galaxy Duos explodes in man's pocket,,Technology,,delay,all,False,False,3,2017-10-09 04:13:57,utsavm,315336/-=-,5254/210516=2.496%
7660,2fd021ea_in,Railway Tickets may get cheaper! Click to know How,,Others,,delay,all,False,False,3,2017-10-09 04:39:37,utsavm,29447/-=-,1298/24744=5.246%
7661,ec591f18_in,Bigg Boss 11: Evicted contestant files complaint against Salman Khan,,News_Entertainment.TV,,delay,all,False,False,3,2017-10-09 04:39:54,utsavm,782931/-=-,22516/550211=4.092%
7662,585df58f_in,"BlackBerry Motion with full touchscreen, 4000 mAh battery unveiled",,Technology,,delay,all,False,False,3,2017-10-09 04:48:54,utsavm,225337/-=-,10766/203779=5.283%
7663,c34059ac_in,Kangana- Hrithik controversy: Here's the latest,,News_Entertainment,,delay,all,False,False,3,2017-10-09 04:51:11,utsavm,591720/-=-,18200/434967=4.184%
7664,f4e2c2a2_in,Bigg Boss 11: Evicted contestant Zubair Khan files complaint against Salman Khan,,News_Entertainment,,delay,all,False,False,3,2017-10-09 05:11:04,xinyunx,1394345/-=-,39253/1063402=3.691%
7665,b223d2a8_in,"धनहीनता के योग बनते हैं कुछ इस तरह, जातक पैसे-पैसे के लिए तरस जाता है",,Religion,,delay,all,False,False,3,2017-10-09 05:18:43,utsavm,14/-=-,-/12=-
7666,e342a6e2_in,गोधरा कांड: दोषियों की सजा पर गुजरात हाईकोर्ट का आज आएगा फैसला,,Crime,,delay,all,False,False,3,2017-10-09 05:18:50,utsavm,286/-=-,14/237=5.907%
7667,f04a40c2_in,"न विज्ञापन हैं, न कोई चार्ज फिर कैसे कमाई करता है वॉट्सऐप, ये है फंडा",,Technology,,delay,all,False,False,3,2017-10-09 05:18:56,utsavm,23667/-=-,1518/20711=7.329%
7668,1cae3a34_in,"बिना सिम के भी हो सकती है कालिंग, ये है trick",,Technology,,delay,all,False,False,3,2017-10-09 05:19:02,utsavm,652997/-=-,43667/553223=7.893%
7669,1e4936dc_in,"बिग बॉस के डायरेक्टर को डेट कर रही ये कंटेस्टेंट, करती है इंजीनियर की नौकरी",,News_Entertainment,,delay,all,False,False,3,2017-10-09 05:19:09,utsavm,2130115/-=-,71961/2012243=3.576%
7670,c4bca114_in,पीएफ ट्रांसफर करवाना व पैसा निकालना अब आसान,,Business,,delay,all,False,False,3,2017-10-09 05:19:42,utsavm,59/-=-,3/55=5.455%
7671,d0fa3dfb_in,तो इस तरह से मनाया हनीप्रीत ने अपना करवाचौथ !,,Others,,delay,all,False,False,3,2017-10-09 05:20:10,utsavm,61127/-=-,3132/50923=6.15%
7672,33e60193_in,आज का राशिफल (09 अक्टूबर),,Religion,,delay,all,False,False,3,2017-10-09 05:20:29,utsavm,33/-=-,5/29=17.24%
7673,467b7313_in,"OnePlus 5 खरीदने का यही है मौका, ढेरों ऑफर्स",,Technology,,delay,all,False,False,3,2017-10-09 05:22:24,utsavm,16670/-=-,780/14670=5.317%
7674,f2dc1277_in,यहां बुर्के में वर्कआउट करती हैं महिलाएं,,Others,,delay,all,False,False,3,2017-10-09 05:22:35,utsavm,8160/-=-,374/7318=5.111%
7675,3e9345a6_in,Rana Daggubati's throwback pic with Baahubali Prabhas is too cute to handle,,News_Entertainment,,delay,all,False,False,3,2017-10-09 06:01:07,utsavm,169563/-=-,5192/153500=3.382%
7676,65794b6e_in,'WhatsApp Business' to be Introduced as Standalone App,,Technology,,delay,all,False,False,3,2017-10-09 06:01:16,utsavm,132762/-=-,5548/106624=5.203%
7677,1f838149_in,"Drop 'Muslim' and 'Hindu' From Names of AMU, BHU, UGC Suggests",,Education,,delay,all,False,False,3,2017-10-09 06:01:38,utsavm,15395/-=-,300/9782=3.067%
7678,be460896_in,Firecrackers Banned For Diwali In Delhi By Supreme Court,,Others,,delay,all,False,False,3,2017-10-09 06:01:57,utsavm,85754/-=-,2673/72143=3.705%
7679,74c8d967_in,Godhra train carnage: High Court commutes death sentence to 11 into life imprisonment,,Crime,,delay,all,False,False,3,2017-10-09 06:02:29,utsavm,197811/-=-,4341/149149=2.911%
7680,8eae46c5_in,BSNL Takes on Reliance Jio and Bharti Airtel With an All New Plan,,Technology,,delay,all,False,False,3,2017-10-09 06:22:56,utsavm,3597022/-=-,114441/3188137=3.59%
7681,a9af2386_in,Why is Centre insisting on hiking Delhi Metro fares?,,News_Politics,,delay,all,False,False,3,2017-10-09 06:23:08,utsavm,29097/-=-,783/24159=3.241%
7682,f47a478c_in,Dangal effect? Akhada welcomes women to fight wrestling for the first time,,Others,,delay,all,False,False,3,2017-10-09 06:27:14,utsavm,80394/-=-,1396/67582=2.066%
7683,512d2999_in,OnePlus 5 price in India: Top offers to avail before OnePlus 5T or 6 launches,,Technology,,delay,all,False,False,3,2017-10-09 06:27:23,utsavm,217470/-=-,6879/186289=3.693%
7684,206243c6_in,"Unlimited Voice Calls, 1GB Per Day: Latest Airtel Recharges",,Technology,,delay,all,False,False,3,2017-10-09 06:27:58,utsavm,734682/-=-,28401/504890=5.625%
7685,ae1bb401_in,अपने से 11 साल छोटे लड़के के इश्क में पागल महिला ताईक्वांडो कोच की घिनौनी हरकत,,Crime,,delay,all,False,False,3,2017-10-09 06:36:56,utsavm,301/-=-,25/263=9.506%
7686,4c2b5b08_in,"Love Triangle पर बेस्ड है 'ये इश्क बड़ा बेदर्दी...', जल्द होगी रिलीज",,News_Entertainment,,delay,all,False,False,3,2017-10-09 06:38:49,utsavm,44525/-=-,1545/40213=3.842%
7687,215a6571_in,चंद्रमुखी चौटाला ने लगाए करवा चौथ पर ठुमके,,News_Entertainment.TV,,delay,all,False,False,3,2017-10-09 06:40:13,utsavm,2160423/-=-,48301/2046293=2.36%
7688,f8121446_in,जब Uber का ड्राइवर इस एक्ट्रेस को देने लगा गंदी-गंदी गालियां...,,News_Entertainment.Bollywood,,delay,all,False,False,3,2017-10-09 06:40:37,utsavm,2338418/-=-,62195/2193110=2.836%
7689,b51b8da1_in,"12 वीं पास के लिए सरकारी नौकरी पाने का सुनहरा मौका, यहां करें ऑनलाइन आवेदन",,Education,,delay,all,False,False,3,2017-10-09 06:42:16,utsavm,2703474/-=-,120562/2427121=4.967%
7690,381d0093_in,Avoiding marriage despite physical relation doesn't amount to rape: Court,,Others,,delay,all,False,False,3,2017-10-09 07:11:09,utsavm,154586/-=-,4341/117839=3.684%
7691,6e7922a6_in,"Petrol, Diesel Price Today, Proposed Petrol Pump Owners Strike And More",,Others,,delay,all,False,False,3,2017-10-09 07:11:18,utsavm,321859/-=-,12422/255422=4.863%
7692,af054f4c_in,"No Fan, Coffee for Honeypreet in Police Lock-up",,Crime,,delay,all,False,False,3,2017-10-09 07:11:25,utsavm,1087162/-=-,101605/738628=13.76%
7693,f1d1ef13_in,Outrage over images of soldiers' bodies in cartons,,Others_Terrorism,,delay,all,False,False,3,2017-10-09 07:11:38,utsavm,77929/-=-,1767/62068=2.847%
7694,cf5fff36_in,OMG! Groom humiliates bride by playing her infidelity video: Watch,,Others,,delay,all,False,False,3,2017-10-09 07:11:46,utsavm,135299/-=-,2574/99142=2.596%
7695,32a9f95f_in,"शादी के दो दिन बाद पत्नी पर किया हमला, मरा समझ भाग गया पति",,Crime,,delay,all,False,False,3,2017-10-09 07:33:17,utsavm,40814/-=-,2126/32444=6.553%
7696,7b634679_in,"देवी-देवता के ड्रेस में हुई शादी, देखें PHOTOS",,Others,,delay,all,False,False,3,2017-10-09 07:33:25,utsavm,56507/-=-,3206/50098=6.399%
7697,6d1f3196_in,"पॉर्न स्टार संग दिखे मिथुन के बेटे, फोटो वायरल",,News_Entertainment,,delay,all,False,False,0,2017-10-09 07:33:33,utsavm,-/-=-,-/-=-
7698,9a51c493_in,"देखें: कमाल गैजट! फोन भी है, खिलौना भी",,Technology,,delay,all,False,False,0,2017-10-09 07:33:40,utsavm,-/-=-,-/-=-
7699,3b32f45_in,एसएचओ की कुर्सी पर बैठने वाली राधे मां के खिलाफ शिकायत दर्ज,,Crime,,delay,all,False,False,3,2017-10-09 07:33:52,utsavm,5118/-=-,194/4562=4.253%
7700,dc404edd_in,इन उपायों से तीन महीनों में उतर जाए पुराने से पुराना कर्जा,,Others,,delay,all,False,False,3,2017-10-09 07:37:27,utsavm,105/-=-,7/65=10.77%
7701,5880dcca_in,माता वैष्णो देवी के दरबार में जाने का प्लान बना रहे हैं तो ये खबर जरूर पढ़ें,,Others,,delay,all,False,False,3,2017-10-09 07:37:36,utsavm,2495875/-=-,109737/2306151=4.758%
7702,fb442ed2_in,"CCTV में कैद हुई भूतों की बेहद डरावनी हरकतें, देखकर काँप जाएगी रुह",,Others,,delay,all,False,False,3,2017-10-09 07:38:03,utsavm,7896/-=-,270/4864=5.551%
7703,c1aa3c3d_in,"अब बैंक में तुरंत मिलेगी नौकरी, आजमाएं ये 5 आसान टिप्स",,Education,,delay,all,False,False,3,2017-10-09 07:38:18,utsavm,4997/-=-,174/4337=4.012%
7704,4c6a2c74_in,ट्रेन के बाथरूम में ले जाकर पांच मजदूरों ने किया लड़की के साथ 'गंदा काम',,Crime,,delay,all,False,False,3,2017-10-09 07:38:38,utsavm,108/-=-,14/92=15.22%
