id,entry_id,title,push_title,category,city,push_type,push_os,push_entire,test_mode,status,insert_time,operator,Receive/Send,Click/Show
10061,6fb58dcc_in,Hema Malini reveals name of Esha Deol's new-born daughter,,News_Entertainment,,delay,all,False,False,3,2017-10-24 06:32:10,utsavm,270648/-=-,28099/283487=9.912%
10062,33919d90_in,"विकास पागल हो गया' के बाद 'गब्बर सिंह टैक्स, राहुल गांधी के जुमले क्यों छाए सोशल मीडिया पर?",,Others,,delay,all,False,False,3,2017-10-24 07:28:47,utsavm,9052/-=-,261/8657=3.015%
10063,349830c3_in,"गाय विवाद सुलझाने गई यूपी पुलिस की छीनी गई बंदूक, महिलाओं ने पीटकर बना लिया बंधक",,Crime,,delay,all,False,False,3,2017-10-24 07:28:57,utsavm,6880/-=-,387/6636=5.832%
10064,ca8ebb06_in,गुजरात दौरे पर गए राहुल गांधी पर बने ये Jokes-,,Funny,,delay,all,False,False,3,2017-10-24 07:29:08,utsavm,9904/-=-,419/9500=4.411%
10065,52bfa856_in,"विराट को लेकर डॉक्टर के पास पहुंची अनुष्का, आखिर क्या है माजरा?",,News_Entertainment,,delay,all,False,False,3,2017-10-24 07:29:20,utsavm,233404/-=-,12949/216016=5.994%
10066,29416d0a_in,BIGG BOSS 11: महा..महा..ट्विस्ट..डबल एलिमिनेशन..ये 2 कंटेस्टेंट OUT!,,News_Entertainment.TV,,delay,all,False,False,3,2017-10-24 07:30:13,utsavm,4648/-=-,172/4201=4.094%
10067,76d58047_in,Prabhas Celebrates His Birthday on Saaho Set With Shraddha Kapoor,,News_Entertainment,,delay,all,False,False,3,2017-10-24 08:37:00,utsavm,324782/-=-,10510/321722=3.267%
10068,3530fe5d_in,Vodafone offers 4G data at less than Rs 5 per GB for 6 months; know the tariff,,Business,,delay,all,False,False,3,2017-10-24 08:37:35,utsavm,3192908/-=-,93809/3075121=3.051%
10069,efa03646_in,"Lenovo K8 Note review: At Rs 12,999, best option with brilliant battery life",,Technology,,delay,all,False,False,3,2017-10-24 08:38:33,utsavm,764512/-=-,23067/778397=2.963%
10070,ca0b25b5_in,Sanjay Dutt is in high spirits as he poses with sister. Watch video,,News_Entertainment.Bollywood,,delay,all,False,False,3,2017-10-24 08:50:20,utsavm,65047/-=-,1208/63567=1.9%
10071,e4ea457_in,New Man In Malaika Arora's Life? No It's Not Arjun Kapoor!,,News_Entertainment,,delay,all,False,False,3,2017-10-24 08:51:42,utsavm,256078/-=-,8392/257232=3.262%
10072,f40794d_in,"सुलझी कुलदीप मर्डर मिस्ट्री, आरोपी अंबिकापुर से गिरफ्तार",,Crime,,delay,all,False,False,3,2017-10-24 08:59:02,utsavm,57134/-=-,2867/56697=5.057%
10073,a653f5c9_in,"'बादशाहो' के गाने पर इन लड़कियों का डांस मचा रहा धमाल, देखें वायरल VIDEO",,News_Entertainment,,delay,all,False,False,3,2017-10-24 08:59:11,utsavm,648493/-=-,25022/621134=4.028%
10074,f317c16f_in,"Photos: मौनी रॉय ने कराया बोल्ड फोटोशूट, सिर्फ शर्ट पहनकर दिए ऐसे पोज",,News_Entertainment.TV,,delay,all,False,False,3,2017-10-24 08:59:24,utsavm,525570/-=-,29437/493625=5.963%
10075,57399f14_in,"10वीं पास के लिए रक्षा मंत्रालय में नौकरी का मौका, जल्द करें आवेदन",,Education,,delay,all,False,False,3,2017-10-24 08:59:34,utsavm,74189/-=-,2797/71790=3.896%
10076,2e86ca70_in,"Jio ने सस्ता कर दिया ये प्लान, मिल रहा दोगुने से भी ज्यादा डेटा और अनलिमिटेड कॉल",,Business,,delay,all,False,False,3,2017-10-24 08:59:48,utsavm,2598376/-=-,119975/2422590=4.952%
10077,f93b3564_in,"Virat Kohli, Anushka Sharma to get married this December: Reports",,News_Entertainment,,delay,all,False,False,3,2017-10-24 09:50:22,apoorvs,413196/-=-,21103/406641=5.19%
10078,d92c4ffc_in,IAF fighter jets touchdown on Lucknow-Agra Expressway: 10 big highlights,,Others,,delay,all,False,False,3,2017-10-24 09:51:10,apoorvs,61268/-=-,1678/60078=2.793%
10079,74363ccd_in,"Bigg Boss 11: Hina Khan, Shilpa Shinde trolled for making fun of Dhinchak Pooja",,News_Entertainment.TV,,delay,all,False,False,3,2017-10-24 09:51:32,apoorvs,252536/-=-,11189/240793=4.647%
10080,51a6bdd_in,"MP: BJP leader takes picture of a woman defecating in open, booked",,Crime,,delay,all,False,False,3,2017-10-24 09:52:34,apoorvs,69644/-=-,2297/68535=3.352%
10081,e91d2d4e_in,Terror funding case: Hizbul chief's son arrested for questioning by NIA,,Others_Terrorism,,delay,all,False,False,3,2017-10-24 09:52:55,apoorvs,27975/-=-,601/21240=2.83%
10082,908e29ca_in,Mouni Roy's off-shoulder blouse adds a sensual modern twist to a lehenga,,Fashion,,delay,all,False,False,3,2017-10-24 10:00:38,apoorvs,258335/-=-,10303/253540=4.064%
10083,1723b1ca_in,Baahubali 2 beats Salman Khan's Tubelight to become most viewed TV premiere,,News_Entertainment,,delay,all,False,False,3,2017-10-24 10:10:11,utsavm,96938/-=-,2659/89821=2.96%
10084,25ff7d8c_in,"Want to defeat BJP in Gujarat, awaiting Congress' response: Hardik Patel",,News_Politics,,delay,all,False,False,3,2017-10-24 10:10:47,utsavm,22319/-=-,821/22027=3.727%
10085,85f557b4_in,"Karbonn Titanium Jumbo with 4000mAh battery launched in India at Rs 6,490",,Technology,,delay,all,False,False,3,2017-10-24 10:11:49,utsavm,737983/-=-,31805/734151=4.332%
10086,4b1f14f4_in,Bigg Boss 11: Arshi Khan was lying about having sex with Shahid Afridi; know more,,News_Entertainment,,delay,all,False,False,3,2017-10-24 10:12:40,utsavm,3074105/-=-,72214/2932724=2.462%
10087,10c7011d_in,"Railway recruitment 2017: Vacancies announced, apply latest by November 13",,Education,,delay,all,False,False,3,2017-10-24 10:13:25,utsavm,3015485/-=-,100660/2968596=3.391%
10088,7fde06ff_in,"When Ranveer, Ayushmann and Irrfan wore skirts, and rocked them",,Fashion,,delay,all,False,False,3,2017-10-24 10:16:54,apoorvs,45264/-=-,829/43496=1.906%
10089,ef9a6ccc_in,"Rahul Gandhi, Hardik Patel secretly met in Gujarat? Hotel CCTV footage goes viral",,News_Politics,,delay,all,False,False,3,2017-10-24 10:17:25,apoorvs,26295/-=-,734/25863=2.838%
10090,a33bd8e4_in,"Pet tax in Punjab: Pay Rs 250 to keep a dog, Rs 500 to own a cow",,Pet_Animals,,delay,all,False,False,3,2017-10-24 10:17:49,apoorvs,20694/-=-,478/19851=2.408%
10091,f4826d86_in,Jawans at Indo-China border being trained in Chinese language: Rajnath Singh,,others ,,delay,all,False,False,3,2017-10-24 10:18:25,apoorvs,29676/-=-,627/29125=2.153%
10092,1c6d4e2c_in,Niharika Singh on affair with Nawazuddin: He has chosen to fabricate stories,,News_Entertainment.Bollywood,,delay,all,False,False,3,2017-10-24 10:19:04,apoorvs,9639/-=-,261/9464=2.758%
10093,6abd24bd_in,Veere Di Wedding First Look: Kareena and Sonam Look Bright And Beautiful,,News_Entertainment.Bollywood,,delay,all,False,False,3,2017-10-24 10:32:23,apoorvs,160763/-=-,6170/156145=3.951%
10094,be8ed96b_in,"Ranveer Singh, Shahid Kapoor Will Not Promote Padmavati Together",,News_Entertainment.Bollywood,,delay,all,False,False,3,2017-10-24 10:32:40,apoorvs,21900/-=-,906/21602=4.194%
10095,c1700ba8_in,CONFIRMED! Salman Khan Books Eid 2019 For His Upcoming Film Bharat,,News_Entertainment.Bollywood,,delay,all,False,False,3,2017-10-24 10:32:58,apoorvs,155074/-=-,5257/154735=3.397%
10096,4fd186e1_in,Post-Festive Skincare: Here are Some Skincare Tips to Get Flawless Skin,,Beauty,,delay,all,False,False,3,2017-10-24 10:33:16,apoorvs,25347/-=-,723/24521=2.948%
10097,16cc54da_in,Benefits of Triphala: 5 Ways Triphala Can Help You Maintain Digestive Wellness,,Health,,delay,all,False,False,3,2017-10-24 10:33:30,apoorvs,13086/-=-,296/12758=2.32%
10098,53443e1d_in,Firangi trailer: Kapil Sharma 'acts' and no we are not kidding,,News_Entertainment.Bollywood,,delay,all,False,False,3,2017-10-24 11:07:06,apoorvs,99277/-=-,2842/97964=2.901%
10099,62d42e5c_in,"Amul makes business proposition to Indian Railways, gets 'utterly butterly' reply",,Business,,delay,all,False,False,3,2017-10-24 11:28:19,apoorvs,7374/-=-,209/7068=2.957%
10100,4f6f97e_in,"Centre approves highway projects worth Rs 7 lakh crore, including Bharatmala",,Others,,delay,all,False,False,3,2017-10-24 11:29:04,apoorvs,14824/-=-,300/14581=2.057%
10101,432705fb_in,"मां की बिल्डिंग में लगी आग से ऐश्वर्या राय हुई परेशान, हसबैंड के साथ पहुंची",,News_Entertainment.Bollywood,,delay,all,False,False,3,2017-10-24 11:48:27,apoorvs,1037672/-=-,40156/1009396=3.978%
10102,4618507_in,"टैक्सपेयर्स को बड़ी राहत, वित्त मंत्री अरुण जेटली ने ट्वीट करके किया ऐलान",,Business,,delay,all,False,False,3,2017-10-24 11:54:36,apoorvs,2332/-=-,92/2317=3.971%
10103,84ac88c6_in,"कॉमेडियन ने मोदी का ऐसा उड़ाया मजाक, हंसते-हंसते अक्षय की आंखों से निकल आए आंसू",,News_Entertainment.TV,,delay,all,False,False,3,2017-10-24 11:57:38,apoorvs,331579/-=-,12105/317333=3.815%
10104,2ebbfcbd_in,मैमोरी कार्ड खरीदने से पहले इस तरह पहचानें कार्ड असली है या नकली,,Technology,,delay,all,False,False,3,2017-10-24 12:15:34,apoorvs,38701/-=-,2132/37760=5.646%
10105,fc113c96_in,"आगरा में दोस्त के साथ घूमने गई छात्रा से साथ गैंग रेप की आशंका, माहौल में तनाव",,Crime,,delay,all,False,False,3,2017-10-24 12:16:34,apoorvs,12313/-=-,506/12100=4.182%
10106,57bd24dc_in,"बिहार में 22 सालों से लापता पूरा थाना, ढूंढ़ने में परेशान पुलिस ...जानिए",,Crime,,delay,all,False,False,3,2017-10-24 12:17:09,apoorvs,2884/-=-,91/2567=3.545%
10107,7f3eaece_in,"वाराणसी में चूहों का आतंक, हर साल खा जाते हैं 11 हजार क्विंटल धान",,Others,,delay,all,False,False,3,2017-10-24 12:17:28,apoorvs,4521/-=-,177/4423=4.002%
10108,130f7fc2_in,Firangi के ट्रेलर में देखिए कपिल की कॉमेडी और रोमांस,,News_Entertainment.Bollywood,,delay,all,False,False,3,2017-10-24 12:18:26,apoorvs,1842/-=-,73/1813=4.026%
10109,86e51b67_in,"इस वजह से एक ही डॉक्टर के पास पहुंचे अनुष्का-विराट, दिसंबर में मिल सकती है बड़ी खबर",,News_Entertainment.Bollywood,,delay,all,False,False,3,2017-10-24 12:18:55,apoorvs,23559/-=-,1094/23131=4.73%
10110,dd3cb90b_in,"Infosys को सितंबर तिमाही में 3726 करोड़ का मुनाफा, घटाया रेवेन्यु गाइडेंस",,Business,,delay,all,False,False,3,2017-10-24 12:19:18,apoorvs,1324/-=-,36/1302=2.765%
10111,2cf0a646_in,राष्ट्रगान के दौरान खड़े रहना देशक्ति की परीक्षा नहीं हो सकती: ओवैसी,,News_Politics,,delay,all,False,False,3,2017-10-24 12:19:41,apoorvs,6626/-=-,397/6449=6.156%
10112,fcd88dad_in,राहुल से सीक्रेट मीटिंग के सवाल पर बोले हार्दिक- मिलता तो सबके सामने मिलता,,News_Politics,,delay,all,False,False,3,2017-10-24 12:58:16,apoorvs,8608/-=-,3272/5358=61.07%
10113,588029c9_in,"साथ सोने वाली बात पर सदमे में एक्ट्रेस, कहा- इस हद तक गिर जाएंगे नवाज",,News_Entertainment.Bollywood,,delay,all,False,False,3,2017-10-24 12:59:03,apoorvs,5386/-=-,297/4395=6.758%
10114,d0bf2de6_in,"बात-बात पर चप्पल से पीटने की धमकी देती हैं सपना चौधरी, पार कर दी हद",,News_Entertainment.TV,,delay,all,False,False,3,2017-10-24 13:00:09,apoorvs,33169/-=-,3439/36300=9.474%
10115,19ae5607_in,"एक्सप्रेसवे पर IAF का शक्ति प्रदर्शन, सुपर हरक्यूलिस लैंड, मिराज ने किया टचडाउन",,Others,,delay,all,False,False,3,2017-10-24 13:00:35,apoorvs,5479/-=-,107/5403=1.98%
10116,60e17abe_in,टेरर फंडिंग के मामले में हिजबुल चीफ सलाहुद्दीन का बेटा गिरफ्तार,,Others_Terrorism,,delay,all,False,False,3,2017-10-24 13:01:00,apoorvs,1993/-=-,64/1956=3.272%
10117,2841f66f_in,"चीनी बॉर्डर पर भारत बनाएगा 50 नई सीमा चौकियां, जवान सीखेंगे चीनी भाषा",,Others,,delay,all,False,False,3,2017-10-24 13:01:16,apoorvs,7502/-=-,222/7331=3.028%
10118,aa6b3511_in,"मोदी सरकार ने पेश की अर्थव्यवस्‍था की चमकदार तस्वीर, 2022 तक सड़कों का जाल बिछाने का वादा",,Others,,delay,all,False,False,3,2017-10-24 13:01:35,apoorvs,3079/-=-,86/3013=2.854%
10119,6122ea34_in,"मीडिया पर पाबंदी वाले बिल पर बैकफुट पर राजे, सिलेक्ट कमिटी के पास भेजा विधेयक",,News_Politics,,delay,all,False,False,3,2017-10-24 13:02:05,apoorvs,1610/-=-,77/1707=4.511%
10120,8d26c96f_in,नोटबंदी का एक साल: विपक्ष ने मोदी सरकार को घेरने का बनाया प्लान,,News_Politics,,delay,all,False,False,3,2017-10-24 13:02:21,apoorvs,4840/-=-,320/3832=8.351%
10121,bdd0b86b_in,"मुंबई फिर हुई शर्मसार, छेड़छाड़ से बचने के लिए चलती ट्रेन से कूदने को मजबूर हुई लड़की",,Crime,,delay,all,False,False,3,2017-10-24 13:02:39,apoorvs,6028/-=-,345/5862=5.885%
10122,3c7362e9_in,"आखिरकार कड़वाहट खत्म: सचिन और कांबली में हुई दोस्ती, एक दूसरे को गले भी लगाया",,News_Sports.Cricket,,delay,all,False,False,3,2017-10-24 13:03:25,apoorvs,5454/-=-,188/5302=3.546%
10123,ac98b789_in,"OMG !! क्रिकेट जगत फिर से शर्मसार, पूर्व अंपायर डेरेल हेयर ने की चोरी",,News_Sports.Cricket,,delay,all,False,False,3,2017-10-24 13:03:43,apoorvs,22781/-=-,1149/22154=5.186%
10124,3a9a0617_in,"पीएम मोदी पर चूड़ियां फेंकने पर महिला हुई गिरफ्तार, वीडियो भी वायरल",,Crime,,delay,all,False,False,3,2017-10-24 13:03:57,apoorvs,1586775/-=-,39159/1549126=2.528%
10125,ed7b05f1_in,तमिल फिल्म मर्सल के एक्टर विजय पर हिंदू भावना आहत करने का केस दर्ज,,News_Entertainment.Moive,,delay,all,False,False,3,2017-10-24 13:04:19,apoorvs,4881/-=-,254/4726=5.375%
10126,a2d84594_in,रोहिंग्या मुस्लिमों पर अत्याचार: म्यांमार सेना के खिलाफ अमेरिका ने उठाया बड़ा कदम,,Others,,delay,all,False,False,3,2017-10-24 13:04:34,apoorvs,10402/-=-,422/10088=4.183%
10127,eb05598b_in,घर में पालतू जानवर रखने पर टैक्स लगाएगी पंजाब सरकार,,Pet_Animals,,delay,all,False,False,3,2017-10-24 13:04:50,apoorvs,42259/-=-,1433/33260=4.308%
10128,e98815a4_in,IPL GC proposal may ease Dhoni's return to Chennai Super Kings,,News_Sports.Cricket,,delay,all,False,False,3,2017-10-24 13:40:37,apoorvs,172779/-=-,5283/168147=3.142%
10129,65403daa_in,Tata Nexon review: The most affordable SUV experience,,Auto,,delay,all,False,False,3,2017-10-24 13:40:53,apoorvs,112414/-=-,2404/98867=2.432%
10130,7622bcb6_in,"GST collections at Rs 92,150 crore in September",,Business,,delay,all,False,False,3,2017-10-24 13:41:11,apoorvs,101535/-=-,3438/99368=3.46%
10131,58fffc7a_in,"New shoes bite initially: Dharmendra Pradhan in defence of GST, noteban",,News_Politics,,delay,all,False,False,3,2017-10-24 13:41:26,apoorvs,33747/-=-,1003/40088=2.502%
10132,7e76a118_in,Government to infuse Rs 2.11 lakh crore into PSU banks,,Business,,delay,all,False,False,3,2017-10-24 13:41:42,apoorvs,9219/-=-,312/8972=3.477%
10133,89d4a90b_in,7 important questions to ask yourself before getting serious about a relationship,,Love&Relationship,,delay,all,False,False,3,2017-10-24 13:49:39,apoorvs,52409/-=-,1592/51309=3.103%
10134,3fd87_in,Twinkle Khanna is effortless as she poses in pyjamas for fashion magazine,,Fashion,,delay,all,False,False,3,2017-10-24 13:50:40,apoorvs,55081/-=-,1596/61837=2.581%
10135,8acb13c7_in,Bipasha Basu swears by this fitness routine. Here's what keeps her in shape,,Health,,delay,all,False,False,3,2017-10-24 13:51:25,apoorvs,23387/-=-,518/22776=2.274%
10136,afb2a309_in,Pay by Google makes online payment faster: Here's how it works,,Technology,,delay,all,False,False,3,2017-10-24 13:51:55,apoorvs,128958/-=-,2673/126301=2.116%
10137,85d921bd_in,"Nokia 7 set to launch in India on October 31: Price, specs and features",,Technology,,delay,all,False,False,3,2017-10-24 13:52:19,apoorvs,271629/-=-,12119/263060=4.607%
10138,40067f06_in,Bihar: Mob lynches four criminals trying to flee after firing at businessman,,Crime,,delay,all,False,False,3,2017-10-24 13:52:51,apoorvs,53130/-=-,1234/52112=2.368%
10139,7b4395b4_in,Chhath Puja 2017: How to Nail Pink and Gold Festive Makeup for Surya Shashti,,Beauty,,delay,all,False,False,3,2017-10-24 14:00:54,apoorvs,41747/-=-,823/41031=2.006%
10140,b50c5fb0_in,"Chhath Puja 2017: Importance, dates and timings of this auspicious festival",,Religion,,delay,all,False,False,3,2017-10-24 14:01:20,apoorvs,47741/-=-,1840/48911=3.762%
10141,969d1f0d_in,India vs New Zealand: Tom Latham Wants Kiwis to Seal Deal in Pune,,News_Sports.Cricket,,delay,all,False,False,3,2017-10-24 14:12:41,apoorvs,226354/-=-,8298/222423=3.731%
10142,37a607b5_in,Assam Tourism's Video Featuring Priyanka Chopra is Winning the Internet,,Travel,,delay,all,False,False,3,2017-10-24 14:13:04,apoorvs,15409/-=-,437/15017=2.91%
10143,8c003a9e_in,"Congress Is Busy Making Gabbar And GST Memes, BJP Isn't Liking It",,News_Politics,,delay,all,False,False,3,2017-10-24 14:13:24,apoorvs,26403/-=-,877/25362=3.458%
10144,695023ca_in,"Sitharaman Says North Korea's Nuclear Ties Must be Probed, Hints at Pakistan",,News_Politics,,delay,all,False,False,3,2017-10-24 14:13:50,apoorvs,14232/-=-,481/13952=3.448%
10145,c1a416ea_in,Laptops Pose Fire Hazard in Checked Baggage And Should be Banned,,Travel,,delay,all,False,False,3,2017-10-24 14:14:06,apoorvs,589004/-=-,7354/576945=1.275%
10146,e63cdce3_in,भारत की सरजमीं से ऐसे हमला करेगी किम जोंग की आर्मी!,,Science,,delay,all,False,False,3,2017-10-24 14:43:21,apoorvs,1648/-=-,75/1629=4.604%
10147,898d55f6_in,"होंडा के इस स्कूटर की तस्वीरें लीक, 2000 रुपए देकर कराएं बुकिंग",,Auto,,delay,all,False,False,3,2017-10-24 14:43:52,apoorvs,29939/-=-,1106/29151=3.794%
10148,b5024d36_in,1.5 करोड़ युवा घर बैठे ऐसे कर रहे हैं मोटी कमाई,,Education,,delay,all,False,False,3,2017-10-24 14:44:23,apoorvs,22704/-=-,1114/22053=5.051%
10149,e0c1dda9_in,VIDEO: रॉयल एनफील्ड और बजाज की टक्कर में कौन निकला आगे,,Auto,,delay,all,False,False,3,2017-10-24 14:45:05,apoorvs,2304/-=-,127/2280=5.57%
10150,f097a581_in,छठ पर्व: जानें पहले चार दिनों में कैसे करें पूजा और कैसे मिलेगा फल,,Religion,,delay,all,False,False,3,2017-10-24 14:45:23,apoorvs,6169/-=-,291/6062=4.8%
10151,4f6a38b4_in,"सात समंदर पार करें साथी की तलाश, टिंडर वेब के साथ",,Love&Relationship,,delay,all,False,False,3,2017-10-24 14:45:53,apoorvs,4877/-=-,157/4717=3.328%
10152,3a1e7883_in,"नेचुरल एयर-प्यूरिफायर है दीपक, दूर भागती हैं बीमारियां",,Religion,,delay,all,False,False,3,2017-10-24 14:46:46,apoorvs,8814/-=-,337/8552=3.941%
10153,f4c86e7c_in,"इन सर्दियों में हाथ नहीं खोएंगे अपनी चमक, बने रहेंगे नर्म और मुलायम",,Beauty,,delay,all,False,False,3,2017-10-24 14:47:35,apoorvs,2556/-=-,84/2480=3.387%
10154,44437c2b_in,"कैमरा खरीदने से पहले ध्यान रखिए ये 5 बातें, मिलेगी बढ़िया डील",,Technology,,delay,all,False,False,3,2017-10-24 14:50:34,apoorvs,8256/-=-,271/8050=3.366%
10155,d9fccd1b_in,"सुनील ग्रोवर को लेकर बोले कपिल शर्मा, कहा मैं सुनील की जगह होता तो एेसा करता",,News_Entertainment.TV,,delay,all,False,False,3,2017-10-24 14:50:52,apoorvs,1967/-=-,87/1815=4.793%
10156,5f976cda_in,"विराट कोहली की खिल्ली उड़ाई, तो इस दिग्गज को ट्विटर यूजर्स ने ऐसे फटकार लगाई",,News_Sports.Cricket,,delay,all,False,False,3,2017-10-24 14:52:04,apoorvs,10962/-=-,420/10008=4.197%
10157,9e0d1a0b_in,Will New Zealand create history or India bounce back?,2nd ODI Ind Vs NZ,News_Sports,,delay,all,True,False,3,2017-10-25 04:25:36,utsavm,5128955/-=-,140378/4881287=2.876%
10158,b5ed7177_in,Laptops may soon be banned from checked-in bags,,Travel,,delay,all,False,False,3,2017-10-25 04:38:02,utsavm,163704/-=-,5028/146101=3.441%
10159,754e1062_in,अभी भी 50% डिस्काउंट पर मिल रहा है Jio का यह डिवाइस,Jio धन धाना धन ,Business,,immediately,all,True,False,3,2017-10-25 04:56:20,utsavm,3306870/-=-,189399/3117070=6.076%
10160,c3d0b5af_in,"भरा मोदी सरकार का खजाना, सितंबर के GST से मिले 92,150 करोड़",,Business,,delay,all,False,False,3,2017-10-25 04:59:05,utsavm,2325/-=-,77/2157=3.57%
10161,c0d6583b_in,"बुधवार को करें ये काम, बनी रहेगी लक्ष्मीजी की कृपा",,Science,,delay,all,False,False,3,2017-10-25 04:59:35,utsavm,2464962/-=-,46055/2313214=1.991%
10162,3f1eedbd_in,"'मेरे रश्‍के कमर' पर दो लड़कियों का कमाल, हिट हुआ डांस वीडियो",,News_Entertainment,,delay,all,False,False,3,2017-10-25 04:59:48,utsavm,537455/-=-,36588/569091=6.429%
10163,e9f920f7_in,"रेलवे ला रही नई वेबसाइट और मोबाइल ऐप, फास्ट टिकट बुकिंग से लेकर कई नए फीचर्स",,Travel,,delay,all,False,False,3,2017-10-25 04:59:57,utsavm,2954/-=-,134/2820=4.752%
10164,8c47e0eb_in,"धोनी के घर पहुंच इस सिंगर ने सुनाए पंजाबी गाने, पत्नी साक्षी बनाती रही वीडियो",,News_Sports,,delay,all,False,False,3,2017-10-25 05:00:08,utsavm,13053/-=-,669/12550=5.331%
10165,4c10d297_in,"तीन महीने में सबसे ज्यादा खरीदा गया ये स्मार्टफोन, आप भी जानें नाम",,Technology,,delay,all,False,False,3,2017-10-25 05:01:59,utsavm,107836/-=-,7918/101892=7.771%
10166,c82d8358_in,"नवाजुद्दीन ने कहा- 'सेक्स के लिए किया Use', एक्ट्रेस ने दिया ऐसा Reaction",,News_Entertainment,,delay,all,False,False,3,2017-10-25 05:02:18,utsavm,477286/-=-,30732/473760=6.487%
10167,d14a18c7_in,"ब्लू व्हेल गेम के चक्कर में फंसी 19 साल की लड़की, ऐसे पूरा किया टास्क",,Crime,,delay,all,False,False,3,2017-10-25 05:02:35,utsavm,484997/-=-,27983/442957=6.317%
