id,entry_id,title,push_title,category,city,push_type,push_os,push_entire,test_mode,status,insert_time,operator,Receive/Send,Click/Show
33970,f61f7d7e_ru,"Составлен рейтинг стран, дающих гражданство в обмен на инвестиции",,Others,,delay,all,False,0,3,2018-07-22 04:01:17,alexandr,20483/9798=209.1%,214/7558=2.831%
33971,d162ca5a_ru,«Уйду из ММА»: Хабиб требует боя с Макгрегором,,News_Entertainment,,delay,all,False,0,3,2018-07-22 04:03:20,alexandr,5330/703339=0.7578%,34263/5220=656.4%
33972,736a23c8_ru,Эквадор может вскоре выдать Ассанжа Великобритании,,Others,,delay,all,False,0,3,2018-07-22 04:11:33,alexandr,53145/64892=81.9%,645/50954=1.266%
33973,7d19c8d6_ru,Самолет ВВС Великобритании снова заметили у российской границы,,Others,,delay,all,False,0,3,2018-07-22 04:12:39,alexandr,31202/11661=267.6%,368/16339=2.252%
33974,693675_ru,В Италии подсчитали потери от антироссийских санкций,,News_Politics,,delay,all,False,0,3,2018-07-22 04:14:22,alexandr,1228/19480=6.304%,130/1174=11.07%
33980,3461a801_ru,"Афера века: рассказ о племени, которого никогда не существовало",Воскресное чтение,Others,,immediately,all,True,0,3,2018-07-22 07:24:44,alexandr,823801/1552202=53.07%,29475/670608=4.395%
33981,e6ffda6a_ru,Как научить российских дипломатов «торговать родиной»,,News_Politics,,delay,all,False,0,-1,2018-07-22 07:35:50,aleksandrak,2/-=-,-/2=-
33985,bf84972_ru,Ракета Falcon 9 с канадским спутником стартовала во Флориде,,Others,,delay,all,False,0,3,2018-07-22 07:39:09,aleksandrak,18/145=12.41%,-/18=-
33988,ca5f64f6_ru,"В Иране взорвался нефтяной резервуар, есть погибшие",,Others,,delay,all,False,0,3,2018-07-22 07:43:52,aleksandrak,-/4=-,-/-=-
33989,ec0ff8fc_ru,Австралийские ученые разрабатывают квантовую батарею для смартфонов,,Technology,,delay,all,False,0,3,2018-07-22 07:44:15,aleksandrak,2/14=14.29%,-/2=-
33990,a6a4dba2_ru,Талисманом Олимпиады-2020 в Токио стало «Вечное будущее» в сине-белую клетку,,News_Sports,,delay,all,False,0,3,2018-07-22 07:44:35,aleksandrak,15204/112018=13.57%,886/15206=5.827%
33991,f6fbaed_ru,Что изменится в оформлении завещания?,,Others,,delay,all,False,0,3,2018-07-22 07:45:18,aleksandrak,20797/101085=20.57%,751/8763=8.57%
33992,5cae7481_ru,Составлен рейтинг торгующих гражданством стран,,Others,,delay,all,False,0,-1,2018-07-22 07:45:39,aleksandrak,-/-=-,-/-=-
33993,ad79e583_ru,"Великобритания не намерена платить Евросоюзу ""отступные"" за Brexit",,Others,,delay,all,False,0,3,2018-07-22 07:46:20,aleksandrak,-/125=-,-/-=-
33995,d5021de1_ru,Уже не секретные места: в список ЮНЕСКО вошли новые достопримечательности,,Others,,delay,all,False,0,3,2018-07-22 07:47:56,aleksandrak,5/5=100%,-/5=-
33997,11a9148d_ru,Разработана технология мгновенной зарядки для iPhone,,Technology,,delay,all,False,0,3,2018-07-22 07:50:50,aleksandrak,2/52=3.846%,4/2=200%
33998,a8bef6f1_ru,Ученые нашли способ изучить климат Арктики с помощью белых медведиц,,Others,,delay,all,False,0,3,2018-07-22 07:51:35,aleksandrak,83/1849=4.489%,5/77=6.494%
34000,596f620c_ru,Неправильный салат. Почему огурец лучше есть отдельно от помидора,,Others,,delay,all,False,0,3,2018-07-22 07:54:40,aleksandrak,-/20=-,-/-=-
34005,e10ae76_ru,Легкоатлеты из 12 стран мира совершили забег на Останкинскую телебашню,,Others,,delay,all,False,0,3,2018-07-22 07:59:44,aleksandrak,-/13=-,-/-=-
34006,97809573_ru,Тадж-Махалу грозит снос,,Others,,delay,all,False,0,3,2018-07-22 08:00:32,aleksandrak,3/3=100%,-/1=-
34008,56002740_ru,Усик стал абсолютным чемпионом мира по боксу,,News_Sports,,delay,all,False,0,3,2018-07-22 08:01:54,aleksandrak,44/1089=4.04%,15/42=35.71%
34009,1468e17b_ru,Эквадор может лишить Ассанжа убежища и передать его Великобритании,,Others,,delay,all,False,0,3,2018-07-22 08:04:23,aleksandrak,-/9=-,2/-=-
34011,dde7cbfb_ru,В Австралии нашли способ спасти Большой Барьерный риф,,Others,,delay,all,False,0,-1,2018-07-22 08:05:58,aleksandrak,4/-=-,-/4=-
34012,3b290991_ru,На Кубе хотят разрешить однополые браки,,Others,,delay,all,False,0,3,2018-07-22 08:07:03,aleksandrak,6/3=200%,-/4=-
34014,e30b69ec_ru,В Instagram появится новая функция,,Technology,,delay,all,False,0,3,2018-07-22 08:12:25,aleksandrak,10/78=12.82%,2/10=20%
34018,be9b59ca_ru,Братья Березуцкие объявили о завершении карьеры,,News_Sports,,delay,all,False,0,3,2018-07-22 08:15:32,aleksandrak,6/78=7.692%,-/4=-
34020,a68414b3_ru,Billboard назвал самых высокооплачиваемых музыкантов,,News_Entertainment,,delay,all,False,0,3,2018-07-22 08:16:57,aleksandrak,16821/107596=15.63%,717/16786=4.271%
34030,c0a1857a_ru,Арестованную в США россиянку уличили в контактах с чиновниками Обамы,,News_Politics,,delay,all,False,0,3,2018-07-22 15:46:17,alexandr,140/292=47.95%,7/137=5.109%
34031,3f7cd693_ru,Армия США разрабатывает военный костюм Железного человека,,Others,,delay,all,False,0,-1,2018-07-22 16:06:52,aleksandrak,-/-=-,-/-=-
34041,5f7322a2_ru,Папа Франциск призвал не дать мигрантам утонуть в море,,Others,,delay,all,False,0,3,2018-07-22 16:23:01,aleksandrak,23636/110336=21.42%,1077/22469=4.793%
34042,58d34155_ru,Памятник жертвам Брейвика открыли в Осло,,Others,,delay,all,False,0,3,2018-07-22 16:25:54,aleksandrak,713/1181=60.37%,15/662=2.266%
34044,efefea76_ru,Век медитации. Секреты 99-летней преподавательницы йоги,,Others,,delay,all,False,0,3,2018-07-22 16:26:59,aleksandrak,4201/6736=62.37%,99/4014=2.466%
34045,da9d3ed8_ru,Опубликован рейтинг самых высокооплачиваемых музыкантов,,News_Entertainment,,delay,all,False,0,3,2018-07-22 16:28:40,aleksandrak,11904/20737=57.4%,683/11442=5.969%
34046,544bb203_ru,Реальные зарплаты: Белоруссия обогнала Россию,,Others,,delay,all,False,0,3,2018-07-22 16:30:32,aleksandrak,662/819=80.83%,37/643=5.754%
34047,e55a5fe0_ru,Ученого арестовали по делу о госизмене,,Others,,delay,all,False,0,-1,2018-07-22 16:31:13,aleksandrak,6/-=-,-/6=-
34048,11e5690f_ru,Ракета Falcon 9 успешно вывела на орбиту канадский спутник,,Others,,delay,all,False,0,3,2018-07-22 16:31:50,aleksandrak,480/615=78.05%,22/465=4.731%
34049,752b826a_ru,В России насчитали сотни тысяч рабов,,Others,,delay,all,False,0,3,2018-07-22 16:32:15,aleksandrak,14856/21099=70.41%,1047/14161=7.394%
34050,98b98d96_ru,"Экосистему пещеры, из которой спасли детей, восстановят за $1,3 миллиона",,Others,,delay,all,False,0,3,2018-07-22 16:33:07,aleksandrak,391/341=114.7%,10/379=2.639%
34051,4729ec4a_ru,"Вышел трейлер фэнтезийного мультсериала от автора ""Симпсонов""",,News_Entertainment,,delay,all,False,0,3,2018-07-22 17:10:37,alexandr,17956/18440=97.38%,716/17241=4.153%
34052,b4513403_ru,Япония сообщила о рекордном росте турпотока из России,,Others,,delay,all,False,0,-1,2018-07-22 17:11:10,alexandr,-/-=-,-/-=-
34053,4bf783a8_ru,Медики назвали главные смертельные угрозы человечества в XXI веке,,Others,,delay,all,False,0,3,2018-07-23 02:56:24,alexandr,5684/10155=55.97%,256/17560=1.458%
34054,e617a3cd_ru,«Барселона» проявляет интерес к футболисту сборной России,,News_Sports,,delay,all,False,0,3,2018-07-23 02:56:59,alexandr,34390/113730=30.24%,2045/20533=9.96%
34055,83643442_ru,Российские ученые разработали четвероногих роботов,,Technology,,delay,all,False,0,3,2018-07-23 02:57:38,alexandr,6057/784521=0.7721%,32198/5902=545.5%
34056,a58edde6_ru,Названы главные риски для мировой экономики,,Business,,delay,all,False,0,3,2018-07-23 03:19:54,alexandr,3786/44910=8.43%,284/3613=7.861%
34061,d37148ef_ru,Наступила неделя апвеллинга и аномальной температуры воздуха,Погода в России,Others,,immediately,all,True,0,3,2018-07-23 05:57:51,alexandr,820072/1556011=52.7%,47321/669284=7.07%
34063,8fe7fc6a_ru,Медведев предложил Северному Кавказу оплатить долги за газ активами,,Others,,delay,all,False,0,3,2018-07-23 06:32:35,alexandr,5/31=16.13%,-/7=-
34064,753f72ef_ru,В России возьмутся за недовольство жителей в соцсетях,,Others,,delay,all,False,0,3,2018-07-23 06:33:11,alexandr,13237/122662=10.79%,1794/12370=14.5%
34065,6bfdf14_ru,В США появилась группа по противодействию РФ в киберпространстве,,Others,,delay,all,False,0,3,2018-07-23 06:33:31,alexandr,25/67=37.31%,2/21=9.524%
34066,24a83894_ru,СМИ раскрыли детали обвинения по делу о госизмене сотрудника ЦНИИмаш,,Others,,delay,all,False,0,3,2018-07-23 06:34:13,alexandr,2988/111407=2.682%,581/2926=19.86%
34067,60b5115f_ru,Эксперты насчитали десятки миллионов рабов во всем мире,,News_Politics,,delay,all,False,0,3,2018-07-23 06:34:26,alexandr,5/146=3.425%,-/6=-
34073,ac69352a_ru,Ученые подтвердили важность использования солнцезащитных средств,,Others,,delay,all,False,0,-1,2018-07-23 07:44:24,borisf,-/-=-,-/-=-
34074,a90df43b_ru,Футболист Неймар ответил на критику за частые симуляции,,News_Sports,,delay,all,False,0,3,2018-07-23 07:54:42,borisf,3667/105884=3.463%,1863/3608=51.64%
34075,a68c7754_ru,Названы главные смертоносные болезни XXI века,,Others,,delay,all,False,0,3,2018-07-23 08:03:01,borisf,22482/127334=17.66%,1864/21603=8.628%
34080,feb0ed2c_ru,Названы самые экономичные автомобили 2018 года,,Auto,,delay,all,False,0,3,2018-07-23 09:15:14,aleksandrak,6/10=60%,-/6=-
34081,23ae857d_ru,Астрономы предупредили о магнитной буре,,Others,,delay,all,False,0,-1,2018-07-23 09:16:26,aleksandrak,1/-=-,-/1=-
34082,a9026787_ru,Переводчик Google начал предсказывать конец света,,Others,,delay,all,False,0,3,2018-07-23 09:17:14,aleksandrak,13/215=6.047%,-/11=-
34083,cba90eb4_ru,«Хаббл» сфотографировал «большого брата» Млечного Пути,,Science,,delay,all,False,0,-1,2018-07-23 09:19:52,aleksandrak,-/-=-,-/-=-
34086,b2c43802_ru,В Сколково научились создавать аватары людей,,Technology,,delay,all,False,0,-1,2018-07-23 09:27:52,aleksandrak,-/-=-,-/-=-
34090,8d252b5d_ru,Украина приготовилась перехватывать российские корабли,,Others,,delay,all,False,0,3,2018-07-23 09:32:05,borisf,8/7=114.3%,-/8=-
34093,f617a651_ru,«Невозможные» материалы создали простым способом,,Technology,,delay,all,False,0,-1,2018-07-23 09:35:39,aleksandrak,8/-=-,-/6=-
34094,1fa82de9_ru,Названы главные смертельные болезни XXI века,,Others,,delay,all,False,0,-1,2018-07-23 09:36:04,aleksandrak,4/-=-,-/4=-
34097,af62b491_ru,Климатологи доказали влияние человека на колебания времен года,,Others,,delay,all,False,0,3,2018-07-23 09:41:33,aleksandrak,18/42=42.86%,5/18=27.78%
34099,b6d695b0_ru,Как правильно выбрать сочный и сладкий арбуз,,Others,,delay,all,False,0,3,2018-07-23 09:51:02,borisf,2040/80284=2.541%,660/1992=33.13%
34101,f6042f4a_ru,В Сенате США призвали ввести суровые санкции против России,,News_Politics,,delay,all,False,0,3,2018-07-23 10:27:35,borisf,102/829=12.3%,21/101=20.79%
34102,1fa32c46_ru,Любовник Джорджа Майкла назвал смерть певца самоубийством,,News_Entertainment,,delay,all,False,0,3,2018-07-23 10:49:02,borisf,6153/104444=5.891%,964/5914=16.3%
34106,1cbb7f36_ru,Названы самые дешевые для отдыха места в сентябре,,Others,,delay,all,False,0,-1,2018-07-23 12:48:01,aleksandrak,2/-=-,-/2=-
34107,94847424_ru,Стокилограммовый камень выпал из Стены Плача,,Others,,delay,all,False,0,-1,2018-07-23 12:48:41,aleksandrak,-/-=-,-/-=-
34109,1c65d2cc_ru,Илон Маск выпустит смартфон,,Technology,,delay,all,False,0,3,2018-07-23 12:51:03,aleksandrak,970/1844=52.6%,32/857=3.734%
34113,e52bbfe9_ru,Россияне взбунтовались против налога на интернет-покупки,,Others,,delay,all,False,0,3,2018-07-23 12:56:35,aleksandrak,30/1068=2.809%,74/29=255.2%
34114,9bc559de_ru,Марсианский камень оказался не по зубам Curiosity,,Science,,delay,all,False,0,-1,2018-07-23 12:59:09,aleksandrak,13/-=-,-/13=-
34115,87779bd_ru,«Они съели мою девушку». Как легенды о морских чудовищах оказались правдой,,Science,,delay,all,False,0,3,2018-07-23 13:06:48,aleksandrak,690/1152=59.9%,20/655=3.053%
34117,7f23f0c3_ru,Ученые назвали дату смерти интернета,,Others,,delay,all,False,0,3,2018-07-23 13:08:13,aleksandrak,465/504=92.26%,12/433=2.771%
34121,c3378458_ru,ЦИК принял заявку на проведение референдума по пенсионной реформе,,News_Politics,,delay,all,False,0,3,2018-07-23 13:35:04,borisf,643/520=123.7%,32/617=5.186%
34122,caa0eae6_ru,"Минфин расширит круг банков, продающих ""народные облигации""",,Business,,delay,all,False,0,3,2018-07-23 13:39:02,borisf,404/1064=37.97%,18/360=5%
34123,e0c17033_ru,"В ""Роскосмосе"" раскрыли подробности дела о госизмене в ЦНИИмаше",,Others,,delay,all,False,0,3,2018-07-23 13:46:41,borisf,1147/993=115.5%,79/1115=7.085%
34124,6010070f_ru,Дачные перетрубации. Что сделать до принятия закона?,,Others,,delay,all,False,0,3,2018-07-23 14:03:58,alexandr,371/395=93.92%,31/354=8.757%
34125,31b11a99_ru,"""Каша в голове"". Депутат из Крыма о словах Порошенко про победу Усика",,News_Politics,,delay,all,False,0,3,2018-07-23 14:04:53,alexandr,537/435=123.4%,29/515=5.631%
34133,7adc12d7_ru,Трамп раскрыл подробности переговоров с Путиным,,Others,,delay,all,False,0,3,2018-07-23 16:22:24,borisf,5453/7040=77.46%,237/5138=4.613%
34134,74dcf455_ru,В России подешевел бензин,,Others,,delay,all,False,0,3,2018-07-23 16:32:53,borisf,25641/28255=90.75%,2124/24113=8.809%
34136,99526a8_ru,ФНС нашла нарушения в работе популярного интернет-магазина,,Others,,delay,all,False,0,3,2018-07-24 04:03:30,alexandr,16599/71154=23.33%,1423/15943=8.926%
34137,ea95ef86_ru,Роберт Де Ниро может сыграть в новом фильме про Джокера,,News_Entertainment,,delay,all,False,0,3,2018-07-24 04:03:51,alexandr,57600/31147=184.9%,1620/55223=2.934%
34138,78b0cb9c_ru,Вашингтон заявил о проникновении хакеров из РФ в энергосистемы США,,Others,,delay,all,False,0,3,2018-07-24 04:04:03,alexandr,5704/766428=0.7442%,26927/5609=480.1%
34139,307fac54_ru,Хейли опровергла возможность дружбы РФ и США,,News_Politics,,delay,all,False,0,3,2018-07-24 04:04:32,alexandr,34898/17292=201.8%,778/34384=2.263%
34140,24845cd1_ru,"Центробанк выявил 67,8 млн поддельных рублей",,Business,,delay,all,False,0,3,2018-07-24 04:08:12,alexandr,3153/12429=25.37%,247/3036=8.136%
34141,8fee02d5_ru,Россияне стали брать больше потребительских кредитов,,Others,,delay,all,False,0,3,2018-07-24 04:12:16,alexandr,18099/32195=56.22%,313/17193=1.821%
34142,92d83ac5_ru,В тюрьму за глазные капли: Минздрав расширил список запрещенных лекарств,,Others,,delay,all,False,0,3,2018-07-24 05:47:05,anastasijaf,22/113971=0.0193%,1040/21=4952%
34143,f491a057_ru,"Заключенные сообщили о пытках в крымской колонии: «Раздели, били, травили»",,News_Politics,,delay,all,False,0,3,2018-07-24 05:48:01,anastasijaf,106/16278=0.6512%,80/103=77.67%
34144,e0968bad_ru,Минздрав назвал страдающие от ожирения регионы,,Others,,delay,all,False,0,3,2018-07-24 05:53:07,anastasijaf,212/4=5300%,1/192=0.5208%
34145,9ad83b75_ru,Автор «скандальных» ток-шоу на НТВ станет ведущим «России 1»,,News_Entertainment,,delay,all,False,0,3,2018-07-24 05:54:21,anastasijaf,159/18022=0.8823%,114/156=73.08%
34146,109289c7_ru,Еду в Вануату. За сколько можно купить гражданство другой страны?,,Others,,delay,all,False,0,3,2018-07-24 05:56:52,anastasijaf,10/218=4.587%,2/10=20%
34147,7b334adc_ru,Кто выйдет из тюрем раньше срока из-за нового закона?,,Crime,,delay,all,False,0,3,2018-07-24 05:58:30,anastasijaf,5/3=166.7%,-/5=-
34148,55127bc_ru,"Результаты медобследования Роналду шокировали врачей ""Ювентуса""",,News_Sports,,delay,all,False,0,3,2018-07-24 06:01:07,anastasijaf,18/105572=0.01705%,1758/989=177.8%
34149,1805e644_ru,"Кадырова возмутила дочь алтайского чиновника, зарубившая котенка топором",,Others,,delay,all,False,0,3,2018-07-24 06:01:50,anastasijaf,887/107593=0.8244%,935/843=110.9%
34165,418f1e6d_ru,Путина попросили вмешаться еще в одну войну,Телеграмма с юга,News_Politics,,immediately,all,True,0,3,2018-07-24 06:13:40,borisf,135/1555692=0.008678%,40671/111=3.664e+04%
34167,6fd1169a_ru,Минэк выступил за упрощение покупки подержанных машин,,Business,,delay,all,False,0,3,2018-07-24 06:59:56,borisf,-/11=-,-/-=-
34168,38bdbce4_ru,Легковые автомобили россиян поставят на военный учет,,Others,,delay,all,False,0,3,2018-07-24 07:05:57,borisf,5/7=71.43%,-/5=-
34169,ee0c9506_ru,В Гидрометцентре рассказали о погоде в августе,,Others,,delay,all,False,0,3,2018-07-24 07:10:14,borisf,985/90166=1.092%,1122/895=125.4%
34170,695a3e24_ru,США нанесут удар по автомобилям из Европы,,News_Politics,,delay,all,False,0,3,2018-07-24 07:48:05,borisf,68/2=3400%,4/64=6.25%
34171,f2684b23_ru,Футболиста лишили приза лучшему игроку из-за возраста,,News_Sports,,delay,all,False,0,3,2018-07-24 07:49:23,borisf,31/113709=0.02726%,1014/30=3380%
34172,6cc1a4c3_ru,Минобороны предложило отбирать автомобили у граждан в случае войны,,Others,,delay,all,False,0,3,2018-07-24 08:03:24,borisf,1/7=14.29%,-/1=-
34173,404e3c7_ru,Россиянку признали лучшим писателем-фантастом Европы,,Others,,delay,all,False,0,3,2018-07-24 08:28:32,borisf,34/28062=0.1212%,233/33=706.1%
34174,a75ab4bc_ru,Чемпионка России и Белоруссии по футболу умерла в 28 лет,,News_Sports,,delay,all,False,0,3,2018-07-24 08:32:31,borisf,34/50=68%,4/30=13.33%
34175,f969b5a4_ru,Количество американских войск в странах мира: свежие данные,,Others,,delay,all,False,0,3,2018-07-24 08:34:19,borisf,2/149=1.342%,-/2=-
34185,c8764316_ru,Госдума окончательно приняла закон о повышении НДС,,Others,,delay,all,False,0,3,2018-07-24 09:19:25,borisf,8/6=133.3%,-/8=-
34190,190dd5b3_ru,"В США считают, что «российские хакеры» проникли в энергосети страны",,Others,,delay,all,False,0,3,2018-07-24 09:24:36,alexandr,-/4=-,-/-=-
34191,3a006d12_ru,Все автомобили россиян поставят на учет в Минобороны,,Others,,delay,all,False,0,3,2018-07-24 09:25:03,alexandr,4/-=-,-/4=-
34192,bc3a7d76_ru,Россиян оставили без многоэтажек,,Others,,delay,all,False,0,3,2018-07-24 09:25:28,alexandr,-/2=-,-/-=-
34193,82a2957c_ru,Правительство определилось с новым подходом к индексации пенсий,,Business,,delay,all,False,0,3,2018-07-24 09:53:24,borisf,5/-=-,-/4=-
34201,86e70092_ru,Укрпочта: Пенсии больше не платим - денег нет,,News_Politics,,delay,all,False,0,3,2018-07-24 10:12:54,anastasijaf,4/1=400%,-/4=-
34204,77e29f77_ru,В Комсомольске-на-Амуре мальчик выжил после падения с девятого этажа,,Others,,delay,all,False,0,3,2018-07-24 10:27:47,anastasijaf,2/-=-,-/4=-
34205,c5c48394_ru,В Париже покончила с собой одна из основательниц движения Femen,,Others,,delay,all,False,0,3,2018-07-24 10:28:33,anastasijaf,4/3=133.3%,-/4=-
34206,2cfd3147_ru,Госдума приняла закон о повышении НДС до 20%‍,,Others,,delay,all,False,0,3,2018-07-24 10:29:30,anastasijaf,2/1=200%,-/2=-
34207,e735b328_ru,Голикова рассказала об индексации пенсий в 2019 году,,Others,,delay,all,False,0,3,2018-07-24 10:40:33,anastasijaf,7/5=140%,-/7=-
34208,a0519cef_ru,Керлингист Крушельницкий признается в употреблении допинга на Олимпиаде-2018,,News_Sports,,delay,all,False,0,3,2018-07-24 11:05:42,anastasijaf,20/15=133.3%,-/18=-
34209,e9be40f5_ru,"""Сотрудники колонии собираются мне мстить"": передавшая журналистам видео пыток",,Others,,delay,all,False,0,3,2018-07-24 11:14:42,anastasijaf,-/-=-,-/-=-
34216,4d918b41_ru,Израиль сбил самолет «Сухого»,,Others,,immediately,all,True,0,3,2018-07-24 11:56:52,anastasijaf,73018/179805=40.61%,6255/65571=9.539%
34217,ec0e5252_ru,В российской колонии до смерти запытали заключенного,,Others,,delay,all,False,0,3,2018-07-24 11:57:47,anastasijaf,4/2=200%,-/4=-
34218,223c3ef9_ru,Минобороны отказалось воевать на машинах россиян,,Others,,delay,all,False,0,3,2018-07-24 11:58:21,anastasijaf,2876/3082=93.32%,204/2793=7.304%
34219,d45c5631_ru,Экономика России провернула негативный маневр,,Business,,delay,all,False,0,3,2018-07-24 11:58:52,anastasijaf,2/1=200%,-/2=-
34220,4d066057_ru,Российские полицейские избили инвалида-колясочника за рацию,,Others,,delay,all,False,0,3,2018-07-24 12:00:05,anastasijaf,10/7=142.9%,2/10=20%
34221,8ea64439_ru,Пожары на популярном у россиян курорте унесли десятки жизней,,Others,,delay,all,False,0,3,2018-07-24 12:00:52,anastasijaf,-/1=-,-/-=-
34228,17367c4_ru,Путин посетит саммит БРИКС в ЮАР,,Others,,delay,all,False,0,3,2018-07-24 13:01:19,alexandr,1/10=10%,-/1=-
34229,c58b9641_ru,Скончался советник президента РФ Вениамин Яковлев,,Others,,delay,all,False,0,3,2018-07-24 13:01:51,alexandr,3/2=150%,-/3=-
34230,ccde30e7_ru,Госдума учредила День принятия Крыма в состав России,,Others,,delay,all,False,0,3,2018-07-24 13:02:19,alexandr,6/4=150%,-/6=-
