id,entry_id,title,push_title,category,city,push_type,push_os,push_entire,test_mode,status,insert_time,operator,Receive/Send,Click/Show
16266,b504345_ru,Обвинения против Нетаньяху: в чем полиция подозревает премьер-министра Израиля?,,Others,,delay,all,False,0,3,2018-02-14 14:37:10,lyudmilat,-/-=-,-/-=-
16268,6164959a_ru,Собчак пожаловалась в Верховный суд на регистрацию кандидатуры Путина,,Others,,delay,all,False,0,3,2018-02-14 14:45:12,aleksandrak,-/-=-,-/-=-
16271,f3482790_ru,Россиян оставили без дневного сна,,Others,,delay,all,False,0,3,2018-02-14 14:51:46,aleksandrak,-/-=-,-/-=-
16278,ce40f8dd_ru,Российские хоккеисты стартовали на Олимпиаде с поражения,,News_Sports,,delay,all,False,0,3,2018-02-14 16:25:11,borisf,-/-=-,-/-=-
16279,dda45a61_ru,Ученые обнаружили подводный супервулкан у берегов Японии,,Others,,delay,all,False,0,3,2018-02-15 02:47:00,alexandr,-/-=-,-/-=-
16280,27da85b9_ru,Более 30 домов введут в 2018 году для переселения граждан по реновации,,Others,,delay,all,False,0,3,2018-02-15 02:47:51,alexandr,-/-=-,-/-=-
16281,5b269500_ru,В Госдуме ответили на замечание НАТО про «Искандеры»,,Others,,delay,all,False,0,3,2018-02-15 02:49:35,alexandr,-/-=-,-/-=-
16282,991f02a7_ru,Великобритания обвинила РФ в кибератаке с помощью вируса Petya,,Technology,,delay,all,False,0,3,2018-02-15 02:50:15,alexandr,-/-=-,-/-=-
16283,10262661_ru,«Реал» обыграл «ПСЖ» в первом мачте 1/8 Лиги чемпионов,,News_Sports,,delay,all,False,0,3,2018-02-15 02:51:18,alexandr,-/-=-,-/-=-
16284,919bb4e6_ru,Кадыров рассказал об итогах анализа халяльности криптовалюты,,Others,,delay,all,False,0,3,2018-02-15 02:53:05,alexandr,-/-=-,-/-=-
16285,68eb4d2d_ru,Названа сумма штрафа за незаконную продажу билетов на ЧМ-2018,,Others,,delay,all,False,0,3,2018-02-15 02:55:45,alexandr,-/-=-,-/-=-
16286,4488440a_ru,Число погибших при стрельбе в школе во Флориде возросло до 17 человек,,Others,,delay,all,False,0,3,2018-02-15 02:57:10,alexandr,-/-=-,-/-=-
16287,91c235d6_ru,Американский дипломат захотел экзотики и купил «Жигули» своего возраста,,Others,,delay,all,False,0,3,2018-02-15 04:10:57,alexandr,7/-=-,-/-=-
16288,9ef9d39c_ru,Россиянам с нестандартным мышлением предложат новый компактный кроссовер,,Auto,,delay,all,False,0,3,2018-02-15 04:12:19,alexandr,-/-=-,-/-=-
16293,e97740b6_ru,"Всех, кто за рулем, разделят на две категории",Водители получат отметку,Others,,immediately,all,True,0,3,2018-02-15 06:31:54,borisf,-/-=-,-/-=-
16296,d5a42e84_ru,Слезы вместо поцелуев. Тарасова и Морозов сами отдали медаль соперникам,,News_Sports,,delay,all,False,0,3,2018-02-15 07:01:19,lyudmilat,2/-=-,-/2=-
16298,578c24f6_ru,Насколько сильно зарплата влияет на будущую пенсию?,,Others,,delay,all,False,0,3,2018-02-15 07:46:24,lyudmilat,-/-=-,-/-=-
16300,f3d7e140_ru,В Петербурге торговцы БАДами создали крупное преступное сообщество,,Crime,,delay,all,False,0,3,2018-02-15 08:27:01,lyudmilat,-/-=-,-/-=-
16303,e15e374_ru,В посольство Нидерландов в Москве прислали белый порошок,,News_Politics,,delay,all,False,0,3,2018-02-15 08:30:48,lyudmilat,45/-=-,-/45=-
16304,52a0f78d_ru,Британский МИД обвинил Россию в кибератаке с использованием вируса NotPetya,,Others,,delay,all,False,0,3,2018-02-15 08:36:23,lyudmilat,-/-=-,-/-=-
16305,2e184311_ru,Российские керлингистки одержали первую победу на ОИ-2018,,News_Sports,,delay,all,False,0,3,2018-02-15 08:37:23,lyudmilat,-/-=-,-/-=-
16306,c6919f7f_ru,Польша хочет построить собственный газопровод,,News_Politics,,delay,all,False,0,3,2018-02-15 08:40:35,lyudmilat,-/-=-,-/-=-
16312,5d65d0db_ru,Несколько посольств в Москве получили конверты с белым порошком,,Others,,delay,all,False,0,3,2018-02-15 09:19:00,lyudmilat,-/-=-,-/-=-
16313,6818d692_ru,У Германии не хватает танков для участия в военных операциях НАТО,,Others,,delay,all,False,0,3,2018-02-15 09:21:41,lyudmilat,-/-=-,-/-=-
16314,e1bb3b38_ru,"Во Флориде рассказали, как напавшему на школу удалось убить столько учеников",,Others,,delay,all,False,0,3,2018-02-15 09:22:21,lyudmilat,-/-=-,-/-=-
16315,89dddfa_ru,Журналист «Новой газеты» Нурматов покинул Россию,,Others,,delay,all,False,0,3,2018-02-15 09:31:42,lyudmilat,-/-=-,-/-=-
16316,c8551fd5_ru,Житель Челябинска предложил Минкульту показывать кино с субтитрами,,Others,,delay,all,False,0,3,2018-02-15 09:42:58,lyudmilat,-/-=-,-/-=-
16317,c834d62c_ru,Госдума может разрешить показ нацистской символики без цели пропаганды,,Others,,delay,all,False,0,3,2018-02-15 10:11:08,lyudmilat,-/-=-,-/-=-
16318,1afe3e60_ru,Журналист Али Феруз улетел из России в Германию,,Others,,delay,all,False,0,3,2018-02-15 10:12:36,aleksandrak,-/-=-,-/-=-
16319,a23f0497_ru,Ученые признали йогурты полезными для здоровья сердца и сосудов,,Others,,delay,all,False,0,3,2018-02-15 10:13:22,aleksandrak,72/-=-,-/-=-
16320,76203145_ru,Кудрин анонсировал увольнение трети чиновников,,Others,,delay,all,False,0,3,2018-02-15 10:14:24,aleksandrak,-/-=-,-/-=-
16321,d979362c_ru,Выход новой части «Игры престолов» отложили еще на год,,News_Entertainment,,delay,all,False,0,3,2018-02-15 10:18:47,aleksandrak,-/-=-,-/-=-
16324,cc63e861_ru,"В американских школах запрещают понятие ""лучший друг""",,Others,,delay,all,False,0,3,2018-02-15 10:24:35,aleksandrak,-/-=-,-/-=-
16326,4f0986ea_ru,Найдено неожиданное применение радиоактивным отходам из Чернобыля,,Others,,delay,all,False,0,3,2018-02-15 10:30:24,aleksandrak,-/-=-,-/-=-
16328,c10e7e1_ru,Британские физики сфотографировали одиночный атом,,Others,,delay,all,False,0,3,2018-02-15 10:36:31,aleksandrak,-/-=-,-/-=-
16329,dd56e19d_ru,Суд отменил штраф за фото c Парада Победы 1945 года в соцсети,,Others,,delay,all,False,0,3,2018-02-15 10:37:39,borisf,-/-=-,-/-=-
16330,613e14cd_ru,Власти Крыма намерены развивать скоростные пассажирские перевозки по морю,,Others,,delay,all,False,0,3,2018-02-15 10:38:00,aleksandrak,-/-=-,-/-=-
16332,dead2b78_ru,Специалисты МАК получили запись разговоров в кабине падающего Ан-148,,Others,,delay,all,False,0,3,2018-02-15 10:41:29,borisf,-/-=-,-/-=-
16333,61ae77f8_ru,"Женщины живут дольше мужчин: оказалось, что хромосомы ни при чем",,Others,,delay,all,False,0,3,2018-02-15 10:41:58,aleksandrak,-/-=-,-/-=-
16335,be3166eb_ru,В Москве назвали самые необычные имена новорожденных в 2017 году,,Others,,delay,all,False,0,3,2018-02-15 10:44:16,aleksandrak,-/-=-,-/-=-
16337,ff3b740f_ru,Названы сроки принятия законов о криптовалютах в России,,Others,,delay,all,False,0,3,2018-02-15 10:45:40,borisf,-/-=-,-/-=-
16339,1230df2e_ru,Бывшая супруга Владимира Потанина претендует на 1 трлн рублей,,Others,,delay,all,False,0,3,2018-02-15 10:49:19,borisf,-/-=-,-/-=-
16340,6217d997_ru,Уникальный случай: мужчина смог вскормить грудью ребенка,,Others,,delay,all,False,0,3,2018-02-15 10:53:22,borisf,-/-=-,-/-=-
16341,7df9455f_ru,Странные запреты: что нужно убрать из чемодана перед полетом,,Others,,delay,all,False,0,3,2018-02-15 10:54:27,aleksandrak,-/-=-,-/-=-
16342,4475e33_ru,"УНИАН, прекрати! Украинские СМИ снова «разрушили» Крымский мост",,Others,,delay,all,False,0,3,2018-02-15 10:56:36,borisf,-/-=-,-/-=-
16345,a829ec96_ru,BMW построит в России свой первый завод полного цикла,,Auto,,delay,all,False,0,3,2018-02-15 11:01:17,borisf,-/-=-,-/-=-
16346,3df4458d_ru,Кудрин анонсировал увольнение трети чиновников,,News_Politics,,delay,all,False,0,3,2018-02-15 11:13:04,lyudmilat,-/-=-,-/-=-
16347,75f5ffa6_ru,"""Лёд"" тронулся и лидирует в прокате",,News_Entertainment,,delay,all,False,0,3,2018-02-15 11:21:03,borisf,-/-=-,-/-=-
16348,8fc620fe_ru,Цунтробанк поможет россиянам меньше платить по ипотеке,,Business,,delay,all,False,0,3,2018-02-15 11:22:40,borisf,-/-=-,-/-=-
16349,65226c41_ru,Российские интернет-провайдеры начали блокировать сайт Навального,,Technology,,delay,all,False,0,3,2018-02-15 11:23:08,lyudmilat,-/-=-,-/-=-
16351,8abb866c_ru,В России заблокировали сайт Навального,,Others,,delay,all,False,0,3,2018-02-15 11:46:47,aleksandrak,-/-=-,-/4=-
16352,e8d6a23_ru,«Макдоналдс» убрал чизбургеры из детских наборов.,,Others,,delay,all,False,0,3,2018-02-15 11:50:11,lyudmilat,-/-=-,-/-=-
16353,265c51be_ru,"Страны НАТО договорились создать ""военный Шенген""",,Others,,delay,all,False,0,3,2018-02-15 11:56:00,lyudmilat,-/-=-,-/-=-
16354,93a20989_ru,В США женщина-трансгендер впервые смогла кормить ребёнка грудью,,Others,,delay,all,False,0,3,2018-02-15 11:57:38,aleksandrak,-/-=-,-/-=-
16355,ba6d9c56_ru,НАТО создаст «военный Шенген»,,Others,,delay,all,False,0,3,2018-02-15 12:04:07,aleksandrak,-/-=-,-/-=-
16359,bd5b577f_ru,Новый вид антибиотиков борется даже с устойчивыми бактериями,,Others,,delay,all,False,0,3,2018-02-15 12:23:18,lyudmilat,-/-=-,-/-=-
16366,43ba1c40_ru,Израильские ученые научились определять настроение человека по почерку,,Others,,delay,all,False,0,3,2018-02-15 12:50:57,aleksandrak,-/-=-,-/-=-
16368,18373bf7_ru,Чернильный дракон. Зачем в странах СНГ кириллицу меняют на латиницу?,,News_Politics,,delay,all,False,0,3,2018-02-15 13:01:48,aleksandrak,-/-=-,-/-=-
16370,c6e64dd1_ru,КНДР под властью женщины: чего ждать от Ким Ё Чжон,,Others,,delay,all,False,0,3,2018-02-15 13:06:55,lyudmilat,-/-=-,-/-=-
16372,25993286_ru,Парламент ЮАР избрал нового президента,,Others,,delay,all,False,0,3,2018-02-15 13:13:31,lyudmilat,-/-=-,-/-=-
16373,59f8c4f0_ru,Студентов ВГИКа угрозами загнали на лекцию Мединского,,Education,,delay,all,False,0,3,2018-02-15 13:14:59,aleksandrak,-/-=-,-/-=-
16374,4ad8d1d8_ru,"Суд отменил штраф человеку, разместившему фотографию с Парада Победы",,Others,,delay,all,False,0,3,2018-02-15 13:16:38,aleksandrak,-/-=-,-/-=-
16375,f3673191_ru,Грудинин не коммунист и не может возглавлять КПРФ - Зюганов,,News_Politics,,delay,all,False,0,3,2018-02-15 13:32:16,lyudmilat,-/-=-,-/-=-
16376,83510c71_ru,"Дания обвинила Россию в кибератаке, «сравнимой с военным ударом»",,Others,,delay,all,False,0,3,2018-02-15 13:33:46,lyudmilat,-/-=-,-/-=-
16377,a6f32257_ru,Кабмин ужесточил правила прохождения техосмотра,,Others,,delay,all,False,0,3,2018-02-15 13:34:41,lyudmilat,-/-=-,-/-=-
16379,8637b6a3_ru,"Психологи вычислили, сколько денег нужно для счастья",,Others,,delay,all,False,0,3,2018-02-15 13:54:19,aleksandrak,-/-=-,-/-=-
16384,e20218ca_ru,Российских военных лишат смартфонов,,Others,,delay,all,False,0,3,2018-02-15 14:12:07,aleksandrak,-/-=-,-/-=-
16385,23f2ed8c_ru,"Голодец заявила, что пенсии должны вырасти до 25 тысяч рублей",,Others,,delay,all,False,0,3,2018-02-15 14:19:13,lyudmilat,-/-=-,-/-=-
16386,a2c392c0_ru,"Китайский Новый год Собаки 2018: когда праздновать, что сулит",,Others,,delay,all,False,0,3,2018-02-15 14:21:02,lyudmilat,-/-=-,-/-=-
16387,21b82482_ru,"Спецоперация в Дагестане: уничтожен главарь банды, подорвавшей воинскую колонну",,Others,,delay,all,False,0,3,2018-02-15 14:31:00,lyudmilat,-/-=-,-/-=-
16402,9617d2e9_ru,"Жильцы сами выберут способ оплаты ""коммуналки""",,Others,,delay,all,False,0,3,2018-02-15 14:59:34,alexandr,-/-=-,-/-=-
16403,1e084eb6_ru,"Фильм ""Лёд"" стартовал в День всех влюбленных с рекорда",,Others,,delay,all,False,0,3,2018-02-15 15:00:19,alexandr,-/-=-,-/-=-
16404,5fcf371b_ru,АвтоВАЗ сократил убыток по итогам года почти в пять раз,,Auto,,delay,all,False,0,3,2018-02-15 15:03:40,alexandr,-/-=-,-/-=-
16405,ee4334f3_ru,"Глава Роструда рассказал о будущем ""серой"" занятости",,Others,,delay,all,False,0,3,2018-02-15 15:06:08,alexandr,-/-=-,-/-=-
16407,90d13e24_ru,В России изменились правила прохождения техосмотра,,Others,,delay,all,False,0,3,2018-02-15 15:09:44,alexandr,-/-=-,-/-=-
16408,1e25cdab_ru,Минкомсвязи не исключило возможность блокировки в России YouTube и Instagram,,Others,,delay,all,False,0,3,2018-02-15 15:10:17,lyudmilat,-/-=-,-/-=-
16409,58bf6a6a_ru,Гребенщиков назвал фильм Серебренникова о Цое лживым,,News_Entertainment,,delay,all,False,0,3,2018-02-16 04:07:24,alexandr,-/-=-,-/-=-
16410,3cb22062_ru,"Стрелок из Флориды заявил, что устроил атаку по приказу голосов",,Others,,delay,all,False,0,3,2018-02-16 04:08:27,alexandr,-/-=-,-/-=-
16411,8fa155e_ru,Некредитные организации получат доступ к единой биометрической системе,,Business,,delay,all,False,0,3,2018-02-16 04:16:39,alexandr,-/-=-,-/-=-
16412,d8a98513_ru,ВЦИОМ рассказал о планах россиян на покупку автомобилей в 2018 году,,Others,,delay,all,False,0,3,2018-02-16 04:18:39,alexandr,-/-=-,-/-=-
16413,fe58f7e4_ru,Австралия обвинила Россию в создании вируса NotPetya,,Technology,,delay,all,False,0,3,2018-02-16 04:19:59,alexandr,-/-=-,-/-=-
16414,7b5cef9e_ru,"Эксперт рассказал, к чему может привести ужесточение правил техосмотра",,Others,,delay,all,False,0,3,2018-02-16 04:24:16,alexandr,-/-=-,-/-=-
16415,114c3a82_ru,Ученые рассказали о связи роста со смертельно опасной болезнью,,Others,,delay,all,False,0,3,2018-02-16 04:26:43,alexandr,-/-=-,-/-=-
16416,6045fd8d_ru,В России ужесточили правила техосмотра,Без аптечки не пройдёт,Others,,immediately,all,True,0,3,2018-02-16 06:12:31,alexandr,-/-=-,-/-=-
16418,25dc2709_ru,Минпромторг назвал дату введения продуктовых карточек в России,,Others,,delay,all,False,0,3,2018-02-16 07:57:01,borisf,2/-=-,-/2=-
16424,c97e3746_ru,Пилоты Ан-148 ругались до катастрофы,,Others,,delay,all,False,0,3,2018-02-16 08:19:41,borisf,75/-=-,-/-=-
16425,ba211da3_ru,Найден способ включить YouTube в России,,Others,,delay,all,False,0,3,2018-02-16 08:22:36,borisf,-/-=-,-/-=-
16426,a13e1fb9_ru,"В Skype нашли опасную уязвимость, но Microsoft не будет ее исправлять",,Others,,delay,all,False,0,3,2018-02-16 08:26:19,borisf,-/-=-,-/-=-
16427,eee4b0f6_ru,Норовирусную инфекцию на Олимпиаде подхватили спортсмены,,News_Sports,,delay,all,False,0,3,2018-02-16 08:33:40,borisf,-/-=-,-/-=-
16428,886d6bc5_ru,Неврологи подсказали путь к избавлению от лишнего веса,,Others,,delay,all,False,0,3,2018-02-16 08:36:29,borisf,-/-=-,-/-=-
16429,824ffda_ru,Forbes признал Павла Дурова долларовым миллиардером,,Technology,,delay,all,False,0,3,2018-02-16 08:51:34,borisf,-/-=-,-/-=-
16430,d8fe172d_ru,Российский лыжник завоевал медаль на Олимпиаде,,News_Sports,,delay,all,False,0,3,2018-02-16 08:52:10,borisf,2/-=-,-/2=-
16432,323cfc83_ru,Россияне решили продлить себе мартовские каникулы,,Others,,delay,all,False,0,3,2018-02-16 09:49:20,aleksandrak,-/-=-,-/-=-
16433,9511f05_ru,В Израиле создали защиту от системы распознавания лиц,,Technology,,delay,all,False,0,3,2018-02-16 09:50:49,aleksandrak,-/-=-,-/-=-
16434,1bd0fd34_ru,Верховный суд рассмотрит жалобу Собчак на регистрацию Путина на выборах,,Others,,delay,all,False,0,3,2018-02-16 09:52:12,aleksandrak,1/-=-,-/1=-
16436,cd16ff71_ru,Медведев призвал очистить законодательство,,Education,,delay,all,False,0,3,2018-02-16 09:53:50,aleksandrak,-/-=-,-/-=-
16441,a02b335a_ru,Моющие средства оказались опасными для женщин,,Others,,delay,all,False,0,3,2018-02-16 10:01:06,aleksandrak,-/-=-,-/-=-
16442,a92bfa4b_ru,5 самых развлекательных городов мира,,Others,,delay,all,False,0,3,2018-02-16 10:01:49,aleksandrak,-/-=-,-/-=-
16444,3a07dc90_ru,Японцам разрешат по желанию выходить на пенсию после 70 лет,,Others,,delay,all,False,0,3,2018-02-16 10:04:51,aleksandrak,-/-=-,-/-=-
16445,a06a488b_ru,Полиция применила слезоточивый газ на антиамериканской демонстрации в Турции,,News_Politics,,delay,all,False,0,3,2018-02-16 10:05:44,lyudmilat,-/-=-,-/-=-
16447,168ef582_ru,Найдено объяснение выходу животных на сушу,,Others,,delay,all,False,0,3,2018-02-16 10:07:02,aleksandrak,-/-=-,-/-=-
16448,1e9de704_ru,Ученые объяснили особо сильную боль от пореза бумагой,,Others,,delay,all,False,0,3,2018-02-16 10:12:19,aleksandrak,-/-=-,-/-=-
16459,cd91b0b5_ru,«Яндекс» показал испытания беспилотной машины в реальных условиях зимы,,Others,,delay,all,False,0,3,2018-02-16 10:44:05,aleksandrak,-/-=-,-/-=-
16462,3469b25f_ru,Турция вынудила США ограничить поддержку сирийских курдов,,News_Politics,,delay,all,False,0,3,2018-02-16 11:17:02,lyudmilat,-/-=-,-/-=-
16463,70670727_ru,Российские хоккеисты забросили словенцам восемь шайб на Олимпиаде,,News_Sports,,delay,all,False,0,3,2018-02-16 11:26:37,lyudmilat,-/-=-,-/-=-
16465,425351ac_ru,Беспилотный автомобиль «Яндекса» проехал по московским улицам,,Others,,delay,all,False,0,3,2018-02-16 11:39:48,lyudmilat,-/-=-,-/-=-
16468,d84cd540_ru,ЦБ предложил запретить уличные табло с курсами валют,,Business,,delay,all,False,0,3,2018-02-16 11:41:18,borisf,-/-=-,-/-=-
16477,c4ffd86e_ru,"Верховный суд признал законной регистрацию Путина, отклонив иск Собчак",,Others,,delay,all,False,0,3,2018-02-16 12:03:48,aleksandrak,-/-=-,-/-=-
16483,91c66c6c_ru,CAS объяснил недопуск 13 россиян на Олимпиаду в Пхёнчхане,,News_Sports,,delay,all,False,0,3,2018-02-16 12:36:14,lyudmilat,75/-=-,-/74=-
16484,f5294b2e_ru,В Госдуме обвинения РФ в организации кибератак назвали беспочвенными,,Technology,,delay,all,False,0,3,2018-02-16 12:37:19,lyudmilat,-/-=-,-/-=-
16485,53142c8a_ru,Наблюдатели ОБСЕ зафиксировали продвижение частей ВСУ в Донбассе,,News_Politics,,delay,all,False,0,3,2018-02-16 12:39:29,lyudmilat,-/-=-,-/-=-
16486,b72ce4f4_ru,Матерившийся во время заседания судья Краснодарского суда уволился,,News_Politics,,delay,all,False,0,3,2018-02-16 12:40:04,lyudmilat,-/-=-,-/-=-
16487,ed8f9213_ru,Москвичам предлагают переименовать линии метро,,Others,,delay,all,False,0,3,2018-02-16 12:47:29,lyudmilat,72/-=-,-/-=-
16488,9a2d7d56_ru,Верховный суд не удовлетворил жалобу Собчак на Путина,,Others,,delay,all,False,0,3,2018-02-16 12:53:49,lyudmilat,-/-=-,-/-=-
16492,49b5b9a8_ru,"Натяжной гламур. 10 признаков того, что вам пора делать ремонт",,Others,,delay,all,False,0,3,2018-02-16 13:09:35,aleksandrak,-/-=-,-/-=-
16495,4dcd7166_ru,"Социальная сеть ""ВКонтакте"" оказалась недоступна",,Technology,,delay,all,False,0,3,2018-02-16 13:18:02,lyudmilat,-/-=-,-/-=-
16496,8abef257_ru,Уличные табло с курсами валют могут попасть под запрет,,Business,,delay,all,False,0,3,2018-02-16 13:18:52,lyudmilat,-/-=-,-/-=-
16498,dfcab170_ru,"Минпромторг назвал дату введения ""талонов на бедность"" в России",,Others,,delay,all,False,0,3,2018-02-16 13:22:10,lyudmilat,-/-=-,-/-=-
16505,f62f1231_ru,Въездной турпоток в Россию увеличился,,Others,,delay,all,False,0,3,2018-02-16 14:19:57,alexandr,-/-=-,-/-=-
16506,c2eec8dc_ru,Бывший пилот прокомментировал содержание самописца упавшего Ан-148,,Others,,delay,all,False,0,3,2018-02-16 14:22:35,alexandr,-/-=-,-/-=-
16507,5b4bb5d0_ru,"Ученые выяснили, почему порезы от бумаги вызывают сильную боль",,Others,,delay,all,False,0,3,2018-02-16 14:24:44,alexandr,-/-=-,-/-=-
16508,8e20c774_ru,Раскрыты риски бедности для молодых россиян с детьми,,Others,,delay,all,False,0,3,2018-02-16 14:28:45,alexandr,-/-=-,-/-=-
16509,e9b1602f_ru,США запустят спутники Судного дня,,Technology,,delay,all,False,0,3,2018-02-16 14:29:22,alexandr,-/-=-,-/-=-
16510,e440b2ab_ru,Россиян оградят от созерцания курсов валют,,Business,,delay,all,False,0,3,2018-02-16 14:30:41,alexandr,-/-=-,-/-=-
16511,ca97ce0f_ru,Тимати припомнили дисс на Россию и назвали основателем оппозиционного рэпа,,News_Entertainment,,delay,all,False,0,3,2018-02-16 14:32:06,alexandr,-/-=-,-/-=-
16512,97ac02ab_ru,Минтруд призвал отказаться от досрочных пенсий,,Others,,delay,all,False,0,3,2018-02-16 14:33:57,alexandr,-/-=-,-/-=-
16513,3a89a4c6_ru,Москвичам рекомендуют отказаться от поездок на автомобилях в выходные,,Others,,delay,all,False,0,3,2018-02-16 14:38:45,lyudmilat,-/-=-,-/-=-
16514,3deffb46_ru,Администрация «ВКонтакте» объяснила сбой в работе соцсети,,Others,,delay,all,False,0,3,2018-02-16 14:39:37,lyudmilat,-/-=-,-/-=-
16515,b778d556_ru,Что известно о погибших и раненых в Сирии россиянах,,News_Politics,,delay,all,False,0,3,2018-02-16 14:46:34,lyudmilat,-/-=-,-/-=-
