id,entry_id,title,push_title,category,city,push_type,push_os,push_entire,test_mode,status,insert_time,operator,Receive/Send,Click/Show
22714,73856430_ru,Химики расшифровали доклад о «Новичке»: Скрипалей отравили англичане,,Others,,delay,all,False,0,3,2018-04-13 08:23:08,borisf,-/-=-,-/-=-
22715,73243fe4_ru,На сколько оштрафуют за знак «Шипы» летом,,Others,,delay,all,False,0,3,2018-04-13 08:24:16,borisf,-/-=-,-/-=-
22718,96db2017_ru,Cуд постановил заблокировать Telegram в России,,Others,,delay,all,False,0,3,2018-04-13 08:41:41,leiz,-/-=-,-/-=-
22722,f4ec215c_ru,"Юристы Telegram заявили, что не видели документы по иску о блокировке",,Others,,delay,all,False,0,3,2018-04-13 08:48:56,leiz,-/-=-,-/-=-
22725,48caa753_ru,Настю Рыбку посадили в тюрьму,,Others,,delay,all,False,0,3,2018-04-13 08:52:51,leiz,-/-=-,-/-=-
22735,bf30eb6e_ru,Ураганам перестанут присваивать некоторые имена,,Others,,delay,all,False,0,3,2018-04-13 09:00:16,aleksandrak,-/-=-,-/-=-
22737,4900eb49_ru,Нейросеть может предсказывать поведение собак,,Others,,delay,all,False,0,3,2018-04-13 09:03:34,aleksandrak,-/-=-,-/-=-
22738,c94833f1_ru,В Африке найден самый большой череп льва,,Science,,delay,all,False,0,3,2018-04-13 09:04:41,leiz,-/-=-,-/-=-
22740,39485a7e_ru,Как выглядел проект строительства базы СССР на Луне,,Technology,,delay,all,False,0,3,2018-04-13 09:06:23,aleksandrak,-/-=-,-/-=-
22741,e1ff153c_ru,Российские футболисты провели самый успешный за последние годы сезон в УЕФА,,News_Sports,,delay,all,False,0,3,2018-04-13 09:08:09,leiz,-/-=-,-/-=-
22744,79496de0_ru,"Фотокорр ""России сегодня"" получил премию World Press Photo",,Others,,delay,all,False,0,3,2018-04-13 09:10:03,aleksandrak,-/-=-,-/-=-
22746,d705f6d3_ru,Сбербанк: оплата через распознавание лиц заработает очень скоро,,Technology,,delay,all,False,0,3,2018-04-13 09:10:23,borisf,-/-=-,-/-=-
22748,86cf697c_ru,Какие русофобские цитаты на самом деле подделаны,,Others,,delay,all,False,0,3,2018-04-13 09:17:14,borisf,-/-=-,-/-=-
22750,87e7af8f_ru,"В Балтийском море упал вертолет, есть погибшие",,Others,,delay,all,False,0,3,2018-04-13 09:20:48,aleksandrak,-/-=-,-/-=-
22751,86ee7613_ru,Сколько миллионов людей в мире говорят по-русски? Узнай ответ,,News_Politics,,delay,all,False,0,3,2018-04-13 09:22:31,borisf,-/-=-,-/-=-
22753,599c82ab_ru,Штраф за неправильную тонировку автомобилей хотят увеличить в 10 раз,,Auto,,delay,all,False,0,3,2018-04-13 09:24:21,aleksandrak,-/-=-,-/-=-
22756,d14b3c4a_ru,Роскомнадзор заблокировал онлайн-рацию Zello,,Technology,,delay,all,False,0,3,2018-04-13 09:26:55,aleksandrak,-/-=-,-/-=-
22758,5b1f36ee_ru,«Безлимит» и «эконом»: Минстрой внедрит новые тарифы ЖКХ,,Others,,delay,all,False,0,3,2018-04-13 09:28:24,borisf,-/-=-,-/-=-
22760,cb8b3e99_ru,Исчез жених Юлии Скрипаль,,Others,,delay,all,False,0,3,2018-04-13 09:31:31,borisf,-/-=-,-/-=-
22761,4d5d718b_ru,В Венеции могут начать брать с туристов плату за визит,,Others,,delay,all,False,0,3,2018-04-13 09:33:15,aleksandrak,-/-=-,-/-=-
22762,93bab0b7_ru,Будущий госсекретарь США заявил об убийстве «сотен» русских,,Others,,delay,all,False,0,3,2018-04-13 09:33:26,borisf,-/-=-,-/-=-
22763,2db0dc59_ru,Кашалот съел более 25 кг мусора,,Others,,delay,all,False,0,3,2018-04-13 09:34:29,aleksandrak,-/-=-,-/-=-
22764,b4a1f719_ru,Лионель Месси отпразднует день рождения в Подмосковье,,Others,,delay,all,False,0,3,2018-04-13 09:36:19,borisf,-/-=-,-/-=-
22765,c23e2de3_ru,5 секретов идеальной подписи,,Others,,delay,all,False,0,3,2018-04-13 09:44:06,borisf,-/-=-,-/-=-
22766,387fa5fe_ru,Теория плоской Земли опровергнута одним селфи с вершины Эвереста,,Others,,delay,all,False,0,3,2018-04-13 09:50:03,borisf,-/-=-,-/-=-
22767,e0294a81_ru,"Блогер неделю ел только в ""Макдоналдсе"" и похудел. Как?",,Others,,delay,all,False,0,3,2018-04-13 09:51:32,borisf,-/-=-,-/-=-
22768,c3a05333_ru,«Самое замечательное — выход в открытый космос»: как работают космонавты,,Others,,delay,all,False,0,3,2018-04-13 09:59:11,aleksandrak,-/-=-,-/-=-
22775,c8dea7a8_ru,"Во Франции задержали предполагаемых ""провокаторов евромайдана""",,News_Politics,,delay,all,False,0,3,2018-04-13 10:33:43,anastasijaf,-/-=-,-/-=-
22776,11604f64_ru,Охранник из Выборга зарубил двух мигрантов и пустил трупы плыть по реке в лодке,,Others,,delay,all,False,0,3,2018-04-13 10:36:42,anastasijaf,-/-=-,-/-=-
22778,6a8b0834_ru,"«Дуров, введи войска»: реакция соцсетей на блокировку Telegram в России",,Others,,delay,all,False,0,3,2018-04-13 10:47:25,anastasijaf,-/-=-,-/-=-
22779,6760b914_ru,Как обойти блокировку Telegram,,Others,,delay,all,False,0,3,2018-04-13 11:02:16,anastasijaf,-/-=-,-/-=-
22780,538f9b0_ru,Российская биатлонистка выиграла суд у газеты Bild из-за статьи о допинг,,News_Sports,,delay,all,False,0,3,2018-04-13 11:09:14,anastasijaf,-/-=-,-/-=-
22781,e82b2967_ru,Telegram отказался идти на уступки после блокировки,,Technology,,delay,all,False,0,3,2018-04-13 11:13:21,aleksandrak,-/-=-,-/-=-
22782,c8ca364b_ru,Кадыров предложил дать Путину бесконечное количество сроков,,News_Politics,,delay,all,False,0,3,2018-04-13 11:28:55,anastasijaf,-/-=-,-/-=-
22783,3c6705ae_ru,Улюкаева отправят в Сибирь,,Others,,delay,all,False,0,3,2018-04-13 11:29:30,anastasijaf,-/-=-,-/-=-
22784,80764222_ru,Назван российский город с самыми быстрорастущими зарплатами,,Others,,delay,all,False,0,3,2018-04-13 11:31:56,anastasijaf,-/-=-,-/-=-
22785,ca208944_ru,"""ВКонтакте"" поддержит авторов Telegram-каналов",,Others,,delay,all,False,0,3,2018-04-13 11:34:38,aleksandrak,-/-=-,-/-=-
22792,d111b79c_ru,Комиссия Совета Федерации обвинила «Медузу» во вмешательстве в выборы,,Others,,delay,all,False,0,3,2018-04-13 12:07:40,anastasijaf,-/-=-,-/-=-
22793,874120fb_ru,В ответ на санкции в Госдуме хотят выпускать пиратские товары,,News_Politics,,delay,all,False,0,3,2018-04-13 12:11:23,anastasijaf,-/-=-,-/-=-
22799,32dc568c_ru,Дуров рассказал о последствиях блокировки Telegram,,Technology,,delay,all,False,0,3,2018-04-13 15:16:42,borisf,-/-=-,-/-=-
22800,61007e5e_ru,"СРОЧНО: крупное ДТП в Вологодской области, есть погибшие",,Others,,delay,all,False,0,3,2018-04-13 17:06:07,anastasijaf,-/-=-,-/-=-
22801,a67735b1_ru,"Трамп объявил, что отдал приказ ударить по Сирии",,News_Politics,,delay,all,False,0,3,2018-04-14 01:59:47,leiz,-/-=-,-/-=-
22802,c108fe4a_ru,В Дамаске взорвались первые американские снаряды,,Others,,delay,all,False,0,3,2018-04-14 02:03:30,leiz,-/-=-,-/-=-
22803,ad1d8dbd_ru,Мэй объяснила решение начать удары по Сирии,,News_Politics,,delay,all,False,0,3,2018-04-14 02:06:21,leiz,14/-=-,-/14=-
22804,17a2846a_ru,Самочувствие метеозависимых людей улучшится из-за снижения активности Солнца,,Science,,delay,all,False,0,3,2018-04-14 02:09:52,leiz,-/-=-,-/-=-
22805,1a43adef_ru,Премьер Украины рассказал о неподъемном долге страны,,Others,,delay,all,False,0,3,2018-04-14 02:19:58,leiz,-/-=-,-/-=-
22811,87207b9_ru,США заявили о нежелании уничтожать Асада,,News_Politics,,delay,all,False,0,3,2018-04-14 05:11:21,leiz,-/-=-,-/-=-
22812,69cde3b1_ru,Два человека погибли в ДТП под Омском,,Others,,delay,all,False,0,3,2018-04-14 05:19:43,leiz,-/-=-,-/-=-
22813,4adceca7_ru,«Тотальный диктант» напишут в 1000 городов по всему миру,,Education,,delay,all,False,0,3,2018-04-14 05:22:30,leiz,-/-=-,-/-=-
22814,6009bc39_ru,"МЧС рассказало, как Монголия загрязняет озеро Байкал",,Others,,delay,all,False,0,3,2018-04-14 05:28:19,leiz,-/-=-,-/-=-
22815,756d69d1_ru,Почему людям нравятся кошки,,Others,,delay,all,False,0,3,2018-04-14 05:31:04,leiz,-/-=-,-/-=-
22821,7a315ddd_ru,Apple намерена увольнять сотрудников за утечки информации,,Others,,delay,all,False,0,3,2018-04-14 06:15:36,leiz,-/-=-,-/-=-
22822,cee91699_ru,"США, Великобритания и Франция атаковали Дамаск и Хомс",Главное об ударе по Сирии,News_Politics,,immediately,all,True,0,3,2018-04-14 07:05:08,leiz,1/-=-,2/1=200%
22824,78ae9e4d_ru,В США скончался кинорежиссер Милош Форман,,News_Entertainment,,delay,all,False,0,3,2018-04-14 07:30:36,leiz,-/-=-,-/-=-
22825,85088951_ru,Опубликован рейтинг самых продаваемых новых иномарок в России,,Auto,,delay,all,False,0,3,2018-04-14 07:35:52,leiz,-/-=-,-/-=-
22826,27010202_ru,Samsung выпустит сенсорный смартфон без выхода в интернет,,Technology,,delay,all,False,0,3,2018-04-14 07:39:42,leiz,-/-=-,-/-=-
22827,14107be0_ru,СК: запасной выход кинозала ТЦ в Кемерово был стянут тросом с замком,,Others,,delay,all,False,0,3,2018-04-14 07:47:17,leiz,-/-=-,-/-=-
22832,3a6e6995_ru,8 лучших фильмов про свадьбу,,News_Entertainment,,delay,all,False,0,3,2018-04-14 08:45:23,leiz,-/-=-,-/-=-
22833,1f974abb_ru,Топ-7 фильмов про виртуальную реальность,,News_Entertainment,,delay,all,False,0,3,2018-04-14 08:47:22,leiz,-/-=-,-/-=-
22834,e1c0fa1e_ru,Разработана новейшая вакцина против гепатита В,,Others,,delay,all,False,0,3,2018-04-14 08:49:00,leiz,-/-=-,-/-=-
22835,97109da9_ru,Мэй ушла от ответа на вопрос о повторных ударах по Сирии,,News_Politics,,delay,all,False,0,3,2018-04-14 08:51:48,leiz,-/-=-,-/-=-
22836,d305e6a0_ru,Госдума может ужесточить санкции в отношении США из-за атаки на Сирию,,News_Politics,,delay,all,False,0,3,2018-04-14 08:54:18,leiz,-/-=-,-/-=-
22842,a9872916_ru,«Перед смертью Люся Гурченко очень устала»,,Others,,delay,all,False,0,3,2018-04-14 09:27:41,leiz,-/-=-,-/-=-
22843,57ce2e81_ru,Очевидцы сняли на видео отражение сирийскими ПВО ракетной атаки,,Others,,delay,all,False,0,3,2018-04-14 10:33:03,anastasijaf,12/-=-,-/-=-
22848,ff16bace_ru,У Джо Линна Тернера из Deep Purple в Минске случился инфаркт,,Others,,delay,all,False,0,3,2018-04-14 10:46:47,anastasijaf,-/-=-,-/2=-
22850,cb2e6eae_ru,Сын Сергея Скрипаля погиб в Петербурге в 2017 году,,Crime,,delay,all,False,0,3,2018-04-14 10:53:28,leiz,-/-=-,-/-=-
22851,9043ae3c_ru,"В Хабаровске прошли похороны двух пилотов, погибших при крушении Ми-8",,Others,,delay,all,False,0,3,2018-04-14 10:55:17,leiz,-/-=-,-/-=-
22852,a4419f9e_ru,Экс-вокалист группы Deep Purple попал в больницу Минска,,News_Entertainment,,delay,all,False,0,3,2018-04-14 10:57:54,leiz,-/-=-,-/-=-
22853,8171c272_ru,На эвакуацию из «Зимней вишни» у посетителей было пять минут,,Others,,delay,all,False,0,3,2018-04-14 11:02:54,leiz,-/-=-,-/-=-
22858,898964aa_ru,Путин отреагировал на удар американцев по Сирии,,News_Politics,,delay,all,False,0,3,2018-04-14 11:18:06,anastasijaf,9/-=-,-/12=-
22860,565b320b_ru,Сирийская оппозиция назвала фарсом ракетную атаку США,,News_Politics,,delay,all,False,0,3,2018-04-14 11:19:44,anastasijaf,-/-=-,-/-=-
22861,55bf2c6b_ru,Вице-спикер Госдумы предложил заваривать кору дуба вместо американских лекарств,,News_Politics,,delay,all,False,0,3,2018-04-14 11:24:56,anastasijaf,-/-=-,-/-=-
22862,d0ab3bb_ru,Российские телеканалы изменили сетку вещания и сегодня говорят только о Сирии,,Others,,delay,all,False,0,3,2018-04-14 11:27:44,anastasijaf,-/-=-,-/-=-
22865,588313d0_ru,"""Дайте интервью, зачтется ему"": мама обвиненного антифашиста о шантаже ФСБ и НТВ",,Others,,delay,all,False,0,3,2018-04-14 11:59:08,anastasijaf,-/-=-,-/-=-
22866,2a91dfc9_ru,Елена Скрипаль не считает Россию виновной в нападении на Сергея и Юлию,,Others,,delay,all,False,0,3,2018-04-14 12:12:30,anastasijaf,-/-=-,-/-=-
22867,51cfe8df_ru,Легкомоторный самолет разбился в Липецкой области,,News_Sports,,delay,all,False,0,3,2018-04-14 12:13:20,anastasijaf,-/-=-,-/-=-
22870,e3d72be0_ru,Валютный кризис: Что будет с рублем после атаки на Сирию,,Business,,delay,all,False,0,3,2018-04-14 14:12:15,anastasijaf,-/-=-,-/-=-
22871,834ebab3_ru,Госдума собирается запретить американские лекарства (список),,Others,,delay,all,False,0,3,2018-04-14 14:13:06,anastasijaf,-/-=-,-/-=-
22874,9c55f131_ru,«Проявление совести человечества». Как на удар по Сирии отреагировали в мире,,News_Politics,,delay,all,False,0,3,2018-04-14 14:52:55,anastasijaf,-/-=-,-/-=-
22875,7e5da6d0_ru,Пентагон: сирийцы не сбили ни одной ракеты,,Others,,delay,all,False,0,3,2018-04-14 14:55:02,anastasijaf,79/-=-,-/79=-
22877,e65ba3a9_ru,Почему люди хотят войны,,News_Politics,,delay,all,False,0,3,2018-04-14 15:37:12,anastasijaf,-/-=-,-/-=-
22878,40ffd106_ru,Лавров рассказал о признаках отравления Скрипалей веществом BZ,,Others,,delay,all,False,0,3,2018-04-14 15:43:14,anastasijaf,-/-=-,-/-=-
22881,6308faa7_ru,Хейли заявила о готовности США нанести новый удар по Сирии,,Others,,delay,all,False,0,3,2018-04-14 16:28:05,anastasijaf,-/-=-,-/-=-
22882,9180bc56_ru,"НАТО рассказал, что Россия должна сделать после бомбежки Сирии",,Others,,delay,all,False,0,3,2018-04-14 17:54:03,anastasijaf,-/-=-,-/-=-
22883,c5cc0179_ru,Совбез ООН отклонил российскую резолюцию по Сирии,,News_Politics,,delay,all,False,0,3,2018-04-14 17:57:52,anastasijaf,-/-=-,-/-=-
22884,13ca1a99_ru,"Разработчик «Новичка» рассказал, чем могли отравить Скрипалей",,Others,,delay,all,False,0,3,2018-04-15 03:44:35,alexandr,73/-=-,-/71=-
22885,79141dc2_ru,«Роскосмос» оценит эффективность предприятий космической отрасли по KPI,,Others,,delay,all,False,0,3,2018-04-15 03:59:34,alexandr,-/-=-,-/-=-
22886,5b6164f8_ru,Олег Газманов раскритиковал рэп-баттлы,,News_Entertainment,,delay,all,False,0,3,2018-04-15 04:09:03,alexandr,79/-=-,-/-=-
22887,5d7e8303_ru,Фильм «Нелюбовь» стал победителем новой кинопремии «Золотая арка»,,Others,,delay,all,False,0,3,2018-04-15 04:11:36,alexandr,-/-=-,-/-=-
22891,d845a607_ru,Почему Красную горку отмечают неправильно,"""В загс или на кладбище?""",Others,,immediately,all,True,0,3,2018-04-15 07:27:42,alexandr,5/-=-,-/82=-
22893,b8dcccc1_ru,"Швейцария осудила США, Великобританию и Францию за спешку в Сирии",,Others,,delay,all,False,0,3,2018-04-15 09:10:24,aleksandrak,-/-=-,-/-=-
22895,bbe20247_ru,Один человек оказался под завалом в шахте в Ростовской области,,Others,,delay,all,False,0,3,2018-04-15 09:11:40,aleksandrak,-/-=-,-/-=-
22897,963c581d_ru,Сколько за прошлый год заработали российские депутаты и чиновники,,Others,,delay,all,False,0,3,2018-04-15 09:13:25,aleksandrak,-/-=-,-/-=-
22898,4b65d5a1_ru,Самая уродливая собака Великобритании стала моделью,,Others,,delay,all,False,0,3,2018-04-15 09:16:46,aleksandrak,16/-=-,-/-=-
22899,1f435301_ru,«Нелюбовь» Звягинцева получила премию «Восток-Запад. Золотая арка»,,News_Entertainment,,delay,all,False,0,3,2018-04-15 09:20:22,aleksandrak,-/-=-,-/-=-
22900,fe370f43_ru,"Ученые обнаружили, что двойные звезды ""плюются"" планетами",,Science,,delay,all,False,0,3,2018-04-15 09:20:38,aleksandrak,-/-=-,-/-=-
22904,abf516a2_ru,Мифы о лекарствах. Почему таблетки не всегда помогают и как их выбрать?,,Others,,delay,all,False,0,3,2018-04-15 09:28:57,aleksandrak,-/-=-,-/-=-
22909,2e5e779_ru,В Риме умер кинорежиссер Витторио Тавиани,,News_Entertainment,,delay,all,False,0,3,2018-04-15 13:35:59,aleksandrak,-/-=-,-/-=-
22911,37893351_ru,В какое время правильнее пить воду,,Others,,delay,all,False,0,3,2018-04-15 13:41:02,aleksandrak,-/-=-,-/-=-
22914,237d90f3_ru,ЕС выступает за создание двух государств для решения палестинской проблемы,,News_Politics,,delay,all,False,0,3,2018-04-15 13:59:29,alexandr,-/-=-,-/-=-
22915,745dccb0_ru,Сотрудники ЦРУ раскритиковали художественные фильмы о себе,,Others,,delay,all,False,0,3,2018-04-15 14:01:11,alexandr,-/-=-,-/-=-
22916,be215092_ru,Назван претендент на титульный бой с Нурмагомедовым,,News_Sports,,delay,all,False,0,3,2018-04-15 14:02:00,alexandr,-/-=-,-/-=-
22917,c5641166_ru,Порошенко считает армию Украины одной из самых эффективных в Европе,,News_Politics,,delay,all,False,0,3,2018-04-15 14:02:34,alexandr,-/-=-,-/-=-
22923,faba5b57_ru,"США заявили, что выведут войска из Сирии только достигнув своих ""целей""",,Others,,delay,all,False,0,3,2018-04-15 14:36:09,alexandr,-/-=-,-/-=-
22924,ff19c127_ru,В Николаеве произошел взрыв на территории автосалона,,Others,,delay,all,False,0,3,2018-04-15 14:36:47,alexandr,-/-=-,-/-=-
22925,2fe80c9b_ru,Путин обсудил с Роухани ситуацию в Сирии после авиаудара,,News_Politics,,delay,all,False,0,3,2018-04-15 14:37:53,alexandr,-/-=-,-/-=-
22926,236aae8e_ru,Названы возможные причины авиакатастрофы под Липецком,,News_Sports,,delay,all,False,0,3,2018-04-15 14:39:41,aleksandrak,3/-=-,-/-=-
22927,1b21b9f2_ru,Бракованный российский спутник окончательно потерялся,,Others,,delay,all,False,0,3,2018-04-15 14:39:52,alexandr,-/-=-,-/-=-
22929,63ccd0c7_ru,"Чтобы решить палестинскую проблему, ЕС хочет создать два государства",,News_Politics,,delay,all,False,0,3,2018-04-15 14:43:05,aleksandrak,-/-=-,-/-=-
22931,ee20fc58_ru,Rolls-Royce хочет делать двигатели для российско-китайского самолета,,Others,,delay,all,False,0,3,2018-04-15 14:44:11,alexandr,-/-=-,-/-=-
22932,8142a595_ru,Акция в поддержку заключенных каталонских политиков собрала 315 тыс. человек,,Others,,delay,all,False,0,3,2018-04-15 14:48:06,aleksandrak,-/-=-,-/-=-
22933,a7f051df_ru,В Британии предложили ограничить полномочия кабмина после удара по Сирии,,News_Politics,,delay,all,False,0,3,2018-04-15 14:51:40,aleksandrak,-/-=-,-/-=-
22934,1f950d8b_ru,СМИ: Великобритания готовит санкции против российских бизнесменов,,News_Politics,,delay,all,False,0,3,2018-04-15 14:58:30,alexandr,3/-=-,-/4=-
22941,9e6f4677_ru,Башар Асад попал в базу данных украинского сайта «Миротворец»,,Others,,delay,all,False,0,3,2018-04-15 15:21:44,alexandr,-/-=-,-/-=-
22942,bf4b80e4_ru,"Ученые рассказали, когда появится лекарство от ""болезни Стивена Хокинга""",,Others,,delay,all,False,0,3,2018-04-15 15:57:12,aleksandrak,-/-=-,-/-=-
22944,4e1aa225_ru,Киев решает судьбу договора с Москвой,,News_Politics,,delay,all,False,0,3,2018-04-15 15:59:01,aleksandrak,-/-=-,-/-=-
22945,4b745394_ru,«Спартак» подаст протест на результат матча с «Уралом»,,News_Sports,,delay,all,False,0,3,2018-04-15 16:00:42,alexandr,-/-=-,-/-=-
22946,2052e7b2_ru,Профпригодность водителей в РФ хотят проверять каждые 10 лет,,Others,,delay,all,False,0,3,2018-04-16 01:59:39,alexandr,-/-=-,-/-=-
22947,e23cafd8_ru,Госдума рассмотрит законопроект об антисанкциях,,News_Politics,,delay,all,False,0,3,2018-04-16 02:00:39,alexandr,-/-=-,-/-=-
22948,920c4bf0_ru,В России хотят запретить сыроподобные продукты,,Others,,delay,all,False,0,3,2018-04-16 02:02:01,alexandr,-/-=-,-/-=-
22949,c757cf01_ru,«Манчестер Сити» выиграл чемпионат Англии по футболу,,News_Sports,,delay,all,False,0,3,2018-04-16 02:02:46,alexandr,-/-=-,-/-=-
22950,8eeab143_ru,В Приморском крае от укусов клещей пострадали 76 человек,,Others,,delay,all,False,0,3,2018-04-16 02:06:30,alexandr,-/-=-,-/-=-
22951,c9cb9eee_ru,"Глава МИД Германии назвал Россию ""сложным"" партнером",,Others,,delay,all,False,0,3,2018-04-16 02:10:50,alexandr,-/-=-,-/-=-
22952,dac31cd8_ru,"""Коммерсант"" сообщил о не выделенных на ремонт ""Зимней вишне"" деньгах",,Others,,delay,all,False,0,3,2018-04-16 02:11:35,alexandr,-/-=-,-/-=-
22957,e5c4e071_ru,После авиаударов Запад выдвигает новый ультиматум Москве,Продолжение войны,News_Politics,,immediately,all,True,0,3,2018-04-16 06:13:59,alexandr,50/-=-,-/46=-
22964,a65b83cb_ru,Составлен ТОП-10 желанных у россиян смартфонов,,Technology,,delay,all,False,0,3,2018-04-16 06:29:08,alexandr,-/-=-,-/74=-
22965,759bd7a7_ru,«Мисс Россия» прокомментировала победу в конкурсе,,News_Entertainment,,delay,all,False,0,3,2018-04-16 07:32:45,alexandr,-/-=-,-/13=-
22966,5b7c4d53_ru,Сколько ракет коалиции на самом деле сбито советским оружием в Сирии,,Others,,delay,all,False,0,3,2018-04-16 08:43:57,borisf,-/-=-,-/-=-
22967,84b0cdad_ru,С каким пробегом лучше всего покупать машину,,Auto,,delay,all,False,0,3,2018-04-16 08:45:56,borisf,-/-=-,-/-=-
22968,8a3d1980_ru,"В Германии продают ""брежневский"" лимузин за 76 млн рублей",,Auto,,delay,all,False,0,3,2018-04-16 08:48:11,borisf,-/-=-,-/-=-
22975,865b0cb7_ru,Рубль вступил в полосу сильных колебаний,,Business,,delay,all,False,0,3,2018-04-16 09:12:49,borisf,-/-=-,-/-=-
