id,entry_id,title,push_title,category,city,push_type,push_os,push_entire,test_mode,status,insert_time,operator,Receive/Send,Click/Show
15549,b3a80821_id,Pernyataan Jokowi soal diktator untuk SBY?,,News_Politics,,delay,all,False,False,3,2017-08-09 12:32:32,siscaj,330877/2151327=15.38%,11242/212940=5.279%
15550,d8ad6b55_id,Koleksinya akan dimasukkan ke museum ini,Jokowi Punya Keris ,Business,,immediately,all,True,False,3,2017-08-09 13:29:32,erompas,820243/3110637=26.37%,19580/580152=3.375%
15551,66453a7c_id,Begini gaya hidup istri pengacara Sunan Kalijaga ,Tajir Abis!,News_Entertainment,,immediately,all,True,False,3,2017-08-09 14:45:57,erompas,1121887/2542845=44.12%,51177/788328=6.492%
15552,3ccd02f4_id,Dybala resmi gunakan nomor punggung 10 di Juventus,,News_Sports,,delay,android,False,False,3,2017-08-10 00:29:03,yogic,583218/557361=104.6%,15354/449538=3.416%
15553,dde0d095_id,Fadli Zon: Diktator tidak ditentukan oleh tampang,,News_Politics,,delay,android,False,False,3,2017-08-10 00:30:24,yogic,660831/857702=77.05%,30817/457606=6.734%
15554,ab6f4404_id,Sekjen Golkar tegaskan posisi Setnov tak terganti,,News_Politics,,delay,android,False,False,3,2017-08-10 00:32:12,yogic,358194/347512=103.1%,16806/223836=7.508%
15555,e69610f5_id,Sido Muncul bakal format ulang jamu tradisional,,Business,,delay,android,False,False,3,2017-08-10 00:34:49,yogic,3235/2749=117.7%,98/2398=4.087%
15556,74b1950b_id,Tulisan ibu ini tentang caesar bikin netizen gemas,,Parenting,,delay,android,False,False,3,2017-08-10 00:40:04,yogic,1702358/2611226=65.19%,67840/1093234=6.205%
15557,7664c271_id,"Wasekjen PKB: Bu Khofifah tokoh nasional, jangan jadi lokal",,News_Politics,Surabaya,delay,android,False,False,3,2017-08-10 00:41:12,yogic,49738/4158=1196%,1640/49352=3.323%
15558,28c6d7e_id,Acho dan pengelola Green Pramuka berdamai,,News_Entertainment,Jakarta,delay,android,False,False,3,2017-08-10 00:41:32,yogic,212015/262725=80.7%,7077/150684=4.697%
15559,c9334b23_id,Foto industri jamu Nyonya Meneer disegel bikin miris,,Business,"Semarang,Salatiga,Yogyakarta",delay,android,False,False,3,2017-08-10 00:44:25,yogic,15261/1315=1161%,783/14854=5.271%
15560,1a635241_id,FBI geledah rumah bekas ketua tim kampanye Trump,,News_Politics,,delay,android,False,False,3,2017-08-10 00:46:52,yogic,160563/154614=103.8%,7583/112068=6.766%
15561,94da4621_id,"Jenderal ini dekat banget dengan ulama, anggap ayah sendiri",,Religion,,delay,android,False,False,3,2017-08-10 00:47:36,yogic,1343811/1512301=88.86%,82622/823648=10.03%
15562,4d1eb21a_id,"Disalahgunakan untuk Iklan pizza, Victoria tempuh hukum",,News_Entertainment,,delay,android,False,False,3,2017-08-10 00:49:02,yogic,3058/35657=8.576%,89/2472=3.6%
15563,838d2731_id,Begini kondisi 3 halte tak terawat di Jalan Soekarno Hatta,,Travel,Bandung,delay,android,False,False,3,2017-08-10 00:50:04,yogic,19162/113354=16.9%,635/17020=3.731%
15564,5f8f5192_id,Alquran dan sains jelaskan matahari sebagai sumber warna,,Religion,,delay,android,False,False,3,2017-08-10 00:52:15,yogic,260353/487725=53.38%,8709/161092=5.406%
15565,98d12b85_id,"Austria bukan favorit, Rossi khawatirkan MotoGP 2017",,News_Sports,,delay,all,False,False,3,2017-08-10 00:53:34,yogic,315750/611517=51.63%,12822/198973=6.444%
15566,f6b187e3_id,Pelajaran karier dari kemenangan Anies Baswedan,,News_Politics,,delay,android,False,False,3,2017-08-10 00:54:50,yogic,323240/400875=80.63%,10526/253822=4.147%
15567,255c715b_id,"Gerakan Golkar Bersih, inikah tanda-tanda perpecahan?",Berita Top Pagi,News_Politics,,immediately,android,True,False,3,2017-08-10 01:31:07,yogic,6953004/25312340=27.47%,144311/4297657=3.358%
15568,d5a7b855_id,"Bingung bikin puisi, sajak siswa ini malah viral",,Funny,,delay,android,False,False,3,2017-08-10 03:49:30,yogic,2123721/8185182=25.95%,78452/1316669=5.958%
15569,473ed7ee_id,Berapa gaji Setya Novanto sebagai Ketua DPR RI?,,News_Politics,,delay,android,False,False,3,2017-08-10 03:49:42,yogic,101352/550725=18.4%,1976/60097=3.288%
15570,b312e601_id,"Orang kesurupan dibacakan Ayat Kursi malah dikoreks,i",,Funny,,delay,android,False,False,3,2017-08-10 03:51:41,yogic,3158407/9701061=32.56%,115413/1943476=5.938%
15571,2664c9cb_id,"Yama Carlos jamin tak ada KDRT, wanita maupun pria lain",,News_Entertainment,,delay,android,False,False,3,2017-08-10 03:52:57,yogic,60763/66431=91.47%,7645/36554=20.91%
15572,694ebe0d_id,Ternyata Najwa Shihab sudah 2 tahun tidak di Metro TV,,News_Entertainment,,delay,android,False,False,3,2017-08-10 03:54:18,yogic,1492141/3901445=38.25%,61694/888149=6.946%
15573,88c8b1f0_id,Aktor Tommy Kurniawan maju jadi Calon Bupati Tangerang,,News_Entertainment,"Jakarta,Bekasi,Tangerang",delay,android,False,False,3,2017-08-10 03:57:27,yogic,516045/834268=61.86%,19586/335145=5.844%
15574,b8448929_id,Selorohan Charles ini bikin Putri Diana sakit hati,,News_Entertainment,,delay,android,False,False,3,2017-08-10 03:58:47,yogic,29995/18117=165.6%,1330/31943=4.164%
15575,4b99bcbf_id,Ternyata pria ini yang siram tubuh Joya pakai bensin,,Crime,,delay,android,False,False,3,2017-08-10 04:00:46,yogic,2023264/4500251=44.96%,122236/1416193=8.631%
15576,7e57206e_id,Kronologi asmara anggota DPRD Ernawati dan narapidana,,News_Politics,,delay,android,False,False,3,2017-08-10 04:02:35,yogic,33227/27032=122.9%,1351/16553=8.162%
15577,972364b0_id,Jasa Marga Surabaya larang pengguna tol tanpa kartu,,Business,surabaya,delay,all,False,False,3,2017-08-10 04:03:31,andrewka,8816/8626=102.2%,275/5326=5.163%
15578,6454a1ee_id,Ini nama MPV baru keluaran Mitsubishi,,Auto,,delay,android,False,False,3,2017-08-10 04:03:41,yogic,1192326/5257911=22.68%,39488/748377=5.276%
15579,3a7027bc_id,Gugatan cerai digugurkan Ibnu Jamil layangkan talak,,News_Entertainment,jakarta,delay,all,False,False,3,2017-08-10 04:04:26,andrewka,54184/231626=23.39%,2227/33057=6.737%
15580,99f90d0d_id,Sylviana sambangi Balai Kota bertemu Djarot,,News_Politics,jakarta,delay,all,False,False,3,2017-08-10 04:04:40,andrewka,855661/4901048=17.46%,12151/540787=2.247%
15581,11954cfe_id,Pelaku curanmor lintas provinsi diringkus,,Crime,,delay,all,False,False,3,2017-08-10 04:04:54,andrewka,226757/292030=77.65%,7697/131960=5.833%
15582,508a1a5f_id,Ini dia bocah MU penerima medali Mourinho,,News_Sports,,delay,android,False,False,3,2017-08-10 04:05:04,yogic,267828/570112=46.98%,8708/180149=4.834%
15583,7f8edf71_id,Milisi Houthi eksekusi tentara pendukung eks Presiden Yaman,,Others_Terrorism,,delay,all,False,False,3,2017-08-10 04:05:19,andrewka,63856/339097=18.83%,2193/53200=4.122%
15584,763d7da3_id,Siapa pemotret pertama gerhana?,,Education,,delay,android,False,False,3,2017-08-10 04:05:46,yogic,138255/778542=17.76%,2617/85057=3.077%
15585,1dccd4a9_id,Curhatan siswa SMAN 10 Bekasi yang tak diakui pihak sekolah,,Education,bekasi,delay,all,False,False,3,2017-08-10 04:06:33,andrewka,128/240=53.33%,2/81=2.469%
15586,92a54744_id,"Kisah lucu Gus Dur, Romo Magnis, dan sopir bus",,Religion,,delay,all,False,False,3,2017-08-10 04:07:33,andrewka,158306/181644=87.15%,5179/98911=5.236%
15587,317c1676_id,Ahli fisika Indonesia klaim temukan bukti penciptaan,,Education,,delay,android,False,False,3,2017-08-10 04:07:39,yogic,14527/27820=52.22%,623/8381=7.433%
15588,d38bd991_id,"Dari perut hingga sekolah, Rafathar ada yang nanggung",,News_Entertainment,,delay,android,False,False,3,2017-08-10 04:10:02,yogic,892534/3115116=28.65%,31660/526873=6.009%
15589,aff0d216_id,Jalur terlarang motor di Jakarta dinilai sulitkan warga,,Crime,"Jakarta,Bekasi,Tangerang",delay,android,False,False,3,2017-08-10 04:11:35,yogic,103976/150138=69.25%,3680/60100=6.123%
15590,df30b4e4_id,Dirut First Travel dan istri ditangkap polisi,,Crime,,delay,all,False,False,3,2017-08-10 04:59:47,andrewka,56536/77481=72.97%,2187/37778=5.789%
15591,e4bd73de_id,Diplomat PBB pertimbangkan tindakan ke Korea Utara,,News_Politics,,delay,all,False,False,3,2017-08-10 05:00:47,andrewka,76163/71901=105.9%,2649/44441=5.961%
15592,e234a23d_id,AHY minta restu Jokowi untuk The Yudhoyono Institute,,News_Politics,,delay,all,False,False,3,2017-08-10 05:01:06,andrewka,274086/1203712=22.77%,8662/166906=5.19%
15593,84957c9f_id,"Sejumlah menteri dipanggil ke Istana, bahas reshuffle?",,News_Politics,,delay,all,False,False,3,2017-08-10 05:01:50,andrewka,175820/1035422=16.98%,1846/122908=1.502%
15594,60797ad3_id,Polisi gali potensi pencucian uang di kasus First Travel,,Crime,,delay,all,False,False,3,2017-08-10 05:03:13,andrewka,66854/141770=47.16%,1704/46258=3.684%
15595,4588a90e_id,JK: malu kita masih ribut soal garam,,Business,,delay,all,False,False,3,2017-08-10 05:04:30,andrewka,30858/47939=64.37%,1116/19791=5.639%
15596,a047e6f0_id,DPR RI jadi parlemen paling terbuka di Asia Tenggara,,News_Politics,,delay,all,False,False,3,2017-08-10 05:12:08,andrewka,1494/3011=49.62%,59/1033=5.712%
15597,a83a97d0_id,Pilot pesawat yang jatuhkan bom atom di Jepang mengakui ini,,News_Politics,,delay,all,False,False,3,2017-08-10 05:13:35,andrewka,186877/1127639=16.57%,3431/114751=2.99%
15598,824c4622_id,Cut Meyriska senang akhirnya bisa lihat hal ini,,News_Entertainment,,delay,all,False,False,3,2017-08-10 05:14:03,andrewka,297260/515282=57.69%,10338/182982=5.65%
15599,71f0331f_id,"Instagram ada live streaming baru, pilih sendiri penontonmu",,News_Entertainment,,delay,all,False,False,3,2017-08-10 05:15:32,andrewka,645390/1389450=46.45%,18634/401339=4.643%
15600,1f9313e0_id,"Punya nama unik, berikut kisah di balik nama bu guru ini",,Funny,,delay,android,False,False,3,2017-08-10 05:19:01,yogic,373548/870415=42.92%,13214/213634=6.185%
15601,2e6bbcce_id,"Faiz, mahasiswa kedokteran termuda di Universitas Airlangga",,Education,,delay,all,False,False,3,2017-08-10 05:20:01,andrewka,64568/64283=100.4%,2414/40116=6.018%
15602,e6346b79_id,"Guam, wilayah AS di Pasifik dihuni orang Indonesia purba",,News_Entertainment,,delay,all,False,False,3,2017-08-10 05:20:56,andrewka,195438/1157719=16.88%,5697/135444=4.206%
15603,d0975aa3_id,"Dituduh nyogok, ini sebenarnya penyebab dia keluar",Ingat Polisi Ganteng Ini?,Crime,Medan,immediately,android,True,False,3,2017-08-10 05:52:01,yogic,11846/13125=90.26%,835/7684=10.87%
15604,6b36847e_id,GIIAS 2017: Isuzu hadirkan 5 Model LCV dari MU-X & D-Max,,Auto,,delay,all,False,False,3,2017-08-10 05:55:43,andrewka,448316/2699393=16.61%,6368/282034=2.258%
15605,ec62ee06_id,"Ulang Tahun, Marshanda dapat ucapan ini dari Nia Ramadhani",,News_Entertainment,,delay,all,False,False,3,2017-08-10 05:56:09,andrewka,137165/203883=67.28%,4550/83578=5.444%
15606,9d707aee_id,"Umur masih belasan, artis muda ini sudah melahirkan",Baru Menikah 6 Bulan,News_Entertainment,Surabaya,immediately,android,True,False,3,2017-08-10 05:56:49,yogic,154423/222154=69.51%,7993/76359=10.47%
15607,f70e7d76_id,"Alasan 'SD' beli bensin, siram dan bakar tukang servis ",,Crime,,delay,all,False,False,3,2017-08-10 05:57:41,andrewka,2940945/11862861=24.79%,151162/1948127=7.759%
15608,48cd8a8e_id,"Masih ngutang, Barcelona cegah PSG mainkan Neymar",,News_Sports,,delay,all,False,False,3,2017-08-10 05:58:19,andrewka,406987/659341=61.73%,40857/253147=16.14%
15609,edf6e2e1_id,Prancis tangkap seorang Pria terduga penabrak 6 tentara,,Others_Terrorism,,delay,all,False,False,3,2017-08-10 05:58:43,andrewka,60076/76076=78.97%,958/43906=2.182%
15610,baec512b_id,"Korupsi suami istri wali kota Cimahi, Itoc lindungi Atty",,Crime,bandung,delay,all,False,False,3,2017-08-10 05:59:57,andrewka,89/212=41.98%,7/69=10.14%
15611,c48b0500_id,Del Bosque: Barca lebih bagus tanpa Neymar,,News_Sports,,delay,all,False,False,3,2017-08-10 06:00:09,andrewka,308627/425144=72.59%,18363/175965=10.44%
15612,382243e1_id,"Balas dendam, pemukim Israel bakar kendaraan warga Palestina",,Others_Terrorism,,delay,all,False,False,3,2017-08-10 06:00:36,andrewka,550353/2905844=18.94%,11963/460361=2.599%
15613,fcf7bf46_id,Penyanyi Ello ditangkap karena kasus narkoba,,News_Entertainment,,delay,android,False,False,3,2017-08-10 06:01:55,yogic,65989/187737=35.15%,1829/40595=4.505%
15614,a10b169b_id,"Peringatan! 3 Bulan Tak Bayar Sewa, Penghuni Rusunawa Diusir",,News_Politics,jakarta,delay,all,False,False,3,2017-08-10 06:03:57,andrewka,6444/9288=69.38%,249/4019=6.196%
15615,971cf6df_id,"Diisukan selingkuhan, Szheilla dekat dengan pemain bola",Ini Bukti Kemesraannya,News_Entertainment,Bandung,immediately,android,True,False,3,2017-08-10 06:10:22,yogic,5513/3937=140%,197/4463=4.414%
15616,e180aeca_id,"Cerai lagi, inikah selingkuhan Enji eks Ayu Ting Ting?",Ramai di Medsos,News_Entertainment,Others,immediately,android,True,False,3,2017-08-10 06:15:27,jatua,108425/166229=65.23%,4446/64224=6.923%
15617,b0126877_id,"Lah, Ello ditangkap polisi karena narkoba 4 hari lalu?",Baru Ketahuan Hari Ini,News_Entertainment,"Semarang,Salatiga,Yogyakarta,Jakarta,Bekasi,Tangerang",immediately,android,True,False,3,2017-08-10 06:20:05,jatua,96767/122178=79.2%,4812/59731=8.056%
15618,f6398d77_id,Istana angkat suara soal polemik patung raksasa di Tuban,,News_Politics,,delay,android,False,False,3,2017-08-10 06:59:57,yogic,555582/516069=107.7%,35566/445665=7.98%
15619,ae0764d5_id,"Tarif sekali parkir jadi Rp50 ribu, ini kata Sekda DKI",,Crime,"Jakarta,Bekasi,Tangerang",delay,android,False,False,3,2017-08-10 07:01:05,yogic,46004/111272=41.34%,1371/23975=5.718%
15620,8ca765d7_id,10 Foto lawas aktris saat jadi bintang iklan sabun,,News_Entertainment,,delay,all,False,False,3,2017-08-10 08:09:47,siscaj,56837/87503=64.95%,1802/30511=5.906%
15621,d8e5c19c_id,"Lama tak ada kabar, ini kegiatan hot mama Alexandra Gottardo",,News_Entertainment,,delay,all,False,False,3,2017-08-10 08:11:19,siscaj,51660/108876=47.45%,1093/34777=3.143%
15622,c436ef6d_id,"Bikin haru, 6 tentara gagah ini bersujud di kaki Ibunda",,Parenting,,delay,all,False,False,3,2017-08-10 08:12:32,siscaj,66032/163857=40.3%,1432/40826=3.508%
15623,d445c44f_id,5 Aktor Bollywood berbadan kekar ini rupanya vegetarian,,News_Entertainment,,delay,all,False,False,3,2017-08-10 08:17:04,siscaj,94222/237100=39.74%,1737/58329=2.978%
15624,25f82bd0_id,"Artis ini cuma lulusan SD, sekarang kehidupannya berubah",,News_Entertainment,,delay,all,False,False,3,2017-08-10 08:26:40,alvinka,138145/225823=61.17%,4169/101931=4.09%
15625,88027ebb_id,Enji eks Ayu Ting Ting mau perceraiannya tak terendus,,News_Entertainment,jakarta,delay,all,False,False,3,2017-08-10 08:27:15,alvinka,810245/1860319=43.55%,32548/550316=5.914%
15626,8466b2d6_id,"Menjelang nikah, Raisa galau di teaser MV 'usai di sini'",,News_Entertainment,,delay,all,False,False,3,2017-08-10 08:28:40,alvinka,18728/26832=69.8%,432/12605=3.427%
15627,ad97fe13_id,"Maia Estianty selfie bareng ayah, kenang zaman sekolah",,News_Entertainment,,delay,all,False,False,3,2017-08-10 08:30:50,alvinka,224408/225494=99.52%,7842/129662=6.048%
15628,bb1b6762_id,"Bikin gemas, Ada foto Aura Kasih kecil tanpa busana",,News_Entertainment,,delay,all,False,False,3,2017-08-10 08:32:55,alvinka,600813/817125=73.53%,23307/450145=5.178%
15629,c3197a1f_id,Pose lucu Maudy Ayunda dan Raisa bikin netizen bingung,,News_Entertainment,,delay,all,False,False,3,2017-08-10 08:33:44,alvinka,222749/410985=54.2%,5441/141993=3.832%
15630,c06dbcca_id,"6 kali hamil, 4 kali pula Ashanty alami keguguran",,News_Entertainment,,delay,all,False,False,3,2017-08-10 08:34:44,alvinka,294251/307555=95.67%,45778/204836=22.35%
15631,d9006c19_id,Mengenang AHY berseragam militer yang hipnotis kaum hawa,,News_Politics,,delay,all,False,False,3,2017-08-10 08:48:11,siscaj,179037/763716=23.44%,4143/110850=3.737%
15632,f503703c_id,"Ijab kabul dianggap sah, tapi mempelai pria kayak kumur",,Funny,,delay,android,False,False,3,2017-08-10 08:49:12,yogic,332945/968160=34.39%,9495/211336=4.493%
15633,eef0f719_id,"Mesranya Prilly Latuconsina dipeluk cowok ini, pacaran?",,News_Entertainment,,delay,all,False,False,3,2017-08-10 08:49:20,siscaj,79771/136726=58.34%,2526/49257=5.128%
15634,3de9405b_id,"Penampakan Ello sekarang kalau buka baju, kurus banget!",,News_Entertainment,,delay,all,False,False,3,2017-08-10 09:06:39,siscaj,124738/212936=58.58%,3055/106547=2.867%
15635,18ba654a_id,5 seleb ini pernah duet dengan penyanyi Korea,,News_Entertainment,,delay,all,False,False,3,2017-08-10 09:07:56,alvinka,48028/81967=58.59%,1061/29750=3.566%
15636,5b3158ea_id,Video Ajun Perwira dicekoki minuman oleh wanita>>,,News_Entertainment,,delay,all,False,False,3,2017-08-10 09:09:29,siscaj,92773/79498=116.7%,4712/67891=6.941%
15637,3cdc2eb_id,"Puji Jokowi, Arief Poyuono: saya disuruh Prabowo",,News_Politics,,delay,all,False,False,3,2017-08-10 09:16:35,siscaj,1379503/4536863=30.41%,46111/830590=5.552%
15638,2e8024c0_id,Wajah Soimah tanpa makeup disebut mirip ABG,,News_Entertainment,,delay,all,False,False,3,2017-08-10 09:17:26,alvinka,4513842/20911146=21.59%,157383/2633935=5.975%
15639,2e8024c0_id,"Wajah Soimah Tanpa Makeup Bikin Netizen Pangling, Disebut Mirip ABG",,News_Entertainment,,delay,all,False,True,3,2017-08-10 09:35:56,demo,-/76=-,-/-=-
15640,6b02329f_id,"Direnovasi, ini 8 perubahan GBK ",Bikin Pangling Deh,News_Sports,"Jakarta,Bekasi,Tangerang ",immediately,all,True,False,3,2017-08-10 09:58:53,erompas,1103030/4026125=27.4%,32863/630228=5.214%
15641,54ce61e8_id,Aremania desak 3 daerah ini pakai atribut Arema,Ada Apa Ini?,News_Sports,Surabaya,immediately,all,True,False,3,2017-08-10 10:05:04,erompas,179115/588182=30.45%,5489/115766=4.741%
15642,ff11005d_id,Kekasih Rina Nose pernah dekati Ayu Ting Ting?,,News_Entertainment,,delay,all,False,False,3,2017-08-10 10:07:46,alvinka,750187/1189915=63.05%,29080/484207=6.006%
15643,dea51c16_id,"Pamer wajah lelah, Prilly Latuconsina banjir pujian",,News_Entertainment,,delay,all,False,False,3,2017-08-10 10:08:32,alvinka,364794/677884=53.81%,7442/261598=2.845%
15644,c5f21caa_id,Mantan Ayu Ting Ting ceraikan istri karena orang ketiga?,,News_Entertainment,,delay,all,False,False,3,2017-08-10 10:09:13,alvinka,218195/434230=50.25%,7137/124671=5.725%
15645,a586ba65_id,Ini 3 kandidat kuat calon pelatih baru Persib ,Kembali ke Lokal?,News_Sports,Bandung,immediately,all,True,False,3,2017-08-10 10:11:11,erompas,55637/229543=24.24%,2047/32382=6.321%
15646,9ae4f43d_id,"Disampaikan pada Jokowi lewat AHY, ini isinya",SBY Titip Pesan ,News_Politics,"Medan,Others ",immediately,all,True,False,3,2017-08-10 10:17:51,erompas,592261/2451530=24.16%,15182/367601=4.13%
15647,172e0676_id,"Bak putri & pangeran, ini pose Natasha dengan Verrell",Serasi Sekali,News_Entertainment,"Semarang,Salatiga,Yogyakarta",immediately,all,True,False,3,2017-08-10 10:21:02,erompas,89214/289226=30.85%,2386/61465=3.882%
15648,a1a4b789_id,Deretan artis ditangkap kasus narkoba tahun ini >>,,Crime,,delay,all,False,False,3,2017-08-10 10:38:42,siscaj,230757/290872=79.33%,7447/136937=5.438%
15649,f701c3ae_id,"Ulang tahun, AHY dimasakin spesial oleh Gibran di istana",,News_Politics,,delay,android,False,False,3,2017-08-10 10:46:41,jatua,61653/118888=51.86%,1901/43247=4.396%
15650,efe47afd_id,Heboh peluncuran buku  professor hiburannya tari Perut,,Funny,,delay,android,False,False,3,2017-08-10 10:51:53,jatua,18875/27829=67.82%,521/12862=4.051%
15651,1d40e99c_id,"Enji kegep selingkuh & gugat cerai, curhatan istri bikin sedih",,News_Entertainment,,delay,android,False,False,3,2017-08-10 10:57:48,jatua,28053/181174=15.48%,1218/19307=6.309%
15652,fbb921e5_id,"Pakai ini sambil joget di Pesbukers, Zaskia Gotik picu kehebohan",,News_Entertainment,,delay,android,False,False,3,2017-08-10 10:59:33,jatua,767539/3049839=25.17%,28327/493349=5.742%
15653,e12dec31_id,"Ternyata dia berbakat, bisnis lipstik Kylie Jenner sudah triliunan!",,News_Entertainment,,delay,android,False,False,3,2017-08-10 11:09:59,jatua,13365/10927=122.3%,297/8784=3.381%
15654,43340ad5_id,Fans heboh lihat penampakan ganjil Rihanna ini,,News_Entertainment,,delay,all,False,False,3,2017-08-10 11:20:33,alvinka,41097/42271=97.22%,1317/31351=4.201%
15655,df33377f_id,Ini alasan Najwa Shihab berhenti dari 'Mata Najwa',,News_Entertainment,,delay,all,False,False,3,2017-08-10 11:25:50,siscaj,126095/660577=19.09%,4152/84053=4.94%
15656,db292348_id,"Ayu Ting Ting promosikan lotion pemutih, wajahnya kok",,News_Entertainment,,delay,all,False,False,3,2017-08-10 11:27:07,siscaj,325375/1253360=25.96%,10716/211059=5.077%
15657,a79472b_id,"Dua bulan pasca melahirkan, Beyonce tampil seksi",,News_Entertainment,,delay,all,False,False,3,2017-08-10 11:27:29,alvinka,36600/71300=51.33%,677/24855=2.724%
15658,ee98da8c_id,"Ini harga jam tangan 7 atlet kaya dunia, Neymar paling murah",,News_Sports,,delay,all,False,False,3,2017-08-10 11:44:05,siscaj,8239/8245=99.93%,305/5400=5.648%
15659,32047d2d_id,"Jokowi tak bisa penuhi undangan AHY, kenapa?",,News_Politics,"Jakarta,Bekasi,Tangerang",delay,all,False,False,3,2017-08-10 12:29:15,siscaj,161943/782194=20.7%,5860/106965=5.478%
15660,be13f1bd_id,Mengapa Ridwan Kamil dikesampingkan partai-partai besar?,,News_Politics,Bandung,delay,all,False,False,3,2017-08-10 12:38:32,siscaj,1966/1922=102.3%,67/1239=5.408%
15661,c1401abe_id,4 Wanita cantik nan seksi yang pernah kecantol pesona Ello,,News_Entertainment,,delay,all,False,False,3,2017-08-10 12:44:33,siscaj,10994/11129=98.79%,447/6851=6.525%
15662,17cd5998_id,"Ternyata, Maia Estianty cucu mantan istri Presiden Sukarno",,News_Entertainment,,delay,all,False,False,3,2017-08-10 12:48:01,siscaj,120019/252682=47.5%,5278/77790=6.785%
15663,b6525935_id,Mantan suami Ayu Ting Ting gugat cerai istrinya,,News_Entertainment,,delay,all,False,False,3,2017-08-10 12:49:26,siscaj,447687/791965=56.53%,18351/358101=5.125%
15664,e2d6d180_id,"Mieke Amalia datangi RSKO hanya 10 menit, simak videonya>>",,News_Entertainment,,delay,all,False,False,3,2017-08-10 12:51:18,siscaj,189312/103406=183.1%,9390/151382=6.203%
15665,68f3b959_id,Verrell Bramasta sudah berani pegang-pegang Natasha Wilona,,News_Entertainment,,delay,all,False,False,3,2017-08-10 12:52:34,siscaj,278870/1575693=17.7%,16034/180492=8.883%
15666,749ca377_id,Misteri di balik tato 4:20 di lengan Ello,Kodekah?,News_Entertainment,,immediately,all,True,False,3,2017-08-10 13:08:22,erompas,1189563/2326536=51.13%,37221/929171=4.006%
15667,fbad9507_id,"Periksa Novel, pimpinan KPK dampingi penyidik Polri",,Crime,,delay,all,False,False,3,2017-08-10 13:15:22,erompas,115626/328704=35.18%,4525/69636=6.498%
15668,ff01c488_id,"Tengok gaya putra sulung Jokowi dan SBY ini, apa bedanya?",,News_Politics,,delay,all,False,False,3,2017-08-10 13:35:27,erompas,33909/70427=48.15%,1635/17459=9.365%
15669,1ad4ca9b_id,Sosok ini bakal jadi pelatih Persib,,News_Sports,,delay,all,False,False,3,2017-08-10 13:35:57,erompas,486588/1861377=26.14%,22220/287257=7.735%
15670,2d2056a_id,Ini putri Soekarno dari pernikahannya dengan wanita Jepang,,News_Politics,,delay,all,False,False,3,2017-08-10 13:38:16,erompas,12857/18099=71.04%,633/8832=7.167%
15671,ec672ed0_id,Ternyata ini alasan Enji ceraikan istri,,News_Entertainment,,delay,all,False,False,3,2017-08-10 14:07:18,erompas,13679/21133=64.73%,576/12400=4.645%
15672,c91685fb_id,"Banggain sikap Agnez Mo, fans bawa-bawa Ayu Ting Ting?","Kena Lagi, Kena Lagi",News_Entertainment,,immediately,all,True,False,3,2017-08-10 14:58:07,erompas,1512027/7430155=20.35%,35564/946569=3.757%
15673,dbdec370_id,NU rayu Kaesang sampaikan keluhan Full Day School ke Jokowi,,Education,,delay,android,False,False,3,2017-08-11 00:31:40,yogic,471312/17=2.772e+06%,19935/374813=5.319%
15674,b05c88fd_id,Pulusan rusa di Pulau Komodo diduga dibantai,,Crime,,delay,android,False,False,3,2017-08-11 00:31:56,yogic,81271/57944=140.3%,2270/56538=4.015%
15675,fbf2eb6f_id,Ini Isi pesan SBY untuk Jokowi lewat Agus Yudhoyono,,News_Politics,,delay,android,False,False,3,2017-08-11 00:33:35,yogic,1585132/1=1.585e+08%,74402/1234115=6.029%
15676,b7ddcb42_id,"Ditegur tidak pakai helm, oknum TNI pukul Polantas",,Crime,,delay,android,False,False,3,2017-08-11 00:37:13,yogic,498464/-=-,15077/332242=4.538%
15677,c78e2e2f_id,"Didepak dari pesawat, pria muslim gugat Virgin Atlantic",,Crime,,delay,android,False,False,3,2017-08-11 00:39:17,yogic,181010/-=-,5783/120918=4.783%
15678,dae879b4_id,Bima Arya siap maju jadi Cawagub di Pilgub Jabar 2018,,News_Politics,Bandung,delay,android,False,False,3,2017-08-11 00:40:21,yogic,19606/1=1.961e+06%,305/19405=1.572%
15679,fb0ed91c_id,Ada Ormas baru 2 tahun beraktivitas bakal dibubarkan,,News_Politics,,delay,android,False,False,3,2017-08-11 00:41:13,yogic,606717/6=1.011e+07%,22587/377451=5.984%
15680,f086cad6_id,"Ekonomi stagnan, perlukah Jokowi rombak menteri?",,News_Politics,,delay,android,False,False,3,2017-08-11 00:42:00,yogic,141572/2=7.079e+06%,3496/89535=3.905%
15681,9a76058f_id,Seperti ini sosok Ello di mata Fatin Shidqia,,News_Entertainment,,delay,android,False,False,3,2017-08-11 00:42:49,yogic,328084/1408=2.33e+04%,14046/201924=6.956%
15682,5138829c_id,Mourinho akan buat sejarah di Premier League,,News_Sports,,delay,android,False,False,3,2017-08-11 00:46:19,yogic,722451/138=5.235e+05%,27380/449817=6.087%
15683,b6081a2d_id,"Sharp Aquos S2, perpaduan iPhone 8 dan Essential Phone",,Technology,,delay,android,False,False,3,2017-08-11 00:48:17,yogic,113805/32=3.556e+05%,2444/79434=3.077%
15684,ea7c6cd9_id,"Reshuffle kabinet 16 Agustus, Najwa Shihab jadi menteri?",,News_Politics,,delay,android,False,False,3,2017-08-11 00:51:30,yogic,20500/13=1.577e+05%,756/14731=5.132%
15685,f27ff7ad_id,Amazon dan Tencent investasi di bisnis smartphone,,Technology,,delay,android,False,False,3,2017-08-11 00:52:02,yogic,40704/899=4528%,1116/40345=2.766%
15686,cf4ed29b_id,Ini komentar Roy Suryo tentang pidato Viktor Laiskodat,,News_Politics,,delay,android,False,False,3,2017-08-11 00:55:45,yogic,693014/205=3.381e+05%,29615/436244=6.789%
15687,fbb55273_id,"Honda Civic R meluncur di GIIAS 2017, segini harganya",,Auto,,delay,all,False,False,3,2017-08-11 00:57:03,yogic,125023/731=1.71e+04%,5193/78204=6.64%
