id,entry_id,title,push_title,category,city,push_type,push_os,push_entire,test_mode,status,insert_time,operator,Receive/Send,Click/Show
32503,62351af1_ru,СМИ: жена Полански отказалась присоединиться к киноакадемии США,,News_Entertainment,,delay,all,False,0,3,2018-07-09 11:04:29,aleksandrak,3805/7408=51.36%,146/3682=3.965%
32504,b521d6d5_ru,Маск объяснил устройство мини-субмарины для спасения детей в Таиланде,,Others,,delay,all,False,0,3,2018-07-09 11:04:42,aleksandrak,11/44=25%,4/11=36.36%
32505,fb83c5cd_ru,Британский министр по Brexit подал в отставку,,Others,,delay,all,False,0,3,2018-07-09 11:06:18,aleksandrak,3/-=-,-/3=-
32507,ec3e2c77_ru,Прославлявшего Украину члена хорватской сборной выгнали из делегации,,News_Sports,,delay,all,False,0,3,2018-07-09 13:31:10,borisf,994/172861=0.575%,3633/712=510.3%
32508,ecb36661_ru,ФИФА признала защиту сборной России лучшей на ЧМ,,News_Sports,,delay,all,False,0,3,2018-07-09 13:34:10,borisf,20/822=2.433%,71/20=355%
32509,4c3dcb7a_ru,WhatsApp запустил долгожданные каналы для всех,,Others,,delay,all,False,0,3,2018-07-09 13:37:29,borisf,92/148=62.16%,16/84=19.05%
32510,b60e7506_ru,4 простых способа лучше выглядеть на фотографиях,,Others,,delay,all,False,0,3,2018-07-09 13:48:38,borisf,26/483=5.383%,-/18=-
32513,8b6cd6b4_ru,Эфиопия и Эритрея заключили мирный договор,,News_Politics,,delay,all,False,0,3,2018-07-09 15:57:31,aleksandrak,19/682=2.786%,19/17=111.8%
32514,1a01dd84_ru,Минобороны Британии обвинило Россию в гибели гражданки страны от «Новичка»,,Others,,delay,all,False,0,3,2018-07-09 15:58:44,aleksandrak,16446/46877=35.08%,227/15809=1.436%
32515,3d5b35f8_ru,"Найдена зона мозга, которая растёт вместе с социальным статусом",,Science,,delay,all,False,0,3,2018-07-09 15:59:57,aleksandrak,352/1315=26.77%,-/327=-
32516,d928510_ru,Подтверждено спасение восьми детей из пещеры в Таиланде,,Others,,delay,all,False,0,3,2018-07-09 16:01:14,aleksandrak,110/3132=3.512%,420/110=381.8%
32517,46f5b7_ru,На чемпионате мира выступили за ответственное отношение к окружающей среде,,News_Sports,,delay,all,False,0,3,2018-07-09 16:01:37,aleksandrak,75263/7460=1009%,848/74890=1.132%
32518,83b35625_ru,Суд вернул в госсобственность Украины титано-магниевый комбинат Фирташа,,News_Politics,,delay,all,False,0,3,2018-07-09 16:03:26,aleksandrak,317/318=99.69%,22/303=7.261%
32519,6bf9d013_ru,Тереза Мэй приняла отставку Бориса Джонсона с поста главы МИД Великобритании,,Others,,delay,all,False,0,3,2018-07-09 16:06:03,aleksandrak,4/662=0.6042%,14/573=2.443%
32522,a308d532_ru,Дожди в Москве побили рекорд 1961 года,,Others,,delay,all,False,0,-1,2018-07-09 16:08:12,aleksandrak,-/-=-,-/-=-
32526,63cacc52_ru,Открыт самый яркий объект в юной Вселенной,,Science,,delay,all,False,0,-1,2018-07-09 16:10:21,aleksandrak,-/-=-,-/-=-
32527,6a03f0c5_ru,"Учёные рассказали, чем опасны галстуки",,Others,,delay,all,False,0,3,2018-07-09 16:13:27,aleksandrak,474/475=99.79%,21/451=4.656%
32528,2cf9a5c6_ru,Правительство поручило довести доступность мест в яслях до 100%,,Education,,delay,all,False,0,3,2018-07-09 16:13:54,aleksandrak,10/203=4.926%,10/9=111.1%
32529,8d1baece_ru,Большинство восьмиклассников не различают виды искусства,,Education,,delay,all,False,0,3,2018-07-09 16:14:19,aleksandrak,382/296=129.1%,10/376=2.66%
32530,fd1ec8c8_ru,Турция сменила форму правления,,News_Politics,,delay,all,False,0,3,2018-07-09 16:16:20,aleksandrak,244/260=93.85%,16/235=6.809%
32536,b07c4676_ru,Серебренников назвал причину своего уголовного преследования,,Others,,delay,all,False,0,3,2018-07-09 16:32:48,aleksandrak,541/622=86.98%,14/508=2.756%
32538,ff8f0c32_ru,В Большом адронном коллайдере заметили редчайшее явление,,Others,,delay,all,False,0,3,2018-07-09 16:38:12,aleksandrak,7495/14404=52.03%,367/7144=5.137%
32549,9421cf16_ru,За борщевик на даче будут крупно штрафовать,,Others,,delay,all,False,0,3,2018-07-09 17:03:46,aleksandrak,738/80580=0.9159%,35/580=6.034%
32555,41815e66_ru,Врач сборной ответил на обвинения во вдыхании футболистами аммиака,,News_Sports,,delay,all,False,0,3,2018-07-09 17:12:44,borisf,18330/11030=166.2%,1331/17301=7.693%
32556,4d75f169_ru,Борис Джонсон ушел в отставку с поста главы МИД Британии,,Others,,delay,all,False,0,3,2018-07-09 17:14:08,borisf,5725/1889=303.1%,30/5582=0.5374%
32557,ab3d7ba7_ru,Ученые объявили о создании эффективной вакцины против ВИЧ,,Others,,delay,all,False,0,3,2018-07-10 02:36:33,alexandr,13806/46620=29.61%,266/13167=2.02%
32558,325a7478_ru,В Раде заявили об «убийстве Украины»,,News_Politics,,delay,all,False,0,3,2018-07-10 02:37:05,alexandr,6106/26673=22.89%,120/5679=2.113%
32559,5e8cba60_ru,Минтруд предлагает освободить самозанятых от трудовых договоров,,Others,,delay,all,False,0,3,2018-07-10 02:37:50,alexandr,46260/29053=159.2%,191/45984=0.4154%
32560,e84dd2ad_ru,Трамп назвал отговаривавших от беседы с Путиным помощников «глупыми»,,Others,,delay,all,False,0,3,2018-07-10 02:38:25,alexandr,6317/18933=33.37%,211/49290=0.4281%
32561,a399635d_ru,На Джонни Деппа подали в суд за избиение,,News_Entertainment,,delay,all,False,0,3,2018-07-10 02:39:03,alexandr,15263/3541=431%,78/15137=0.5153%
32562,e6dd2320_ru,В интернете активизировались перекупщики билетов на ЧМ-2018,,Others,,delay,all,False,0,3,2018-07-10 02:39:32,alexandr,19583/5931=330.2%,167/4604=3.627%
32563,1e3aa6c4_ru,"ООН заявила о проблемах с доступом к питьевой воде у 2,1 млрд человек",,Others,,delay,all,False,0,3,2018-07-10 02:40:03,alexandr,86/5351=1.607%,10921/81=1.348e+04%
32564,ada61645_ru,За нелегальный техосмотр введут уголовную ответственность,,Others,,delay,all,False,0,3,2018-07-10 02:40:40,alexandr,134/3878=3.455%,104/110=94.55%
32565,29cf9987_ru,«Реал Мадрид» присмотрел замену Роналду,,News_Sports,,delay,all,False,0,3,2018-07-10 02:41:11,alexandr,437240/862879=50.67%,19283/418216=4.611%
32573,b78d8b82_ru,Назван возраст старейшего предпринимателя в РФ,,Others,,delay,all,False,0,3,2018-07-10 05:14:46,alexandr,9848/94316=10.44%,711/9731=7.307%
32574,ef49727e_ru,"В РКК рассказали, когда космонавты смогут летать к МКС за три часа",,Technology,,delay,all,False,0,3,2018-07-10 05:14:56,alexandr,2695/1033=260.9%,30/2663=1.127%
32575,afe396c9_ru,У всех спасенных из пещеры в Таиланде детей обнаружили признаки инфекции,,Others,,delay,all,False,0,3,2018-07-10 05:55:21,anastasijaf,466891/623915=74.83%,29132/421186=6.917%
32576,6fd19817_ru,"Какие функции смартфона стоит отключить, чтобы батарея держала дольше?",,Technology,,delay,all,False,0,3,2018-07-10 06:02:32,anastasijaf,327/170450=0.1918%,5169/291=1776%
32577,e5d576f5_ru,Госдума рассмотрит законопроект о ликвидации роуминга в России,Рекомендован к принятию,News_Politics,,immediately,all,True,0,3,2018-07-10 06:03:06,alexandr,891498/1599531=55.73%,34905/742883=4.699%
32578,f54382e8_ru,В Британии назначен новый министр иностранных дел,,News_Politics,,delay,all,False,0,3,2018-07-10 06:08:52,anastasijaf,33477/103413=32.37%,507/5246=9.665%
32579,28ea1176_ru,Президент Азербайджана заявил о своей роли в смене власти в Армении,,News_Politics,,delay,all,False,0,3,2018-07-10 06:09:47,anastasijaf,2314/108151=2.14%,734/2265=32.41%
32580,e3fe2527_ru,В компаниях в Москве и Петербурге остановился рост зарплат,,Business,,delay,all,False,0,3,2018-07-10 06:10:38,anastasijaf,452/67826=0.6664%,320/427=74.94%
32590,87a9656a_ru,Американец 30 лет притворялся саудовским принцем,,Others,,delay,all,False,0,3,2018-07-10 07:18:38,borisf,3741/108796=3.439%,1000/3653=27.37%
32591,5e105df_ru,Должникам по алиментам хотят снизить штрафы,,Others,,delay,all,False,0,3,2018-07-10 08:01:47,borisf,32/383=8.355%,5/29=17.24%
32592,a3449f94_ru,Продажи Lada за рубежом резко взлетели вверх,,Auto,,delay,all,False,0,3,2018-07-10 08:03:15,borisf,4/1=400%,-/4=-
32593,101b5ff2_ru,На плечи россиян ляжет очередной налог,,Others,,delay,all,False,0,3,2018-07-10 08:08:59,borisf,2/1=200%,-/2=-
32594,9876557f_ru,Порошенко призвал опечатать границу с Россией,,News_Politics,,delay,all,False,0,3,2018-07-10 08:10:35,borisf,2/1=200%,-/2=-
32595,17f75dda_ru,"«Слава Украине!» и «Белград, гори!»: что имел в виду Вида",,News_Sports,,delay,all,False,0,3,2018-07-10 08:16:46,borisf,8/10=80%,-/8=-
32596,63a64336_ru,"«Белград, гори!». Провокацию с Домагоем Видой готовили в Киеве?",,Others,,delay,all,False,0,3,2018-07-10 08:25:14,borisf,6/75=8%,2/6=33.33%
32597,b14534c3_ru,Когда начнется отборочный турнир на Евро-2020?,,News_Sports,,delay,all,False,0,3,2018-07-10 08:28:37,borisf,69/56=123.2%,4/68=5.882%
32598,2270570e_ru,Техосмотр обрастет штрафами и «уголовкой»,,Technology,,delay,all,False,0,3,2018-07-10 08:32:48,borisf,5/4=125%,-/3=-
32599,d211fd23_ru,Google добавила в Play Market главное новшество за 10 лет,,Technology,,delay,all,False,0,3,2018-07-10 08:34:23,borisf,6/23=26.09%,-/4=-
32600,2acd52d_ru,Свой среди чужих: что нужно знать о полуфиналах ЧМ-2018,,News_Sports,,delay,all,False,0,3,2018-07-10 08:39:36,borisf,6/15=40%,-/6=-
32601,49ce1391_ru,Украинцы обвалили рейтинг ФИФА антироссийскими проклятиями,,News_Sports,,delay,all,False,0,3,2018-07-10 08:41:58,borisf,587/24712=2.375%,250/565=44.25%
32603,9a170e48_ru,Кинотеатры могут начать проверять документы перед покупкой билета,,Others,,delay,all,False,0,-1,2018-07-10 08:44:46,borisf,-/-=-,-/-=-
32605,92e77173_ru,"Hyundai привезла в Россию ""лимитированную"" Creta",,Auto,,delay,all,False,0,3,2018-07-10 08:46:28,borisf,-/7=-,-/-=-
32607,65eb4517_ru,"Следствие по делу ""Зимней вишни"" заявило о давлении на потерпевших",,Others,,delay,all,False,0,3,2018-07-10 08:49:57,alexandr,6/4=150%,2/6=33.33%
32609,179a903a_ru,Россия ужесточила миграционное законодательство,,News_Politics,,delay,all,False,0,3,2018-07-10 08:55:50,alexandr,4/1=400%,-/4=-
32620,dc90fb88_ru,Россиян обложат очередным налогом,,Others,,delay,all,False,0,3,2018-07-10 10:33:56,anastasijaf,4/4=100%,-/4=-
32621,d7cbae83_ru,"Песков ответил сенатору Кеннеди, сравнившему российские власти с мафией",,Others,,delay,all,False,0,3,2018-07-10 10:40:01,anastasijaf,4/5=80%,-/4=-
32622,b2efe28a_ru,У регионов возникли проблемы с пенсионной реформой,,News_Politics,,delay,all,False,0,3,2018-07-10 10:40:43,anastasijaf,6/8=75%,-/6=-
32623,c3335cbd_ru,Родные покойника наследуют проценты по кредиту — решение ВС,,News_Politics,,delay,all,False,0,3,2018-07-10 10:46:58,anastasijaf,2/2=100%,-/2=-
32624,baa4bf85_ru,Депутата Госдумы Жигарева избили из-за красавицы-модели,,Others,,delay,all,False,0,3,2018-07-10 10:48:20,anastasijaf,2/11=18.18%,-/2=-
32625,fe753243_ru,Павел Грудинин рассказал о разводе: «Люблю Ксению семь лет»,,Others,,delay,all,False,0,3,2018-07-10 10:57:02,anastasijaf,4/2=200%,-/4=-
32626,311efdb_ru,DJ Smash дал показания против избившего его «очень циничного» депутата,,News_Entertainment,,delay,all,False,0,3,2018-07-10 10:59:41,anastasijaf,754/1476=51.08%,44/728=6.044%
32627,fcf7d3ba_ru,Почему нельзя покупать подержанные машины у официальных дилеров,,Auto,,delay,all,False,0,-1,2018-07-10 11:02:00,anastasijaf,-/-=-,-/-=-
32628,cc9f7346_ru,"Где найти деньги, если врезался в дорогую иномарку",,Others,,delay,all,False,0,-1,2018-07-10 11:06:13,anastasijaf,-/-=-,-/-=-
32629,8d18895e_ru,Почему прозрачное масло убивает двигатель машины,,Others,,delay,all,False,0,-1,2018-07-10 11:07:11,anastasijaf,-/-=-,-/-=-
32630,687b5c69_ru,В Таиланде выводят из пещеры последнего школьника с тренером,,Others,,delay,all,False,0,3,2018-07-10 11:10:43,anastasijaf,56/114=49.12%,-/51=-
32631,7e7beac8_ru,Врачи не пустили спасенных таиландских детей в Москву на ЧМ-2018,,Others,,delay,all,False,0,3,2018-07-10 11:18:11,anastasijaf,137/292=46.92%,4/127=3.15%
32633,f6dac0d9_ru,Джорджа Клуни сбила машина,,News_Entertainment,,delay,all,False,0,3,2018-07-10 11:20:04,anastasijaf,93839/153205=61.25%,3605/50322=7.164%
32634,1de6c16d_ru,Всех застрявших в пещере в Таиланде спасли,,Others,,delay,all,False,0,3,2018-07-10 11:21:25,anastasijaf,37/37=100%,4/38=10.53%
32643,9169ae9b_ru,В США перед судом предстал годовалый ребенок мигрантов,,News_Politics,,delay,all,False,0,3,2018-07-10 11:54:46,anastasijaf,10/15=66.67%,-/10=-
32652,f2b7d37d_ru,Эксперты назвали Топ-10 самых продаваемых иномарок в России,,Auto,,delay,all,False,0,3,2018-07-10 12:28:33,alexandr,12/16=75%,2/12=16.67%
32653,211a550d_ru,Взрослым разрешили купаться в Черном море,,Others,,delay,all,False,0,3,2018-07-10 12:28:54,alexandr,2731/3477=78.54%,120/2621=4.578%
32656,88f264_ru,Трамп сравнил предстоящие переговоры с Путиным и Мэй,,Others,,delay,all,False,0,3,2018-07-10 12:32:12,anastasijaf,28/37=75.68%,-/26=-
32657,fe6d393a_ru,"Ученые создали лекарство, удаляющее стареющие клетки из организма",,Others,,delay,all,False,0,3,2018-07-10 12:33:29,anastasijaf,248/236=105.1%,23/238=9.664%
32658,90767593_ru,За нелегальный техосмотр хотят ввести уголовную ответственность,,Others,,delay,all,False,0,3,2018-07-10 12:35:11,anastasijaf,67/157=42.68%,4/66=6.061%
32659,cb913876_ru,Госдума приняла закон о расширении полномочий РАН,,News_Politics,,delay,all,False,0,3,2018-07-10 13:02:56,anastasijaf,13097/33081=39.59%,318/12457=2.553%
32660,8210cf03_ru,Трамп назвал Джонсона другом и высказался по поводу будущего Мэй,,News_Politics,,delay,all,False,0,3,2018-07-10 13:05:45,anastasijaf,1750/7095=24.67%,16/1663=0.9621%
32672,9a578966_ru,Утвержден новый цвет служебных автомобилей полиции и Росгвардии,,Others,,delay,all,False,0,3,2018-07-10 13:52:56,borisf,897/765=117.3%,41/833=4.922%
32673,9d2b92ce_ru,Замдекана юрфака МГУ обвиняют в мошенничестве на 39 миллионов,,Others,,delay,all,False,0,3,2018-07-10 14:12:00,anastasijaf,665/603=110.3%,15/641=2.34%
32674,5759d5f9_ru,Россиянам могут запретить продавать посторонним доли в квартире,,Others,,delay,all,False,0,3,2018-07-10 14:14:48,anastasijaf,1210/2488=48.63%,27/1134=2.381%
32676,6a7afb5b_ru,Украина предложила России сотрудничество в сфере ядерной энергетики,,News_Politics,,delay,all,False,0,3,2018-07-10 14:49:21,anastasijaf,424/427=99.3%,9/396=2.273%
32679,de59fef7_ru,В НАТО появится новый член,,Others,,delay,all,False,0,3,2018-07-10 14:54:09,anastasijaf,3497/3482=100.4%,223/3309=6.739%
32681,f516714f_ru,В ЮАР разбился пассажирский самолет,,Others,,delay,all,False,0,3,2018-07-10 15:30:52,anastasijaf,701/1616=43.38%,29/654=4.434%
32683,28ef8cae_ru,Франция стала первым финалистом чемпионата мира,,News_Sports,,delay,all,False,0,3,2018-07-10 19:57:51,anastasijaf,431229/454458=94.89%,9368/270184=3.467%
32685,a13794f8_ru,Ученые нашли в Приморье новые для России виды грибов-животных,,Others,,delay,all,False,0,3,2018-07-11 03:18:44,alexandr,22912/85567=26.78%,345/21775=1.584%
32686,b23f164b_ru,Режиссера Люка Бессона снова обвинили в домогательствах,,News_Entertainment,,delay,all,False,0,3,2018-07-11 03:19:17,alexandr,27630/7485=369.1%,137/27410=0.4998%
32687,1d8d6e14_ru,Россия приостанавливает пуски с Байконура,,Others,,delay,all,False,0,3,2018-07-11 03:19:54,alexandr,6189/9225=67.09%,173/5804=2.981%
32688,c1c8f396_ru,"Бюджетное правило принесло России 1,7 трлн рублей за полгода",,Business,,delay,all,False,0,3,2018-07-11 03:20:26,alexandr,3289/43863=7.498%,360/3149=11.43%
32689,14b5c12a_ru,Коллекторам предоставят доступ к биометрическим данным россиян,,Others,,delay,all,False,0,3,2018-07-11 03:20:57,alexandr,7328/10643=68.85%,242/6983=3.466%
32690,99ac2a79_ru,За отказ удалить из сети данные по решению суда введут уголовное наказание,,Others,,delay,all,False,0,3,2018-07-11 03:21:29,alexandr,264281/616903=42.84%,15403/250172=6.157%
32691,8111adb9_ru,Карту волшебного мира Винни-Пуха продали за рекордные $570 тыс.,,Others,,delay,all,False,0,3,2018-07-11 03:22:07,alexandr,7175/18586=38.6%,216/6827=3.164%
32692,366770f3_ru,Ученые развеяли миф о безопасности никотиновых электронных сигарет,,Others,,delay,all,False,0,3,2018-07-11 03:28:59,alexandr,136561/283013=48.25%,4955/137833=3.595%
32693,a595256b_ru,Регистрировать новые машины можно будет без посещения ГИБДД,Знаковые изменения,Auto,,immediately,all,True,0,3,2018-07-11 06:02:21,alexandr,1320285/1960430=67.35%,42944/1042861=4.118%
32700,8ffd3289_ru,К концу недели в России установится экстремальная жара,,Others,,delay,all,False,0,3,2018-07-11 07:32:16,borisf,16036/131549=12.19%,1639/15110=10.85%
32701,680366a8_ru,Греция объявила о высылке российских дипломатов,,Others,,delay,all,False,0,3,2018-07-11 07:39:34,borisf,20079/137304=14.62%,1743/19173=9.091%
32702,14260ca1_ru,Российский интернет замкнут по китайскому сценарию,,Technology,,delay,all,False,0,3,2018-07-11 07:44:09,borisf,15/440=3.409%,4/15=26.67%
32703,67e99e3b_ru,Центробанк ужесточает условия выдачи потребительских кредитов,,Business,,delay,all,False,0,3,2018-07-11 07:51:28,borisf,10/60=16.67%,1/8=12.5%
32704,54eaf846_ru,"Украинцы обвалили рейтинг ""Газпрома"" в Facebook",,Others,,delay,all,False,0,3,2018-07-11 07:55:44,borisf,6509/102008=6.381%,557/6493=8.578%
32705,d8fc1b5f_ru,Налоговики потребовали предоставить полный доступ к счетам россиян,,Others,,delay,all,False,0,3,2018-07-11 07:57:38,borisf,13031/127599=10.21%,1589/12421=12.79%
32707,b6a4e6e_ru,В России хотят ввести новые правила регистрации автомобилей,,Auto,,delay,all,False,0,3,2018-07-11 08:35:03,aleksandrak,12/215=5.581%,2/12=16.67%
32708,bd8682ee_ru,Врачи в Таиланде рассказали о состоянии спасенных из пещеры детей,,Others,,delay,all,False,0,3,2018-07-11 08:35:18,aleksandrak,-/15=-,-/-=-
32710,f37f20b6_ru,Налоговики захотели контролировать счета россиян,,Others,,delay,all,False,0,-1,2018-07-11 08:36:01,aleksandrak,-/-=-,-/-=-
32711,3fc4edc7_ru,Россия зеркально ответит на высылку дипломатов из Греции,,Others,,delay,all,False,0,3,2018-07-11 08:36:55,aleksandrak,-/3=-,-/-=-
32713,7dd6f42e_ru,Названы секреты успешного путешествия,,Others,,delay,all,False,0,3,2018-07-11 08:38:08,aleksandrak,18/825=2.182%,5/16=31.25%
32719,2ce1a61a_ru,Женщин захотели отпускать на пенсию раньше,,Others,,delay,all,False,0,3,2018-07-11 08:43:16,aleksandrak,35463/125664=28.22%,2010/34237=5.871%
32723,e68f2518_ru,Леса на всей территории России продолжают гореть,,Others,,delay,all,False,0,3,2018-07-11 08:46:27,aleksandrak,-/1=-,-/-=-
32724,52b4e864_ru,Число жертв наводнений в Японии достигло 179,,Others,,delay,all,False,0,3,2018-07-11 08:46:50,aleksandrak,16/2404=0.6656%,2/11=18.18%
32725,a9633dc0_ru,Средний чек россиян за один визит в магазин стал меньше,,Others,,delay,all,False,0,3,2018-07-11 08:47:38,aleksandrak,17/213=7.981%,6/14=42.86%
32726,df87e652_ru,Греция высылает российских дипломатов за вмешательство во внутренние дела,,Others,,delay,all,False,0,3,2018-07-11 09:09:46,anastasijaf,-/-=-,-/-=-
32731,1fa3d376_ru,«Гибкие» знаки: еще одно нововведение на дорогах,,Others,,delay,all,False,0,3,2018-07-11 09:18:05,anastasijaf,4/6=66.67%,-/4=-
32732,3a33d585_ru,Женщин пожелали отпускать на пенсию раньше,,Others,,delay,all,False,0,3,2018-07-11 09:20:49,anastasijaf,13/697=1.865%,1/11=9.091%
32733,5b34c6c4_ru,Российский интернет сократят по китайскому сценарию,,Technology,,delay,all,False,0,3,2018-07-11 09:21:46,anastasijaf,4/2=200%,-/4=-
32734,d6f39b5a_ru,Похищен владелец крупнейшего агрохолдинга «Орловская Нива» Сергей Будагов,,Crime,,delay,all,False,0,3,2018-07-11 09:23:58,anastasijaf,4/16=25%,4/4=100%
32735,fe5680f_ru,Петербуржец в горячем споре убил украинца пулей в лоб,,Others,,delay,all,False,0,3,2018-07-11 09:24:52,anastasijaf,-/-=-,-/-=-
32736,949e1bee_ru,«Узнают по голосу»: коллекторы получат доступ к биометрическим данным должников,,Business,,delay,all,False,0,3,2018-07-11 09:26:33,anastasijaf,-/1=-,-/-=-
32737,17c09a7f_ru,Росстат насмешил трюком: скрыли пугающий рост цен,,Business,,delay,all,False,0,3,2018-07-11 09:27:59,anastasijaf,-/-=-,-/-=-
32739,469e0864_ru,Медведев подписал постановление о новых цветах полицейских автомобилей,,Others,,delay,all,False,0,3,2018-07-11 09:32:12,anastasijaf,-/1=-,-/-=-
32740,7274543f_ru,Деньги россиян возьмут под тотальный контроль,,Others,,delay,all,False,0,3,2018-07-11 09:36:59,borisf,-/-=-,-/-=-
32741,55c8fa2f_ru,За какие растения на участке могут оштрафовать?,,Others,,delay,all,False,0,3,2018-07-11 09:38:55,anastasijaf,-/4=-,-/-=-
32742,e6bb6d53_ru,Шнуров внезапно заговорил о трезвости,,Others,,delay,all,False,0,3,2018-07-11 09:41:27,borisf,6/1=600%,-/6=-
