id,entry_id,title,push_title,category,city,push_type,push_os,push_entire,test_mode,status,insert_time,operator,Receive/Send,Click/Show
8513,62b6c4b6,"Jessica Mila Beli Rumah Miliaran Rupiah, Ini Foto-fotonya",,News_Entertainment,,delay,all,False,False,3,2017-06-08 12:22:11,alvinka,1293/-=-,54/1187=4.549%
8514,fc1c86af,Foto Ini Tunjukkan Sosok Ibu Tiri Verrell Bramasta Sebenarnya,,News_Entertainment,,delay,all,False,False,3,2017-06-08 12:23:42,alvinka,5222/-=-,162/5031=3.22%
8515,52bd452,5 Anak Bintang Hollywood Ini Bikin Penasaran!,,News_Entertainment,,delay,all,False,False,3,2017-06-08 12:27:16,alvinka,4899/-=-,288/4607=6.251%
8516,a96bc4d1,'Lemparan 3 Angka Durant Buat Cavaliers Panik',,News_Sports,,delay,all,False,False,3,2017-06-08 12:28:29,alvinka,375/-=-,17/360=4.722%
8517,8af12b0e,Tugas Sampaoli Asah Para Tukang Gedor Argentina,,News_Sports,,delay,all,False,False,3,2017-06-08 12:28:55,alvinka,1914/-=-,83/1797=4.619%
8518,c951681a,Selebrasi mereka diulas di media asing karena ini,Bali United Jadi Sorotan ,News_Politics,,immediately,all,True,False,3,2017-06-08 12:28:58,erompas,723342/-=-,42988/687871=6.249%
8519,c951681a,Selebrasi mereka diulas di media asing karena ini,Bali United Jadi Sorotan ,News_Politics,,delay,all,False,False,3,2017-06-08 12:28:58,auto_gen,221459/-=-,10665/207505=5.14%
8520,cac2c690,AC Milan Capai Kesepakatan dengan Pemain Bola Ini,,News_Sports,,delay,all,False,False,3,2017-06-08 12:29:28,alvinka,15856/-=-,338/15112=2.237%
8521,74100355,Pelatih Timnas Indonesia Panggil Pemain Muda Ini>>,,News_Sports,,delay,all,False,False,3,2017-06-08 12:30:20,alvinka,19563/-=-,838/18308=4.577%
8522,5de4e6de,Prakiraan Susunan Pemain Indonesia saat Jumpa Kamboja,,News_Sports,,delay,all,False,False,3,2017-06-08 12:31:06,alvinka,571/-=-,36/529=6.805%
8523,27dbb222,Mercedes Bakal Tinggalkan Formula 1?,,News_Sports,,delay,all,False,False,3,2017-06-08 12:31:31,alvinka,224/-=-,9/216=4.167%
8524,72f64a0c,"Lihat Permainan Indo, Ini Pengakuan Pelatih Timnas Kamboja",,News_Sports,,delay,all,False,False,3,2017-06-08 12:32:26,alvinka,6194/-=-,454/5733=7.919%
8525,8c7fc8fc,"Valentino Rossi Minta GP Catalunya Mundur, Alasannya>>",,News_Sports,,delay,all,False,False,3,2017-06-08 12:33:04,alvinka,16421/-=-,1214/14986=8.101%
8526,f9c33880,"Terlalu Mahal, Man United Urung Boyong Pemain Ini",,News_Sports,,delay,all,False,False,3,2017-06-08 12:33:42,alvinka,14089/-=-,871/12745=6.834%
8527,a423d6e4,6 Rekor yang Lahir pada Final NBA 2017,,News_Sports,,delay,all,False,False,3,2017-06-08 12:34:09,alvinka,290/-=-,5/279=1.792%
8528,1bdf67d3,Cuitan GM Langgar Fatwa? Reaksi MUI>>,,Crime,,delay,all,False,False,3,2017-06-08 12:35:00,alvinka,11478/-=-,778/10858=7.165%
8529,320c70be,"Peladen Baladacintarizieq Ada di AS, Polda Kontak FBI",,Crime,,delay,all,False,False,3,2017-06-08 12:35:52,alvinka,11202/-=-,556/10648=5.222%
8530,79af8149,Ternyata Ini yang Membuat Dua Warga Kotabaru Tewas,,Crime,,delay,all,False,False,3,2017-06-08 12:36:26,alvinka,6448/-=-,383/6238=6.14%
8531,e72a0144,Kapolda Metro Larang Aksi Bela Ulama Jumat 9 Juni,,Crime,,delay,all,False,False,3,2017-06-08 12:38:31,alvinka,27211/-=-,2346/25935=9.046%
8532,e69904e9,Dimana Lokasi Penahanan Ahok?,,Crime,,delay,all,False,False,3,2017-06-08 12:40:15,alvinka,4224/-=-,360/4137=8.702%
8533,be6a4997,Timnas Indonesia tekuk Kamboja 2-0,Akhirnya Menang,News_Sports,,immediately,all,True,False,3,2017-06-08 14:28:05,erompas,690310/-=-,39891/664560=6.003%
8534,be6a4997,Timnas Indonesia tekuk Kamboja 2-0,Akhirnya Menang,News_Sports,,delay,all,False,False,3,2017-06-08 14:28:05,auto_gen,134231/-=-,6075/126110=4.817%
8535,8136b8dd,"Penyebarnya di Amerika, polisi minta tolong FBI",Chat Mesum Rizieq-Firza,Crime,,delay,all,False,False,3,2017-06-08 10:19:39,auto_plus,116772/-=-,7335/110429=6.642%
8536,b9aa433a,Kronologi hilangnya Aris idol,Berita Top Pagi,News_Entertainment,,immediately,all,True,False,3,2017-06-09 01:55:15,calvink,288797/-=-,19990/282916=7.066%
8537,b9aa433a,Kronologi hilangnya Aris idol,Berita Top Pagi,News_Entertainment,,delay,all,False,False,3,2017-06-09 01:55:15,auto_gen,1185462/-=-,74973/1137492=6.591%
8538,90353a9c,Begini Gaya Santai Jokowi Saat Naik Pesawat CN-295,,Others,jakarta,delay,all,False,False,3,2017-06-09 02:34:22,calvink,376308/-=-,17329/357966=4.841%
8539,513182d0,Cara Polres Banyuwangi Menangkal Radikalisme,,Religion,Surabaya,delay,all,False,False,3,2017-06-09 02:34:35,calvink,17217/-=-,1305/16600=7.861%
8540,26719e67,Cara Pemerintah Mempersempit Gerak Penghindar Pajak,,Business,,delay,all,False,False,3,2017-06-09 02:34:58,calvink,6035/-=-,393/5830=6.741%
8541,b0ee853,Begini Kronologi Penggerebekan Kasus Narkoba Akasaka,,Others,Surabaya,delay,all,False,False,3,2017-06-09 02:35:30,calvink,114921/-=-,5966/109555=5.446%
8542,715ad8c1,"Biayanya Rp 90 Miliar, Program Mudik Gratis Dianggap Boroskan Anggaran",,Others,,delay,all,False,False,3,2017-06-09 05:02:42,calvink,318243/-=-,12481/305949=4.079%
8543,e76af3fc,"Temui SYL, Bapomi Sulsel Target 3 Besar di Pomnas 2017 - Tribun Timur",,Business,,immediately,all,False,True,3,2017-06-09 05:46:36,demo,1/-=-,-/-=-
8544,2d16587c,"Pemainnya Malas Heningkan Cipta, Reaksi Federasi Sepakbola Arab Saudi Sangat Mengejutkan - Banjarmasin Post",,Others,,immediately,all,False,True,3,2017-06-09 05:57:48,demo,1/-=-,1/1=100%
8545,7a836100,"5 Spot selfie terkeren di Semarang, bikin temanmu iri",Pas Buat Ngabuburit,Travel,"Semarang,Salatiga,Yogyakarta",immediately,android,True,False,3,2017-06-09 06:13:36,jatua,21009/-=-,1273/20128=6.325%
8546,7a836100,"5 Spot selfie terkeren di Semarang, bikin temanmu iri",Pas Buat Ngabuburit,Travel,"Semarang,Salatiga,Yogyakarta",delay,android,False,False,3,2017-06-09 06:13:36,auto_gen,24159/-=-,1300/22650=5.74%
8547,98e27b9c,"Dibangun di Medan, begini penampakannya yang mewah",Intip Rumah Raline Shah,News_Entertainment,Medan,immediately,all,True,False,3,2017-06-09 06:27:52,calvink,3830/-=-,391/3707=10.55%
8548,d22df63e,Polwan Polres Luwu Cuci Mukena dan Bersihkan Masjid Agung Belopa - Tribun Timur,,Others,,immediately,all,False,True,3,2017-06-09 06:27:54,demo,1/-=-,-/-=-
8549,98e27b9c,"Dibangun di Medan, begini penampakannya yang mewah",Intip Rumah Raline Shah,News_Entertainment,Medan,delay,all,False,False,3,2017-06-09 06:27:52,auto_gen,11918/-=-,1051/11230=9.359%
8550,2d82e94f,"Akun FB gadis Bandung sebarkan kebencian, ternyata kasihan",Medsos Makan Korban,Crime,Bandung,immediately,all,True,False,3,2017-06-09 06:28:46,calvink,11534/-=-,1354/11120=12.18%
8551,2d82e94f,"Akun FB gadis Bandung sebarkan kebencian, ternyata kasihan",Medsos Makan Korban,Crime,Bandung,delay,all,False,False,3,2017-06-09 06:28:46,auto_gen,37717/-=-,4207/36156=11.64%
8552,7e183559,Masjid cantik di Malang ini punya kisah unik,Dibangun oleh Jin?,Travel,Surabaya,immediately,all,True,False,3,2017-06-09 06:29:59,calvink,37596/-=-,2965/36124=8.208%
8553,7e183559,Masjid cantik di Malang ini punya kisah unik,Dibangun oleh Jin?,Travel,Surabaya,delay,all,False,False,3,2017-06-09 06:29:59,auto_gen,118190/-=-,8685/111226=7.808%
8554,9049818,128 Preman di Pasuruan Terjaring Operasi Pekat Selama Ramadan,,Crime,,delay,all,False,False,3,2017-06-09 08:16:27,steve,23852/-=-,2321/23060=10.07%
8555,545c2d9,Polda Tutup Empat Tambang Ilegal di Gowa,,Crime,,delay,all,False,False,3,2017-06-09 08:16:32,steve,8790/-=-,386/8467=4.559%
8556,54cd1a48,Kabar Terbaru dari Kapolda Metro Soal Situs Baladacintarizieq,,Crime,jakarta,delay,all,False,False,3,2017-06-09 08:17:56,steve,406913/-=-,20092/389320=5.161%
8557,9327b732,"Pilgub Jabar, Ridwan Kamil: Saya Kuat di Kota Lemah di Desa",,News_Politics,bandung,delay,all,False,True,3,2017-06-09 08:19:33,steve,1/-=-,-/-=-
8558,eb1b35b8,"Demi Bayar Hutang Judi, Pegawai Samsung ini Nekat Curi 8.474 Ponsel",,Others,,delay,all,False,False,3,2017-06-09 08:20:22,steve,1238/-=-,43/1162=3.701%
8559,492b6d5e,Kuasa Hukum Habib Rizieq Masih Urus Berkas Praperadilan,,Crime,jakarta,delay,all,False,False,3,2017-06-09 08:20:37,steve,32813/-=-,1916/31593=6.065%
8560,4ae4f81d,Holland: Sejak Awal Conte Punya Ide 3-4-3 di Chelsea,,News_Sports,,delay,all,False,False,3,2017-06-09 08:21:17,steve,94786/-=-,5181/91230=5.679%
8561,e11ae6fc,Suara May Dipastikan Tak Dapat Kursi Mayoritas,,Others,,delay,all,False,False,3,2017-06-09 08:22:07,steve,34676/-=-,1615/33332=4.845%
8562,9049818,128 Preman di Pasuruan Terjaring Operasi Pekat Selama Ramadan,,Crime,,delay,all,False,False,3,2017-06-09 08:47:46,steve,158716/-=-,3324/151479=2.194%
8563,551e204b,Empat Anggota Ormas Diusir Saat Minta ‘Jatah’ THR di Minimarket!,,Crime,bekasi,delay,all,False,False,3,2017-06-09 08:48:02,steve,3703/-=-,205/3572=5.739%
8564,9c373de6,Eks Massa AntiAhok Tetap Usaha Pinjam Istiqlal untuk Reuni,,Crime,,delay,all,False,False,3,2017-06-09 08:49:52,steve,372681/-=-,18284/354838=5.153%
8565,4d1264a2,Safari Ramadlan SBY Akan Roadshow ke Pulau Jawa,,News_Politics,surabaya,delay,all,False,True,3,2017-06-09 08:50:36,steve,1/-=-,1/1=100%
8566,e7c840ac,Ini Dia Nama-nama Pemenang Lomba Maskot PKA VII,,Others,,immediately,all,False,True,3,2017-06-09 08:50:42,demo,1/-=-,1/1=100%
8567,61d0e8c7,Kapolda Metro Bandingkan Toleransi Warga Rawa Bebek-Timur Tengah,,Crime,jakarta,delay,all,False,False,3,2017-06-09 08:51:09,steve,16382/-=-,668/15959=4.186%
8568,9d3068c9,Amien Rais Dianggap Tukang Adu Domba Dan Rusak Nilai Pancasila,,News_Politics,,delay,all,False,False,3,2017-06-09 08:52:59,steve,219386/-=-,14675/210007=6.988%
8569,76a572fd,Djarot : PNS Terlibat Pungli Harus Diberhentikan,,Crime,jakarta,delay,all,False,False,3,2017-06-09 08:58:21,steve,23050/-=-,1673/22159=7.55%
8570,c84b7c8a,"Di Arab Saudi, Uang Bukan Masalah Buat Habib Rizieq",,Crime,,delay,all,False,False,3,2017-06-09 08:58:37,steve,742214/-=-,39237/713295=5.501%
8571,d89fead0,Komnas HAM Jelaskan Alasan Ingin Urus Aduan Kriminalisasi Ulama,,Crime,jakarta,delay,all,False,False,3,2017-06-09 08:59:34,steve,7219/-=-,446/6965=6.403%
8572,c40de48b,Antara 'karpet merah' Untuk Rizieq dan Kekesalan Kapolda Metro,,Crime,,delay,all,False,False,3,2017-06-09 09:33:26,steve,479852/-=-,29619/449634=6.587%
8573,7f86e08,"Oknum Kejati Bengkulu Ditangkap, Jamwas Datangi KPK",,Crime,,delay,all,False,False,3,2017-06-09 09:33:42,steve,6107/-=-,316/5918=5.34%
8574,f6bfdd89,"Tabung Gas Bocor, 13 Warga Cempaka Putih Alami Luka Bakar Serius",,Crime,jakarta,delay,all,False,False,3,2017-06-09 09:34:14,steve,3555/-=-,133/3385=3.929%
8575,d6a233b7,PNS Pelaku Pungli Terancam Dipecat,,Crime,jakarta,delay,all,False,False,3,2017-06-09 09:45:48,steve,3785/-=-,161/3666=4.392%
8576,c618768f,Pemimpin Partai Buruh Inggris Minta PM May Mundur,,Others,,delay,all,False,True,3,2017-06-09 09:53:29,steve,-/-=-,-/-=-
8577,7e27e036,Seleksi DKPP Seharusnya Terbuka dan Transparan,,News_Politics,,immediately,all,False,True,3,2017-06-09 10:03:59,demo,-/-=-,-/-=-
8578,bbfc96a,"Draft Kabupaten Bandung Timur Sudah Ada di DPD RI, Harus Terealisasi hingga 2025",,News_Politics,,immediately,all,False,True,3,2017-06-09 10:12:42,demo,-/-=-,-/-=-
8579,84126382,NasDem Jatim Berencana Balas Kunjungan Gus Ipul dan PKB,,News_Politics,surabaya,delay,all,False,True,3,2017-06-09 10:24:26,steve,-/-=-,-/-=-
8580,bcafc098,Jokowi Diminta Hentikan Balas Dendam Kekalahan Ahok,,Crime,jakarta,delay,all,False,False,3,2017-06-09 10:50:40,andrewka,107806/-=-,8166/104199=7.837%
8581,539c356b,Polisi Tangkap Santri Pengunggah Meme Hina Jokowi,,News_Politics,surabaya,delay,all,False,False,3,2017-06-09 10:51:26,andrewka,3929/-=-,151/3827=3.946%
8582,c8b877c,"Perampokan dengan Senpi di Daan Mogot, Satu Korban Tewas",,Crime,jakarta,delay,all,False,False,3,2017-06-09 10:51:33,andrewka,6172/-=-,328/6027=5.442%
8583,701bcb03,Pendemo di Masjid Istiqlal Minta Jokowi Cabut Perkara Rizieq,,Crime,jakarta,delay,all,False,False,3,2017-06-09 10:51:37,andrewka,67332/-=-,4968/64876=7.658%
8584,490b1cc7,Program Anies-Sandi Masuk Pembahasan DPRD DKI,,Crime,jakarta,delay,all,False,False,3,2017-06-09 10:51:41,andrewka,27705/-=-,1908/27030=7.059%
8585,598a4599,"Perampokan Sadis di SPBU, Diduga Korban Sudah Dikuntit Pelaku",,Crime,jakarta,delay,all,False,False,3,2017-06-09 10:51:45,andrewka,15312/-=-,794/14552=5.456%
8586,c9f46cf5,"Banyak Ojek Online, Depan Stasiun Pesing Macet",,Crime,jakarta,delay,all,False,False,3,2017-06-09 10:51:48,andrewka,12669/-=-,710/12290=5.777%
8587,77d502fc,KPK: Komnas HAM Sampaikan Temuan 'Menarik' Kasus Teror Novel,,Crime,jakarta,delay,all,False,False,3,2017-06-09 10:52:12,andrewka,13074/-=-,989/12741=7.762%
8588,7996edef,"Ini 5 Masjid Rancangan Ridwan Kamil, Bagaimana Menurutmu?",,Others,bandung,delay,all,False,False,3,2017-06-09 10:52:16,andrewka,2263/-=-,72/2122=3.393%
8590,ae714243,Harry Kane: Cristiano Ronaldo Contoh Sempurna,,News_Sports,,delay,all,False,False,3,2017-06-09 10:55:03,andrewka,64756/-=-,2921/62360=4.684%
8591,eeecc531,Demokrat: Pansus Angket Menghambat Kinerja KPK,,News_Politics,jakarta,delay,all,False,False,3,2017-06-09 10:55:10,andrewka,307/-=-,17/300=5.667%
8592,1cbeb2ad,Parlemen Jepang Buka Jalan Kaisar untuk Mundur,,News_Entertainment,,delay,all,False,False,3,2017-06-09 10:55:14,andrewka,831/-=-,26/811=3.206%
8593,5b8fbcba,Masjid Tertua Ini Saksi Ridwan Kamil Tak Lagi Wali Kota Bandung,,Travel,bandung,delay,all,False,False,3,2017-06-09 10:55:17,andrewka,13196/-=-,598/12724=4.7%
8594,b14beb44,"Perampokan di Daan Mogot Viral, Netizen Sayangkan Foto Korban Beredar di Media Sosial",,Crime,jakarta,delay,all,False,False,3,2017-06-09 10:55:22,andrewka,13866/-=-,840/13466=6.238%
8595,3da79e3d,NasDem Tolak Usulan Penambahan Kursi Pimpinan Parlemen,,News_Politics,jakarta,delay,all,False,False,3,2017-06-09 10:55:25,andrewka,6584/-=-,132/6389=2.066%
8596,9bff38d1,"Terminal Helikopter Pertama di RI Mulai Dibangun, Luasnya 2,8 Hektar",,Others,tangerang,delay,all,False,False,3,2017-06-09 10:55:28,andrewka,3592/-=-,92/3448=2.668%
8597,a15461d0,"Gaya Casual Jokowi, Seskab: Presiden Tidak Tersekat Persoalan Formalitas dan Protokoler",,Business,jakarta,delay,all,False,False,3,2017-06-09 10:55:31,andrewka,2325/-=-,64/2248=2.847%
8598,eda18ff3,Detik-detik Tim KPK Angkut 3 Koper usai Geledah Ruang Komisi B DPRD Jatim,,Others,,delay,all,False,False,3,2017-06-09 10:55:34,andrewka,6731/-=-,174/6511=2.672%
8599,9e61233,Presidium 212 Beberkan Penyebab Aksi Persekusi,,Crime,jakarta,delay,all,False,False,3,2017-06-09 10:55:37,andrewka,4589/-=-,296/4418=6.7%
8600,11980d36,"OTT Sasar Jaksa, Anak Buah Prabowo Malah Mengkritik KPK",,News_Politics,jakarta,delay,all,False,False,3,2017-06-09 10:55:41,andrewka,12105/-=-,527/11750=4.485%
8601,f3761d5f,"Bertemu penebang kayu, ini yang dilakukannya ",Harimau Turun Gunung,Others,Medan,immediately,all,True,False,3,2017-06-09 11:47:09,andrewka,3849/-=-,287/3658=7.846%
8602,f3761d5f,"Bertemu penebang kayu, ini yang dilakukannya ",Harimau Turun Gunung,Others,Medan,delay,all,False,False,3,2017-06-09 11:47:09,auto_gen,11668/-=-,928/11173=8.306%
8603,9a24e053,"Sempat hebohkan medsos, ternyata ini wujud sebenarnya",Penampakan Pocong Surabaya,Crime,Surabaya,immediately,all,True,False,3,2017-06-09 11:47:59,andrewka,37914/-=-,3154/35255=8.946%
8604,9a24e053,"Sempat hebohkan medsos, ternyata ini wujud sebenarnya",Penampakan Pocong Surabaya,Crime,Surabaya,delay,all,False,False,3,2017-06-09 11:47:59,auto_gen,116840/-=-,9402/107375=8.756%
8605,dac5c288,Netizen pada bingung dengan merek sepatunya ,Jokowi ke Tasikmalaya,Others,Bandung,immediately,all,True,False,3,2017-06-09 11:48:28,andrewka,11587/-=-,700/10971=6.38%
8606,dac5c288,Netizen pada bingung dengan merek sepatunya ,Jokowi ke Tasikmalaya,Others,Bandung,delay,all,False,False,3,2017-06-09 11:48:28,auto_gen,23248/-=-,1199/22088=5.428%
8607,50f2fc20,"Dituding 'Serang' Pansus, KPK Ingatkan Aturan soal Angket",,News_Politics,jakarta,delay,all,False,False,3,2017-06-09 11:49:39,andrewka,2848/-=-,75/2730=2.747%
8608,f15de0c5,"Pakai Sepatu Kets Kebesaran, Jokowi Bilang Begini",,Others,,delay,all,False,False,3,2017-06-09 11:49:43,andrewka,45725/-=-,3838/44422=8.64%
8609,353db2a7,Lokasi Penahanan Ahok Masih Belum Dipastikan,,Crime,jakarta,delay,all,False,False,3,2017-06-09 11:49:46,andrewka,4844/-=-,141/4722=2.986%
8610,de5afb05,"Hormati Korban Teror London, Pesepakbola Arab Saudi Ini Banjir Pujian",,Others,,delay,all,False,False,3,2017-06-09 11:49:50,andrewka,24362/-=-,1243/23627=5.261%
8611,2e537dec,Sekjen PBNU: Mengembangkan Islam Bukan dengan Cacian,,Religion,jakarta,delay,all,False,False,3,2017-06-09 11:49:54,andrewka,4830/-=-,145/4730=3.066%
8612,51f4b425,Apple Membuat Fitur Baru Khusus Pengemudi. Apa Itu?,,Others,,delay,all,False,False,3,2017-06-09 11:49:58,andrewka,10411/-=-,253/9948=2.543%
8613,275b0176,Klub Tiongkok Siap Tawar Cristiano Ronaldo £175 Juta,,News_Sports,,delay,all,False,False,3,2017-06-09 11:50:02,andrewka,29836/-=-,1759/28527=6.166%
8614,c3027a4f,Massa Aksi Bela Ulama 96 Tegaskan Aksi Hingga Salat Tarawih,,News_Politics,jakarta,delay,all,False,False,3,2017-06-09 11:58:12,steve,4365/-=-,308/4262=7.227%
8615,90bd7c73,Begini Kronologi Perampokan Sadis di SPBU Daan Mogot yang Tewaskan Davidson,,Crime,jakarta,delay,all,False,False,3,2017-06-09 11:58:32,steve,197167/-=-,11823/190134=6.218%
8616,5b56b125,Korban Perampokan di Daan Mogot Bawa Uang Rp300 Juta,,Crime,jakarta,delay,all,False,False,3,2017-06-09 11:58:51,andrewka,321/-=-,8/315=2.54%
8617,8ad78813,"Kecelakaan Kereta api yang terjadi dijalur lintas Rantau Parapat menuju Medan di dekat stasiun Perlanaan sore ini 09/06/2017 pada pukul 17.30 wib, tidak ada korban jiwa saat kecelakaan terjadi.",,Technology,bandung,delay,all,False,True,0,2017-06-09 15:50:23,steve,3629/-=-,157/3493=4.495%
8618,dcfeb998,Alvaro Morata Di Antara Manchester United & AC Milan,,News_Sports,,delay,all,False,False,3,2017-06-09 12:03:18,andrewka,25836/-=-,1421/24577=5.782%
8619,990a883,Jokowi akan Lantik Djarot Jadi Gubernur DKI di Istana,,News_Politics,jakarta,delay,all,False,False,3,2017-06-09 12:07:21,andrewka,28172/-=-,1827/27803=6.571%
8620,5bb19b28,Pria Tewas Ditembak Perampok di Pom Bensin Daan Mogot,,Crime,jakarta,delay,all,False,False,3,2017-06-09 12:07:28,andrewka,578/-=-,43/543=7.919%
8621,ccc1028a,"Jelang Mudik, Polres Pekalongan Periksa Senjata",,News_Politics,,delay,all,False,False,3,2017-06-09 12:08:34,andrewka,3376/-=-,160/3296=4.854%
8622,6893f522,Pria Tewas Ditembak Pencuri di Daan Mogot,,Crime,jakarta,delay,all,False,False,3,2017-06-09 12:11:17,andrewka,36213/-=-,1316/34717=3.791%
8623,90bd7c73,Kronologi kejadian di SPBU Daan Mogot yang tewaskan korban,Perampokan Sadis Jakarta,Crime,"Jakarta,Bekasi,Tangerang",immediately,all,True,False,3,2017-06-09 12:37:36,andrewka,160546/-=-,12828/153821=8.34%
8624,b06bd6ab,Para pelaku sempat merekayasa kejadian yang sebenarnya ,Tewas Dianiaya Teman,Crime,"Semarang,Salatiga,Yogyakarta",immediately,all,True,False,3,2017-06-09 12:38:05,andrewka,21248/-=-,1064/20208=5.265%
8625,b06bd6ab,Para pelaku sempat merekayasa kejadian yang sebenarnya ,Tewas Dianiaya Teman,Crime,"Semarang,Salatiga,Yogyakarta",delay,all,False,False,3,2017-06-09 12:38:05,auto_gen,54802/-=-,2431/52320=4.646%
8626,7fd7d164,Ridwan Kamil Minta Jangan Kaget Kalau Dirinya tak Bisa Maju,,News_Politics,bandung,delay,all,False,False,3,2017-06-09 12:58:47,andrewka,4295/-=-,152/4154=3.659%
8627,420d2258,"Beredar Kabar Bakal Dilantik Jadi Gubernur pada 15 Juni, Djarot: Saya Belum Tahu",,Crime,jakarta,delay,all,False,False,3,2017-06-09 12:58:58,andrewka,50912/-=-,4535/49570=9.149%
8628,b8bb4139,5 Gaya berpakaian Presiden Jokowi ini paling sita perhatian masyarakat,,Others,,delay,all,False,False,3,2017-06-09 12:59:06,andrewka,26881/-=-,696/25854=2.692%
8629,9ee90bf6,CCTV Tak Merekam Wajah Bandit yang Menembak Kepala Davidson,,Crime,jakarta,delay,all,False,False,3,2017-06-09 12:59:34,andrewka,1612/-=-,106/1594=6.65%
8630,64eea737,PBNU: Ulama Tak Perlu Dibela,,News_Politics,,immediately,all,True,False,3,2017-06-09 12:59:43,andrewka,363613/-=-,20280/350817=5.781%
8631,64eea737,PBNU: Ulama Tak Perlu Dibela,,News_Politics,,delay,all,False,False,3,2017-06-09 12:59:43,andrewka,827452/-=-,41322/798099=5.178%
8633,9e56b970,Sandiaga Uno Mengaku Kesulitan Bertemu Djarot,,News_Politics,jakarta,delay,all,False,False,3,2017-06-09 14:17:39,andrewka,8111/-=-,914/7875=11.61%
8634,eac99c3,Diego Costa: Conte Tak Mengandalkan Saya di Musim Depan,,News_Sports,,delay,all,False,False,3,2017-06-09 14:18:09,andrewka,1408/-=-,89/1362=6.535%
8635,9e0ce5,Ini Makanan Kesukaan Plt Gubernur DKI Djarot Saat Sahur dan Buka Puasa,,Others,jakarta,delay,all,False,False,3,2017-06-09 14:18:45,andrewka,207/-=-,11/202=5.446%
8636,511341ef,"Awas, Beredar Surat Undangan Sosialisasi Pajak Palsu ",,Others,,delay,all,False,False,3,2017-06-09 14:19:14,andrewka,225/-=-,11/224=4.911%
8637,360ff9a7,"Kapolda Kalsel : Tanpa Ulama, Tidak Ada Artinya Polri di Tengah Masyarakat ",,Crime,,delay,all,False,False,3,2017-06-09 14:19:21,andrewka,1706/-=-,138/1607=8.587%
8638,60099e18,Agen: Andrea Conti Sudah Sepakat Gabung AC Milan,,News_Sports,,delay,all,False,False,3,2017-06-09 15:22:29,steve,590/-=-,42/564=7.447%
8639,13744b38,Luka Modric Ungkap Kunci Hajar Juventus,,News_Sports,,delay,all,False,False,3,2017-06-09 15:22:57,steve,5015/-=-,354/4873=7.265%
8640,a520287d,Militer Solusi Terakhir Tangani Terorisme,,News_Politics,jakarta,delay,all,False,False,3,2017-06-09 15:23:08,steve,25/-=-,-/22=-
8641,26432963,Polsek Sunggal Gelar Sosialisasi Bahaya Narkoba,,Crime,medan,delay,all,False,False,3,2017-06-09 15:23:33,steve,88/-=-,4/88=4.545%
8642,9bf8e567,Polisi Siap Kawal Warga Saat Ambil Uang di Bank,,Crime,jakarta,delay,all,False,False,3,2017-06-09 15:26:22,steve,316/-=-,15/307=4.886%
8643,eabb624e,Kejari Kapuas Percepat Proses Kasus Kepemilikan Sajam,,Crime,,delay,all,False,False,3,2017-06-09 15:26:33,steve,953/-=-,46/908=5.066%
8644,f4c19e42,KPK Segel Ruangan Kepala Balai Wilayah Sungai Sumatera VIII Bengkulu - Pos Kupang,,Crime,jakarta,delay,all,False,False,3,2017-06-09 15:28:42,steve,27/-=-,1/25=4%
8645,26d7b5ec,Perindo Bagi Ribuan Takjil di Jl Haji Bau Makassar - Tribun Timur,,Crime,,delay,all,False,False,3,2017-06-09 15:28:48,steve,887/-=-,38/864=4.398%
8646,bf350146,Sopir Go-Jek Solo Bagi-bagi Takjil untuk Pengemudi Becak,,Crime,,delay,all,False,False,3,2017-06-09 15:28:56,steve,3528/-=-,177/3443=5.141%
8647,4f0263df,Davidson Korban Perampokan Maut Punya Istri dan Bayi 8 Bulan,,Crime,jakarta,delay,all,False,False,3,2017-06-09 15:29:05,steve,977/-=-,78/938=8.316%
8648,2a73f8f4,Kenapa Young Lex Buat Tato Bergambar Wajah Ahok di Tangan Kanan Bukan di Tangan Kiri?,,Crime,jakarta,delay,all,False,False,3,2017-06-09 15:29:14,steve,1856/-=-,107/1818=5.886%
8649,10aea0cb,Warga Bojonegoro Jadi Korban Pencurian Rumah Kosong,,Crime,surabaya,delay,all,False,False,3,2017-06-09 15:29:22,steve,156/-=-,7/147=4.762%
8650,f10bbc9d,"Terjaring KPK, Kejaksaan Agung Langsung Proses Pelanggaran Disiplin Jaksa Kejati Bengkulu",,Crime,jakarta,delay,all,False,False,3,2017-06-09 15:29:37,steve,37/-=-,-/32=-
8651,a59923bd,"Lewat Tol, Kecepatan Kendaraan Dibatasi 40 Km/Jam",,Crime,,delay,all,False,False,3,2017-06-09 15:29:44,steve,912/-=-,67/881=7.605%
8652,29519bc,"Setiap Hari, Polsek Medan Satria Bagikan 500 Bungkus Takjil",,Crime,medan,delay,all,False,False,3,2017-06-09 15:29:51,steve,54/-=-,2/52=3.846%
8653,64e017fc,Bermain dan Belajar di RPTRA Lenteng Agung,,Crime,jakarta,delay,all,False,False,3,2017-06-09 15:30:04,steve,50/-=-,1/48=2.083%
8654,c3307728,"Dinilai Punya Banyak Kesamaan di RKPD, Sandiaga: Filosofinya Beda",,Crime,jakarta,delay,all,False,False,3,2017-06-09 15:30:14,steve,1013/-=-,88/965=9.119%
8655,65577bba,"Malam Ini, Praktik Prostitusi di Kolong Tol Kalijodo Ditertibkan",,Crime,jakarta,delay,all,False,False,3,2017-06-09 15:30:21,steve,3039/-=-,139/2935=4.736%
8656,7822a066,Kapolres jamin jalur Temanggung siap dilalui pemudik,,Crime,semarang,delay,all,False,False,3,2017-06-09 15:30:30,steve,59/-=-,4/58=6.897%
8657,9739315,Mereka yang Dibela Alumni 212 di Aksi Bela Ulama,,Crime,jakarta,delay,all,False,False,3,2017-06-09 15:31:12,steve,521/-=-,35/492=7.114%
8658,40327889,"Penampakan Pocong di Surabaya Bikin Heboh, Ternyata Seperti ini Wujudnya, Bikin Gregetan",,Crime,surabaya,delay,all,False,False,3,2017-06-09 15:31:38,steve,1272/-=-,148/1219=12.14%
8659,bbdd423f,Panglima TNI: Jatim Baro Meter Keamanan Nasional,,Crime,surabaya,delay,all,False,False,3,2017-06-09 15:31:54,steve,136/-=-,5/126=3.968%
8660,1d7e63c4,Proyek Tol Bocimi Disambung ke Sukabumi-Ciranjang - Pojok Bandung,,Crime,bandung,delay,all,False,False,3,2017-06-09 15:31:59,steve,228/-=-,22/222=9.91%
8661,3a7ae683,Bikin paspampres kalang kabut ketika lakukan aksi ini ,Kejutan Presiden Jokowi,Others,,immediately,all,True,False,3,2017-06-09 15:33:06,andrewka,357251/-=-,25366/344022=7.373%
8662,3a7ae683,Bikin paspampres kalang kabut ketika lakukan aksi ini ,Kejutan Presiden Jokowi,Others,,delay,all,False,False,3,2017-06-09 15:33:06,auto_gen,302103/-=-,15846/285539=5.55%
8664,f048fb82,5 Fakta terbaru aksi perampokan di SPBU Daan Mogot,Berita Top Pagi,Crime,,immediately,all,True,False,3,2017-06-10 01:26:19,alvinka,280841/-=-,18475/268842=6.872%
8665,f048fb82,5 Fakta terbaru aksi perampokan di SPBU Daan Mogot,Berita Top Pagi,Crime,,delay,all,False,False,3,2017-06-10 01:26:19,auto_gen,1141549/-=-,63308/1063520=5.953%
8666,8036b63,Manajer Koperasi Bawa Uang Rp 350 Juta Tewas Ditembak Perampok,,Crime,jakarta,delay,all,False,False,3,2017-06-10 02:49:02,steve,339479/-=-,23011/319037=7.213%
8667,4fb61f36,"Polisi Fokus Usut Kasus Usut Firza, Pengacara: Salah Alamat",,Crime,,delay,all,False,False,3,2017-06-10 02:49:11,steve,686039/-=-,35653/641879=5.554%
8668,75487be2,"Soal Kasus Novel, Komnas HAM: Ada Apa Antara Pimpinan KPK-Polri?",,Crime,jakarta,delay,all,False,False,3,2017-06-10 02:49:21,steve,22624/-=-,797/21437=3.718%
