id,entry_id,title,push_title,category,city,push_type,push_os,push_entire,test_mode,status,insert_time,operator,Receive/Send,Click/Show
33257,6bd18349_ru,Песков опроверг слухи о готовности РФ выдать Сноудена США,,Others,,delay,all,False,0,3,2018-07-16 05:37:08,alexandr,1330/110388=1.205%,443/1290=34.34%
33259,49115626_ru,Как Pussy Riot чуть не сорвали финал чемпионата мира,Забег по полю,Others,,immediately,all,True,0,3,2018-07-16 06:32:48,alexandr,843415/1600244=52.71%,41012/694405=5.906%
33263,cab20e6c_ru,Эксперты назвали самые бесполезные функции смартфонов,,Technology,,delay,all,False,0,3,2018-07-16 07:32:28,alexandr,14/92=15.22%,2/14=14.29%
33267,7941a7cb_ru,Нурмагомедов ответил Макгрегору на фото с Путиным,,Others,,delay,all,False,0,3,2018-07-16 07:37:46,alexandr,14599/127968=11.41%,2348/13420=17.5%
33268,2ccf6031_ru,В России озаботились качеством жизни молодых мам и пенсионеров,,Education,,delay,all,False,0,3,2018-07-16 07:39:43,alexandr,6/23=26.09%,1/6=16.67%
33269,43547741_ru,Трамп назвал причину наихудших отношений с Россией за всю историю,,News_Politics,,delay,all,False,0,3,2018-07-16 07:40:58,alexandr,13/437=2.975%,7/14=50%
33271,c3227e30_ru,Краснодарский край начал взимать с отдыхающих курортный сбор,,Others,,delay,all,False,0,3,2018-07-16 07:59:56,borisf,-/197=-,-/-=-
33272,95ef605e_ru,У нового Google Chrome обнаружили серьезный недостаток,,Technology,,delay,all,False,0,3,2018-07-16 08:03:46,borisf,10/63=15.87%,5/10=50%
33273,28f99de4_ru,Француз стал чемпионом мира без единого матча за сборную,,News_Sports,,delay,all,False,0,3,2018-07-16 08:11:02,borisf,1066/102726=1.038%,999/1025=97.46%
33274,d9cee86d_ru,Как водой смыло: Волгоград терпит бедствие после ЧМ,,Others,,delay,all,False,0,3,2018-07-16 08:19:11,borisf,10/1=1000%,-/10=-
33275,e9173a10_ru,Пропавших детей найдут по мобильнику,,Others,,delay,all,False,0,3,2018-07-16 08:28:06,borisf,1/30=3.333%,1/1=100%
33276,bda856eb_ru,Полиция назвала имена выбежавших на поле в финале ЧМ,,Others,,delay,all,False,0,3,2018-07-16 08:38:39,borisf,-/68=-,-/-=-
33277,c9371800_ru,Ученые нашли простой способ профилактики рака,,Others,,delay,all,False,0,3,2018-07-16 08:42:18,borisf,-/11=-,-/-=-
33278,49699c1d_ru,Lada Priora все-таки снимают с конвейера,,Auto,,delay,all,False,0,3,2018-07-16 08:49:41,borisf,1/2=50%,-/1=-
33285,63f49e92_ru,Мужчин перестанут высмеивать за сандалии,,News_Entertainment,,delay,all,False,0,3,2018-07-16 09:17:26,aleksandrak,41/347486=0.0118%,8644/32=2.701e+04%
33286,5fe4e380_ru,Источник: космонавтов вернули к старому графику подготовки к полету на МКС,,Others,,delay,all,False,0,3,2018-07-16 09:18:41,aleksandrak,3/47=6.383%,-/3=-
33287,aebf5fa4_ru,ЧМ-2018 поднял популярность футбола на 22%,,News_Sports,,delay,all,False,0,3,2018-07-16 09:19:39,aleksandrak,-/79=-,-/-=-
33289,3f3c5f4d_ru,Каждый мозг уникален,,Others,,delay,all,False,0,3,2018-07-16 09:20:37,aleksandrak,28/15=186.7%,2/28=7.143%
33290,acab5ab6_ru,«Милиционер вступает в игру». Как и зачем Pussy Riot прервали финал чемпионата,,Others,,delay,all,False,0,3,2018-07-16 09:21:05,aleksandrak,2/1=200%,-/2=-
33291,7be80ceb_ru,"Кто такой Лука Модрич, ставший лучшим футболистом ЧМ-2018?",,News_Sports,,delay,all,False,0,3,2018-07-16 09:21:25,borisf,92/61559=0.1495%,458/85=538.8%
33293,ba596087_ru,В ОКР назвали возможные города-кандидаты на Олимпиаду-2036,,News_Sports,,delay,all,False,0,3,2018-07-16 09:22:51,aleksandrak,2/32=6.25%,-/2=-
33294,7d2dacb2_ru,В России ускорят поиски пропавших детей,,Others,,delay,all,False,0,-1,2018-07-16 09:23:21,aleksandrak,23/-=-,2/19=10.53%
33298,939a824d_ru,Следственный комитет: подлинность останков семьи Николая II подтверждена новыми экспертизами,,Others,,delay,all,False,0,3,2018-07-16 09:28:18,aleksandrak,36/628=5.732%,6/32=18.75%
33303,494a4b68_ru,Путин опоздал на встречу с Трампом,,News_Politics,,delay,all,False,0,3,2018-07-16 10:27:18,aleksandrak,6/80=7.5%,-/6=-
33304,4374da69_ru,Названы способы избавления от страха перед полетами,,Others,,delay,all,False,0,3,2018-07-16 10:28:21,aleksandrak,3102/35891=8.643%,334/2903=11.51%
33307,759d6bda_ru,В Волгограде разрушился склон у стадиона «Волгоград-Арена»,,Others,,delay,all,False,0,3,2018-07-16 10:47:14,borisf,2/22=9.091%,-/2=-
33308,193cb158_ru,Нет вопросов: в Петербурге закрасили граффити с Черчесовым,,News_Sports,,delay,all,False,0,3,2018-07-16 10:51:22,borisf,2/5=40%,-/2=-
33312,9981fd42_ru,Поветкин подерется с непобежденным британским чемпионом на «Уэмбли»,,News_Sports,,delay,all,False,0,3,2018-07-16 11:14:25,alexandr,25/283=8.834%,1/22=4.545%
33313,b3829ba2_ru,Они покорили Россию и мир: лучшие игроки ЧМ-2018,,News_Sports,,delay,all,False,0,3,2018-07-16 11:14:39,borisf,-/2=-,-/-=-
33314,7a93e33c_ru,Будущее уже здесь: что такое умная ткань и что она умеет?,,Technology,,delay,all,False,0,3,2018-07-16 11:15:22,alexandr,-/1=-,-/-=-
33315,55586c83_ru,Туринская плащаница объявлена подделкой: ученые провели экспертизу,,Others,,delay,all,False,0,3,2018-07-16 11:58:44,borisf,4/9=44.44%,-/4=-
33321,ef482ce2_ru,Российские приставы не смогли взыскать долги по налогам с Депардье,,News_Entertainment,,delay,all,False,0,3,2018-07-16 12:24:59,borisf,17665/126088=14.01%,1412/16215=8.708%
33322,f2dbb906_ru,Меланья Трамп прибыла в Хельсинки одетая не по погоде,,Others,,delay,all,False,0,3,2018-07-16 12:42:51,borisf,1/7=14.29%,-/1=-
33323,405272b9_ru,В Париже в честь победы на ЧМ-2018 переименовали шесть станций метро,,News_Sports,,delay,all,False,0,3,2018-07-16 12:47:13,borisf,9/25=36%,-/8=-
33324,ef4dfed0_ru,Миссис президент. Как девушка из хорватской деревни возглавила страну,,News_Politics,,delay,all,False,0,3,2018-07-16 12:54:14,borisf,5/7=71.43%,-/6=-
33327,7c432533_ru,«АвтоВАЗ» прекратит производство Lada Priora,,Auto,,delay,all,False,0,3,2018-07-16 13:50:41,aleksandrak,14/139=10.07%,8/12=66.67%
33333,dbe151c9_ru,Туринская плащаница оказалась художественной подделкой,,Others,,delay,all,False,0,3,2018-07-16 13:56:45,aleksandrak,1077/827=130.2%,62/1022=6.067%
33338,a8267194_ru,"Плохой, хороший, злой: как Илон Маск портит свой имидж",,Others,,delay,all,False,0,3,2018-07-16 14:07:15,aleksandrak,359/322=111.5%,12/342=3.509%
33342,38b351b5_ru,Booking.com поддержал санкции против России,,Others,,delay,all,False,0,-1,2018-07-16 14:21:43,aleksandrak,-/-=-,-/-=-
33344,b744c303_ru,В Германии запустят водородные поезда,,Others,,delay,all,False,0,3,2018-07-16 14:28:30,borisf,934/926=100.9%,25/879=2.844%
33347,30dc6159_ru,Новая теория: предки людей развивали кисти рук ради извлечения костного мозга,,Others,,delay,all,False,0,3,2018-07-16 14:39:39,aleksandrak,6/62=9.677%,2/6=33.33%
33348,8b29b2f5_ru,Если отпуск был «горячим»: 12 правил восстановления кожи после солнечного ожога,,Others,,delay,all,False,0,3,2018-07-16 14:42:30,aleksandrak,143/127=112.6%,-/132=-
33349,dfe960ef_ru,Историк прокомментировал ситуацию вокруг останков семьи Николая II,,Others,,delay,all,False,0,3,2018-07-16 14:44:26,aleksandrak,101/92=109.8%,2/93=2.151%
33352,46d92856_ru,Франция объявила о закрытии торгового представительства в России,,Others,,delay,all,False,0,3,2018-07-16 14:55:04,aleksandrak,92/78=117.9%,1/92=1.087%
33353,2216cabf_ru,Курортный сбор: кому и за что должны платить туристы?,,Others,,delay,all,False,0,3,2018-07-16 14:56:10,aleksandrak,17310/38855=44.55%,619/16407=3.773%
33355,c5463ba5_ru,Путин понадеялся на оздоровление отношений после беседы с Трампом,,Others,,delay,all,False,0,3,2018-07-16 15:58:01,alexandr,115/127=90.55%,6/107=5.607%
33356,be7630fe_ru,В Кремле оправдались за зонт Путина на финале ЧМ-2018,,Others,,delay,all,False,0,3,2018-07-16 17:08:08,borisf,3336/3466=96.25%,193/2814=6.859%
33357,1d3b4c14_ru,Трамп придумал характеристику Путину,,News_Politics,,delay,all,False,0,3,2018-07-16 17:17:31,borisf,263/57474=0.4576%,1888/262=720.6%
33358,1aa73fea_ru,Саммит в Хельсинки: главные заявления Путина и Трампа,,News_Politics,,delay,all,False,0,3,2018-07-16 17:36:50,borisf,1615/193796=0.8334%,6745/1855=363.6%
33359,e60cb36f_ru,Участников Pussy Riot приговорили к 15 суткам ареста за акцию на финале ЧМ,,Others,,delay,all,False,0,3,2018-07-17 03:27:12,alexandr,139/124439=0.1117%,1107/134=826.1%
33360,574ab092_ru,Иностранцам упростят процедуру получения российского гражданства,,Others,,delay,all,False,0,3,2018-07-17 03:27:59,alexandr,66/109191=0.06044%,721/57=1265%
33361,48bc1637_ru,Путин назвал причину ухудшения российско-американских отношений,,News_Politics,,delay,all,False,0,3,2018-07-17 03:28:32,alexandr,5988/735158=0.8145%,96589/5722=1688%
33362,6910eac5_ru,В Шанхайский рейтинг лучших вузов вошли 17 российских университетов,,Education,,delay,all,False,0,3,2018-07-17 03:29:11,alexandr,54/240=22.5%,3/50=6%
33363,53703272_ru,«Нафтогаз» отреагировал на слова Путина о транзите газа,,Others,,delay,all,False,0,3,2018-07-17 03:29:51,alexandr,9/42=21.43%,-/9=-
33364,cfb3364_ru,Криштиану Роналду официально представили в качестве игрока «Ювентуса»,,News_Sports,,delay,all,False,0,3,2018-07-17 03:31:20,alexandr,24748/91583=27.02%,799/24880=3.211%
33365,54ecff80_ru,Трамп сообщил о «важных выводах» после встречи с Путиным,,News_Politics,,delay,all,False,0,3,2018-07-17 03:31:57,alexandr,20976/109933=19.08%,804/20899=3.847%
33366,b3f97119_ru,Флойд Мейвезер возглавил список самых высокооплачиваемых знаменитостей,,News_Entertainment,,delay,all,False,0,3,2018-07-17 03:32:48,alexandr,833/1116=74.64%,22/787=2.795%
33372,adea439c_ru,Путин рассказал о «пошедшей по-другому» встрече с Трампом,Неожиданность в Хельсинки,News_Politics,,immediately,all,True,0,3,2018-07-17 06:09:03,alexandr,137/1534890=0.008926%,40880/115=3.555e+04%
33374,c8f64c58_ru,Названы регионы России с самой грязной питьевой водой,,Others,,delay,all,False,0,3,2018-07-17 08:43:21,borisf,35/78675=0.04449%,4/32=12.5%
33375,3d59e9cd_ru,Маткапитал разрешат потратить на покупку дачи,,Others,,delay,all,False,0,3,2018-07-17 08:46:26,borisf,3/12=25%,-/3=-
33376,2f6e287_ru,"Минфин разобрался, почему россияне недовольны ОСАГО",,Others,,delay,all,False,0,3,2018-07-17 08:47:35,borisf,2/18=11.11%,-/2=-
33377,d3f38ece_ru,"Сверхдешевые смартфоны Nokia пришли в Россию, названа цена",,Technology,,delay,all,False,0,3,2018-07-17 08:48:24,borisf,-/45=-,1/-=-
33378,88c06f37_ru,Минтранс намерен сократить число съездов с автотрасс,,Others,,delay,all,False,0,3,2018-07-17 08:49:13,borisf,1/36=2.778%,-/1=-
33379,339a591a_ru,Раскрыт спонсор встречи Трампа и Путина,,Others,,delay,all,False,0,3,2018-07-17 09:13:32,borisf,2/10=20%,-/2=-
33383,ee40a59_ru,Он одурачил президента. Самый гениальный розыгрыш в истории футбола,,News_Sports,,delay,all,False,0,3,2018-07-17 09:24:16,borisf,25692/127804=20.1%,2023/24109=8.391%
33384,e25384cc_ru,Личные данные россиян попали в выдачу «Яндекса»,,Technology,,delay,all,False,0,3,2018-07-17 09:26:40,borisf,1/6=16.67%,-/1=-
33385,bb2d006e_ru,ФСБ задержала экс-главу московского СК Дрыманова,,Crime,,delay,all,False,0,3,2018-07-17 09:48:32,anastasijaf,-/16=-,2/-=-
33386,441bbf97_ru,ЕСПЧ присудил Pussy Riot 37 тысяч евро за панк-молебен,,Others,,delay,all,False,0,3,2018-07-17 09:52:11,anastasijaf,83/794=10.45%,9/80=11.25%
33387,2f86f091_ru,Названы регионы РФ с самой грязной питьевой водой,,Others,,delay,all,False,0,3,2018-07-17 09:52:45,anastasijaf,-/2=-,-/-=-
33388,37b4c6fc_ru,На заброшенной украинской базе обнаружили сотни готовых к бою танков,,Others,,delay,all,False,0,3,2018-07-17 10:04:55,anastasijaf,6/7=85.71%,-/6=-
33389,32c44676_ru,Китайские танки добрались до подмосковного Алабина,,Others,,delay,all,False,0,3,2018-07-17 10:06:02,borisf,2/15=13.33%,-/2=-
33390,3b4938a8_ru,В России начали продавать первый смартфон на Android Go,,Technology,,delay,all,False,0,3,2018-07-17 10:07:31,borisf,2/-=-,-/2=-
33391,abd63f55_ru,В России начали продавать обновленные Renault Logan и Sandero,,Auto,,delay,all,False,0,3,2018-07-17 10:08:39,borisf,23/7=328.6%,-/19=-
33393,68971be5_ru,Роскосмос назвал сроки запуска сверхтяжелой ракеты,,Others,,delay,all,False,0,3,2018-07-17 10:09:58,anastasijaf,-/1=-,-/-=-
33395,22994907_ru,ЕСПЧ оправдал Россию по делу о смерти Анны Политковской,,News_Politics,,delay,all,False,0,3,2018-07-17 10:11:05,anastasijaf,11/157=7.006%,4/7=57.14%
33396,f9da79d6_ru,"Челябинская библиотека сняла боевик, чтобы читатели вернули книги",,Others,,delay,all,False,0,3,2018-07-17 10:13:59,anastasijaf,-/1=-,-/-=-
33397,59cc4e5b_ru,Назван самый высокооплачиваемый актер на планете,,News_Entertainment,,delay,all,False,0,3,2018-07-17 10:14:22,alexandr,1340/249615=0.5368%,7544/1324=569.8%
33398,a3487c40_ru,"Аспирант погиб, случайно выпав из окна главного здания МГУ",,Others,,delay,all,False,0,3,2018-07-17 10:17:58,anastasijaf,2/3=66.67%,-/2=-
33399,4ee7557_ru,Сибирские ученые разработали новую технологию лечения рака,,Others,,delay,all,False,0,3,2018-07-17 10:20:09,anastasijaf,2/2=100%,-/2=-
33419,f8063e11_ru,Джефф Безос стал самым богатым человеком в истории,,Others,,delay,all,False,0,-1,2018-07-17 10:37:51,borisf,2/-=-,-/2=-
33429,1f298ab_ru,"""Макаронина"": Трампу незаслуженно досталось от экс-терминатора",,News_Politics,,delay,all,False,0,3,2018-07-17 11:14:35,anastasijaf,11/6=183.3%,2/11=18.18%
33430,8a03534a_ru,Найден затопленный 113 лет назад российский крейсер,,Others,,delay,all,False,0,3,2018-07-17 11:41:55,anastasijaf,-/26=-,-/-=-
33431,7af9c7d4_ru,Спецагент ФБР признал в Познере сотрудника КГБ и пропагандиста,,News_Entertainment,,delay,all,False,0,3,2018-07-17 11:42:36,anastasijaf,10195/30581=33.34%,521/9776=5.329%
33432,f5f49e64_ru,Турецкие спецслужбы начали похищать людей на Украине,,News_Politics,,delay,all,False,0,3,2018-07-17 11:43:06,anastasijaf,2/1=200%,-/2=-
33433,3bfbb811_ru,В Казани украли мешочек с бриллиантами на 100 миллионов рублей,,Others,,delay,all,False,0,3,2018-07-17 11:43:41,anastasijaf,37/82=45.12%,4/37=10.81%
33434,77b10a8b_ru,Госдума поддержала замену военных кафедр,,Others,,delay,all,False,0,-1,2018-07-17 11:51:59,anastasijaf,-/-=-,-/-=-
33441,132cb986_ru,Россиянам решили вернуть накопительную часть пенсии,,Business,,delay,all,False,0,3,2018-07-17 12:23:32,borisf,28/30=93.33%,4/26=15.38%
33442,fd5c37a_ru,Премия «Русский Букер» не будет вручена в этом году из-за отсутствия спонсора,,Others,,delay,all,False,0,3,2018-07-17 12:27:10,anastasijaf,11/14=78.57%,-/11=-
33443,e65865cd_ru,В Екатеринбурге 100 тысяч человек прошло крестным ходом памяти царской семьи,,Others,,delay,all,False,0,3,2018-07-17 12:37:12,anastasijaf,41/39=105.1%,-/41=-
33444,8e86655f_ru,Госдума поддержала законопроект о выборе дня бракосочетания,,News_Politics,,delay,all,False,0,3,2018-07-17 12:45:42,borisf,4/151=2.649%,7/145=4.828%
33447,c91e32c4_ru,"""Челси"" и ЦСКА договорились о трансфере Головина",,News_Sports,,delay,all,False,0,3,2018-07-17 13:04:01,borisf,110/129=85.27%,12/107=11.21%
33448,6ae1b362_ru,ГД обязала граждан сдавать недействительные полисы ОМС и сообщать об утере,,Others,,delay,all,False,0,3,2018-07-17 13:27:32,anastasijaf,14/20=70%,-/14=-
33449,c34f320d_ru,Кабмин выделил 36 млрд руб. для повышения МРОТ до прожиточного минимума,,Others,,delay,all,False,0,3,2018-07-17 13:28:45,anastasijaf,1063/1300=81.77%,25/995=2.513%
33450,411244a8_ru,Число отравившихся в закусочной в Туве превысило 90 человек,,Others,,delay,all,False,0,3,2018-07-17 13:29:10,anastasijaf,5/1=500%,-/3=-
33451,bc49924b_ru,"Кто такая Мария Бутина, обвиненная в США в шпионаже?",,News_Politics,,delay,all,False,0,3,2018-07-17 13:32:03,anastasijaf,99/113=87.61%,-/97=-
33459,95af497e_ru,В России нашли нарушения на каждом втором объекте с массовым пребыванием людей,,Others,,delay,all,False,0,3,2018-07-17 13:46:28,anastasijaf,34/41=82.93%,-/34=-
33460,7eb6588e_ru,В Брюсселе задержали мужчину за захват заложницы и угрозу устроить взрыв,,Others,,delay,all,False,0,3,2018-07-17 13:47:06,anastasijaf,4/52=7.692%,-/3=-
33461,e087cb5d_ru,«Уеду в Россию»: Робертино Лоретти уходит со сцены,,News_Entertainment,,delay,all,False,0,3,2018-07-17 13:54:45,anastasijaf,4340/7014=61.88%,123/4078=3.016%
33462,186714f6_ru,Женщину назвали вероятным отравителем Скрипаля,,Others,,delay,all,False,0,3,2018-07-17 14:03:18,borisf,333/291=114.4%,16/316=5.063%
33466,5a08983c_ru,Пенсия к 2024 году сравняется с двумя прожиточными минимумами,,Others,,delay,all,False,0,3,2018-07-17 14:25:51,anastasijaf,288/211=136.5%,34/282=12.06%
33467,c0a343a8_ru,Опубликовано видео взрыва на заводе в Санкт-Петербурге,,Others,,delay,all,False,0,3,2018-07-17 14:27:10,anastasijaf,460/427=107.7%,19/426=4.46%
33468,79512e01_ru,Хадльгримссон ушел с поста главного тренера сборной Исландии по футболу,,News_Sports,,delay,all,False,0,3,2018-07-17 14:29:22,anastasijaf,85/22034=0.3858%,13/83=15.66%
33478,fffde3a5_ru,В центре Праги обрушилась часть дома: продолжаются поиски людей под завалами,,Others,,delay,all,False,0,3,2018-07-17 15:27:44,anastasijaf,49/45=108.9%,-/49=-
33479,fad5eb5b_ru,"В Японском море начали поднимать русский крейсер, груженный золотом",,Others,,delay,all,False,0,3,2018-07-17 15:28:45,anastasijaf,6/3=200%,-/4=-
33480,f6aa17f8_ru,Поклонскую позвали в ЛДПР,,News_Politics,,delay,all,False,0,3,2018-07-17 16:02:26,anastasijaf,40/47=85.11%,4/38=10.53%
33481,2b0c0fa2_ru,США пригрозили России новыми санкциями,,News_Politics,,delay,all,False,0,3,2018-07-17 16:04:41,anastasijaf,49/39=125.6%,2/49=4.082%
33482,160fa9fd_ru,Женщину назвали вероятным отравителем Скрипаля,,Others,,delay,all,False,0,3,2018-07-17 16:05:31,anastasijaf,16/22=72.73%,2/16=12.5%
33483,2fc631ac_ru,"Pussy Riot опубликовали клип про ""хорошего полицейского"" с девятью требованиями",,Others,,delay,all,False,0,3,2018-07-17 16:07:26,anastasijaf,1356/2009=67.5%,47/1273=3.692%
33486,49332c39_ru,"Россия готова продлить контракт ""Газпрома"" и ""Нафтогаза""",,Others,,delay,all,False,0,3,2018-07-17 16:28:51,anastasijaf,234/3777=6.195%,24/222=10.81%
33487,9ff657bd_ru,WhatsApp получил самую долгожданную функцию этого года,,Technology,,delay,all,False,0,3,2018-07-17 16:35:46,borisf,23030/22592=101.9%,2366/19907=11.89%
33488,c56e047b_ru,Зидан собрался в «Ювентус» вслед за Роналду,,News_Sports,,delay,all,False,0,3,2018-07-17 16:42:38,alexandr,3100/2649=117%,248/2996=8.278%
33489,7487ce7c_ru,"В Россию привезли маленькие ""Мерседесы"" с полным приводом",,Auto,,delay,all,False,0,3,2018-07-17 17:02:48,alexandr,192/119071=0.1612%,3585/192=1867%
33490,1942d816_ru,Суд арестовал генерала Дрыманова на два месяца,,Others,,delay,all,False,0,3,2018-07-17 17:39:54,anastasijaf,281/890=31.57%,5/266=1.88%
33491,b5671142_ru,Авторынок России в июне вошел в пятерку лидеров в Европе,,Others,,delay,all,False,0,3,2018-07-18 02:34:29,alexandr,6029/730249=0.8256%,39787/5879=676.8%
33492,7aae7874_ru,На майнеров криптовалют распространят нормы Налогового кодекса,,Others,,delay,all,False,0,3,2018-07-18 02:38:25,alexandr,79/112274=0.07036%,602/72=836.1%
33493,9ff629ea_ru,Продукты для школ и детских садов будут чипировать,,Others,,delay,all,False,0,3,2018-07-18 02:38:49,alexandr,211/40=527.5%,4/211=1.896%
33494,c996ef2a_ru,Часть госуслуг передадут бизнесу и НКО,,Others,,delay,all,False,0,3,2018-07-18 02:39:01,alexandr,3844/7481=51.38%,110/3637=3.024%
33495,a17e18dc_ru,Ростехнадзор займется промбезопасностью в зоне газопроводов,,News_Politics,,delay,all,False,0,3,2018-07-18 02:39:11,alexandr,237/10809=2.193%,43/227=18.94%
33496,29d46be_ru,"Граффити с Черчесовым, Дзюбой и Акинфеевым появилось в Москве",,News_Sports,,delay,all,False,0,3,2018-07-18 02:39:23,alexandr,106246/25033=424.4%,1156/106364=1.087%
33497,b5671142_ru,Авторынок России в июне вошел в пятерку лидеров в Европе,,Others,,delay,all,False,0,3,2018-07-18 02:39:45,alexandr,48/2755=1.742%,4/48=8.333%
33503,ee28479e_ru,Трамп обвинил СМИ в занижении значения его встречи с Путиным,,News_Politics,,delay,all,False,0,3,2018-07-18 05:59:29,anastasijaf,-/31=-,-/-=-
33504,83e095a3_ru,Глава Пентагона решил провести первые за три года переговоры с Шойгу,,Others,,delay,all,False,0,3,2018-07-18 06:01:15,anastasijaf,6/288=2.083%,-/6=-
33505,9fda2e70_ru,ЦСКА согласился отпустить Александра Головина,,News_Sports,,delay,all,False,0,3,2018-07-18 06:02:06,anastasijaf,22/281=7.829%,3/14=21.43%
