id,entry_id,title,push_title,category,city,push_type,push_os,push_entire,test_mode,status,insert_time,operator,Receive/Send,Click/Show
9273,333d8f04,"Cegah Premanisme, Polisi Razia Anak Punk",,Crime,,delay,all,False,False,3,2017-06-15 09:05:26,alvinka,721/982=73.42%,36/676=5.325%
9274,b4fc779f,Kronologis Penangkapan Anggota DPRD Tabanan Pesta Sabu Bareng Calon Istri,,Crime,,delay,all,False,False,3,2017-06-15 09:05:32,alvinka,12999/18591=69.92%,791/12454=6.351%
9275,5a795b82,2 Pelaku Perampokan Sadis di SPBU Daan Mogot Ditangkap,,Crime,,delay,all,False,False,3,2017-06-15 09:05:51,alvinka,38795/72416=53.57%,2557/36606=6.985%
9276,12631013,Begini Aksi sang Pengintai dalam Perampokan Davidson di Daan Mogot,,Crime,,delay,all,False,False,3,2017-06-15 09:05:59,alvinka,119739/39743=301.3%,4508/115108=3.916%
9277,4cceb350,"Usai Beraksi, Perampok Davidson Tantono di Daan Mogot Bagi Uang",,Crime,,delay,all,False,False,3,2017-06-15 09:06:41,alvinka,32823/66830=49.11%,2082/30684=6.785%
9278,2493b255,Anggota parlemen AS masih kritis akibat ditembak,,Crime,,delay,all,False,False,3,2017-06-15 09:07:00,alvinka,42/111=37.84%,-/39=-
9279,e89dd02b,Polisi Selidiki Kabar Long Stay Visa Habib Rizieq,,Crime,,delay,all,False,False,3,2017-06-15 09:07:05,alvinka,289040/212271=136.2%,20375/278472=7.317%
9280,d7679d04,KPK Tanggapi Dugaan Keterlibatan Jenderal di Kasus Novel,,Crime,,delay,all,False,False,3,2017-06-15 09:07:11,alvinka,13184/23679=55.68%,1029/12628=8.149%
9281,2180b92c,Pola Teror Lone Wolf ISIS Sulit Dideteksi,,Others_Terrorism,,delay,all,False,False,3,2017-06-15 09:08:28,alvinka,2502/4168=60.03%,139/2400=5.792%
9282,b57859e0,TNI Perlu Membantu Menggempur ISIS di Filipina,,Others_Terrorism,,delay,all,False,False,3,2017-06-15 09:08:33,alvinka,152118/57688=263.7%,5574/144161=3.867%
9283,449ac5a1,Jet Tempur AU Malaysia Dilaporkan Hilang Kontak,,Others_Plane_Crash,,delay,all,False,False,3,2017-06-15 09:09:02,alvinka,21992/29144=75.46%,1246/20471=6.087%
9284,9473e17d,Waspadai perampok sadis beraksi seperti di SPBU Daan Mogot,,Crime,jakarta,delay,all,False,False,3,2017-06-15 09:36:13,steve,7538/10289=73.26%,397/7313=5.429%
9285,9ae7836d,KPK Klaim Tak Tahu Petinggi Polisi Tersangkut Kasus Novel,,Crime,jakarta,delay,all,False,False,3,2017-06-15 09:37:50,steve,9963/13167=75.67%,475/9563=4.967%
9286,82c835db,Polisi Belum Bisa Identifikasi Pelempar Bom Molotov Rumah Dirut TransJakarta,,Crime,jakarta,delay,all,False,False,3,2017-06-15 09:38:16,steve,681/1387=49.1%,49/655=7.481%
9287,d3df1369,"Perampokan di SPBU Daan Mogot, Berawal dari Modus Pecah Ban",,Crime,jakarta,delay,all,False,False,3,2017-06-15 09:38:27,steve,7907/10341=76.46%,654/7441=8.789%
9288,b3cd254c,Imbauan dan Sniper Disebar di Jalur Mudik Pantura Situbondo,,Crime,,delay,all,False,False,3,2017-06-15 09:38:35,steve,6933/8626=80.37%,354/6769=5.23%
9289,ac1b9633,Sembilan Titik Rawan Perampokan di Cempaka Putih Dijaga 'Preman',,Crime,jakarta,delay,all,False,False,3,2017-06-15 09:38:45,steve,29/65=44.62%,2/29=6.897%
9290,51f4200d,"Setelah Ahok Jatuh, Haji Lulung Ingin Jenguk Ahok di Penjara",,Crime,jakarta,delay,all,False,False,3,2017-06-15 09:39:15,steve,15241/24514=62.17%,1196/14820=8.07%
9291,4a7006b1,"Bak skenario film, begini rencana mereka",Perampokan Daan Mogot,Crime,"Jakarta,Bekasi,Tangerang",immediately,all,True,False,3,2017-06-15 10:07:17,siscaj,128730/7564=1702%,9073/125277=7.242%
9292,4a7006b1,"Bak skenario film, begini rencana mereka",Perampokan Daan Mogot,Crime,"Jakarta,Bekasi,Tangerang",delay,all,False,False,3,2017-06-15 10:07:17,auto_gen,164812/119573=137.8%,9533/155870=6.116%
9293,ae5b74d0,"Apartemen dilanda api, warga muslim jadi pahlawan",Kebakaran di London,Others,Bandung,immediately,all,True,False,3,2017-06-15 10:10:20,siscaj,12665/10046=126.1%,528/11585=4.558%
9294,ae5b74d0,"Apartemen dilanda api, warga muslim jadi pahlawan",Kebakaran di London,Others,Bandung,delay,all,False,False,3,2017-06-15 10:10:20,auto_gen,21180/30930=68.48%,673/20252=3.323%
9295,95ec5e28,Fabio Capello: Scudetto Saya Bersama Juventus Dicuri!,,News_Sports,,delay,all,False,False,3,2017-06-15 10:10:56,steve,1140/2418=47.15%,65/1088=5.974%
9296,b7743342,21 Napi Lapas Jambi Masih Buron,,Others,,delay,all,False,False,3,2017-06-15 10:11:34,steve,22/39=56.41%,6/21=28.57%
9297,5b18c91f,"FOTO: Minta Maaf, Ririn Ekawati Jawab Gosip Pilih Kasih Terhadap Anak",,News_Entertainment,,delay,all,False,False,3,2017-06-15 10:11:54,steve,109587/57814=189.6%,5134/103601=4.956%
9298,7b918230,"4 Kendaraan Terlibat Kecelakaan Beruntun di Cangkringrandu Jombang, 2 Mobil Ringsek",,Crime,surabaya,delay,all,False,False,3,2017-06-15 10:12:14,steve,5562/9404=59.15%,361/5338=6.763%
9299,d615749c,"Bom Mobil di Hotel Somalia Tewaskan 17 Orang, 20 Orang Disandera",,Others,,delay,all,False,False,3,2017-06-15 10:12:53,steve,214/520=41.15%,13/199=6.533%
9300,7177be33,Riduan ambil formulir calon Wakil Gubernur Sumsel,,News_Politics,,delay,all,False,False,3,2017-06-15 10:14:46,steve,636/829=76.72%,42/622=6.752%
9301,1b0e57d8,Empati Essien untuk Korban Kebakaran di London,,Others,bandung,delay,all,False,False,3,2017-06-15 10:15:24,steve,2182/7900=27.62%,138/2063=6.689%
9302,a3d8e06d,JK Bantah Banyak Khatib Masjid Sebarkan Ujaran Kebencian,,Others,jakarta,delay,all,False,False,3,2017-06-15 10:16:20,steve,406/766=53%,14/401=3.491%
9303,127030d5,"Resmi, Jokowi Tetapkan 23 Juni Jadi Cuti Bersama Lebaran",,News_Politics,,delay,all,False,False,3,2017-06-15 10:16:36,siscaj,7128/7868=90.59%,254/6811=3.729%
9304,dc6b80ad,Arsenal Tawar Simon Kjaer £10 Juta,,News_Sports,,delay,all,False,False,3,2017-06-15 10:17:09,steve,11056/4958=223%,300/10657=2.815%
9305,309d5f9,"Petinggi PKS Bertemu Habib Rizieq, Bicarakan Ini>>",,News_Politics,,delay,all,False,False,3,2017-06-15 10:17:13,siscaj,234776/145334=161.5%,15727/225035=6.989%
9306,68483847,"Baru Hitungan Jam Dilantik, Istri PM Lesotho Ditembak Mati",,News_Politics,,delay,all,False,False,3,2017-06-15 10:21:06,steve,6984/7335=95.21%,291/6774=4.296%
9307,e0db3b9f,Pengacara Anggap Andika 'The Titans' Korban,,Crime,bandung,delay,all,False,False,3,2017-06-15 10:21:34,steve,1354/2258=59.96%,50/1334=3.748%
9308,4b7d1578,"Agar Tak Jadi Sasaran Bandit, Pemudik Kereta Api Diimbau Tak Pamer Perhiasan",,Crime,medan,delay,all,False,False,3,2017-06-15 10:23:04,steve,468/936=50%,9/453=1.987%
9309,33df8cf4,"Jelang Lebaran, Waspadai Kejahatan Jalanan",,Crime,surabaya,delay,all,False,False,3,2017-06-15 10:24:04,steve,789/1299=60.74%,13/765=1.699%
9310,2802f0d9,Polrestro Tangerang Kota Gelar Bazar Murah,,Crime,tangerang,delay,all,False,False,3,2017-06-15 10:24:33,steve,740/1174=63.03%,33/709=4.654%
9311,a12e4283,Polisi Bangka Selidiki Kasus Pembuangan Bayi,,Crime,,delay,all,False,False,3,2017-06-15 10:33:43,steve,5333/9400=56.73%,164/5159=3.179%
9312,6ad43405,"Ke Cilacap, Jokowi kembali pakai sneaker",Gaya Andalan Jokowi ,News_Politics,"Surabaya,Semarang,Salatiga,Yogyakarta",immediately,all,True,False,3,2017-06-15 10:43:17,erompas,66510/12304=540.6%,2885/58961=4.893%
9313,6ad43405,"Ke Cilacap, Jokowi kembali pakai sneaker",Gaya Andalan Jokowi ,News_Politics,"Surabaya,Semarang,Salatiga,Yogyakarta",delay,all,False,False,3,2017-06-15 10:43:17,auto_gen,113194/108418=104.4%,4407/108200=4.073%
9314,5d39f38,Begini jawaban santainya soal foto ini,Gaya Khas Menteri Susi ,News_Politics,"Medan,Others",immediately,all,True,False,3,2017-06-15 10:51:42,erompas,183895/13202=1393%,8557/162470=5.267%
9315,5d39f38,Begini jawaban santainya soal foto ini,Gaya Khas Menteri Susi ,News_Politics,"Medan,Others",delay,all,False,False,3,2017-06-15 10:51:42,auto_gen,276076/135986=203%,12136/261583=4.639%
9316,f8e7c668,"Gak rela Chelsea Islan pacari Bastian Steel, fans baper",Komennya Lucu Semua,News_Entertainment,,delay,all,False,False,3,2017-06-15 05:55:19,auto_gen,19892/30891=64.39%,762/17676=4.311%
9317,9ca47c23,Patrick Schick Segera Tes Medis Di Juventus,,Others,,delay,all,False,False,3,2017-06-15 11:10:01,steve,725/1444=50.21%,46/677=6.795%
9318,72619862,"Asyik Berpesta Narkoba Bareng Wanita, Anggota DPRD Bali Diringkus",,Crime,jakarta,delay,all,False,False,3,2017-06-15 11:39:56,steve,59/100=59%,3/58=5.172%
9319,82b3c5df,"Terlibat Kasus Narkoba, Anggota DPRD Tabanan Ditahan Polisi",,Crime,jakarta,delay,all,False,False,3,2017-06-15 11:40:09,steve,17/32=53.12%,1/17=5.882%
9320,86c3e84e,"Ngeri, Perampok di SPBU Daan Mogok Pakai Paku 'Khusus`",,Crime,jakarta,delay,all,False,False,3,2017-06-15 11:52:43,steve,116/209=55.5%,9/114=7.895%
9321,9c3324b2,Xaveriandy Sutanto Ajukan Banding Kasus Suap Jaksa,,Crime,,delay,all,False,False,3,2017-06-15 11:52:52,steve,631/1037=60.85%,15/616=2.435%
9322,aa228bf0,"Kebakaran Apartemen di London, Ibu Lempar Bayinya dari Lantai 10 - Tribun Manado",,Others,,delay,all,False,False,3,2017-06-15 12:05:05,steve,442/1203=36.74%,20/426=4.695%
9323,2327097c,"Diincar Liverpool, Bek Porto Ini Merasa Tersanjung",,News_Sports,,delay,all,False,False,3,2017-06-15 12:05:17,steve,1299/2417=53.74%,62/1235=5.02%
9324,9cb838aa,"Diduga Pesta Narkoba, Anggota DPRD Bali Ditangkap",,Crime,jakarta,delay,all,False,False,3,2017-06-15 12:05:32,steve,357/579=61.66%,17/350=4.857%
9325,83282558,United Airlines Batal Terbang Setelah Penumpang Lihat Kebocoran Bahan Bakar Dari Sayap Pesawat,,Others_Plane_Crash,,delay,all,False,False,3,2017-06-15 12:06:21,steve,786/1031=76.24%,47/763=6.16%
9326,936c4f4c,Paket 500 Detonator di Makassar Tak Berkaitan dengan Terorisme,,Crime,jakarta,delay,all,False,False,3,2017-06-15 12:06:32,steve,1609/2617=61.48%,80/1583=5.054%
9327,47b917a6,Batu Diduga Candi Ditemukan di Kebonsari,,Others,,delay,all,False,False,3,2017-06-15 12:06:49,steve,1088/2540=42.83%,68/1046=6.501%
9328,c132740b,"Sejak 2015, Frekuensi Bencana Alam dan Kebakaran Terus Meningkat",,Others_Natural_Disaster,semarang,delay,all,False,False,3,2017-06-15 12:07:14,steve,12/50=24%,1/12=8.333%
9329,268b0b1c,"Parkir Liar, 182 Kendaraan Terjaring Razia di Taman Sari",,Crime,jakarta,delay,all,False,False,3,2017-06-15 12:07:39,steve,56/99=56.57%,3/52=5.769%
9330,3d9d4ac9,"TOP NEWS (8): Bertemu di Makkah, Habib Rizieq dan Amien Rais Bahas Kriminalisasi Ulama",,Religion,,delay,all,False,False,3,2017-06-15 12:07:55,steve,221478/138475=159.9%,18180/213866=8.501%
9331,49d1e2cc,"Bantah Terima Rp 4 Miliar, Perantara Suap Yudi Widiana Berdalih Cuma Terima Atribut Partai",,Others,bekasi,delay,all,False,False,3,2017-06-15 12:08:09,steve,5/10=50%,-/5=-
9332,4181a1b9,Isu Sekelompok Orang Hendak Mengganti Pancasila Mengusik Banyak Daerah,,Others,jakarta,delay,all,False,False,3,2017-06-15 12:08:19,steve,1454/2625=55.39%,110/1408=7.812%
9333,d93dd998,Semen Indonesia Berikan Santunan Kepada 500 Anak Yatim,,Business,,delay,all,False,False,3,2017-06-15 12:09:13,steve,152/207=73.43%,4/152=2.632%
9334,d586fc83,Dua Remaja Selundupkan Dua Dus Obat Batuk Dextro ke Sel Tahanan PN Semarang,,Others,semarang,delay,all,False,False,3,2017-06-15 12:09:53,steve,16/41=39.02%,-/15=-
9335,9bae010,Gangguan Mental Bisa Jadi Pembelaan Bagi Tersangka Insiden Melbourne,,Others,,delay,all,False,False,3,2017-06-15 12:10:33,steve,42/81=51.85%,-/41=-
9336,5c5cf8b5,Kemendikbud Sudah Pernah Bahas Lima Hari Sekolah dengan PBNU,,Others,jakarta,delay,all,False,False,3,2017-06-15 12:12:36,steve,185/536=34.51%,14/180=7.778%
9337,d043d73d,Aksi Tolak Hak Angket KPK di Sejumlah Daerah,,News_Politics,yogyakarta,delay,all,False,False,3,2017-06-15 12:12:48,steve,14/37=37.84%,2/13=15.38%
9338,a6a0f28e,"Anak-anak Sering Main Petasan, Warga Bekasi Utara Lapor Polisi, Nih Barang Sitaannya...",,Crime,bekasi,delay,all,False,False,3,2017-06-15 12:22:15,steve,104/171=60.82%,2/102=1.961%
9339,bbce2a0e,Minggu Depan Ketua KPK dan Kapolri bertemu Bahas Teror Novel,,Crime,jakarta,delay,all,False,False,3,2017-06-15 12:22:47,steve,2072/3190=64.95%,174/2031=8.567%
9340,ef23f499,Garuda Indonesia terancam bangkrut,Kok bisa?,Business,,immediately,all,True,False,3,2017-06-15 12:38:51,erompas,238711/7531=3170%,14385/229226=6.275%
9341,ef23f499,Garuda Indonesia terancam bangkrut,Kok bisa?,Business,,delay,all,False,False,3,2017-06-15 12:38:51,auto_gen,373063/200560=186%,15463/352655=4.385%
9342,e89dd02b,Polisi Selidiki Kabar Long Stay Visa Habib Rizieq,,Crime,,delay,all,False,False,3,2017-06-15 09:07:05,auto_plus,152202/53410=285%,3154/145562=2.167%
9343,78a8baa7,"Berbuka di jalan, tindakan Jokowi ini bikin terenyuh",Berkah Ramadan,News_Politics,,immediately,all,True,False,3,2017-06-15 14:40:39,erompas,212248/7082=2997%,13486/205159=6.573%
9344,78a8baa7,"Berbuka di jalan, tindakan Jokowi ini bikin terenyuh",Berkah Ramadan,News_Politics,,delay,all,False,False,3,2017-06-15 14:40:39,auto_gen,520806/200326=260%,25100/500791=5.012%
9345,c3d33475,"Elit PKS temui DPO Rizieq, ini komentar keras Ruhut",Berita Top Pagi ,News_Politics,,immediately,all,True,False,3,2017-06-16 02:09:30,andrewka,277504/7756=3578%,17949/266330=6.739%
9346,c3d33475,"Elit PKS temui DPO Rizieq, ini komentar keras Ruhut",Berita Top Pagi ,News_Politics,,delay,all,False,False,3,2017-06-16 02:09:30,auto_gen,43975/7392=594.9%,3370/42481=7.933%
9347,7985355b,"Ancam Bunuh A Pink, Si Pelaku Ternyata Fans yang Cemburu",,News_Entertainment,,delay,all,False,False,3,2017-06-16 03:57:00,steve,15662/22228=70.46%,1031/14968=6.888%
9348,9baed47,Tolak Hak Angket KPK,,Crime,jakarta,delay,all,False,False,3,2017-06-16 04:23:36,andrewka,20673/43780=47.22%,971/19557=4.965%
9349,50dad98,Survei Median: Sutarmidji dan Karolin Calon Kuat Pilgub Kalbar,,News_Politics,,delay,all,False,False,3,2017-06-16 04:23:39,andrewka,10016/18894=53.01%,563/9665=5.825%
9350,a981c71a,Derby Tolak Tawaran Rp 120 Miliar Huddersfield untuk Ince,,News_Sports,,delay,all,False,False,3,2017-06-16 04:23:42,andrewka,67635/123808=54.63%,2805/63684=4.405%
9351,2873f697,Usaha Semakin Banyak Dimenangkan KPPU,,Business,medan,delay,all,False,False,3,2017-06-16 04:23:45,andrewka,57/120=47.5%,1/56=1.786%
9352,50ff9cab,DPR sentil manajemen Garuda karena kalah dengan Lion Air Group,,Others,jakarta,delay,all,False,False,3,2017-06-16 04:23:49,andrewka,293/389=75.32%,17/280=6.071%
9353,a457a1ae,"Sudah Lulus SMA, Menteri Susi Punya Kans Maju Pilgub Jabar",,Others,,delay,all,False,False,3,2017-06-16 04:23:52,andrewka,390723/839093=46.56%,12662/370275=3.42%
9354,9b7192cb,"Konflik Marawi, Peluru di Leher Jurnalis ABC Berhasil Dikeluarkan",,Others,,delay,all,False,False,3,2017-06-16 04:23:55,andrewka,298280/674357=44.23%,6900/284564=2.425%
9355,549929e4,"Pemerintah Ancam Mundur, PD Tetap Ngotot Presidential Threshold 0%",,News_Politics,,delay,all,False,False,3,2017-06-16 04:23:58,andrewka,49509/105340=47%,2313/46807=4.942%
9356,d4f0bd3f,"Diminati Barcelona, Nacho: Bellerin Tetap di Arsenal",,News_Sports,,delay,all,False,False,3,2017-06-16 04:24:01,andrewka,97238/161139=60.34%,4188/92804=4.513%
9357,ce904aee,Menolak Hak Angket DPR,,News_Politics,,delay,all,False,False,3,2017-06-16 04:24:04,andrewka,50822/106573=47.69%,2476/48202=5.137%
9358,15e02c77,Spalletti Pilih Santai Soal Bursa Transfer Musim Panas,,News_Sports,,delay,all,False,False,3,2017-06-16 04:24:07,andrewka,75737/126290=59.97%,3035/71774=4.229%
9359,b1187a7d,Santri Beatbox Pukau Jokowi di Pesantren Darussalam,,Others,,delay,all,False,False,3,2017-06-16 04:24:10,andrewka,229759/368771=62.3%,16240/220122=7.378%
9360,9f769d2,Masih Banyak Sekolah di Bandung Belajar Dua Shift,,Health,bandung,delay,all,False,False,3,2017-06-16 04:24:16,andrewka,2913/4749=61.34%,157/2788=5.631%
9361,92e395c3,Hadapi pansus KPK dengan suara publik,,News_Politics,jakarta,delay,all,False,False,3,2017-06-16 04:24:19,andrewka,20024/42376=47.25%,706/18835=3.748%
9362,49cbde11,Novel Baswedan 3 Kali Menolak Tawaran Pemeriksaan Polisi,,Crime,jakarta,delay,all,False,False,3,2017-06-16 04:25:13,andrewka,245350/523263=46.89%,9163/232261=3.945%
9363,e7700437,"Jelang Lebaran, Sriwijaya Air Buka Rute Jakarta-Banyuwangi",,Others,jakarta,delay,all,False,False,3,2017-06-16 04:25:16,andrewka,104919/231311=45.36%,2575/99676=2.583%
9364,2ef2a0c1,Begini cerita Dirut PLN soal polemik tarif listrik,,Business,,delay,all,False,False,3,2017-06-16 04:25:19,andrewka,311727/634634=49.12%,13124/297783=4.407%
9365,db2e586c,Kisah batu bleneng yang tak bisa 'disentuh',Mistisnya Tol Cipali,Others,Bandung,immediately,all,True,False,3,2017-06-16 05:27:08,andrewka,9500/19813=47.95%,763/9144=8.344%
9366,db2e586c,Kisah batu bleneng yang tak bisa 'disentuh',Mistisnya Tol Cipali,Others,Bandung,delay,all,False,False,3,2017-06-16 05:27:08,auto_gen,41811/85718=48.78%,3020/39200=7.704%
9367,545969a3,"Pak Bupati, gimana caranya biar ayah tak beli togel'",Surat Bocah Purbalingga,Others,Surabaya,immediately,all,True,False,3,2017-06-16 05:27:34,andrewka,28026/57601=48.66%,2122/27170=7.81%
9368,545969a3,"Pak Bupati, gimana caranya biar ayah tak beli togel'",Surat Bocah Purbalingga,Others,Surabaya,delay,all,False,False,3,2017-06-16 05:27:34,andrewka,30806/64212=47.98%,1690/29015=5.825%
9369,7437a24,Drama spiritual artis cantik ini berjumpa kakek jubah putih,Ujian Jadi Mualaf,Religion,Medan,immediately,all,True,False,3,2017-06-16 05:31:54,andrewka,2859/7435=38.45%,219/2779=7.881%
9370,7437a24,Drama spiritual artis cantik ini berjumpa kakek jubah putih,Ujian Jadi Mualaf,Religion,Medan,delay,all,False,False,3,2017-06-16 05:31:54,auto_gen,11819/30948=38.19%,774/11128=6.955%
9371,6c9f7f64,5 Geng sosialita artis yang gak kalah dari Girl Squad ,Cantikya Bikin Pusing,News_Entertainment,"Semarang,Salatiga,Yogyakarta",immediately,android,True,False,3,2017-06-16 05:50:20,jatua,15538/30710=50.6%,964/14847=6.493%
9372,6c9f7f64,5 Geng sosialita artis yang gak kalah dari Girl Squad ,Cantikya Bikin Pusing,News_Entertainment,"Semarang,Salatiga,Yogyakarta",delay,android,False,False,3,2017-06-16 05:50:20,auto_gen,322/494=65.18%,26/263=9.886%
9373,6c9f7f64,5 Geng sosialita artis yang gak kalah eksis dari Girl Squad ,Cantiknya Bikin Pusing,News_Entertainment,Others,immediately,android,True,False,3,2017-06-16 06:07:41,jatua,118335/237789=49.76%,7400/112181=6.596%
9374,6c9f7f64,5 Geng sosialita artis yang gak kalah eksis dari Girl Squad ,Cantiknya Bikin Pusing,News_Entertainment,,delay,android,False,False,3,2017-06-16 06:07:41,auto_gen,37074/58688=63.17%,2680/31178=8.596%
9375,6c9f7f64,5 Geng sosialita artis yang gak kalah eksis dari Girl Squad ,Cantiknya Bikin Pusing,News_Entertainment,"Jakarta,Bekasi,Tangerang",immediately,android,True,False,3,2017-06-16 06:08:46,jatua,134600/255427=52.7%,8405/128679=6.532%
9376,4b396bf6,"Sebut Keterlibatan Jendral dalam Kasusnya, Polisi Dalami Keterangan Novel di Singapura",,Others,jakarta,delay,all,False,False,3,2017-06-16 06:24:28,steve,39703/57289=69.3%,1857/38126=4.871%
9377,2708d0ef,"Kapolda Metro Ingatkan Hati-hati Jelang Lebaran, Bandit Mengincar",,Crime,jakarta,delay,all,False,False,3,2017-06-16 06:24:46,steve,124297/232608=53.44%,6940/119883=5.789%
9378,a30419a4,Gawat! Pesawat Susi Air Ditembaki di Puncak Jaya,,Others,,delay,all,False,False,3,2017-06-16 06:27:27,steve,55896/124591=44.86%,2050/53250=3.85%
9379,c25e99d3,Pesawat Susi Air Pengangkut Logistik Pilkada Papua Ditembaki,,Others,,delay,all,False,False,3,2017-06-16 06:50:28,andrewka,30758/69940=43.98%,967/29450=3.284%
9380,57e8dea8,"Situasi Politik Tegang, Qatar Belanja 36 Jet Tempur AS ",,Business,,delay,all,False,False,3,2017-06-16 06:50:36,andrewka,72920/114446=63.72%,4528/70023=6.466%
9381,b376d9e9,Polisi: Ungkap Kasus Novel Sebenarnya Tidak Sulit,,Others,,delay,all,False,False,3,2017-06-16 06:50:46,andrewka,418170/935831=44.68%,11353/399789=2.84%
9382,419e118f,PKS: Pertemuan dengan Habib Rizieq di Mekah Tak Direncanakan,,Others,jakarta,delay,all,False,False,3,2017-06-16 06:51:15,andrewka,398747/801491=49.75%,16327/383355=4.259%
9383,87f07cea,Penembak Jitu Bersiaga di Pantura Situbondo,,Crime,surabaya,delay,all,False,False,3,2017-06-16 06:52:10,andrewka,16851/26726=63.05%,1060/16287=6.508%
9384,7283af84,PKS Sesalkan Wacana Pemerintah Tarik Diri Dari Pembahasan RUU Pemilu,,News_Politics,jakarta,delay,all,False,False,3,2017-06-16 06:52:13,andrewka,10324/15728=65.64%,322/10010=3.217%
9385,8612af14,Pilpres 2019 Kemungkinan Hanya Diikuti Calon Tunggal,,News_Politics,jakarta,delay,all,False,False,3,2017-06-16 07:17:08,steve,6134/13958=43.95%,191/5839=3.271%
9386,85377cac,Xhaka Harap Ozil Tak Tinggalkan Arsenal,,News_Sports,,delay,all,False,False,3,2017-06-16 07:23:37,steve,15373/32397=47.45%,402/14637=2.746%
9387,1583fbe9,Kompolnas Angkat Suara soal Penolakan Red Notice untuk Rizieq,,News_Politics,,delay,all,False,False,3,2017-06-16 07:49:05,steve,503215/1081760=46.52%,22962/481717=4.767%
9388,c8580acd,Kuasa Hukum Sebut Rizieq Simbol Perlawanan Pemerintah,,News_Politics,jakarta,delay,all,False,False,3,2017-06-16 08:00:55,steve,195255/412250=47.36%,8566/186559=4.592%
9389,5838b0cd,"Hendak Gabung ISIS, Seorang Warga Australia Ditangkap",,Others,,delay,all,False,False,3,2017-06-16 08:02:47,steve,7319/10919=67.03%,454/7081=6.412%
9390,5f2782a9,"Diincar Madrid, Mbappe Malah Rencana Bertahan",,News_Sports,,delay,all,False,False,3,2017-06-16 08:02:58,steve,41336/66435=62.22%,1624/39714=4.089%
9391,ab2c8877,Novel Baswedan Ditantang Ungkap Nama Jenderal Terlibat Penyiraman Air Keras,,Crime,,delay,all,False,False,3,2017-06-16 09:10:27,steve,265234/541478=48.98%,12323/255830=4.817%
9392,6a09f986,"Heran, Jaksa Agung 'Kok' Belum Tahu Kemana Ahok Harus Dieksekusi",,Crime,jakarta,delay,all,False,False,3,2017-06-16 09:10:59,steve,15251/26921=56.65%,818/14697=5.566%
9393,a47535b8,Polisi: Penembak Susi Air di Puncak Jaya Diduga Kelompok Bersenjata,,Crime,,delay,all,False,False,3,2017-06-16 09:11:13,steve,154067/271376=56.77%,9297/149071=6.237%
9394,f1d3ccb6,293 Kendaraan Dinas Polres Semarang Laik Jalan,,Crime,semarang,delay,all,False,False,3,2017-06-16 09:11:54,steve,3737/5766=64.81%,163/3542=4.602%
9395,22e26b77,Rano Karno Disebut Terima Rp700 Juta dari Korupsi Atut,,Crime,,delay,all,False,False,3,2017-06-16 09:12:04,steve,1709/3245=52.67%,82/1643=4.991%
9396,191ec233,BREAKING NEWS: Bejo Warga Jalan Mata Air Way Nangka Pinangjaya Kemiling Tewas Dibunuh Pencuri,,Crime,,delay,all,False,False,3,2017-06-16 09:12:10,steve,2429/3472=69.96%,172/2359=7.291%
9397,846e5017,"Tiga Polisi di Puncak Jaya Kena Panah, Ada yang di Lengan, Tangan dan Kaki",,Crime,,delay,all,False,False,3,2017-06-16 09:13:09,steve,8501/14009=60.68%,616/8279=7.441%
9398,70741b98,Berikut 7 Langkah Polda Jabar Urai Arus Kendaraan di Jalur Selatan,,Crime,bandung,delay,all,False,False,3,2017-06-16 09:13:53,steve,4356/7295=59.71%,178/4229=4.209%
9399,e06762b9,"Kedapatan Pungli, Oknum PNS Lari ke Rumah Kepala Dinas dan Teriak-teriak Tak Mau Ditangkap",,Crime,,delay,all,False,False,3,2017-06-16 09:14:53,steve,4470/7239=61.75%,255/4308=5.919%
9400,a6511eb6,"Menerobos Palang Pintu, Lima Orang Tewas Tertabrak KA",,Crime,,delay,all,False,False,3,2017-06-16 09:15:18,steve,107534/206027=52.19%,6977/103204=6.76%
9401,64aa9161,"Polsek Pacet Cianjur Razia Petasan, Ini Yang Didapat - Pojok Jabar",,Crime,,delay,all,False,False,3,2017-06-16 09:15:48,steve,1184/1898=62.38%,64/1131=5.659%
9402,235bd0e3,"Antisipasi Perampokan, Polres Bekasi Beri Pengawalan Gratis untuk Masyarakat",,Crime,bekasi,delay,all,False,False,3,2017-06-16 09:16:31,steve,750/1171=64.05%,34/716=4.749%
9403,25adb9eb,"Siaga Cegah ISIS, TNI Tak Sengaja Bongkar Jalur Penyelundupan Narkotik",,Crime,,delay,all,False,False,3,2017-06-16 09:16:56,steve,32587/62596=52.06%,1989/31406=6.333%
9404,5e24eb0e,"Nahas, Seorang Pemuda Tewas Tersambar Commuterline",,Crime,jakarta,delay,all,False,False,3,2017-06-16 09:17:03,steve,420/778=53.98%,22/396=5.556%
9405,ca72fac6,Kebakaran Hebat di Apartemen Grenfell Tower London Tewaskan 17 Orang,,Crime,,delay,all,False,False,3,2017-06-16 09:17:15,steve,7257/18060=40.18%,158/6987=2.261%
9406,380430d9,"Kasus Novel, KPK Belum Dapat Info soal Dugaan Keterlibatan Petinggi Polri",,Crime,jakarta,delay,all,False,False,3,2017-06-16 09:18:25,steve,1508/2051=73.53%,167/1480=11.28%
9407,77132f5c,"Bulan Ramadan Marak Kejahatan, Anton Medan Kritik Pedas Polisi",,Crime,medan,delay,all,False,False,3,2017-06-16 09:18:37,steve,1534/2926=52.43%,64/1466=4.366%
9408,f76ba1b6,Korban Kebakaran Apartemen London Tertolong Muslim yang Sahur,,Crime,,delay,all,False,False,3,2017-06-16 09:20:20,steve,23462/33650=69.72%,1254/22726=5.518%
9409,529447b6,"Soal Long Stay Visa Arab Saudi untuk Habib Rizieq, Ini Kata Polri",,Crime,jakarta,delay,all,False,False,3,2017-06-16 09:20:31,steve,135218/241147=56.07%,9735/130141=7.48%
9410,84ea32be,"Rusia telah bunuh pemimpin ISIS, Al Baghdadi?",,Others,,delay,all,False,False,3,2017-06-16 09:42:07,steve,248014/517644=47.91%,11617/238455=4.872%
9411,a0eae68d,Antonio Rudiger Bantah Rumor Akan Tinggalkan AS Roma,,News_Sports,,delay,all,False,False,3,2017-06-16 09:44:49,steve,18532/33757=54.9%,456/17914=2.545%
9412,5581a2c4,Ternyata kelompok ini yang mengaturnya,Pertemuan Amien-Rizieq,Others,"Jakarta,Bekasi,Tangerang",immediately,all,True,False,3,2017-06-16 10:04:44,siscaj,134662/256633=52.47%,8426/130681=6.448%
9413,5581a2c4,Ternyata kelompok ini yang mengaturnya,Pertemuan Amien-Rizieq,Others,"Jakarta,Bekasi,Tangerang",delay,all,False,False,3,2017-06-16 10:04:44,auto_gen,493357/984560=50.11%,27586/470818=5.859%
9414,cde2166e,"Punya museum 3D terbesar di dunia, udah pernah masuk?",Kebanggaan Warga Bandung,Travel,bandung,immediately,all,True,False,3,2017-06-16 10:11:43,siscaj,9372/19846=47.22%,483/9024=5.352%
9415,cde2166e,"Punya museum 3D terbesar di dunia, udah pernah masuk?",Kebanggaan Warga Bandung,Travel,bandung,delay,all,False,False,3,2017-06-16 10:11:43,auto_gen,15228/33297=45.73%,689/14536=4.74%
9416,e277f0,"Sopir truk lebih memilih masuk jurang, ini alasannya",Keputusan Tepat ,Others,Medan,immediately,all,True,False,3,2017-06-16 10:23:00,erompas,2810/7480=37.57%,226/2736=8.26%
