id,entry_id,title,push_title,category,city,push_type,push_os,push_entire,test_mode,status,insert_time,operator,Receive/Send,Click/Show
17816,a75ec6b9_id,Voli putri Indonesia dapat perak usai kalah dari Thailand,,News_Sports,,delay,all,False,False,3,2017-08-27 10:44:59,alvinka,16571/44924=36.89%,482/10700=4.505%
17817,a2074e66_id,"Bertinju gaya asal-asalan,  McGregor dijadikan meme ejekan",,News_Sports,,delay,all,False,False,3,2017-08-27 10:48:23,alvinka,33103/124746=26.54%,945/20542=4.6%
17818,aa2a0daf_id,Ini 4 fakta bisnis kaos putra bungsu Jokowi ,Keren Juga Nih ,News_Politics,"Surabaya,Semarang,Salatiga,Yogyakarta,Bandung ",immediately,all,False,False,3,2017-08-27 11:12:42,erompas,10221/51332=19.91%,122/11500=1.061%
17819,6001d94d_id,Lukaku diberi label sebagai striker menakutkan,,News_Sports,,delay,all,False,False,3,2017-08-27 11:20:39,erompas,9538/35984=26.51%,454/6896=6.584%
17820,e6ee2a3d_id,"Fadli Zon temui Rizieq di Arab, Sekjen Golkar minta ini ",,Crime,,delay,all,False,False,3,2017-08-27 11:24:28,erompas,215912/513569=42.04%,6728/152069=4.424%
17821,a07d42f2_id,"Duh! Warga New York 'diteror' kalkun, kok bisa?",,Food,,delay,all,False,False,3,2017-08-27 11:43:48,erompas,42187/126874=33.25%,894/25249=3.541%
17822,99ca3a58_id,Pelatih Luis Milla sebut Malaysia curang? ,Timnas Kalah,News_Sports,,immediately,all,True,False,3,2017-08-27 12:08:49,erompas,2482141/9437405=26.3%,85760/1447475=5.925%
17823,c28eccfe_id,6 gaya Nella Kharisma ini disebut tiru Via Vallen,,News_Entertainment,,delay,all,False,False,3,2017-08-27 12:30:58,alvinka,10577/38046=27.8%,259/7982=3.245%
17824,6b087c8c_id,"Dul dapat mobil mewah dari Maia, Mulan bilang begini",,News_Entertainment,,delay,all,False,False,3,2017-08-27 12:34:38,alvinka,39123/100043=39.11%,1152/33164=3.474%
17825,5bd38037_id,Foto di akun IG diduga pedofil ini respons Deddy Corbuzier,,News_Entertainment,,delay,all,False,False,3,2017-08-27 12:48:12,alvinka,3940/14387=27.39%,92/2969=3.099%
17826,5ee5c899_id,Foto-foto Nagita Slavina ini ungkap sisi lain dirinya!,,News_Entertainment,,delay,all,False,False,3,2017-08-27 12:55:24,alvinka,68460/285778=23.96%,2822/51079=5.525%
17827,8b6e6f1_id,"Akan kuliah di London, begini persiapan El Rumi",,News_Entertainment,,delay,all,False,False,3,2017-08-27 12:55:53,alvinka,18373/81070=22.66%,401/13792=2.907%
17828,4105552f_id,Atiqah Hasiholan berhenti main film demi anak,,News_Entertainment,,delay,all,False,False,3,2017-08-27 12:58:40,alvinka,2372/8743=27.13%,68/1828=3.72%
17829,786eead_id,Jeje - Amy Qanita kongkalikong lamar Syahnaz,,News_Entertainment,,delay,all,False,False,3,2017-08-27 12:59:53,alvinka,6812/22097=30.83%,208/4616=4.506%
17830,3e98e127_id,"Raffi Ahmad mendadak ogah diwawancara wartawan, kenapa?",,News_Entertainment,,delay,all,False,False,3,2017-08-27 13:02:16,alvinka,16512/56895=29.02%,798/12527=6.37%
17831,7f55b0eb_id,Girangnya KD tak sengaja bertemu Aurel ,Ada Apa Ini? ,News_Entertainment,,immediately,all,True,False,3,2017-08-27 15:09:01,erompas,2153163/4229849=50.9%,83560/1883074=4.437%
17832,84b09ad4_id,"Chelsea kalahkan Everton, Morata buat sejarah ",,News_Sports,,delay,all,False,False,3,2017-08-27 15:15:51,erompas,24014/51883=46.28%,260/19801=1.313%
17833,165603af_id,"Hamilton kalahkan Vettel, perkecil jarak di klasemen",,News_Sports,,delay,all,False,False,3,2017-08-27 15:18:56,erompas,10485/4411=237.7%,95/9764=0.973%
17834,52a68e48_id,"Ditanya cincin pertunangan, ini jawaban Agnez Mo",,News_Entertainment,,delay,all,False,False,3,2017-08-27 15:20:56,erompas,7627/2468=309%,32/7381=0.4335%
17835,f5629d4d_id,Untuk yang satu ini Awkarin dianggap tak bawa dampak buruk ,,Beauty,,delay,all,False,False,3,2017-08-27 15:27:48,erompas,602/957=62.9%,27/441=6.122%
17836,6d365cdc_id,"Ello direhabilitasi, Aurellie Malah nonton 'pacar' di Singapura?",,News_Entertainment,,delay,all,False,False,3,2017-08-27 15:29:46,erompas,1040/1445=71.97%,56/855=6.55%
17837,e5ab7f74_id,"Akibat cuaca panas, Aceh diselimuti kabut usai turun hujan",,Others_Natural_Disaster,Others,delay,all,False,False,3,2017-08-27 15:31:04,erompas,11734/14982=78.32%,185/8836=2.094%
17838,e1d37ee1_id,Alamak! Foto ini bikin Dicky Smash dibilang cantik,,News_Entertainment,,delay,all,False,False,3,2017-08-27 15:31:51,erompas,3673/5073=72.4%,105/2971=3.534%
17839,7b6c0235_id,"Pemilik First Travel memiliki perilaku aneh, bikin gemas ",,Crime,,delay,all,False,False,3,2017-08-27 15:37:10,erompas,25867/65267=39.63%,494/20378=2.424%
17840,56bb0f20_id,"Taklukkan Everton, Chelsea kini di peringkat 5 ",,News_Sports,,delay,all,False,False,3,2017-08-27 15:37:47,erompas,1532/1580=96.96%,75/1275=5.882%
17841,f3a47a1f_id,McGregor Salahkan orang ini atas kekalahannya,,News_Sports,,delay,all,False,False,3,2017-08-27 15:40:32,erompas,6445/2124=303.4%,328/6068=5.405%
17842,751f83d_id,Tim TNI AL tangkap bajak laut di Ambalat ,,Crime,,delay,all,False,False,3,2017-08-27 15:42:53,erompas,5790/4388=132%,236/5104=4.624%
17843,dc21a7c5_id,"Ayu Ting Ting jalan di tempat umum, orang-orang cuek? ",,News_Entertainment,,delay,all,False,False,3,2017-08-27 15:51:13,erompas,10872/16328=66.59%,775/8708=8.9%
17844,d6d85166_id,"Langka, Mulan Jameela cium pipi Dul di pestanya",,News_Entertainment,,delay,all,False,False,3,2017-08-27 15:53:30,erompas,2666/6288=42.4%,124/1794=6.912%
17845,1a76005d_id,10 Gaya liburan Titi Kamal & Christian Sugiono ini super glamor ,,Food,,delay,all,False,False,3,2017-08-27 15:55:11,erompas,2892/4025=71.85%,114/2283=4.993%
17846,24ae6ee6_id,Cerita Zaskia Adya Mecca gagal pergi haji tahun ini,,News_Entertainment,,delay,all,False,False,3,2017-08-27 23:44:18,yogic,7232/8584=84.25%,345/6144=5.615%
17847,d5f67dad_id,Fajar/Rian jadi satu-satunya wakil ganda putra di SEA Games,,News_Sports,,delay,all,False,False,3,2017-08-27 23:44:32,yogic,141836/320130=44.31%,5564/105909=5.254%
17848,1e494b02_id,4 Misteri bajak laut yang belum terpecahkan,,Funny,,delay,all,False,False,3,2017-08-27 23:44:35,yogic,21089/40229=52.42%,776/17208=4.51%
17849,42cb6e2c_id,"Jual tanah orang, warga Tajur Halang Bogor ditangkap polisi",,Crime,,delay,all,False,False,3,2017-08-27 23:44:39,yogic,103782/283163=36.65%,4751/69867=6.8%
17850,df2250a0_id,PKS desak polisi ungkap jaringan kelompok Saracen,,News_Politics,,delay,all,False,False,3,2017-08-27 23:44:43,yogic,59143/22090=267.7%,1629/47525=3.428%
17851,2dc71e2f_id,Luis Milla bangga bersama Timnas & akan tetap di Indonesia,,News_Sports,,delay,all,False,False,3,2017-08-27 23:44:46,yogic,930691/1535984=60.59%,36680/665443=5.512%
17852,f78e85ed_id,Aparat Polrestabes Surabaya tembak mati bandar narkoba,,Crime,Surabaya,delay,all,False,False,3,2017-08-27 23:44:50,yogic,42207/64133=65.81%,1607/33135=4.85%
17853,93cae163_id,Pembunuh sadis driver Go-Car terlacak lewat IP address HP,,Crime,,delay,all,False,False,3,2017-08-27 23:44:54,yogic,194758/548130=35.53%,6751/131006=5.153%
17854,fe0a5a1f_id,Pedagang diimbau tidak datangkan rokok ilegal,,Business,,delay,all,False,False,3,2017-08-27 23:44:58,yogic,541/1029=52.58%,9/392=2.296%
17855,fac3ba4b_id,Marquez: Mesin yang rusak masih baru,,News_Sports,,delay,all,False,False,3,2017-08-27 23:45:02,yogic,67632/188031=35.97%,2317/50221=4.614%
17856,e4e05f29_id,"Myanmar memburuk, ribuan muslim Rohingya mengungsi",,Religion,,delay,all,False,False,3,2017-08-27 23:45:06,yogic,47445/83409=56.88%,2043/36098=5.66%
17857,1c492651_id,Gubernur Sumut klaim didukung 4 Parpol,,News_Politics,Medan,delay,all,False,False,3,2017-08-27 23:45:10,yogic,925/1628=56.82%,44/698=6.304%
17858,a8be586e_id,"Gagal juara MotoGP Inggris 2017, Rossi tetap senang",,News_Sports,,delay,all,False,False,3,2017-08-27 23:45:13,yogic,289447/607729=47.63%,15560/228057=6.823%
17859,c16ea333_id,Ini pekerjaan 18 bintang Hollywood sebelum tenar,,News_Entertainment,,delay,all,False,False,3,2017-08-27 23:45:15,yogic,36112/1350=2675%,1147/35819=3.202%
17860,41f83ca_id,Ilmuwan kembangkan teknologi agar air laut dapat diminum,,Technology,,delay,all,False,False,3,2017-08-27 23:45:19,yogic,1139/595=191.4%,25/1093=2.287%
17861,c1c602ef_id,Bom mobil tewaskan 13 orang di Afghanistan,,Crime,,delay,all,False,False,3,2017-08-27 23:46:24,yogic,6778/1115=607.9%,199/6616=3.008%
17862,a7e8629a_id,Ini saran Idrus Marham kepada Fahri Hamzah,,News_Politics,,delay,all,False,False,3,2017-08-28 00:41:07,siscaj,872456/4317757=20.21%,23385/591631=3.953%
17863,622752ce_id,Tontowi/Liliyana sukses jadi juara dunia 2017,,News_Sports,,delay,all,False,False,3,2017-08-28 00:41:46,siscaj,58936/206389=28.56%,1159/43977=2.635%
17864,66eab8aa_id,Rossi tertawa meski disalip 2 pembalap muda karena ini,,News_Sports,,delay,all,False,False,3,2017-08-28 00:42:35,siscaj,186853/820494=22.77%,7600/127220=5.974%
17865,1efd9201_id,"Ternyata McGregor sangat kaya, ini deretan mobil mewahnya",,Auto,,delay,all,False,False,3,2017-08-28 00:43:08,siscaj,38378/96978=39.57%,1516/25624=5.916%
17866,4cd84993_id,ICW sebut angket KPK cuma manfaatkan Mahfud MD,,News_Politics,,delay,all,False,False,3,2017-08-28 00:43:56,siscaj,58056/34525=168.2%,2294/51247=4.476%
17867,eec818ff_id,"Kalahkan Tiongkok, Tontowi/Liliyana jadi juara dunia",Berita Top Pagi,News_Sports,,immediately,all,True,False,3,2017-08-28 01:02:02,yogic,4166425/15982724=26.07%,100113/2524563=3.966%
17868,3f1ebb70_id,Menpora sebut lini depan Timnas U-22 kurang,,News_Sports,,delay,all,False,False,3,2017-08-28 01:05:08,yogic,443622/1052708=42.14%,14999/295206=5.081%
17869,2712b190_id,PKS: Jangan sampai Saracen jadi pengalihan isu,,News_Politics,,delay,all,False,False,3,2017-08-28 01:05:49,yogic,41629/93497=44.52%,4917/35615=13.81%
17870,cc7ab0a_id,"Kisah pilu bayi pengidap penyakit langka, BPJS ditolak",,Health,,delay,all,False,False,3,2017-08-28 01:06:37,yogic,40232/138021=29.15%,1271/26138=4.863%
17871,31dc1613_id,"10 Film fiksi ilmiah terbaik abad ini, sudah nonton?",,News_Entertainment,,delay,all,False,False,3,2017-08-28 01:07:27,yogic,6280/9657=65.03%,88/2619=3.36%
17872,49973fc7_id,MU dikabarkan layangkan tawaran 100 juta euro untuk Bale,,News_Sports,,delay,all,False,False,3,2017-08-28 01:09:06,yogic,200948/513345=39.14%,7838/128895=6.081%
17873,3ffdf776_id,Zaskia Gotik siap gelar 2 pesta saat menikah,,News_Entertainment,,delay,all,False,False,3,2017-08-28 01:10:13,yogic,6334/776=816.2%,198/6153=3.218%
17874,f6c6c399_id,Pinjaman dana MRT Rp25 triliun disetujui,,Business,,delay,all,False,False,3,2017-08-28 01:11:18,yogic,7538/21530=35.01%,321/4915=6.531%
17875,174816dc_id,Kim K disebut ingin Kanye West 'balas' Taylor Swift,,News_Entertainment,,delay,all,False,False,3,2017-08-28 01:12:19,yogic,4367/10756=40.6%,107/2728=3.922%
17876,66387bf4_id,"Gara-gara umrah gratis, Maia dikaitkan dengan First Travel",,News_Entertainment,,delay,all,False,False,3,2017-08-28 01:13:13,yogic,711380/1730099=41.12%,25477/465452=5.474%
17877,b7219e88_id,Raffi Ahmad sebut Felicya Angelista mirip boneka Annabelle,,News_Entertainment,,delay,all,False,False,3,2017-08-28 01:14:49,yogic,331867/877251=37.83%,12899/206939=6.233%
17878,1d826ea4_id,"Nego Arab, Menag harap kuota haji 2018 tambah 4000 orang",,Religion,,delay,all,False,False,3,2017-08-28 01:17:05,yogic,116679/249299=46.8%,4669/72568=6.434%
17879,d3460ce2_id,Petr Cech sebut performa Arsenal tak bisa diterima,,News_Sports,,delay,all,False,False,3,2017-08-28 01:17:19,yogic,29245/67962=43.03%,1039/19733=5.265%
17880,c5eb2e6a_id,Kue pengantin Pangeran William-Kate Middleton dilelang,,Food,,delay,all,False,False,3,2017-08-28 01:27:23,yogic,23020/23268=98.93%,261/6077=4.295%
17881,8e9ae77b_id,Sahin relakan kepergian Dembele ke Barcelona,,News_Sports,,delay,all,False,False,3,2017-08-28 01:28:16,yogic,105683/258882=40.82%,3645/72033=5.06%
17882,694f388_id,Menlu AS kembali berseberangan pendapat dengan Trump,,News_Politics,,delay,all,False,False,3,2017-08-28 01:29:20,yogic,102010/327550=31.14%,3931/64996=6.048%
17883,e1dac198_id,"Sudah putus, 3 seleb ini pernah bisnis bareng saat pacaran",,News_Entertainment,,delay,all,False,False,3,2017-08-28 02:20:21,siscaj,19526/52876=36.93%,335/12246=2.736%
17884,76e47792_id,6 Potret sisi relijius Mohammad Ahsan tuai banyak pujian,,News_Sports,,delay,all,False,False,3,2017-08-28 02:26:51,siscaj,3389/8262=41.02%,104/2622=3.966%
17885,99ca94e1_id,"Ahmad Dhani selfie dengan Maia, Mulan kena sindir netizen",,News_Entertainment,,delay,all,False,False,3,2017-08-28 02:36:16,alvinka,678119/1820359=37.25%,25483/457909=5.565%
17886,6ed8126c_id,Anak Atiqah Hasiholan sudah sadar kamera sejak baru lahir,,News_Entertainment,,delay,all,False,False,3,2017-08-28 02:39:16,alvinka,13560/39376=34.44%,389/9722=4.001%
17887,5b31300d_id,"Gadis cantik ini anak sulung Mulan Jameela, cantik mana?",,News_Entertainment,,delay,all,False,False,3,2017-08-28 02:41:49,alvinka,189410/560681=33.78%,6739/125140=5.385%
17888,53bdd8d_id,Ayah Rozak ngarep Ayu Ting Ting dinikahi Andi Arsyil,,News_Entertainment,,delay,all,False,False,3,2017-08-28 02:45:29,alvinka,894842/1828775=48.93%,35153/665890=5.279%
17889,62c7c524_id,Ini hadiah mahal dari kekasih untuk Luna Maya,,News_Entertainment,,delay,all,False,False,3,2017-08-28 02:47:50,alvinka,14086/25732=54.74%,361/11818=3.055%
17890,c3000141_id,Ayu Ting Ting pamer foto saat hamil Bilqis 6 bulan,,News_Entertainment,,delay,all,False,False,3,2017-08-28 02:49:28,alvinka,948869/2075785=45.71%,34733/621021=5.593%
17891,9a3c509c_id,"10 Kasus Taylor Swift dua tahun ini, sering 'berantem'",,News_Entertainment,,delay,all,False,False,3,2017-08-28 02:54:02,siscaj,5582/12581=44.37%,84/3910=2.148%
17892,6c9e39bb_id,Artis-artis yang berkesempatan pergi haji tahun ini,,News_Entertainment,,delay,all,False,False,3,2017-08-28 02:55:01,siscaj,117132/380935=30.75%,4368/81523=5.358%
17893,9e1ff401_id,Kehidupan rumit Raisa sebelum dipastikan menikah>>,,News_Entertainment,,delay,all,False,False,3,2017-08-28 03:02:13,siscaj,16177/31892=50.72%,770/12103=6.362%
17894,491117f8_id,"Gagal juarai MotoGP Inggris, Vinales salahkan ini",,News_Sports,,delay,all,False,False,3,2017-08-28 03:11:04,siscaj,1397156/2822558=49.5%,36391/1252421=2.906%
17895,39e984b9_id,Kisah Soeharto ngaku salah pada si Raja intel Benny Moerdani,,News_Politics,,delay,all,False,False,3,2017-08-28 03:17:09,siscaj,646429/840294=76.93%,21163/445541=4.75%
17896,f89abff2_id,Zaskia Gotik sudah bayangkan jadi penganten sunda,,News_Entertainment,,delay,all,False,False,3,2017-08-28 03:19:09,alvinka,13831/45568=30.35%,332/9797=3.389%
17897,c027f1c7_id,Kecelakaan maut di Kebumen tujuh orang tewas,,Crime,"Semarang,Salatiga,Yogyakarta",delay,all,False,False,3,2017-08-28 03:25:35,siscaj,96862/308894=31.36%,4177/63244=6.605%
17898,d6927de9_id,Deddy Corbuzier sebut Demian Aditya diklaim milik Malaysia,,News_Entertainment,,delay,all,False,False,3,2017-08-28 03:26:51,alvinka,289327/523450=55.27%,14319/192393=7.443%
17899,36fa769d_id,"Dituduh ICW sebarkan hoax, tanggapan ketua Pansus KPK",,News_Politics,,delay,all,False,False,3,2017-08-28 03:26:53,siscaj,80587/80601=99.98%,3534/59370=5.953%
17900,c54ddc6f_id,Syahnaz dan Jeje ingin menikah di Bandung tahun depan,,News_Entertainment,,delay,all,False,False,3,2017-08-28 03:27:42,alvinka,152719/418992=36.45%,11347/114623=9.899%
17901,9a089f71_id,"Ingat, jelang Pilgub Jabar jangan terjebak ini>>",,News_Politics,Bandung,delay,all,False,False,3,2017-08-28 03:28:43,siscaj,4132/5950=69.45%,181/2913=6.214%
17902,9016ffd2_id,"Kian lengket, 8 foto kemesraan Selena Gomez dan Weeknd",,News_Entertainment,,delay,all,False,False,3,2017-08-28 03:30:12,alvinka,5923/13371=44.3%,130/4463=2.913%
17903,e128b5dc_id,"10 Potret mantan istri Engku Emran, cantikan mana?",,News_Entertainment,,delay,all,False,False,3,2017-08-28 03:39:24,siscaj,58499/107764=54.28%,2392/41762=5.728%
17904,7659829e_id,"Saking lucunya, ini 10 foto baby Nastusha dijadikan meme",,News_Entertainment,,delay,all,False,False,3,2017-08-28 04:19:15,siscaj,40184/149200=26.93%,631/28397=2.222%
17905,a63121b1_id,"Dituduh transgender, Gebby Vesta ajukan tantangan ini",,News_Entertainment,,delay,all,False,False,3,2017-08-28 04:21:37,siscaj,63372/125441=50.52%,1920/37259=5.153%
17906,c2de45b4_id,"Jomblo di usia 35, Syahrini ungkap penyebabnya",,News_Entertainment,,delay,all,False,False,3,2017-08-28 04:26:06,alvinka,323546/1841814=17.57%,7675/195999=3.916%
17907,67296d08_id,Ternyata arti 4 jari yang diacungkan Liliyana saat menang>>,,News_Sports,,delay,all,False,False,3,2017-08-28 04:27:33,siscaj,83410/578423=14.42%,1648/50950=3.235%
17908,251c389d_id,Liliyana Natsir pecahkan rekor dunia,,News_Sports,,delay,all,False,False,3,2017-08-28 04:30:28,alvinka,171037/1090194=15.69%,2807/110223=2.547%
17909,eae5d59c_id,Thierry Henry nilai pemain Arsenal pengecut,,News_Sports,,delay,all,False,False,3,2017-08-28 04:33:24,alvinka,28889/88375=32.69%,1048/19470=5.383%
17910,1a0d88f3_id,Montella sebut Suso masuk proyek jangka panjang Milan,,News_Sports,,delay,all,False,False,3,2017-08-28 04:46:42,alvinka,14685/37939=38.71%,498/9499=5.243%
17911,4dc82b5b_id,Barca turunkan 8 pemain jebolan La Masia saat jumpa Alaves,,News_Sports,,delay,all,False,False,3,2017-08-28 04:50:46,alvinka,242526/502687=48.25%,7302/174465=4.185%
17912,a7fc20a4_id,Robson: MU-nya Mourinho terbaik sejak era Fergie,,News_Sports,,delay,all,False,False,3,2017-08-28 04:51:49,alvinka,105174/245211=42.89%,4353/72766=5.982%
17913,676dd714_id,Gol salto Andrea Belotti sekelas Wayne Rooney bikin heboh ,,News_Sports,,delay,all,False,False,3,2017-08-28 05:01:24,alvinka,25005/72144=34.66%,979/15925=6.148%
17914,d3c3896c_id,"Dianggap rasis, komposer film Ayat Ayat Cinta dihujat",Diancam Diboikot,News_Entertainment,"Medan,Surabaya",immediately,all,False,False,3,2017-08-28 05:18:26,yogic,4465/6916=64.56%,119/2782=4.277%
17915,249648eb_id,3 Paspampres gulat hadapi pria tanpa busana di Istana,Lihat Rekamannya,Crime,"Jakarta,Bekasi,Tangerang",immediately,all,False,False,3,2017-08-28 05:20:32,yogic,308986/510628=60.51%,11360/167369=6.787%
17916,9e5a92de_id,5 fakta buktikan Angela Gilsha cewek perfect,,News_Entertainment,,delay,all,False,False,3,2017-08-28 05:26:36,alvinka,70101/221628=31.63%,2437/46848=5.202%
17917,e8661d81_id,"Ribuan ATM bermasalah, ternyata ini penyebabnya",Kena tegur Menkominfo,Technology,"Semarang,Salatiga,Yogyakarta,Others,Bandung",immediately,all,False,False,3,2017-08-28 05:48:15,yogic,4098/24740=16.56%,135/2620=5.153%
17918,e38177ea_id,Lihat ekspresi Liliana saat naik podium penyerahan medali,,News_Sports,,delay,all,False,False,3,2017-08-28 05:58:53,siscaj,91438/214113=42.71%,1159/23905=4.848%
17919,c3fd8e0f_id,Pacquiao sindir Mayweather sebelum kalahkan McGregor,,News_Sports,,delay,all,False,False,3,2017-08-28 06:06:58,siscaj,103446/181090=57.12%,3364/75383=4.463%
17920,f04c4e83_id,5 alasan Natasha Wilona pantas jadi calon menantu idaman,,News_Entertainment,,delay,all,False,False,3,2017-08-28 06:16:31,alvinka,57311/163475=35.06%,2195/39139=5.608%
17921,5ae30e46_id,2 artis ini rayakan baby shower dengan konsep menggemaskan,,News_Entertainment,,delay,all,False,False,3,2017-08-28 06:17:25,alvinka,41372/126929=32.59%,1180/30027=3.93%
17922,1faf338_id,"Ulang tahun, Millen Cyrus dapat doa ini dari banyak orang",,News_Entertainment,,delay,all,False,False,3,2017-08-28 06:18:10,alvinka,90473/185661=48.73%,3417/59707=5.723%
17923,f75d0b7c_id,"Unggah foto berdua, Baim Wong dan Vebby Palwinta go publik?",,News_Entertainment,,delay,all,False,False,3,2017-08-28 06:25:04,siscaj,21633/56737=38.13%,519/17048=3.044%
17924,55509861_id,"Millendaru ultah, bentuk kuenya dibilang mirip dada>>",,News_Entertainment,,delay,all,False,False,3,2017-08-28 06:58:11,siscaj,74345/208945=35.58%,3073/63345=4.851%
17925,690a4953_id,7 Wanita ini pilih cerai daripada dipoligami>>,,News_Entertainment,,delay,all,False,False,3,2017-08-28 07:09:35,siscaj,160741/418841=38.38%,6151/115151=5.342%
17926,32216a0f_id,"Setelah sembuh, tebak apa yang berubah dari Awkarin",,News_Entertainment,,delay,all,False,False,3,2017-08-28 07:17:27,siscaj,244066/675641=36.12%,7454/151895=4.907%
17927,de2bc86f_id,"Beredar, video rekaman TKW di Arab dikurung di toilet",,Crime,,delay,all,False,False,3,2017-08-28 08:38:52,yogic,627330/2546047=24.64%,14366/439829=3.266%
17928,6945215c_id,"Perusahaan asing ikut tanam modal di startup, siapa saja?",,Technology,,delay,all,False,False,3,2017-08-28 08:55:02,andrewka,10340/52636=19.64%,154/7412=2.078%
17929,7f996913_id,"Pria bugil terobos masuk Istana Kepresidenan, apa tujuannya?",,Crime,,delay,all,False,False,3,2017-08-28 08:55:38,andrewka,193959/639107=30.35%,4334/172754=2.509%
17930,de04da3f_id,"Buntut gangguan satelit Telkom 1, data pelanggan hilang?",,Technology,,delay,all,False,False,3,2017-08-28 08:56:34,andrewka,3322/13971=23.78%,64/2124=3.013%
17931,79ff42d4_id,"Panggilan sayang Ayu Ting-Ting dan Andi Arsyil, apa saja?",,News_Entertainment,,delay,all,False,False,3,2017-08-28 08:58:02,andrewka,902001/4795891=18.81%,26681/751359=3.551%
17932,d348b69a_id,"Indonesia vs Myanmar: tak ada emas, perunggu pun jadi",,News_Sports,,delay,all,False,False,3,2017-08-28 08:59:28,andrewka,651022/3996635=16.29%,22772/506862=4.493%
17933,8900f83e_id,Presiden Vietnam muncul di publik setelah sebulan hilang,,News_Politics,,delay,all,False,False,3,2017-08-28 09:02:24,andrewka,27317/78387=34.85%,793/18094=4.383%
17934,cab03bb4_id,Aktor Hollywood yang akan main di film Indonesia 'Valentine',,News_Entertainment,,delay,all,False,False,3,2017-08-28 09:02:29,andrewka,22003/74936=29.36%,316/14597=2.165%
17935,75b90f26_id,"Rio Dewanto ultah, Atiqah Hasiholan beri kejutan romantis!",,News_Entertainment,,delay,all,False,False,3,2017-08-28 09:04:37,andrewka,29341/80340=36.52%,497/21330=2.33%
17936,f3800d67_id,Ibunda tak restui nikahan Tsania Marwa dengan Atalarik Syach,,News_Entertainment,,delay,all,False,False,3,2017-08-28 09:05:27,andrewka,24757/77930=31.77%,832/16912=4.92%
17937,e34f439d_id,"Novanto tegur doli, GMPG anggap DPP Golkar primitif",,News_Politics,,delay,all,False,False,3,2017-08-28 09:07:06,andrewka,119007/242602=49.05%,3627/68995=5.257%
17938,5a62da67_id,"Dijanjikan gratis, BCA akan ganti biaya tarik tunai di ATM",,Business,,delay,all,False,False,3,2017-08-28 09:07:34,andrewka,325028/1255685=25.88%,4249/271698=1.564%
17939,dec60f7c_id,LPSK sebut kerja sama pelindungan saksi dengan KPK habis,,Crime,,delay,all,False,False,3,2017-08-28 09:08:33,andrewka,7513/27435=27.38%,284/5325=5.333%
17940,2d428300_id,"Polda Metro dinilai menyalahi aturan, SP3 kasus Ade Armando",,Crime,,delay,all,False,False,3,2017-08-28 09:11:07,andrewka,124254/293437=42.34%,8702/83803=10.38%
17941,bc19e0cc_id,"Kolong ""Flyover"" Cibinong malam hari jadi tempat mangkal PSK",,Crime,,delay,all,False,False,3,2017-08-28 09:11:52,andrewka,46237/130345=35.47%,1578/33998=4.641%
17942,7e3b4bda_id,Bethesda akan garap game adaptasi Game of Thrones?,,Gaming,,delay,all,False,False,3,2017-08-28 09:12:16,andrewka,14179/40396=35.1%,119/8682=1.371%
17943,39e324b2_id,"Kapal selam Indonesia, KRI Nagapasa-403 tiba di Surabaya",,News_Politics,surabaya,delay,all,False,False,3,2017-08-28 09:12:48,andrewka,40712/55189=73.77%,766/34263=2.236%
17944,288ace35_id,Kepala daerah gunakan Saracen bakal ditindak,,Crime,jakarta,delay,all,False,False,3,2017-08-28 09:13:15,andrewka,23351/66995=34.85%,563/14664=3.839%
17945,e64539cb_id,"Banjir lumpuhkan Houston, Trump kunjungi Texas",,Others_Natural_Disaster,,delay,all,False,False,3,2017-08-28 09:14:55,andrewka,53258/174808=30.47%,1427/35635=4.004%
17946,f673a91d_id,"Amber Heard disebut tukang bohong, Elon Musk pilih putus",,News_Entertainment,,delay,all,False,False,3,2017-08-28 09:16:24,andrewka,54937/233478=23.53%,1078/39938=2.699%
17947,7d7782cc_id,"Sopir taksi marah ke Bule, ini penjelasan Blue Bird",,Business,,delay,all,False,False,3,2017-08-28 09:17:10,andrewka,187298/260328=71.95%,5141/217274=2.366%
17948,4d3a264e_id,Kemendag diminta luruskan perbedaan persepsi,,Business,,delay,all,False,False,3,2017-08-28 10:40:45,andrewka,674/1672=40.31%,31/622=4.984%
17949,e1f072f8_id,"OTT KPK, Kemenhub gandeng kejaksaan dalam setiap proyek",,News_Politics,,delay,all,False,False,3,2017-08-28 10:41:30,andrewka,57526/515869=11.15%,1708/41177=4.148%
17950,50bb6ad7_id,Alasan dibalik gagalnya pernikahan Syahrini,,News_Entertainment,,delay,all,False,False,3,2017-08-28 10:41:59,andrewka,360116/645028=55.83%,7381/263436=2.802%
17951,56072e28_id,'Hujan' ini cuma guyur di 1 rumah di Tebet,Kok Bisa Ya? ,Funny,"Jakarta,Bekasi,Tangerang ",immediately,all,False,False,3,2017-08-28 10:42:01,erompas,53268/356075=14.96%,1645/33579=4.899%
17952,9c06ab0e_id,Hotman Paris: Sevel bayar gue aja sanggup kok,,Business,,delay,all,False,False,3,2017-08-28 10:42:24,andrewka,265/1102=24.05%,6/183=3.279%
17953,27f3a1ca_id,"Indonesia Vs Myanmar: preview, hasil, jadwal pertandingan",,News_Sports,,delay,all,False,False,3,2017-08-28 10:42:48,andrewka,1412287/8143892=17.34%,34765/907747=3.83%
17954,361c89b6_id,Eggy Sudjana polisikan Sunny & Dedy Mawardi soal Saracen,,Crime,,delay,all,False,False,3,2017-08-28 10:43:12,andrewka,95001/286993=33.1%,3735/61552=6.068%
17955,3e10b1a8_id,DPR akan panggil Kapolri minta penjelasan kasus Saracen,,Crime,,delay,all,False,False,3,2017-08-28 10:43:27,andrewka,72128/346310=20.83%,2721/61562=4.42%
17956,38674f28_id,Kemenperin minta pajak dan bea masuk mobil lebih rendah,,Business,,delay,all,False,False,3,2017-08-28 10:43:52,andrewka,3800/12311=30.87%,98/2532=3.87%
17957,556490f0_id,Laskar bayaran potret kapitalisme kuasai koloni,,Travel,,delay,all,False,False,3,2017-08-28 10:44:10,andrewka,3015/6202=48.61%,53/2248=2.358%
17958,a251c79b_id,Penolakan Jack Ma jadi penasihat E-Commerce Indonesia,,Technology,,delay,all,False,False,3,2017-08-28 10:46:02,andrewka,721/3144=22.93%,8/489=1.636%
17959,973042f0_id,"SEA Games 2017, Fajar/Rian: Kami main kurang tenang",,News_Sports.Badminton,,delay,all,False,False,3,2017-08-28 10:46:58,andrewka,79474/219745=36.17%,3094/53905=5.74%
