id,entry_id,title,push_title,category,city,push_type,push_os,push_entire,test_mode,status,insert_time,operator,Receive/Send,Click/Show
16678,303d426b_id,"Rumah adik Bos First Travel digeledah, ini isinya  ",Tak Disangka-sangka,Crime,,immediately,all,True,False,3,2017-08-18 14:24:43,erompas,1028463/2239506=45.92%,27212/675445=4.029%
16679,49b7cee6_id,"Rayakan Milad FPI, Anies sampaikan pesan spesial",Berita Top Pagi,News_Politics,,immediately,all,True,False,3,2017-08-19 01:41:07,jatua,7969007/13743502=57.98%,203170/4850175=4.189%
16680,81a071d7_id,"Penipuan UN Swissindo, Bupati Pati Jadi Korban?",,Crime,"Semarang,Salatiga,Yogyakarta",delay,all,False,False,3,2017-08-19 01:51:12,jatua,37092/25365=146.2%,1623/23671=6.856%
16681,151b2980_id,"Rindu bayi usia 3 minggu, istri bos First Travel nangis terus",,Crime,,delay,all,False,False,3,2017-08-19 02:00:23,jatua,257017/189284=135.8%,10662/176160=6.052%
16682,6abf1a0d_id,Blak-blakkan istri Caisar beberkan alasan dicerai suami,,Religion,"Semarang,Salatiga,Yogyakarta,Bandung,Medan,Surabaya",delay,all,False,False,3,2017-08-19 02:01:26,jatua,423192/383609=110.3%,19461/280017=6.95%
16683,db45cf65_id,"Bali United kunjungi SMA Denpasar, eh salah fokus ke sini",,Funny,,delay,all,False,False,3,2017-08-19 02:06:47,jatua,480298/645579=74.4%,17431/255741=6.816%
16684,ec2db178_id,Wajib Tahu! Perpres 5 hari sekolah terbit September,,Education,,delay,all,False,False,3,2017-08-19 02:10:53,jatua,170228/122127=139.4%,7902/100991=7.824%
16685,9193e76d_id,Syahrini & artis yang diendorse umroh First Travel diperiksa?,,Crime,,delay,all,False,False,3,2017-08-19 02:12:24,jatua,1496954/1830862=81.76%,61535/860352=7.152%
16686,8205c5b7_id,Korban First Travel singgung Tas Hermes Anniesa Hasibuan di DPR,,Crime,,delay,all,False,False,3,2017-08-19 02:16:46,jatua,1626630/1788215=90.96%,64730/970978=6.666%
16687,807fe803_id,"Sedih, Taeyeon dilecehkan fans di bandara, ia konser bertangan memar",,News_Entertainment,,delay,all,False,False,3,2017-08-19 02:50:59,jatua,151993/142966=106.3%,6561/97435=6.734%
16688,c166c064_id,Lomba 17-an yang satu ini bikin nggak berhenti ngakak ,,Funny,,delay,all,False,False,3,2017-08-19 03:02:50,jatua,277833/241652=115%,11534/167016=6.906%
16689,4cb4d16c_id,"Tega, foto Ayu Ting Ting sama Raffi diedit jadi Nagita",,News_Entertainment,,delay,all,False,False,3,2017-08-19 03:03:38,jatua,3087720/2943478=104.9%,112707/1926254=5.851%
16690,344861db_id,"NASA akan terbangkan bakteri pas gerhana matahari, kenapa?",,Technology,,delay,all,False,False,3,2017-08-19 03:27:51,jatua,858855/951637=90.25%,29886/497959=6.002%
16691,ee8331cd_id,"Kutuk teror Barcelona, Trump sebut mitos Muslim & darah babi",,News_Politics,,delay,all,False,False,3,2017-08-19 03:36:34,jatua,702824/2941715=23.89%,36454/456370=7.988%
16692,94d9c0b5_id,Mau seksinya Rihanna di tubuhmu? Nih coba kaus kakinya ,,Fashion,,delay,all,False,False,3,2017-08-19 03:39:42,jatua,8164/4614=176.9%,215/6383=3.368%
16693,cced4a74_id,Oh begini wujud Homo Sapiens pertama Indonesia ,,Education,,delay,all,False,False,3,2017-08-19 03:42:57,jatua,61710/85764=71.95%,2297/36123=6.359%
16694,5552301c_id,Rizieq Shihab bakal Live Streaming di HUT FPI,,News_Politics,,delay,all,False,False,3,2017-08-19 03:45:05,jatua,1073800/1829011=58.71%,33749/647619=5.211%
16695,c909b8b3_id,Al Khaththath deklarasikan gerakan salat ini di HUT FPI,,Religion,,delay,all,False,False,3,2017-08-19 03:45:55,jatua,84614/98521=85.88%,3224/50624=6.369%
16696,4ac80307_id,"Golkar pede Jokowi menang Pilpres, Gerindra: gak ngaruh",,News_Politics,,delay,all,False,False,3,2017-08-19 03:49:02,jatua,3918375/8290270=47.26%,47304/2367908=1.998%
16697,fd4ab0ed_id,"Mega ketemu SBY, PAN: Mereka bisa koalisi usung Cagub",,News_Politics,,delay,all,False,False,3,2017-08-19 03:50:44,jatua,883227/3450160=25.6%,31433/592125=5.309%
16698,97f804c6_id,"d'Happening heroisme Serka Darwis tayang hari ini, jangan lewatkan",,News_Entertainment,,delay,all,False,False,3,2017-08-19 03:58:25,jatua,217599/255407=85.2%,5681/124185=4.575%
16699,1daf1121_id,"Belum rilis, 10 foto Game of Thrones ep.6 bocor di internet",,News_Entertainment,,delay,all,False,False,3,2017-08-19 03:59:49,jatua,8065/8326=96.87%,139/5693=2.442%
16700,2e31ff50_id,10 Pesawat & helikopter canggih Indonesia dari masa ke masa,,Business,,delay,all,False,False,3,2017-08-19 04:00:32,jatua,259474/453245=57.25%,5827/164444=3.543%
16701,addaeba7_id,"Inilah mereka yang foya-foya pakai uang menipu, kok tega ya?",,Crime,,delay,all,False,False,3,2017-08-19 04:03:35,jatua,285863/267121=107%,18908/185520=10.19%
16702,d668bf14_id,4 Lomba Agustusan suku Dayak yang bikin melongo,,Education,,delay,all,False,False,3,2017-08-19 04:06:09,jatua,493747/1042957=47.34%,13124/294037=4.463%
16703,82e715c3_id,4 Alasan kenapa jadi TKI bisa bikin kaya mendadak ,,Business,,delay,all,False,False,3,2017-08-19 04:08:24,jatua,94929/136447=69.57%,2043/57283=3.567%
16704,20a7365d_id,8 Foto TNI di medan tugas ini bikin mata berkaca-kaca,,Education,,delay,all,False,False,3,2017-08-19 04:15:52,jatua,447033/343808=130%,10430/258700=4.032%
16705,ccbef4ca_id,Gadis cantik ini nggak malu jadi kuli semen demi ibunya,,Education,,delay,all,False,False,3,2017-08-19 04:18:15,jatua,339492/372258=91.2%,9980/194797=5.123%
16706,3c038435_id,Politikus PKS: Dana desa dikorupsi jangan langsung dicap gagal,,News_Politics,,delay,all,False,False,3,2017-08-19 04:20:31,jatua,63869/53467=119.5%,1524/37529=4.061%
16707,31ba0a2e_id,"Mobil pelajar Surabaya ringsek usai tabrak mobil parkir, selanjutnya ..",,Crime,Surabaya,delay,all,False,False,3,2017-08-19 04:21:57,jatua,76847/59573=129%,10293/47413=21.71%
16708,f77526e2_id,Opick digugat cerai karena poligami? Curhat istrinya bikin sedih,,News_Entertainment,,delay,all,False,False,3,2017-08-19 04:28:01,jatua,13556/15293=88.64%,528/8064=6.548%
16709,68cc9332_id,7 Fakta perceraian penyanyi religi Opick ,,News_Entertainment,,delay,all,False,False,3,2017-08-19 04:29:33,jatua,56278/61749=91.14%,1572/34716=4.528%
16710,c3736aee_id,"9 Wanita terkaya di dunia, no 4 seorang jurnalis muda ",,Education,,delay,all,False,False,3,2017-08-19 04:44:09,jatua,14420/14902=96.77%,452/8525=5.302%
16711,4311b871_id,"Keseret juga jadi tersangka, Kiki Hasibuan First Travel menangis ",,Crime,,delay,all,False,False,3,2017-08-19 04:45:49,jatua,551436/794820=69.38%,19412/322258=6.024%
16712,16ae6374_id,"Pacar Laudya Cynthia Bella ternyata artis & anak pejabat, ini orangnya ",,News_Entertainment,,delay,all,False,False,3,2017-08-19 04:47:05,jatua,1927730/3898356=49.45%,35844/1217954=2.943%
16713,1cb399bb_id,6 Lomba perayaan HUT kemerdekaan RI ini berujung maut,,Education,"Medan,Surabaya",delay,all,False,False,3,2017-08-19 04:48:41,jatua,112681/160361=70.27%,4135/73701=5.611%
16714,3a3a58b3_id,Kurir sabu pakai Land Cruiser Prado antar barang haram,,Crime,Medan,delay,all,False,False,3,2017-08-19 04:49:47,jatua,22114/38936=56.8%,676/13540=4.993%
16715,26572a73_id,Opic buka suara soal mau menikah lagi ,,News_Entertainment,,delay,all,False,False,3,2017-08-19 04:51:28,jatua,11629/10628=109.4%,461/6769=6.81%
16716,cf1e81b1_id,"Petarung MMA tewas usai kalah TKO, 2 kali tanding ",,News_Sports,,delay,all,False,False,3,2017-08-19 04:52:44,jatua,1605957/1888679=85.03%,66481/943941=7.043%
16717,51d9cca4_id,Shandy Aulia posting hal menohok saat disebut segera cerai,,News_Entertainment,,delay,all,False,False,3,2017-08-19 04:54:12,jatua,756786/948393=79.8%,24447/404078=6.05%
16718,af6cf9dd_id,Gaun Mulan Jameela yang serba transparan sukses curi perhatian,,News_Entertainment,,delay,all,False,False,3,2017-08-19 04:55:34,jatua,1317301/1540836=85.49%,53378/806511=6.618%
16719,79ce4e8f_id,10 Tahun anak Amrozi tak sudi hormat bendera, Ayahnya Ditembak Mati,News_Politics,"Jakarta,Bekasi,Tangerang,Bandung",immediately,all,False,True,3,2017-08-19 05:46:01,jatua,-/22661=-,-/-=-
16720,5f0b886_id,Presenter TV one dihujat dianggap hina Jokowi begini ,Saat Siaran Langsung,Crime,Others,immediately,all,False,False,3,2017-08-19 05:54:23,jatua,536953/986897=54.41%,15584/320782=4.858%
16721,7f22eba0_id,4 Fakta insiden Taeyeon SNSD diraba & kata maaf pejabat,Bikin Malu Indonesia,News_Entertainment,"Semarang,Salatiga,Yogyakarta",immediately,all,False,False,3,2017-08-19 05:59:45,jatua,84182/258826=32.52%,1105/59969=1.843%
16722,25069a13_id,Momen kocak ketika polisi gadungan dirazia oleh aslinya,Susah Nahan Ketawa,Funny,"Medan,Surabaya",immediately,all,False,False,3,2017-08-19 06:05:10,jatua,27511/29587=92.98%,803/15809=5.079%
16723,48e5cee7_id,Ini alasan Ketum PSSI masih enggan dukung Timnas U-22,,News_Sports,,delay,all,False,False,3,2017-08-19 06:07:05,jatua,4329459/8999279=48.11%,83449/2626181=3.178%
16724,7edd1df5_id,"Terungkap, ini identitas pelaku teror di Barcelona",,Crime,,delay,all,False,False,3,2017-08-19 06:10:01,jatua,147710/147237=100.3%,4330/85181=5.083%
16725,9649a12b_id,"Sebal sama haters, Dewi Sanca kasih foto nungging",,News_Entertainment,,delay,all,False,False,3,2017-08-19 06:14:30,jatua,292975/326934=89.61%,10978/177698=6.178%
16726,a0f2c04c_id,"Dinyinyiri hamil duluan, ini cara Stevianne Agnecya usir haters",,News_Entertainment,,delay,all,False,False,3,2017-08-19 06:17:08,jatua,769361/1082806=71.05%,28641/455884=6.283%
16727,dbfced24_id,"Dipeluk 2 pria, baju transparan Dewi Perssik picu komentar",,News_Entertainment,,delay,all,False,False,3,2017-08-19 06:19:02,jatua,1054761/1156000=91.24%,57662/663144=8.695%
16728,736653d_id,"10 Artis sering muncul di FTV, tapi nggak pernah ingat namanya ",,News_Entertainment,,delay,all,False,False,3,2017-08-19 06:20:07,jatua,731922/1155578=63.34%,22995/433561=5.304%
16729,32b1d44b_id,"Hindari insiden lagi, Taeyeon & Hyoyeon SNSD dikawal ketat",,News_Entertainment,,delay,all,False,False,3,2017-08-19 06:20:55,jatua,33158/34823=95.22%,1069/18741=5.704%
16730,61383674_id,"Kecelakaan latihan militer Korea Selatan, 1 tentara tewas",,News_Politics,,delay,all,False,False,3,2017-08-19 08:20:40,andrewka,753070/785437=95.88%,24827/441944=5.618%
16731,c41de855_id,Benarkah Caisar tidak pernah lagi pulang sejak joget di TV?,,News_Entertainment,,delay,all,False,False,3,2017-08-19 08:22:19,andrewka,269772/425650=63.38%,6653/162790=4.087%
16732,2c5fd7a_id,Yuk intip tingkah lucu dari beauty vlogger Cindercella,,News_Entertainment,,delay,all,False,False,3,2017-08-19 08:23:44,andrewka,130775/146840=89.06%,2450/83046=2.95%
16733,6eece0e0_id,"10 lembaga negara yang terima RAPBN terbesar, apa saja?",,News_Politics,,delay,all,False,False,3,2017-08-19 08:24:59,andrewka,11404/10396=109.7%,445/6813=6.532%
16734,98277fd0_id,Akankah koalisi Megawati - SBY terwujud?,,News_Politics,,delay,all,False,False,3,2017-08-19 08:26:01,andrewka,417689/2081554=20.07%,12946/260046=4.978%
16735,65903c55_id,"Harga Xpander Rp200 Juta-an, Mitsubishi incar kalangan ini?",,Auto,,delay,all,False,False,3,2017-08-19 08:27:15,andrewka,452632/383501=118%,10167/259698=3.915%
16736,641d4cc1_id,"Batal bercerai, Yama Carlos ungkap alasan rujuk dengan istri",,News_Entertainment,,delay,all,False,False,3,2017-08-19 08:30:53,andrewka,97961/109789=89.23%,3455/57549=6.004%
16737,61f39ba1_id,Jokowi bisikan hal ini kepada Ruth pembawa bendera pusaka,,News_Politics,jakarta,delay,all,False,False,3,2017-08-19 08:34:15,andrewka,1737374/3327317=52.22%,30512/1018604=2.995%
16738,e8dc00be_id,Pembelaan Habib Rizieq soal dirinya 'lari' dari kasusnya,,Crime,jakarta,delay,all,False,False,3,2017-08-19 08:35:04,andrewka,209039/231662=90.23%,15176/130052=11.67%
16739,8190f2db_id,Ini yang ingin dilakukan Ailsa Sofia untuk Indonesia ,,News_Entertainment,,delay,all,False,False,3,2017-08-19 08:38:17,andrewka,8388/9172=91.45%,207/5184=3.993%
16740,2bf381_id,"Mitsubishi XPander tak diizinkan dijadikan taksi, alasannya",,Auto,,delay,all,False,False,3,2017-08-19 08:42:17,jatua,257607/451851=57.01%,6032/152187=3.964%
16741,4475cd80_id,"Dulu harga pemain ini 11 Juta Euro, kini ditawar Juventus 75 juta ditolak?",,News_Sports,,delay,all,False,False,3,2017-08-19 08:51:49,jatua,1498576/4009625=37.37%,37336/921919=4.05%
16742,a79ec7d9_id,4 Fakta Milad FPI:  Tumpas LGBT & bunga dari ormas Kristen,,Religion,,delay,all,False,False,3,2017-08-19 08:52:46,jatua,367739/347706=105.8%,11370/219784=5.173%
16743,50916b32_id,"6 Foto Taeyeon & Hyoyeon SNSD pulang, tersenyum lega ",,News_Entertainment,,delay,all,False,False,3,2017-08-19 08:55:04,jatua,94682/118362=79.99%,2761/57129=4.833%
16744,d5a6b80d_id,"Wanita ini disinyalir istri kedua Opick, dibilang sejenis Mulan Jameela",,News_Entertainment,,delay,all,False,False,3,2017-08-19 08:56:23,jatua,91476/127496=71.75%,2854/55628=5.131%
16745,a5536f8b_id,"Dicium mesra oleh sosok gempal ini, Irish Bella tak berkelas?",,News_Entertainment,,delay,all,False,False,3,2017-08-19 08:57:35,jatua,764135/1704024=44.84%,25167/466094=5.4%
16746,4284ffe9_id,"Irish Bella kepergok clubbing sama Giorgino, netizen fokus ke bedak",,News_Entertainment,"Semarang,Salatiga,Yogyakarta,Bandung,Medan,Surabaya",delay,all,False,False,3,2017-08-19 08:59:55,jatua,107174/205114=52.25%,3519/64430=5.462%
16747,e7b09e39_id,Cantiknya Annisa Pohan dalam ucapara kemerdekaan RI,,Beauty,,delay,all,False,False,3,2017-08-19 09:46:35,andrewka,98870/115469=85.62%,2907/58515=4.968%
16748,e684dfda_id,Taeyeon SNSD konfirmasi hal ini terkait insiden bandara,,News_Entertainment,jakarta,delay,all,False,False,3,2017-08-19 09:53:26,andrewka,182/242=75.21%,2/117=1.709%
16749,e684dfda_id,Taeyeon SNSD konfirmasi hal ini terkait insiden bandara,,News_Entertainment,jakarta,delay,all,False,False,3,2017-08-19 09:53:45,andrewka,2024/2924=69.22%,44/1233=3.569%
16750,9fa76689_id,"Tampil di Countdown Asian Games 2018, Taeyeon dan Hyoyeon Cantik Kenakan Outfit Ini!",,Fashion,,delay,all,False,False,0,2017-08-19 09:54:08,andrewka,-/18966=-,-/-=-
16751,57f59005_id,"Isu poligami, Opick dan istri kompak pergi dari rumah",,News_Entertainment,,delay,all,False,False,3,2017-08-19 09:54:15,andrewka,949/1094=86.75%,26/573=4.538%
16752,7a136d49_id,Curhat agen mitra First Travel ke DPR: kami jadi sasaran,,Crime,jakarta,delay,all,False,False,3,2017-08-19 09:56:02,andrewka,174966/234590=74.58%,7350/108223=6.792%
16753,19f65cb_id,Cara baru sindikat narkoba kelabui petugas,,Crime,medan,delay,all,False,False,3,2017-08-19 09:57:08,andrewka,17096/32637=52.38%,257/12635=2.034%
16754,cafee097_id,Anies Baswedan tantang FPI lakukan hal ini,,Crime,jakarta,delay,all,False,False,3,2017-08-19 09:57:33,andrewka,422533/649081=65.1%,15147/265684=5.701%
16755,c894160d_id,Risma dan Anas berpeluang besar diusung PDIP di Pilgub Jatim,,News_Politics,surabaya,delay,all,False,False,3,2017-08-19 09:57:52,andrewka,15266/22733=67.15%,631/9594=6.577%
16756,d08aea04_id,Sudirman Said : Orang dusun jangan minder,,News_Politics,semarang,delay,all,False,False,3,2017-08-19 10:10:54,andrewka,7947/11750=67.63%,206/4861=4.238%
16757,433fdcb0_id,"Diperiksa di Arab Saudi, Habib Rizieq diberondong 50 pertanyaan",,Crime,,delay,all,False,False,3,2017-08-19 10:11:15,andrewka,767892/779208=98.55%,28443/460491=6.177%
16758,c1435aa7_id,Alasan Bunga Zainal mau jadi istri kedua Sukdev Singh,Blak-blakkan Saja,News_Entertainment,"Semarang,Salatiga,Yogyakarta,Jakarta,Bekasi,Tangerang,Bandung",immediately,all,False,False,3,2017-08-19 11:16:01,jatua,1325562/2787008=47.56%,25302/827167=3.059%
16759,23a7d4f8_id,Pria di Surabaya aniaya rekan kerja sampai putus jari,Tega Sekali,Crime,Surabaya,immediately,all,False,False,3,2017-08-19 11:18:55,jatua,234413/567927=41.28%,4235/152707=2.773%
16760,22afb811_id,Sopir perekam oknum pungli akan dihadiahi oleh Polisi,Usai Viral di Sosmed,Crime,Others,immediately,all,False,False,3,2017-08-19 11:22:04,jatua,112827/153480=73.51%,2651/55132=4.808%
16761,c04bd599_id,Din Syamsuddin doakan Deddy Mizwar jadi Gubernur Jabar,,News_Politics,bandung,delay,all,False,False,3,2017-08-19 11:25:29,andrewka,3048/2878=105.9%,62/1764=3.515%
16762,be03098d_id,Charly Van Houten ikhlas lepaskan Regina,,News_Entertainment,,delay,all,False,False,3,2017-08-19 11:25:59,andrewka,76559/216591=35.35%,2460/44340=5.548%
16763,f9803819_id,Kurir narkoba internasional tewas didor di Langkat,Sesuai Instruksi Jokowi,Crime,Medan,delay,all,False,False,3,2017-08-19 11:26:04,jatua,8120/21669=37.47%,291/4984=5.839%
16764,2c26c3a4_id,Malignaggi: McGregor mungkin kena diskualifikasi,,News_Sports,,delay,all,False,False,3,2017-08-19 11:26:11,andrewka,141680/190677=74.3%,5571/96017=5.802%
16765,a60f14c_id,"Selain Taeyeon, 8 seleb Korea ini jadi korban kekasaran fans Indonesia",,News_Entertainment,,delay,all,False,False,3,2017-08-19 11:27:09,jatua,35795/50551=70.81%,820/20639=3.973%
16766,ed204419_id,Aurel 'banting setir' dari nge-DJ? Buka toko jualan ini,,News_Entertainment,Surabaya,delay,all,False,False,3,2017-08-19 11:27:15,andrewka,11135/10810=103%,271/6732=4.026%
16767,b0828c50_id,"Bahas jalur haji, raja Salman bertemu ulama Qatar",,Religion,,delay,all,False,False,3,2017-08-19 11:27:36,andrewka,66547/88525=75.17%,1710/40104=4.264%
16768,18568a01_id,Golkar susul PKB dukung Gus Ipul di Pilgub Jatim,,News_Politics,surabaya,delay,all,False,False,3,2017-08-19 11:27:49,andrewka,7859/9333=84.21%,329/4877=6.746%
16769,aa09cc8e_id,3 Seleb cantik ini pernah kecantol cintanya Moreno Soeprapto,,News_Entertainment,,delay,all,False,False,3,2017-08-19 11:27:52,jatua,8081/11778=68.61%,104/5058=2.056%
16770,59798c0a_id,Mobil konsep paling mencuri perhatian di GIIAS 2017,,Auto,,delay,all,False,False,3,2017-08-19 11:28:04,andrewka,59437/67374=88.22%,1632/34400=4.744%
16771,9319d78a_id,"LDR, Amanda Rawles 'gak kuat pengen lakukan hal ini",,News_Entertainment,,delay,all,False,False,3,2017-08-19 11:30:28,andrewka,1295/1855=69.81%,24/778=3.085%
16772,598e634f_id,Lihat lokasi Syahnaz dilamar kekasihnya di Como Italia,,News_Entertainment,,delay,all,False,False,3,2017-08-19 11:31:30,andrewka,212688/485714=43.79%,8475/131645=6.438%
16773,a9cacb63_id,"Sempat ungkap kekecewaan, instagram Taeyeon unggah foto ini!",,Fashion,,delay,all,False,False,3,2017-08-19 11:32:23,andrewka,237426/268570=88.4%,7410/138123=5.365%
16774,14ade471_id,"Celana terlalu ketat, Si atlet tewas saat salto maut",,News_Sports,,delay,all,False,False,3,2017-08-19 11:32:25,jatua,62132/131261=47.33%,1781/36209=4.919%
16775,7272e868_id,Khawatir ada Merkuri di kosmetik kamu? ayo dicek!,,Beauty,,delay,all,False,False,3,2017-08-19 11:33:08,andrewka,50428/352614=14.3%,1495/25080=5.961%
16776,5a33aff0_id,"FPI gelar milad, Habib Rizieq pidato dari Arab",,News_Politics,jakarta,delay,all,False,False,0,2017-08-19 11:36:27,andrewka,-/11=-,-/-=-
16777,5a33aff0_id,"FPI gelar milad, Habib Rizieq pidato dari Arab",,News_Politics,jakarta,delay,all,False,False,3,2017-08-19 11:37:39,andrewka,20018/210991=9.488%,882/12256=7.196%
16778,39f66648_id,"9 Hal biasa di Indonesia, tapi dilarang di Korea Utara, apa saja?",,News_Lifestyle,,delay,all,False,False,3,2017-08-19 12:16:27,andrewka,128449/200109=64.19%,4107/71191=5.769%
16779,93a0fdb6_id,"Akhiri pidato, Habib Rizieq Kasih isyarat ini pada anggota FPI",,News_Politics,jakarta,delay,all,False,False,3,2017-08-19 12:16:57,andrewka,327458/702661=46.6%,13070/199235=6.56%
16780,c24cd4a9_id,"Indadari alami keguguran pasca usai ditalak, Caisar cuek?",,News_Entertainment,,delay,all,False,False,3,2017-08-19 12:17:36,andrewka,81898/133427=61.38%,3973/51827=7.666%
16781,d58eec60_id,"Jedar pasang foto tangan 'nakal' El, ini reaksi netizen",,News_Entertainment,,delay,all,False,False,3,2017-08-19 12:18:09,andrewka,1674544/4592402=36.46%,54960/1072151=5.126%
16782,403f5182_id,Jumlah penerbang pesawat tempur TNI AU masih jauh dari hal ini,,News_Politics,yogyakarta,delay,all,False,False,3,2017-08-19 12:18:33,andrewka,2412/3585=67.28%,48/1446=3.32%
16783,14e337de_id,"Tampil di Cikarang, aksi menyanyi Titi DJ memukau penonton",,News_Entertainment,,delay,all,False,False,3,2017-08-19 12:33:08,andrewka,2865/4293=66.74%,67/1733=3.866%
16784,358c98b5_id,"HUT RI Ke-72, Habib Rizieq: Merdeka itu lunas dari utang",,Religion,jakarta,delay,all,False,False,3,2017-08-19 12:35:08,andrewka,55682/63161=88.16%,2851/32593=8.747%
16785,c0e60cdb_id,"Tega, riasan istri Moreno Soeprapto jadi target cibiran",Netizen Usil Deh,News_Entertainment,,immediately,all,True,False,3,2017-08-19 13:14:50,jatua,1999327/4771293=41.9%,41657/1222161=3.408%
16786,b843b9d_id,"Lama pacaran, akhirnya Jeje Govinda lamar Syahnaz Sadiqah",,News_Entertainment,,delay,all,False,False,3,2017-08-19 13:17:30,jatua,168079/336435=49.96%,4009/116966=3.427%
16787,16f0138c_id,"Putri Jokowi foto sama Hyoyeon SNSD, netizen usil komentar",,News_Entertainment,,delay,all,False,False,0,2017-08-19 13:18:12,jatua,-/-=-,-/-=-
16788,206beb_id," 5 Transformasi Foto Evi Masamba, Dulunya Seperti Ini!",,News_Entertainment,"Semarang,Salatiga,Yogyakarta,Bandung,Medan,Surabaya",delay,all,False,False,3,2017-08-19 13:23:35,jatua,1315/1449=90.75%,36/800=4.5%
16789,b0bb353a_id,"Usai tekuk Malaysia, 2 atlet polo kita ternyata sejoli",,News_Sports,,delay,all,False,False,3,2017-08-19 14:42:22,jatua,6800/7648=88.91%,336/4145=8.106%
16790,cddfeda_id,"Honor Paskibra di Toraja fantastis, Tator paling banyak",,Education,Medan,delay,all,False,False,3,2017-08-19 14:43:05,jatua,815/727=112.1%,15/476=3.151%
16791,49dd8425_id,"Uniknya sunat massal di TTS, didominasi 'Pasien' non Muslim",,Health,"Surabaya,Others",delay,all,False,False,3,2017-08-19 14:44:04,jatua,58359/64091=91.06%,609/34768=1.752%
16792,c40d6374_id,"Terlibat dalam endorsment First Travel, Ria Irawan jelaskan ini",,News_Entertainment,jakarta,delay,all,False,False,3,2017-08-19 14:45:12,jatua,13645/17923=76.13%,507/8670=5.848%
16793,b51cf970_id,Ternyata begini mendeteksi orang depresi dari postingannya,,Health,,delay,all,False,False,3,2017-08-19 14:46:03,jatua,9056/68598=13.2%,289/5613=5.149%
16794,d9f803c3_id,Rio Febrian sukses bikin penonton Prambanan Jazz baper,,News_Entertainment,yogyakarta,delay,all,False,False,3,2017-08-19 14:49:46,jatua,571/888=64.3%,9/318=2.83%
16795,43b43b37_id,"Olok-olok Jokowi, presenter tvOne diadukan ke KPI",Lanjutan 'Rekening Gemuk',News_Politics,,immediately,all,True,False,3,2017-08-19 14:58:15,jatua,1334635/3813172=35%,27439/777859=3.528%
16796,eed064a7_id,"Netizen penasaran, ternyata yang dilingkari merah adalah Ini",,Funny,,delay,all,False,False,3,2017-08-19 15:00:09,jatua,32963/29777=110.7%,1325/20029=6.615%
16797,cad1a7dc_id,Begini respon warga Korsel soal insiden Taeyeon SNSD di Jakarta,,News_Entertainment,,delay,all,False,False,3,2017-08-19 15:04:28,jatua,57057/52377=108.9%,804/31815=2.527%
16798,f05bd053_id,"Pamer tubuh, Al dan El bikin netizen gagal fokus",,News_Entertainment,,delay,all,False,False,3,2017-08-19 15:06:08,jatua,62118/144964=42.85%,2352/45078=5.218%
16799,714ff3f7_id,Presiden PKS minta maaf soal doa Tifatul Sembiring,,News_Politics,,delay,all,False,False,3,2017-08-19 15:06:39,jatua,11000/15225=72.25%,439/6482=6.773%
16800,62c9611f_id,"Fantastis, uang jamaah First Travel bukan Rp550 Miliar tapi segini",,Crime,,delay,all,False,False,3,2017-08-19 15:12:32,jatua,217995/65626=332.2%,12600/200343=6.289%
16801,ac618695_id,"Opick nikah Siri sama backing vokalnya, ini fotonya",,News_Entertainment,,delay,all,False,False,3,2017-08-19 15:14:28,jatua,15376/14467=106.3%,1013/11233=9.018%
16802,dc6bc0cc_id,Senator di AS Ini berharap Presiden Donald Trump dibunuh,,News_Politics,,delay,all,False,False,3,2017-08-19 15:17:23,jatua,200750/697207=28.79%,10570/129823=8.142%
16803,7dfc84c_id,"Injak-injak foto  Jokowi, pelajar ini berakhir di sel Polisi",,Crime,,delay,all,False,False,3,2017-08-19 15:19:52,jatua,123412/49553=249.1%,6130/105212=5.826%
16804,14769353_id,"Ya Tuhan, bendera Indonesia terbalik di SEA Games 2017",,News_Politics,,delay,all,False,False,3,2017-08-19 15:30:32,jatua,83676/138350=60.48%,3662/54366=6.736%
16805,e2c6e14c_id,"SBY kian akrab dengan warna merah, begini kata Demokrat",,News_Politics,,delay,all,False,False,3,2017-08-20 00:24:11,yogic,690555/472311=146.2%,32030/553859=5.783%
16806,45f3555d_id,Kecelakaan kereta di India tewaskan 23 orang,,Crime,,delay,all,False,False,3,2017-08-20 00:26:03,yogic,31269/29109=107.4%,757/22297=3.395%
16807,f2cb8207_id,BNN amankan 40 kilogram sabu asal Malaysia,,Crime,,delay,all,False,False,3,2017-08-20 00:26:32,yogic,500840/554942=90.25%,19399/361047=5.373%
16808,4bdc5a1d_id,"Ditalak cerai, Indadari bilang ini kemauan Caisar",,News_Entertainment,,delay,all,False,False,3,2017-08-20 00:28:34,yogic,831044/1148123=72.38%,30737/556723=5.521%
16809,2c3ccf19_id,"Masuk 10 besar nasional, Duta Bahasa Kalsel minta maaf",,Education,Others,delay,all,False,False,3,2017-08-20 00:36:41,yogic,103227/6799=1518%,2609/99900=2.612%
16810,4387388d_id,SBY & Mega diharapkan tidak berantem lagi,,News_Politics,Bandung,delay,all,False,False,3,2017-08-20 00:37:56,yogic,10525/186=5659%,328/10284=3.189%
16811,fcdaf335_id,Mantan menteri Jokowi nilai Kemendes tidak solid,,News_Politics,,delay,all,False,False,3,2017-08-20 00:39:00,yogic,18105/11393=158.9%,355/13422=2.645%
16812,8af8d51d_id,"Wimar Witoelar: SBY itu bukan politisi, tapi..",,News_Politics,,delay,all,False,False,3,2017-08-20 00:39:50,yogic,411824/370784=111.1%,22207/318780=6.966%
16813,c9d9e948_id,"Ini dia pemilik mulut terlebar di dunia, muat kaleng minuman",,Funny,,delay,all,False,False,3,2017-08-20 00:41:05,yogic,99879/111442=89.62%,2659/61939=4.293%
16814,a0dae817_id,"""Insya Allah Golkar akan usung Gus Ipul di Pilkada Jatim""",,News_Politics,Surabaya,delay,all,False,False,3,2017-08-20 00:42:05,yogic,60667/1753=3461%,1058/46895=2.256%
16815,491fc4b6_id,"Perjuangan jemaah haji 1970, naik unta lintasi padang pasir",,Religion,,delay,all,False,False,3,2017-08-20 00:42:52,yogic,24500/19378=126.4%,728/16754=4.345%
16816,44c281e5_id,Di pulau terluar RI ini harga BBM masih Rp 13.000/liter,,Business,,delay,all,False,False,3,2017-08-20 00:44:57,yogic,2521/2223=113.4%,48/1622=2.959%
