id,entry_id,title,push_title,category,city,push_type,push_os,push_entire,test_mode,status,insert_time,operator,Receive/Send,Click/Show
16763,aedfd1af_ru,Звезда «Голодных игр» оставит актерскую карьеру для борьбы с коррупцией,,News_Entertainment,,delay,all,False,0,3,2018-02-20 04:34:42,alexandr,-/-=-,-/73=-
16764,4a398bf2_ru,Ученые доказали положительное влияние бега на память,,Others,,delay,all,False,0,3,2018-02-20 04:36:08,alexandr,-/-=-,-/-=-
16765,201ad973_ru,Sony начала разработку собственного онлайн-сервиса вызова такси,,Technology,,delay,all,False,0,3,2018-02-20 04:38:23,alexandr,-/-=-,-/-=-
16766,75b68878_ru,Samsung запатентовала дрон с распознаванием взгляда и жестов,,Technology,,delay,all,False,0,3,2018-02-20 04:39:19,alexandr,-/-=-,-/-=-
16767,4763a113_ru,Продажу алкоголя ограничат во время матчей ЧМ-2018,,Others,,delay,all,False,0,3,2018-02-20 04:40:50,alexandr,-/-=-,-/-=-
16768,102c40ff_ru,РФ стала крупнейшим торговым партнером Украины в минувшем году,,Others,,delay,all,False,0,3,2018-02-20 04:41:50,alexandr,-/-=-,-/-=-
16769,988d3e7a_ru,Боброва и Соловьев стали пятыми на Олимпиаде в Пхенчхане,,News_Sports,,delay,all,False,0,3,2018-02-20 05:03:05,leiz,-/-=-,-/-=-
16770,18841c17_ru,Чиновники оценили выживаемость россиян на работе,,Others,,delay,all,False,0,3,2018-02-20 05:10:27,leiz,-/-=-,-/-=-
16771,5b6deeee_ru,Назван простой способ прожить долго,,Others,,delay,all,False,0,3,2018-02-20 05:12:49,leiz,-/-=-,-/-=-
16772,9f9532c3_ru,Роспотребнадзор составил новый список завышающих цены отелей к ЧМ-2018,,News_Sports,,delay,all,False,0,3,2018-02-20 05:22:12,leiz,-/-=-,-/-=-
16783,121a9f0b_ru,Чего ждать от новой системы биометрической идентификации граждан,С легким опознанием,Business,,immediately,all,True,0,3,2018-02-20 06:06:39,leiz,-/-=-,-/-=-
16785,a57c3ee_ru,"Фильм ""Лёд"" показали в Пхенчхане",,News_Sports,,delay,all,False,0,3,2018-02-20 07:05:23,leiz,-/-=-,-/-=-
16786,157dc0d2_ru,Росстат нашел способ повысить доходы населения,,Others,,delay,all,False,0,3,2018-02-20 07:07:42,leiz,-/-=-,-/-=-
16787,deb36395_ru,Американцы предложили выгнать российского хоккеиста с Игр-2018,,News_Sports,,delay,all,False,0,3,2018-02-20 07:14:23,leiz,-/-=-,-/71=-
16788,1c9748c9_ru,Жительница Челябинской области убила сына и покончила с собой,,Crime,,delay,all,False,0,3,2018-02-20 07:26:25,leiz,-/-=-,-/73=-
16794,b8a45c1f_ru,Жерар Депардье собрался переехать в Алжир,,News_Entertainment,,delay,all,False,0,3,2018-02-20 08:00:43,leiz,-/-=-,-/-=-
16795,8a9fc180_ru,В Саратове пассажирка пострадала при столкновении автобусов,,Others,,delay,all,False,0,3,2018-02-20 08:08:10,leiz,-/-=-,-/-=-
16796,64461369_ru,В компьютерную игру специально встроили вирусы,,Others,,delay,all,False,0,3,2018-02-20 08:12:03,leiz,-/-=-,-/-=-
16809,95e69340_ru,Москва возглавила рейтинг восточноевропейских городов будущего,,Others,,delay,all,False,0,3,2018-02-20 10:18:42,alexandr,-/-=-,-/-=-
16810,6b21e488_ru,Подмосковная барменша ударом кулака убила посетителя,,Others,,delay,all,False,0,3,2018-02-20 10:19:47,alexandr,-/-=-,-/-=-
16811,bbd25202_ru,Социальные пенсии предложили повысить в день дурака,,Others,,delay,all,False,0,3,2018-02-20 10:20:52,alexandr,-/-=-,-/69=-
16812,4fdcb5dc_ru,Россиянин решил проверить квартиру и обнаружил радиацию,,Crime,,delay,all,False,0,3,2018-02-20 10:21:55,alexandr,-/-=-,-/-=-
16813,68b704d2_ru,В Госдуме предлагают организовать министерство виртуальной реальности,,Others,,delay,all,False,0,3,2018-02-20 10:24:44,alexandr,-/-=-,-/-=-
16814,b9521fa3_ru,Посол Австралии одним твитом «расчистил» улицу в центре Москвы,,Others,,delay,all,False,0,3,2018-02-20 10:28:12,lyudmilat,-/-=-,-/-=-
16815,adfedd4c_ru,В Сети появилось видео с секретной американской ракетой,,Others,,delay,all,False,0,3,2018-02-20 10:37:46,lyudmilat,-/-=-,-/-=-
16816,1f10dca1_ru,"Эрдоган пообещал окружить Африн в ""ближайшие дни""",,News_Politics,,delay,all,False,0,3,2018-02-20 10:38:24,lyudmilat,-/-=-,-/-=-
16817,3c383a1d_ru,"Остатки ИГ* перебазировались в Афганистан и Пакистан, заявили в АТЦ",,News_Politics,,delay,all,False,0,3,2018-02-20 10:40:01,lyudmilat,-/-=-,-/-=-
16818,980ffbc6_ru,В Челябинске школьник спас из горящей квартиры двух подростков,,Others,,delay,all,False,0,3,2018-02-20 10:41:33,lyudmilat,-/-=-,-/-=-
16825,e371571a_ru,"Убит экс-барабанщик группы ""Черный кофе"", — СМИ",,Others,,delay,all,False,0,3,2018-02-20 11:39:00,lyudmilat,-/-=-,-/-=-
16826,7bf08693_ru,Жаров: вопрос о блокировке YouTube в России не стоит,,Technology,,delay,all,False,0,3,2018-02-20 11:39:36,lyudmilat,-/-=-,-/-=-
16827,e5b685b1_ru,Фигуристы России впервые в истории ОИ остались без медалей,,News_Sports,,delay,all,False,0,3,2018-02-20 11:42:05,lyudmilat,-/-=-,-/-=-
16828,12b60459_ru,Власти Саранска прокомментировали решение Депардье переехать в Алжир,,News_Entertainment,,delay,all,False,0,3,2018-02-20 11:42:47,lyudmilat,-/-=-,-/-=-
16832,54a4f5b2_ru,Пойманный на допинге словенский хоккеист забыл сказать о лекарстве от астмы,,News_Sports,,delay,all,False,0,3,2018-02-20 12:39:09,lyudmilat,-/-=-,-/-=-
16833,6d4ab204_ru,"Минтруд хочет проиндексировать социальные пенсии на 2,9% с 1 апреля",,Others,,delay,all,False,0,3,2018-02-20 12:39:58,lyudmilat,-/-=-,-/-=-
16834,501c5037_ru,В допинг-пробе «Б» керлингиста Крушельницкого обнаружили мельдоний,,News_Sports,,delay,all,False,0,3,2018-02-20 12:41:31,lyudmilat,-/-=-,-/-=-
16835,c2d48135_ru,"Скучное, с ошибками и без души. Как не нужно составлять резюме",,Others,,delay,all,False,0,3,2018-02-20 12:45:05,lyudmilat,-/-=-,-/-=-
16836,748bc8d4_ru,Названы самые популярные автомобильные марки в России,,Auto,,delay,all,False,0,3,2018-02-20 12:47:04,alexandr,-/-=-,-/-=-
16837,5267068b_ru,"Роскомнадзор отказался блокировать YouTube, не исполнивший решение суда",,Technology,,delay,all,False,0,3,2018-02-20 12:47:55,alexandr,-/-=-,-/-=-
16838,bed5bc6b_ru,Чем займется Екатерина Андреева после ухода из федерального «Времени»?,,News_Entertainment,,delay,all,False,0,3,2018-02-20 12:48:28,lyudmilat,-/-=-,-/-=-
16839,45bd4435_ru,Конец «дачной амнистии». Как было до и как будет после?,,Others,,delay,all,False,0,3,2018-02-20 12:48:40,alexandr,-/-=-,-/-=-
16840,609fe534_ru,Электронные трудовые книжки могут появиться в РФ с 1 января 2020 года,,Others,,delay,all,False,0,3,2018-02-20 12:49:20,alexandr,-/-=-,-/-=-
16841,861589f0_ru,Индия провела успешные испытания баллистической ракеты,,Others,,delay,all,False,0,3,2018-02-20 12:49:48,lyudmilat,-/-=-,-/-=-
16847,be5fbb6d_ru,Делегация ОАР выступила с заявлением по ситуации с Крушельницким,,News_Sports,,delay,all,False,0,3,2018-02-20 13:01:10,borisf,-/-=-,-/74=-
16849,5175417b_ru,МИД РФ рассказал о десятках раненных в Сирии граждан России и стран СНГ,,Others,,delay,all,False,0,3,2018-02-20 14:29:44,lyudmilat,-/-=-,-/-=-
16850,20de7156_ru,"Крушельницкий: Это не просто шок, но и огромный удар по репутации!",,News_Sports,,delay,all,False,0,3,2018-02-20 14:30:28,lyudmilat,-/-=-,-/-=-
16851,51c76e57_ru,Разрыв трубы превратил питерскую улицу в Сайлент Хилл,,Others,,delay,all,False,0,3,2018-02-20 14:40:19,lyudmilat,-/-=-,-/-=-
16852,ce79651c_ru,Насилие без преград. Кто пустил педофилов в детский дом?,,Crime,,delay,all,False,0,3,2018-02-20 14:41:33,lyudmilat,-/-=-,-/-=-
16853,55cc276e_ru,Школьники в США устроили лежачий протест против оружия у стен Белого дома,,News_Politics,,delay,all,False,0,3,2018-02-20 15:26:17,lyudmilat,-/-=-,-/-=-
16854,98770220_ru,Reuters: проправительственные силы Сирии вступают в Африн,,News_Politics,,delay,all,False,0,3,2018-02-20 15:33:07,lyudmilat,-/-=-,-/-=-
16866,79e46215_ru,"Кто сделал вирусный ролик про ""гея на передержке""? Версии ""Медузы""",,News_Entertainment,,delay,all,False,0,3,2018-02-20 16:42:20,lyudmilat,-/-=-,-/-=-
16867,cc508ce9_ru,Порошенко подписал закон о реинтеграции Донбасса,,News_Politics,,delay,all,False,0,3,2018-02-20 17:34:48,lyudmilat,-/-=-,-/-=-
16868,4a1fac38_ru,Путин выступит с посланием Федеральному собранию 1 марта,,News_Politics,,delay,all,False,0,3,2018-02-20 17:35:23,lyudmilat,-/-=-,-/-=-
16869,ae81cd52_ru,"Настоятель храма в Кизляре рассказал о прихожанке, отвлекшей убийцу на себя",,Others,,delay,all,False,0,3,2018-02-20 17:36:01,lyudmilat,-/-=-,-/-=-
16870,b53a6a91_ru,Эрдоган рассказал об отступлении сирийского ополчения из Африна,,News_Politics,,delay,all,False,0,3,2018-02-20 17:38:24,lyudmilat,-/-=-,-/-=-
16876,561af798_ru,"Питательные, зимние, твои: 10 кремов, которые защитят кожу от мороза",,Others,,delay,all,False,0,3,2018-02-20 17:56:08,lyudmilat,-/-=-,-/-=-
16881,a8d3f39f_ru,Год без Виталия Чуркина,,Others,,delay,all,False,0,3,2018-02-20 18:09:52,lyudmilat,-/-=-,-/-=-
16882,f535ab7c_ru,Белый дом: Трамп продолжит жесткую линию в отношении России,,Others,,delay,all,False,0,3,2018-02-21 02:13:11,leiz,-/-=-,-/-=-
16883,e099ca86_ru,"НАТО не считает, что Россия угрожает кому-то из стран-членов альянса",,Others,,delay,all,False,0,3,2018-02-21 02:21:21,leiz,-/-=-,-/-=-
16884,47bfc622_ru,Полицейский стащил печеньки у коллеги и оказался под следствием,,Crime,,delay,all,False,0,3,2018-02-21 02:24:25,leiz,-/-=-,-/71=-
16885,712d630d_ru,Неудачливый наркоторговец вышел на свободу и попался через час,,News_Entertainment,,delay,all,False,0,3,2018-02-21 02:25:37,leiz,-/-=-,-/-=-
16886,dfea624e_ru,Ежемесячно 100 тыс. украинцев уезжают из страны,,News_Politics,,delay,all,False,0,3,2018-02-21 02:29:15,leiz,-/-=-,-/-=-
16887,4a9237e0_ru,Андреева прокомментировала изменения в составе ведущих программы «Время»,,News_Entertainment,,delay,all,False,0,3,2018-02-21 04:59:22,leiz,1/-=-,-/1=-
16888,fd3f6af1_ru,Google запустила новый платежный сервис Google Pay,,Technology,,delay,all,False,0,3,2018-02-21 05:10:26,alexandr,-/-=-,-/-=-
16889,cc4e1a08_ru,"В Москве заработал каршеринг от ""Яндекса""",,Others,,delay,all,False,0,3,2018-02-21 05:11:06,leiz,-/-=-,-/-=-
16890,cd1aa640_ru,МОК направит большую часть доходов от Олимпиады на развитие спорта,,News_Sports,,delay,all,False,0,3,2018-02-21 05:11:16,alexandr,1/-=-,-/74=-
16891,d9d95281_ru,Основатель Amazon начал строить часы на 10 тыс. лет работы,,Others,,delay,all,False,0,3,2018-02-21 05:12:12,alexandr,-/-=-,-/-=-
16892,ddf17b37_ru,Минпромторг разрешит рекламу вейпов в газетах и интернете,,Others,,delay,all,False,0,3,2018-02-21 05:13:11,alexandr,-/-=-,-/-=-
16893,17a89d7e_ru,Девушка поиздевалась над детьми богачей и попала под шквал критики,,Others,,delay,all,False,0,3,2018-02-21 05:14:43,leiz,-/-=-,-/-=-
16894,b4b60644_ru,Названо имя «самой великой мошенницы» в истории Олимпиады,,News_Sports,,delay,all,False,0,3,2018-02-21 05:22:27,alexandr,1/-=-,-/1=-
16895,c81cf7bf_ru,Минкультуры предложило блокировать пиратские сайты без решения суда,,Technology,,delay,all,False,0,3,2018-02-21 05:24:11,alexandr,-/-=-,-/-=-
16896,bb7d40e6_ru,Египет стал крупнейшим покупателем российских продуктов,,Business,,delay,all,False,0,3,2018-02-21 05:25:18,alexandr,-/-=-,-/-=-
16897,28883ef6_ru,Андреева прокомментировала сообщения об уходе из «Времени»,,Others,,delay,all,False,0,3,2018-02-21 05:30:16,alexandr,-/-=-,-/-=-
16898,ab483322_ru,Крушельницкий расскажет свою версию попадания допинга в его организм,,News_Sports,,delay,all,False,0,3,2018-02-21 05:31:57,alexandr,-/-=-,-/-=-
16899,eded888c_ru,Российские фигуристки побили два мировых рекорда за 10 минут,,Others,,delay,all,False,0,3,2018-02-21 05:39:06,alexandr,-/-=-,-/-=-
16900,c90c5a9d_ru,Очередной «путешественник во времени» из 3300 года напророчил апокалипсис,,Others,,delay,all,False,0,3,2018-02-21 05:42:49,alexandr,-/-=-,-/-=-
16901,775c6c0e_ru, Руководство ФКР заявило о «допинговом терроризме» против российского призера Олимпиады, Керлингисты ищут «подрывника»,News_Sports,,immediately,all,True,0,3,2018-02-21 06:10:10,leiz,2/-=-,-/2=-
16902,914aa6bf_ru,"Жители ЕС не считают Россию частью Европы, показал опрос",,News_Politics,,delay,all,False,0,3,2018-02-21 06:10:40,lyudmilat,-/-=-,-/-=-
16903,440a5aef_ru,Котэ нон грата: как избежать проблем в поездках с животными,,Others,,delay,all,False,0,3,2018-02-21 06:14:25,lyudmilat,-/-=-,-/-=-
16917,3d0b91af_ru,От похмелья спасут витамины,,Others,,delay,all,False,0,3,2018-02-21 07:10:41,leiz,-/-=-,-/-=-
16920,ce65b494_ru,Назван крупнейший покупатель российских продуктов,,Business,,delay,all,False,0,3,2018-02-21 07:16:43,leiz,-/-=-,-/-=-
16923,7d060bbf_ru,Медведева рассказала об отношении к побившей ее рекорд фигуристке,,News_Sports,,delay,all,False,0,3,2018-02-21 07:19:09,leiz,1/-=-,-/71=-
16928,7b8fda15_ru,Умер писатель-фантаст Андрей Круз,,News_Entertainment,,delay,all,False,0,3,2018-02-21 07:36:49,lyudmilat,-/-=-,-/-=-
16929,38b2c816_ru,В НАТО перестали считать Россию угрозой,,Others,,delay,all,False,0,3,2018-02-21 07:38:02,lyudmilat,-/-=-,-/-=-
16931,c4a496b4_ru,Загитова побила мировой рекорд Медведевой в короткой программе на Олимпиаде,,News_Sports,,delay,all,False,0,3,2018-02-21 08:02:06,leiz,1/-=-,-/73=-
16932,db26139f_ru,Госдеп вновь призвал Россию прекратить поддержку режима Асада,,News_Politics,,delay,all,False,0,3,2018-02-21 08:15:06,lyudmilat,-/-=-,-/-=-
16933,21a5316e_ru,Доплаты за стаж и детей. Какие пенсионные сенсации оказались неправдой?,,Others,,delay,all,False,0,3,2018-02-21 08:15:35,lyudmilat,-/-=-,-/-=-
16934,1f6f0d89_ru,Какие отличаются средние зарплаты россиян и украинцев?,,News_Politics,,delay,all,False,0,3,2018-02-21 08:17:10,lyudmilat,-/-=-,-/-=-
16935,257cede3_ru,Полиция США сообщила о предотвращении стрельбы в калифорнийской школе,,Others,,delay,all,False,0,3,2018-02-21 08:18:21,lyudmilat,-/-=-,-/-=-
16936,bddd1190_ru,Россияне включили образование в список важнейших расходов,,Education,,delay,all,False,0,3,2018-02-21 08:20:02,leiz,-/-=-,-/-=-
16937,e8c53647_ru,На Казанском направлении электричка сбила мужчину,,Others,,delay,all,False,0,3,2018-02-21 08:25:36,leiz,-/-=-,-/-=-
16938,f1f28a23_ru,Российский интернет ступил на путь Google,,Others,,delay,all,False,0,3,2018-02-21 08:28:34,leiz,-/-=-,-/-=-
16946,6422dc05_ru,"Не пытайся быть сверхчеловеком: 11 лайфхаков, как пережить период неудач",,Others,,delay,all,False,0,3,2018-02-21 08:58:01,lyudmilat,-/-=-,-/-=-
16949,a70c8fa6_ru,"Что может с вами случиться, если вы потеряете смартфон",,Others,,delay,all,False,0,3,2018-02-21 09:20:37,lyudmilat,-/-=-,-/-=-
16951,40104c00_ru,При взрыве автобуса на Шри-Ланке пострадали 19 человек,,Others,,delay,all,False,0,3,2018-02-21 09:40:16,lyudmilat,-/-=-,-/-=-
16954,52954667_ru,Дамаск готов любыми способами противостоять агрессии Турции в Африне,,News_Politics,,delay,all,False,0,3,2018-02-21 09:41:53,lyudmilat,-/-=-,-/-=-
16955,67eca2cf_ru,Отряды национальных сил Сирии вошли в Африн,,News_Politics,,delay,all,False,0,3,2018-02-21 09:48:07,lyudmilat,-/-=-,-/-=-
16964,c6a07941_ru,Елизавета II арендовала земельный участок в центре Киева,,Others,,delay,all,False,0,3,2018-02-21 10:45:32,aleksandrak,-/-=-,-/-=-
16965,f1211e54_ru,«Яндекс» стал самой дорогой компанией Рунета по версии Forbes,,Technology,,delay,all,False,0,3,2018-02-21 10:46:34,aleksandrak,-/-=-,-/-=-
16968,6fa02b10_ru,Названы главные суперзлодеи в истории кино,,News_Entertainment,,delay,all,False,0,3,2018-02-21 10:51:31,aleksandrak,-/-=-,-/-=-
16971,d7cd3512_by,Чтение мыслей и запись воспоминаний. На что способны нейроинтерфейсы будущего?,,Technology,,delay,all,False,0,3,2018-02-21 10:58:22,aleksandrak,-/-=-,-/-=-
16975,e3e1eb58_ru,Сборная России по хоккею вышла в полуфинал Олимпийских игр,,News_Sports,,delay,all,False,0,3,2018-02-21 11:04:58,lyudmilat,1/-=-,-/8=-
16976,221cb81a_ru,Нейросети научились находить болезни сердца,,Others,,delay,all,False,0,3,2018-02-21 11:07:45,aleksandrak,-/-=-,-/-=-
16978,1a256712_ru,"Синоптики рассказали, когда россиянам стоит ждать весну",,Others,,delay,all,False,0,3,2018-02-21 11:09:37,aleksandrak,1/-=-,-/73=-
16979,a109b5a0_ru,ЕГЭ будет переходить на электронный формат,,Education,,delay,all,False,0,3,2018-02-21 11:10:16,aleksandrak,-/-=-,-/-=-
16980,17026d85_ru,Россияне Спицов и Большунов завоевали серебро в командном спринте на ОИ,,News_Sports,,delay,all,False,0,3,2018-02-21 11:41:08,lyudmilat,-/-=-,-/-=-
16981,ccf7799f_ru,ЕГЭ перейдет на электронный формат,,Education,,delay,all,False,0,3,2018-02-21 11:46:36,lyudmilat,-/-=-,-/-=-
16985,1c0378b4_ru,Мосгорсуд оставил под домашним арестом режиссера Кирилла Серебренникова,,Others,,delay,all,False,0,3,2018-02-21 12:09:36,lyudmilat,-/-=-,-/-=-
16986,8e4d3119_ru,Republic: в группе наемников «Вагнер» состоят более 3600 человек,,Others,,delay,all,False,0,3,2018-02-21 12:56:33,lyudmilat,-/-=-,-/-=-
16993,2483364a_ru,Мосгорсуд отказался освободить Серебренникова из-под домашнего ареста,,Others,,delay,all,False,0,3,2018-02-21 13:48:05,aleksandrak,-/-=-,-/-=-
16994,753c0362_ru,"Более 250 тысяч человек напишут ""Тотальный диктант-2018""",,Education,,delay,all,False,0,3,2018-02-21 13:50:38,aleksandrak,-/-=-,-/-=-
16998,5ca73b3c_ru,"Смерть где-то рядом. Как заражают туберкулёзом те, кого не лечат",,Others,,delay,all,False,0,3,2018-02-21 13:58:47,lyudmilat,-/-=-,-/-=-
16999,6af86b30_ru,"Билл Гейтс снимется в ""Теории большого взрыва""",,Others,,delay,all,False,0,3,2018-02-21 13:59:39,aleksandrak,-/-=-,-/-=-
17000,ac106b7c_ru,Суд отказался рассматривать иск Навального к Роскомнадзору,,Technology,,delay,all,False,0,3,2018-02-21 14:00:41,aleksandrak,-/-=-,-/-=-
17003,c1775ffd_ru,Катающийся по переходу петербургского метро джип сняли на видео,,Others,,delay,all,False,0,3,2018-02-21 14:10:39,lyudmilat,-/-=-,-/-=-
17005,4492ffd3_ru,Россиянам грозит «депозитное рабство»,,Others,,delay,all,False,0,3,2018-02-21 14:14:13,lyudmilat,-/-=-,-/-=-
17009,dd56bb67_ru,6 ярких коллекций Недели моды в Лондоне,,Others,,delay,all,False,0,3,2018-02-21 14:17:02,aleksandrak,-/-=-,-/-=-
17012,c67230cc_ru,В России обрушились цены на дешевые смартфоны Samsung,,Technology,,delay,all,False,0,3,2018-02-21 15:25:33,alexandr,-/-=-,-/-=-
17013,de5b1a4d_ru,"Жена Аршавина ""пойдет"" по тяжким статьям",,Others,,delay,all,False,0,3,2018-02-21 15:26:48,alexandr,-/-=-,-/-=-
17014,86bd8755_ru,Интерпол отказался искать Родченкова,,News_Sports,,delay,all,False,0,3,2018-02-21 15:31:25,alexandr,-/-=-,-/-=-
17015,3010570a_ru,"В ""Ростехе"" разработала устройство противовзрывной защиты банкоматов",,Technology,,delay,all,False,0,3,2018-02-21 15:33:21,alexandr,-/-=-,-/-=-
17016,8ba2b33d_ru,Керлингист Александр Крушельницкий отказался от слушаний в CAS,,News_Sports,,delay,all,False,0,3,2018-02-21 17:52:31,borisf,-/-=-,-/-=-
17017,343f2d22_ru,Саакашвили пообещал навещать Порошенко в тюрьме,,Others,,delay,all,False,0,3,2018-02-22 02:00:40,leiz,-/-=-,-/-=-
17018,4bba39a4_ru,На показе Gucci модели вышли на подиум со своими головами в руках,,News_Entertainment,,delay,all,False,0,3,2018-02-22 02:03:18,leiz,-/-=-,-/-=-
17019,df2efc15_ru,Названы лауреаты музыкальной премии Brit Awards,,News_Entertainment,,delay,all,False,0,3,2018-02-22 02:05:47,leiz,-/-=-,-/-=-
17020,a45a0454_ru,Twitter ужесточил правила для борьбы с ботами,,Technology,,delay,all,False,0,3,2018-02-22 02:08:27,leiz,-/-=-,-/-=-
17021,e594eed8_ru,Avito назвал самые популярные подарки на 23 февраля и 8 марта,,Others,,delay,all,False,0,3,2018-02-22 02:11:23,leiz,-/-=-,-/-=-
17022,14d08bcd_ru,Вашингтон еще не определился с продлением ДСНВ после 2021 года,,Others,,delay,all,False,0,3,2018-02-22 03:37:13,alexandr,-/-=-,-/-=-
17023,9703d9dc_ru,Южная Корея потратила на визит сестры Ким Чен Ына почти более $220 тыс.,,Others,,delay,all,False,0,3,2018-02-22 03:38:25,alexandr,-/-=-,-/-=-
17024,696fc5f_ru,Universal Pictures анонсировала выход «Мира Юрского периода 3»,,Others,,delay,all,False,0,3,2018-02-22 03:41:43,alexandr,-/-=-,-/-=-
