id,entry_id,title,push_title,category,city,push_type,push_os,push_entire,test_mode,status,insert_time,operator,Receive/Send,Click/Show
9967,d938ad41,2 jenis Samyang ini tidak mengandung babi,Dijamin Importir,Parenting,Bandung,delay,android,False,False,3,2017-06-23 06:54:17,jatua,5854/12874=45.47%,129/5575=2.314%
9968,12d8aa21,Jika PDIP pilih kandidat baru di Pilgub Jateng,Ganjar Siap Pensiun,News_Politics,"Semarang,Salatiga,Yogyakarta",delay,android,False,False,3,2017-06-23 06:57:08,jatua,2748/5322=51.63%,128/2596=4.931%
9969,74443d08,SBY: Kemenangan sudah di ambang pintu,Sayang Anak,News_Politics,,delay,android,False,False,3,2017-06-23 06:57:58,jatua,22754/19627=115.9%,1513/21518=7.031%
9970,57a010ba,Demokrat: Harapannya rakyat tahu pemimpin masa depan,Stiker AHY di Bus Pemudik?,News_Politics,"Jakarta,Bekasi,Tangerang",delay,android,False,False,3,2017-06-23 07:00:01,jatua,6661/6805=97.88%,276/6430=4.292%
9971,4c30c95d,"Minta bintang, jawaban penumpangnya bikin malu sendiri",Percakapan Driver Ojek Online,Others,,delay,android,False,False,3,2017-06-23 07:01:47,jatua,286408/277896=103.1%,17984/262798=6.843%
9972,e3fdac51,Putri Susi Pudjiastuti memilih status baru ini,Kamu Harus Tahu ,News_Entertainment,,delay,all,False,False,3,2017-06-23 07:41:10,erompas,8231/10742=76.62%,1097/7509=14.61%
9973,7270b8b6,"Pulang kampung, tengok bawaan keluarga Anang-Ashanty ini",Riweuh-nya Artis Mudik,News_Entertainment,,delay,all,False,False,3,2017-06-23 07:56:43,erompas,156123/164117=95.13%,8272/142191=5.818%
9974,7270b8b6,"Perginya ke kampung Anang, astaga kopernya...",Ashanty Mudik ,News_Entertainment,,delay,android,False,False,3,2017-06-23 07:58:29,jatua,1435/1656=86.65%,155/1346=11.52%
9975,74131a90,Sahrul unggah kalimat mengharukan ini,Datangi Makam Ibu,News_Entertainment,,delay,android,False,False,3,2017-06-23 08:00:29,jatua,192399/155617=123.6%,11840/185160=6.394%
9976,b016827d,"Ibu ini nyelonong masuk tol, warga heboh",Nekat Bonceng Bertiga,Auto,,delay,android,False,False,3,2017-06-23 08:01:28,jatua,55774/74554=74.81%,4473/53386=8.379%
9977,74131a90,"Nyekar ke makam ibu, unggahan Sahrul bikin terharu ",Duka Seorang Anak ,News_Entertainment,,delay,all,False,False,0,2017-06-23 08:09:45,erompas,-/-=-,-/-=-
9978,6f16ed93,Begini kebahagian Angel Helga bersama anak yatim ,Berkah Ramadan ,News_Entertainment,,delay,all,False,False,3,2017-06-23 12:53:13,erompas,1833/2622=69.91%,69/1725=4%
9979,6f12c1a3,Ini konfirmasi dari agen Kalidou Koulibaly ,2 Klub Kepincut ,News_Sports,,delay,all,False,False,3,2017-06-23 13:02:48,erompas,13938/21641=64.41%,741/13157=5.632%
9980,31283bcc,Ini yang berbeda dari perlakuan untuk Raja Salman ,Obama Liburan di Bali ,Travel,,delay,all,False,False,3,2017-06-23 13:08:27,erompas,52975/24913=212.6%,2228/51332=4.34%
9981,24d2838e,Begini pengamanan di lokasi tempatnya menginap ,Obama Liburan di Bali,News_Politics,,delay,all,False,False,3,2017-06-23 13:11:19,erompas,255561/75753=337.4%,15121/248477=6.085%
9982,9351e3fd,Suasana Stasiun Gambir disebut seperti di Eropa,Wakapolri Pantau Mudik ,Others,jakarta,delay,all,False,False,3,2017-06-23 13:13:23,erompas,4632/6451=71.8%,331/4479=7.39%
9983,ba7795e7,Ini kendaraan yang dipakainya menuju hotel di Ubud,Obama Sudah di Bali,Travel,,delay,all,False,False,3,2017-06-23 13:17:18,erompas,97714/8830=1107%,4208/94219=4.466%
9984,5b86c212,Ini pengorbanan yang dilakukan Syahrini ,Demi Malam Lailatul Qadar,News_Entertainment,,delay,all,False,False,3,2017-06-23 13:21:27,erompas,42551/9006=472.5%,2182/40981=5.324%
9985,f66cd01,"Demi kenyamanan, bandara ini buka sampai tengah malam",Arus Mudik Mulai Padat,Others ,,delay,all,False,False,3,2017-06-23 13:23:24,erompas,20867/13002=160.5%,839/20095=4.175%
9986,57181d67,Ini jalur yang dipadati pemudik bermotor,Arus Mudik Mulai Padat,Others,,delay,all,False,False,3,2017-06-23 13:24:37,erompas,13054/19553=66.76%,946/12664=7.47%
9987,95d0dc8c,Ratu Elizabeth II kepergok polisi saat tak pakai seat belt,Ketahuan Deh ,News_Entertainment,,delay,all,False,False,3,2017-06-23 13:27:08,erompas,6776/9789=69.22%,366/6528=5.607%
9988,baeec223,Ada kereta wisata seru di Ancol,Liburan Lebaran di Jakarta ,Travel,jakarta,delay,all,False,False,3,2017-06-23 13:28:15,erompas,46643/5257=887.3%,1599/45315=3.529%
9989,32e8c4eb,Timnnas U-16 diminta bertahan di mes saat Idul Fitri ,Pengorbanan Lebaran ,News_Sports,,delay,all,False,False,3,2017-06-23 13:31:33,erompas,55367/52380=105.7%,3809/53837=7.075%
9990,a8c9cce4,Atalarik Syah kepergok tak mau antri saat belanja,Ketahuan Deh ,News_Entertainment,,delay,all,False,False,3,2017-06-23 13:36:23,erompas,152271/91771=165.9%,10633/143942=7.387%
9991,fe4ae53a,10 Ilustrasi tunjukkan rempongnya punya pasangan tinggi,Derita Punya Badan Mini,News_Entertainment,,delay,all,False,False,3,2017-06-23 13:52:31,erompas,11983/18739=63.95%,576/10440=5.517%
9992,9e424f31,Saksi: tumpukan Uang 1 Miliar milho Kades Nono Asli,Kades Sok Pamer Duit,Others,,delay,all,False,False,3,2017-06-23 14:01:53,erompas,21710/16594=130.8%,1920/20926=9.175%
9993,f1718d8b,Ini kesan pertama darinya saat mendarat di Bali ,Liburan Obama Dimulai ,News_Politics,,immediately,all,True,False,3,2017-06-23 14:15:17,erompas,319973/17189=1861%,16855/310545=5.428%
9994,f1718d8b,Ini kesan pertama darinya saat mendarat di Bali ,Liburan Obama Dimulai ,News_Politics,,delay,all,False,False,3,2017-06-23 14:15:17,auto_gen,707075/173523=407.5%,27033/677728=3.989%
9995,b007cc3e,Dia akan lakukan apapun agar Dovizioso juara dunia ,Pengorbanan Lorenzo ,News_Sports,,delay,all,False,False,3,2017-06-23 14:24:23,erompas,146909/21400=686.5%,5159/141801=3.638%
9996,54467056,Uang 100 ini bisa dihargai jutaan rupiah ,Simpan Uang Jadulmu,Business,,delay,all,False,False,3,2017-06-23 14:29:35,erompas,780/1731=45.06%,55/742=7.412%
9997,1558f0b5,Pemerintah Saudi gagalkan serangan bom di Ka'bah >>,Berita Top Pagi,Others_Terrorism,,immediately,all,True,False,3,2017-06-24 01:25:47,jatua,318536/9400=3389%,19992/307014=6.512%
9998,1558f0b5,Pemerintah Saudi gagalkan serangan bom di Ka'bah >>,Berita Top Pagi,Others_Terrorism,,delay,all,False,False,3,2017-06-24 01:25:47,auto_gen,111313/18790=592.4%,38783/107753=35.99%
9999,161920ed,Bus Rosalia Indah kecelakaan di jalur Purbalingga,3 Tewas,Crime,Surabaya,delay,android,False,False,3,2017-06-24 02:02:26,jatua,91843/48292=190.2%,4903/85884=5.709%
10000,9127c3e4,Ruhut: Ha Ha Ha pada kebakaran jenggot!,Ahok Tetap di Mako Brimob,Crime,,delay,android,False,False,3,2017-06-24 02:03:12,jatua,361250/117815=306.6%,20975/340587=6.158%
10001,e1624fe3,Bus Jakarta-Solo terjun ke jurang di Purbalingga,Kecelakaan Mudik,Crime,"Semarang,Salatiga,Yogyakarta",delay,android,False,False,3,2017-06-24 02:04:08,jatua,53635/38871=138%,3534/49522=7.136%
10002,3afe5e31,Pencari kayu ini geger lihat temuan selanjutnya,Heran Lihat Tali Biru,Crime,Medan,delay,android,False,False,3,2017-06-24 02:05:03,jatua,1536/2986=51.44%,78/1423=5.481%
10003,431d6117,Ingin menutup semua TK Islam,Pengakuan Menlu Austria,Crime,,delay,android,False,False,3,2017-06-24 02:05:52,jatua,164058/75455=217.4%,8182/156423=5.231%
10004,90164a03,Reaksi Ahmad Dhani sekarang begini,Maia Segera Menikah,News_Entertainment,Medan,delay,android,False,False,3,2017-06-24 02:08:57,jatua,3459/9789=35.34%,216/3191=6.769%
10005, 5c37cea0,"Selalu nampak mesra, begini sikap Nagita ke Raffi",Tertangkap Kamera,News_Entertainment,,delay,android,False,False,3,2017-06-24 02:10:00,jatua,272784/43556=626.3%,19670/254369=7.733%
10006,ff0cb59d,12 Sosok tenar ini pernah jadi cameo film,Nggak Nyangka,News_Entertainment,,delay,android,False,False,3,2017-06-24 02:16:25,jatua,9488/13290=71.39%,439/8633=5.085%
10007, c05847d2,"Begini tampilan resort mewah di Ubud, Bali",Tempat Obama Menginap ,Travel,,delay,android,False,False,3,2017-06-24 02:29:48,jatua,2937/4069=72.18%,231/2727=8.471%
10008,f45d8504,Para artis korea berakting di Labuan Bajo ,Jadi Tempat Syuting,Travel,,delay,android,False,False,3,2017-06-24 02:30:48,jatua,28714/37404=76.77%,1468/26600=5.519%
10009,30f2e420, Datang yuk ke Festival Ba’da Nang MBreksi,Bagi yang Mudik ke Sleman,Travel,"Semarang,Salatiga,Yogyakarta",delay,android,False,False,3,2017-06-24 02:33:40,jatua,408/654=62.39%,15/388=3.866%
10010,f6fd3a19,13 Tempat Ini wajib dikunjungi sebelum punah,Piknik Yuk,Travel,"Jakarta,Bekasi,Tangerang",delay,android,False,False,3,2017-06-24 02:34:48,jatua,34553/35955=96.1%,2149/32678=6.576%
10011, a9272859,Bus tingkat mewah ini bisa dinikmati dari Bogor-Wonogiri,Harganya Rp3 Miliar,Others,Bandung,delay,android,False,False,3,2017-06-24 02:36:46,jatua,930/1438=64.67%,75/828=9.058%
10012,9a145033, WNI di wilayah ISIS: kami ingin kembali ke Indonesia,Sakit-sakitan Terus,Others,,delay,android,False,False,3,2017-06-24 02:37:39,jatua,20593/17515=117.6%,2250/18930=11.89%
10013,fc3e3894,Ratna Sarumpaet 'syok' ari-ari cucunya belum lepas,Atiqah Hasiholan Melahirkan,Religion,,delay,android,False,False,3,2017-06-24 02:38:37,jatua,16970/22923=74.03%,1009/14869=6.786%
10014, 7cad27ee,Ada kejadian unik di keluarga Ashanty dan Anang ,Lebaran ke Jember,News_Entertainment,"Semarang,Salatiga,Yogyakarta",delay,android,False,False,3,2017-06-24 02:57:27,jatua,939/1315=71.41%,55/775=7.097%
10015, b59b1e5b,Perempuan cantik seperti masih ABG ini ternyata ..,Tebak Usianya,Health,,delay,android,False,False,3,2017-06-24 02:58:25,jatua,50879/60306=84.37%,4776/47937=9.963%
10016,edaada76,Hindari perut begah selama lebaran ,Masalah di Hari Raya,Health,,delay,android,False,False,3,2017-06-24 02:59:22,jatua,16084/23702=67.86%,621/14813=4.192%
10017, ea29bc47,Semua keluhkan kondisi jalur lintas timur Sumatera,Pemudik Wajib Baca,Others,Medan,delay,android,False,False,3,2017-06-24 03:03:25,jatua,-/1=-,-/-=-
10018, 1d933954,Australia kirim 2 pesawat pengintai ke Marawi,Lebaran Tetap Perang,Others,,delay,android,False,False,3,2017-06-24 03:04:03,jatua,20079/20857=96.27%,2481/18857=13.16%
10019,48f32787,Gunakan benda ini agar cepat di tol ,Mau Mudikmu Nyaman?,Business,,delay,android,False,False,3,2017-06-24 03:04:57,jatua,133797/24889=537.6%,4421/127871=3.457%
10020,e5d65351,"Pikir-pikir dulu deh, begini kondisi Jakarta ",Mau Takbiran Malam Ini?,Others,"Jakarta,Bekasi,Tangerang",delay,android,False,False,3,2017-06-24 03:06:09,jatua,22699/27250=83.3%,1484/21635=6.859%
10021, c4545b4e,Begini pemandangan lewat Daendles Pantura Tuban-Lamongan,Cara Mudik Terasyik,Travel,"Jakarta,Bekasi,Tangerang",delay,android,False,False,3,2017-06-24 03:07:09,jatua,446/643=69.36%,21/428=4.907%
10022, 29d0a65b,Unduh aplikasi pintar ini buat bikin sembuh,Kamu Insomnia?,Technology,,delay,android,False,False,3,2017-06-24 03:09:12,jatua,20183/30218=66.79%,799/18781=4.254%
10023,77feefbf,"4 Tahun suami idap kanker, sang artis tahunya begini",Ririn Kecolongan,Parenting,Bandung,delay,android,False,False,3,2017-06-24 03:10:55,jatua,9617/15593=61.68%,550/9151=6.01%
10024,8522712a,Keponakan mimpi diajak jalan ke tempat yang indah,Sebelum Jupe Meninggal,News_Entertainment,,delay,android,False,False,3,2017-06-24 03:12:41,jatua,270479/144778=186.8%,14536/238533=6.094%
10025,bebd8856,Kenapa kok merasa bahagia dan sedih sekaligus?,Lebarannya Venna Melinda,Others,,delay,android,False,False,3,2017-06-24 03:14:56,jatua,5293/7053=75.05%,348/4662=7.465%
10026, fe09b3fd,BMW Seri 4 terbaru serbu Indonesia,Keren Banget,Auto,,delay,android,False,False,3,2017-06-24 03:15:52,jatua,8873/14159=62.67%,518/8459=6.124%
10027,30a266c5,10 Momen teraneh yang ditangkap Google Street View,Ini Apa Sih?,Others,,delay,android,False,False,3,2017-06-24 03:17:07,jatua,5694/10252=55.54%,309/5318=5.81%
10028,f6bb92ab,Tampilan sedih Fery Wijaya antar Ririn ke Bandara,Foto Sebelum Meninggal,News_Entertainment,,delay,android,False,False,3,2017-06-24 03:25:12,jatua,283189/159692=177.3%,19203/250805=7.657%
10029,154d6377,Ayu Ting Ting ungkap kebenarannya dengan cara ini ,Beneran Pakai Susuk?,News_Entertainment,,delay,android,False,False,3,2017-06-24 03:31:54,jatua,311657/142797=218.3%,23061/281914=8.18%
10030, a2b8a25a,Kedai roti Amy Qanita yang sepi disarankan begini,Kalah Sama Milik Nagita,Others,Bandung,delay,android,False,False,3,2017-06-24 03:36:58,jatua,1706/2814=60.63%,100/1442=6.935%
10031,1ff568a1,Ashanty ke Jember naik ojek?,Mudik yang Nyentrik,News_Entertainment,,delay,android,False,False,3,2017-06-24 03:39:52,jatua,44791/54206=82.63%,3195/40469=7.895%
10032,91cc0730,Syahrini boyong 25 orang keluarga ke kota ini,Lebaran di Luar Negeri,News_Politics,,delay,android,False,False,3,2017-06-24 03:43:16,jatua,50606/61252=82.62%,3787/48690=7.778%
10033,5d74edd1,"Bayar Rp5 Juta, peserta dijamin raup puluhan juta",Ada Kursus Gaet Pria Kaya,Others,,delay,android,False,False,3,2017-06-24 03:46:17,jatua,1915/2829=67.69%,122/1856=6.573%
10034,54ac4a54,Ada yang terlempar ke luar dan terjepit di roda,Ngerinya Penumpang Bus Rosalia,Crime,,delay,android,False,False,3,2017-06-24 03:51:35,jatua,734255/256653=286.1%,90050/697729=12.91%
10035,44352c51,Pesawat Garuda lakukan hal darurat ini,Kaca Ditabrak Burung,Others,,delay,android,False,False,3,2017-06-24 03:53:01,jatua,15472/16384=94.43%,751/14715=5.104%
10036, d7e8414f, Soal Anang Hermansyah nyalon walikota Malang,Ini yang Benar,News_Entertainment,Surabaya,delay,android,False,False,3,2017-06-24 04:02:49,jatua,2120/2942=72.06%,210/2053=10.23%
10037,43386197,"Melawak soal pembunuhan presiden, jadinya runyam",Johnny Depp Minta Maaf ,Others,,delay,android,False,False,3,2017-06-24 04:34:44,jatua,42388/53909=78.63%,3229/40779=7.918%
10038,9175dea0,Tips Ampuh Mengatasi Mabuk Udara,,Others,,delay,all,False,False,3,2017-06-24 04:43:10,andrewka,1739/2821=61.64%,65/1663=3.909%
10039,3ec0148d,"Teror Gagal, Pelaku Bom Bunuh Diri Masjidil Haram Tewas Dikepung Polisi",,Others_Terrorism,,delay,all,False,False,3,2017-06-24 04:43:14,andrewka,481490/80106=601.1%,23863/459353=5.195%
10040,d48e3a5d,Harley-Davidson Siapkan Skema untuk Caplok Ducati,,Auto,,delay,all,False,False,3,2017-06-24 04:43:18,andrewka,105946/117800=89.94%,4901/101630=4.822%
10041,a511088d,Rombongan Obama Tiba Di Bali,,Travel,,delay,all,False,False,3,2017-06-24 04:43:21,andrewka,2396/4637=51.67%,101/2309=4.374%
10042,4dd86364,"Jokowi-Obama Bakal Makan Siang di Istana, Apa Dibicarakan Ya?",,News_Politics,jakarta,delay,all,False,False,3,2017-06-24 04:43:25,andrewka,4441/5567=79.77%,221/4257=5.191%
10043,d204cb5b,Cara Sri Mulyani Ucapkan Selamat Idul Fitri,,News_Politics,jakarta,delay,all,False,False,3,2017-06-24 04:51:21,andrewka,24472/31191=78.46%,1535/23805=6.448%
10044,cece3a09,"Bukan Cuma CR7, 4 Pemain Jorge Mendes Ini Bisa Kena Kasus Pajak!",,Others,,delay,all,False,False,3,2017-06-24 04:52:26,andrewka,26719/35604=75.04%,1274/25133=5.069%
10045,d7e8414f,"Hoax, Anang Hermansyah Daftar Calon Wali Kota Malang",,News_Entertainment,surabaya,delay,all,False,False,3,2017-06-24 04:52:29,andrewka,37/46=80.43%,3/37=8.108%
10046, 351a8e1b,Lihat dalamnya vila mewah pilihan keluarga Obama,Rp35 Juta Semalam,Travel,"Jakarta,Bekasi,Tangerang",immediately,android,True,False,3,2017-06-24 05:45:40,jatua,135931/24730=549.7%,8892/131366=6.769%
10047,351a8e1b,Lihat dalamnya vila mewah pilihan keluarga Obama,Rp35 Juta Semalam,Travel,Others,immediately,android,True,False,3,2017-06-24 05:47:45,jatua,132560/15077=879.2%,8256/127648=6.468%
10048,351a8e1b,Lihat dalamnya vila mewah pilihan keluarga Obama,Rp35 Juta Semalam,Travel,,delay,android,False,False,3,2017-06-24 05:47:45,auto_gen,218538/97964=223.1%,11845/203551=5.819%
10049, 351a8e1b,Lihat dalamnya vila mewah pilihan keluarga Obama,Rp35 Juta Semalam,Travel,"Jakarta,Bekasi,Tangerang",delay,android,False,False,3,2017-06-24 05:45:40,auto_gen,161634/103631=156%,8766/149890=5.848%
10050,45faec3d,"Dikenal nyentrik, ini fakta putri cantik menteri Susi",Mengenal Nadine Kaiser,News_Entertainment,"Medan,Semarang,Salatiga",immediately,all,True,False,3,2017-06-24 05:54:16,andrewka,14928/16664=89.58%,865/14464=5.98%
10051,17af9361,4 Nastar itu sama dengan setengah piring nasi,Fakta Kue Lebaran,Health,,delay,android,False,False,3,2017-06-24 05:54:19,jatua,12818/19429=65.97%,707/12178=5.806%
10052,45faec3d,"Dikenal nyentrik, ini fakta putri cantik menteri Susi",Mengenal Nadine Kaiser,News_Entertainment,"Medan,Semarang,Salatiga",delay,all,False,False,3,2017-06-24 05:54:16,auto_gen,23646/36532=64.73%,1047/22085=4.741%
10053,f07f49de,"Tubuhnya bertato, tapi ini fakta jati dirinya",Kades Mandi Uang,Others,Surabaya,immediately,all,True,False,3,2017-06-24 05:55:15,andrewka,30349/20424=148.6%,2124/29540=7.19%
10054,f07f49de,"Tubuhnya bertato, tapi ini fakta jati dirinya",Kades Mandi Uang,Others,Surabaya,delay,all,False,False,3,2017-06-24 05:55:15,auto_gen,58587/87522=66.94%,3615/55351=6.531%
10055,341350b3,Paspampres sterilkan area ini Jokowi mau jenguk Solihin,Waspada Bandung Macet,News_Entertainment,Bandung,immediately,all,True,False,3,2017-06-24 05:57:23,andrewka,9887/13586=72.77%,589/9530=6.18%
10056,341350b3,Paspampres sterilkan area ini Jokowi mau jenguk Solihin,Waspada Bandung Macet,News_Entertainment,Bandung,delay,all,False,False,3,2017-06-24 05:57:23,andrewka,15118/26913=56.17%,684/14243=4.802%
10057, 5e611a6,"Polisi sampai turunkan ratusan personelnya, siapa dia?",Evakuasi Terpidana Mati,Crime,,delay,android,False,False,3,2017-06-24 06:00:04,jatua,13853/20464=67.69%,1670/13310=12.55%
10058,71a6ad9e,"Ashanty: ""Iseng banget ya orang taruh foto""",Soal Anang Nyalon,News_Entertainment,Surabaya,delay,all,False,False,3,2017-06-24 06:04:23,jatua,20917/26887=77.8%,1106/18919=5.846%
10059, 78cfba84,Lebaran ini Angel Lelga tak ada yang menemani,Kenapa Sendirian Lagi?,News_Entertainment,Medan,delay,android,False,False,3,2017-06-24 06:05:28,jatua,192/494=38.87%,6/185=3.243%
10060,4631e4b0,Ngadem di 10 desa wisata Ini yuk,Halo Pemudik di Malang,Travel,Surabaya,delay,android,False,False,3,2017-06-24 06:06:25,jatua,560/958=58.46%,31/524=5.916%
10061, 81f25568,Begini caranya bagi kapan jatah Maia & Ahmad Dhani,Lebaran Ala El Rumi,News_Entertainment,,delay,android,False,False,3,2017-06-24 06:09:06,jatua,10684/15162=70.47%,798/10354=7.707%
10062,c307d1bc,Syahrini pakai jalur khusus liburan ke Disneyland,Uang Memudahkan Semua,Others,,delay,android,False,False,3,2017-06-24 06:10:50,jatua,34253/38270=89.5%,2204/32170=6.851%
10063,1dcaf0c1, Imbauan kepada jamaah ini wajib dibaca dulu,Mau Salat Id di Istiqlal?,News_Entertainment,"Jakarta,Bekasi,Tangerang",delay,android,False,False,3,2017-06-24 06:16:10,jatua,5528/7456=74.14%,683/5285=12.92%
10064, 21e8a5d3,Penampakan tiket palsu di Stasiun Pasar Senen,Seperti Uang Mainan,Others,"Jakarta,Bekasi,Tangerang",delay,android,False,False,3,2017-06-24 06:17:19,jatua,6254/8920=70.11%,333/6019=5.532%
10065,5ab4cb26,AM Hendropriyono masih sah pimpin PKPI,Polemik Ketua Partai,News_Politics,jakarta,delay,all,False,False,3,2017-06-24 06:30:15,andrewka,276829/51665=535.8%,41932/266178=15.75%
10066,36531c37,Polri larang warga bertakbiran menggunakan truk,Kisruh Lebaran,Religion,jakarta,delay,all,False,False,3,2017-06-24 06:30:31,andrewka,4432/6524=67.93%,276/4266=6.47%
10067,16447587,Penampakan lokasi pelaku teror masjidil haram meledakkan diri,Bom Bunuh Diri,terrorism,,delay,all,False,False,3,2017-06-24 06:31:01,andrewka,366296/218230=167.8%,23453/345709=6.784%
10068,e06b34cd,Mourinho belum menyerah boyong bek Real Madrid,Jelang Bursa Transfer,News_Sports,,delay,all,False,False,3,2017-06-24 06:54:35,andrewka,82965/43606=190.3%,4113/79291=5.187%
10069,f831fe75,Mudik dan romantisme desa,Dibalik Tradisi Mudik,Others,,delay,all,False,False,3,2017-06-24 06:54:42,andrewka,167408/42088=397.8%,5199/199973=2.6%
10070,bd72508c,"Di Magelang boleh takbiran, tapi tidak boleh terbangkan balon",Jelang Lebaran,Others,,delay,all,False,False,3,2017-06-24 06:54:58,andrewka,1706/2408=70.85%,104/1648=6.311%
10071, 4d2ec7a8,Obama ajak adik tirinya asal Indonesia ke Bali,Reuni Keluarga,News_Politics,,delay,android,False,False,3,2017-06-24 07:08:59,jatua,802/1640=48.9%,40/717=5.579%
10072,33389982,Qatar: tuntutan Saudi Cs tidak masuk akal,Kisruh Timur Tengah,Others,,delay,all,False,False,3,2017-06-24 08:55:45,andrewka,209550/142345=147.2%,12572/201280=6.246%
10073,58504846," Menjelang puasa, yuk bikin amplop untuk THR",Ngabuburit Hari Terakhir,Fashion,,delay,all,False,False,3,2017-06-24 08:56:52,andrewka,9185/12064=76.14%,407/8897=4.575%
10074,1539bc21,12 penumpang terancam tidak bisa pulang kampung,Gara-gara Tiket Palsu,Others,jakarta,delay,all,False,False,3,2017-06-24 08:58:18,andrewka,2489/3957=62.9%,123/2390=5.146%
10075,8b2b65cf,"Jaga jalur Nagreg, polwan ini sempat tadarus Alquran",Hati Jadi Adem ,Religion,Bandung,immediately,all,False,False,3,2017-06-24 10:18:14,erompas,24730/29190=84.72%,1076/23592=4.561%
10076,8307eef6,Istri cantik bos dealer beberkan fakta soal Ahok ini,Update dari Mako Brimob,News_Politics,"Jakarta,Bekasi,Tangerang,Others",immediately,all,True,False,3,2017-06-24 10:42:14,erompas,280176/15393=1820%,17745/268386=6.612%
10077,8307eef6,Istri cantik bos dealer beberkan fakta soal Ahok ini,Update dari Mako Brimob,News_Politics,"Jakarta,Bekasi,Tangerang,Others",delay,all,False,False,3,2017-06-24 10:42:14,auto_gen,1057574/358504=295%,96823/981436=9.865%
10078,19a5e4df,"Incess beberkan tipe cowok idamannya, sanggup?",Mau Sama Syahrini?,News_Entertainment,Surabaya,immediately,all,True,False,3,2017-06-24 10:55:40,calvink,30390/16256=186.9%,1408/29337=4.799%
10079,19a5e4df,"Incess beberkan tipe cowok idamannya, sanggup?",Mau Sama Syahrini?,News_Entertainment,Surabaya,delay,all,False,False,3,2017-06-24 10:55:40,auto_gen,40555/41232=98.36%,1914/38992=4.909%
10080,10b6b08a,Polri temukan rencana serangan di Mako Brimob,Gerak Sesat Teroris Medan,Others_Terrorism,Medan,immediately,all,True,False,3,2017-06-24 10:56:26,calvink,2506/6068=41.3%,117/2383=4.91%
10081,10b6b08a,Polri temukan rencana serangan di Mako Brimob,Gerak Sesat Teroris Medan,Others_Terrorism,Medan,delay,all,False,False,3,2017-06-24 10:56:26,auto_gen,9220/26907=34.27%,451/8830=5.108%
10082,9af6804b,Ingat Juwita Bahar?,"Pedangdut ini lama hilang, begini rupanya sekarang",News_Entertainment,Semarang,immediately,all,True,False,3,2017-06-24 10:56:33,calvink,12379/12575=98.44%,753/11730=6.419%
10083,9af6804b,Ingat Juwita Bahar?,"Pedangdut ini lama hilang, begini rupanya sekarang",News_Entertainment,"Semarang,Salatiga,Yogyakarta",immediately,all,True,False,3,2017-06-24 10:56:33,calvink,4035/6555=61.56%,252/3794=6.642%
10084,9af6804b,Ingat Juwita Bahar?,"Pedangdut ini lama hilang, begini rupanya sekarang",News_Entertainment,"Semarang,Salatiga,Yogyakarta",delay,all,False,False,3,2017-06-24 10:56:33,auto_gen,17381/28083=61.89%,953/16185=5.888%
10085,9af6804b,Ingat Juwita Bahar?,"Pedangdut ini lama hilang, begini rupanya sekarang",News_Entertainment,Semarang,delay,all,False,False,3,2017-06-24 10:56:33,auto_gen,18265/29044=62.89%,1077/16837=6.397%
10086,3819dbae,Masjid di Cipinang Muara Tetapkan Lebaran Hari Senin,,Others,jakarta,delay,all,False,False,3,2017-06-24 11:08:30,calvink,25799/17988=143.4%,1301/25019=5.2%
10087,a3e3b650,"Sebuah Rumah di Jombang Terkena Ledakan, Penyewanya Kabur",,Crime,Surabaya,delay,all,False,False,3,2017-06-24 11:10:35,calvink,39438/43098=91.51%,2397/38327=6.254%
10088,29b7e75f,MUI hingga Muhammadiyah Hadiri Sidang Isbat di Kemenag,,Religion,jakarta,delay,all,False,False,3,2017-06-24 11:10:52,calvink,4925/7272=67.73%,280/4869=5.751%
10089,e9179b0c,Papan Rambu Masuk Tol Kalijagan Rusak Diterjang Elf,,Others,semarang,delay,all,False,False,3,2017-06-24 11:11:43,calvink,3660/4961=73.78%,309/3571=8.653%
10090,49f65670,"Jelang Takbiran, Polda Metro Pulangkan Masyarakat Perbatasan",,Crime,jakarta,delay,all,False,False,3,2017-06-24 11:12:00,calvink,75729/58924=128.5%,4820/74385=6.48%
10091,3c260a53,"Ditanya Pilgub Jabar, Menteri Susi Beri Jawaban Ini",,News_Politics,Bandung,delay,all,False,False,3,2017-06-24 11:13:27,calvink,3183/6439=49.43%,148/3092=4.787%
10092,4159db,Ada BBM Kemasan untuk Pemudik yang Tiris Bahan Bakar di Tol,,Others,,delay,all,False,False,3,2017-06-24 11:17:42,calvink,31269/37131=84.21%,2460/30696=8.014%
10093,e2cffeb4,Arus Lalin Pantura Plumbon Cirebon Sudah Kembali Normal,,Others,Surabaya,delay,all,False,False,3,2017-06-24 11:18:42,calvink,10/13=76.92%,-/9=-
10094,2d14bba,Susi Minta Ikan Ada Dalam Hidangan Lebaran,,Others,jakarta,delay,all,False,False,3,2017-06-24 11:19:03,calvink,1476/2120=69.62%,97/1463=6.63%
10095,c4a6e62e,Bencana Longsor Kubur Ratusan Orang di China,,Others_Natural_Disaster,,delay,all,False,False,3,2017-06-24 11:19:58,calvink,1022/1524=67.06%,50/994=5.03%
10096,8deb90ab,Anies Dicurhati Pedagang Tanah Abang: Penjualan Turun Pak!,,Crime,jakarta,delay,all,False,False,3,2017-06-24 11:20:12,calvink,9599/14342=66.93%,729/9478=7.691%
10097,a7f99abe,Hilang Kendali Bus Rosalia Terjun Ke Jurang,,Crime,"Semarang,Salatiga,Yogyakarta",delay,all,False,False,3,2017-06-24 11:22:34,calvink,17113/15943=107.3%,722/16334=4.42%
10098,d424bfbe,"Liburan ke Bali, Obama Dijadwalkan Kunjungi Museum",,Travel,,delay,all,False,False,3,2017-06-24 11:22:44,calvink,3130/5002=62.57%,86/3057=2.813%
10099,cbcf5aee,Syarat agar PSG Tak Ditinggal Verratti ke Barcelona,,News_Sports,,delay,all,False,False,3,2017-06-24 11:22:52,calvink,32287/39177=82.41%,1198/31447=3.81%
10100,75b11f60,Jokowi Pilih Berlebaran di Jakarta,,News_Politics,jakarta,delay,all,False,False,3,2017-06-24 11:22:59,calvink,9106/8878=102.6%,692/8893=7.781%
10101,c3905229,Puncak Arus Mudik Bandara Juanda,,Others,surabaya,delay,all,False,False,3,2017-06-24 11:23:06,calvink,17769/11256=157.9%,432/17120=2.523%
10102,5f77fc31,Gelandang Persela Gembira Rayakan Idul Fitri Bersama Keluarga,,News_Sports,,delay,all,False,False,3,2017-06-24 11:24:35,calvink,1380/2107=65.5%,74/1342=5.514%
10103,cc8c9b12,Twitter Rilis Emoji Idul Fitri,,News_Entertainment,,delay,all,False,False,3,2017-06-24 11:24:43,calvink,5704/8685=65.68%,340/5575=6.099%
