id,entry_id,title,push_title,category,city,push_type,push_os,push_entire,test_mode,status,insert_time,operator,Receive/Send,Click/Show
8825,b23415c3_in,#MeToo goes viral as women around the world raise voice against sexual harassment,,Crime,,delay,all,False,False,3,2017-10-16 08:46:33,utsavm,103654/-=-,1960/100794=1.945%
8826,1e73670f_in,"Older Pixel has one advantage over Pixel 2, confirms Google",,Technology,,delay,all,False,False,3,2017-10-16 08:46:42,utsavm,95118/-=-,2185/85357=2.56%
8827,36903aaf_in,"Flipkart Diwali Sale 2017: Offers you can avail under Rs 499, Rs 699, and Rs 999",,Technology,,delay,all,False,False,3,2017-10-16 08:46:52,utsavm,532940/-=-,31412/469659=6.688%
8828,582f1fe4_in,Xiaomi phones have disappointing cameras but this HDR+ hack can make them better,,Technology,,delay,all,False,False,3,2017-10-16 08:47:00,utsavm,169917/-=-,5994/152822=3.922%
8829,b09f7d44_in,"Samsung Galaxy J7 Core with 5.5-inch super AMOLED display, 13MP rear camera launched",,Technology,,delay,all,False,False,3,2017-10-16 08:47:32,utsavm,174010/-=-,9170/155494=5.897%
8830,a4d7eec5_in,"जियो, वोडाफोन, एयरटेल और BSNL इस दिवाली दे रहे हैं कस्टमर्स को ये ऑफर्स",,Technology,,delay,all,False,False,3,2017-10-16 08:54:20,utsavm,2659/-=-,230/2442=9.419%
8831,d93ebbbd_in,399 रुपये में 6 महीने करें अनलिमिटेड कॉल,,Technology,,delay,all,False,False,3,2017-10-16 08:54:27,utsavm,2373734/-=-,114102/2155150=5.294%
8832,6a128560_in,"UPPCL Recruitment 2017: 2523 पदों पर भर्ती, ऐसे करें अप्लाई",,Education,,delay,all,False,False,3,2017-10-16 08:54:36,utsavm,19424/-=-,944/17124=5.513%
8833,78e3fd3_in,स्मार्टफोन में यह एक सेटिंग करने के बाद नहीं होगा वायरस अटैक,,Technology,,delay,all,False,False,3,2017-10-16 08:54:43,utsavm,315283/-=-,9129/297500=3.069%
8834,65f22a95_in,JioPhone Vs एयरटेल स्मार्टफोनः जानें कौन-सा फोन है आपके लिए बेहतर?,,Technology,,delay,all,False,False,3,2017-10-16 08:54:51,utsavm,2471248/-=-,95793/2313993=4.14%
8835,ec42a1bd_in,इस दिवाली 40000 रु से कम की रेंज में खरीद सकते हैं ये स्मार्टफोन्स,,Technology,,delay,all,False,False,3,2017-10-16 08:58:24,utsavm,96329/-=-,8081/91884=8.795%
8836,10dc5b6c_in,Ziva Steals Show as She Carries Drinks for MS Dhoni in Celebrity Clasico,,News_Sports,,delay,all,False,False,3,2017-10-16 09:51:10,xinyunx,257094/-=-,8496/210413=4.038%
8837,4d24eb88_in,"लालू ने ट्विटर पर की शेयर की खुद की ये फोटो, यूजर्स ने किए मजेदार कमेंट्स",,News_Politics,,delay,all,False,False,3,2017-10-16 10:02:53,apoorvs,337900/-=-,11547/320902=3.598%
8838,1dc40fbf_in,"69 की उम्र में ऐसे फिट रहती हैं MP हेमा मालिनी, इस खास चीज से रहती हैं दूर",,Health,,delay,all,False,False,3,2017-10-16 10:05:22,apoorvs,58439/-=-,1681/55742=3.016%
8839,23463e1c_in,"बेंगलुरु में धमाके से 4 बिल्डिंग गिरीं: 7 की मौत, अनाथ हुई बच्ची को गोद लेगी सरकार",,Others,,delay,all,False,False,3,2017-10-16 10:07:29,apoorvs,141365/-=-,8044/124173=6.478%
8840,bd0682c3_in,प्रणव मुखर्जी ने बताया- एयरपोर्ट जाकर क्यों की थी रामदेव से मुलाक़ात,,News_Politics,,delay,all,False,False,3,2017-10-16 10:12:57,apoorvs,3597/-=-,167/3453=4.836%
8841,64d858ee_in,"Mohammad Amir is The Outstanding Bowler I have Faced, Says Virat Kohli in a Chat With Aamir Khan",,News_Sports,,delay,all,False,False,3,2017-10-16 10:15:58,xinyunx,337549/-=-,13761/300620=4.578%
8842,3f265546_in,"यौन शोषण में गिरफ्तार जैन मुनि शांतिसागर बोले, सहमति से किया था सम्बन्ध",,Crime,,delay,all,False,False,3,2017-10-16 10:17:43,apoorvs,220352/-=-,6166/206195=2.99%
8843,14067daa_in,"सर्वे: युवाओं की पहली पसंद बने हुए हैं नरेंद्र मोदी, रेस में राहुल-केजरीवाल बहुत पीछे",,News_Politics,,delay,all,False,False,3,2017-10-16 10:21:24,apoorvs,231/-=-,7/216=3.241%
8844,296e0b92_in,Bengaluru building collapse: Death toll climbs to 7,,Others,,delay,all,False,False,3,2017-10-16 10:23:46,apoorvs,109939/-=-,3234/99681=3.244%
8845,d867e093_in,"Jan Dhan effect: Villagers save more, drink less",,Others,,delay,all,False,False,3,2017-10-16 10:42:58,apoorvs,6581/-=-,319/6061=5.263%
8846,e4f5e471_in,Modi Government May Bring AC And Non-AC Restaurants in Same GST Bracket,,Business,,delay,all,False,False,3,2017-10-16 11:18:45,apoorvs,99492/-=-,3367/75590=4.454%
8847,c6119a50_in,"Kavita Singh Makes History, Becomes First Indian Woman to Sign With WWE",,News_Sports,,delay,all,False,False,3,2017-10-16 11:25:01,apoorvs,32218/-=-,827/24031=3.441%
8848,1b153d5a_in,Did you know these plants can keep insects away?,,Health,,delay,all,False,False,3,2017-10-16 11:43:02,apoorvs,3962/-=-,80/3740=2.139%
8849,aff34366_in,Bengaluru Cylinder Blast: Little Girl Rescued From Debris to be Adopted by Govt,,Others,,delay,all,False,False,3,2017-10-16 11:45:21,apoorvs,166047/-=-,2912/124408=2.341%
8850,21ec6b3b_in,Bachchan Family's Pic From Amitabh Bachchan's Birthday Bash Is A Treat,,News_Entertainment.Bollywood,,delay,all,False,False,3,2017-10-16 11:48:26,apoorvs,270330/-=-,6775/279150=2.427%
8851,8e06b015_in,करने जा रहे हैं दिवाली की शॉपिंग तो इन 4 बातों का रखें विशेष ध्यान,,Others,,delay,all,False,False,3,2017-10-16 12:01:36,apoorvs,6915/-=-,251/6849=3.665%
8852,19e4436e_in,"धौनी ने ऐसे 'रोका' इस खिलाड़ी का रास्ता, अभी तक कर रहा है टीम में आने के लिए संघर्ष",,News_Sports.Cricket,,delay,all,False,False,3,2017-10-16 12:01:53,apoorvs,417188/-=-,8547/381123=2.243%
8853,97c5eaa1_in,नीना गुप्ता का खुलकर काम मांगना साहस की बात है - अनुपम खेर,,News_Entertainment,,delay,all,False,False,3,2017-10-16 12:04:34,apoorvs,1738/-=-,71/1700=4.176%
8854,8716fac7_in,"जिस फिल्म पर हो रहा बवाल, जानें उस 'पद्मावती' की असली कहानी",,News_Entertainment.Bollywood,,delay,all,False,False,3,2017-10-16 12:06:41,apoorvs,2909/-=-,189/2842=6.65%
8855,d72204a6_in,दिवाली से पहले ही दिल्ली‍-एनसीआर की हवा हो गई जहरीली,,Others,,delay,all,False,False,3,2017-10-16 12:07:39,apoorvs,8357/-=-,335/7547=4.439%
8856,aabdd613_in,जानें धनतेरस पर क्‍या खरीदें ताकि हो लाभ और खुश रहे घर-परिवार,,Religion,,delay,all,False,False,3,2017-10-16 12:08:49,apoorvs,38036/-=-,2304/35732=6.448%
8857,da8a4937_in,रिलायंस जियो के यूजर्स की संख्या 13 करोड़ के पार: रिपोर्ट,,Technology,,delay,all,False,False,3,2017-10-16 12:09:30,apoorvs,3911/-=-,144/3792=3.797%
8858,a1d321bc_in,"हांगकांग के मैडम तुसाद म्‍यूजियम में नज़र आएगा वरुण धवन का वैक्स स्टेच्यू , देखिए तस्वीरें",,News_Entertainment.Bollywood,,delay,all,False,False,3,2017-10-16 12:13:35,apoorvs,13161/-=-,92/1689=5.447%
8859,3d1d73b1_in,"कुछ कुछ होता है के पूरे हुए 19 साल, काजोल ने कुछ यूं किया याद",,News_Entertainment.Bollywood,,delay,all,False,False,3,2017-10-16 12:13:51,apoorvs,1239/-=-,71/1204=5.897%
8860,4782431c_in,फेस्टिव सेल ऑफर्स: स्मार्टफोन्स पर मिल रहा है 47000 रुपये तक का ऑफर,,Technology,,delay,all,False,False,3,2017-10-16 12:14:52,apoorvs,3908/-=-,152/3822=3.977%
8861,5b31b3bc_in,"Reliance Jio posts Rs 270.6 crore loss, user base jumps to 138.6 million",,Technology,,delay,all,False,False,3,2017-10-16 12:24:06,apoorvs,4085322/-=-,143772/3639886=3.95%
8862,55134afd_in,Diwali special: Rangoli inspired by Padmavati poster will win your heart,,News_Entertainment.Bollywood,,delay,all,False,False,3,2017-10-16 12:50:06,apoorvs,132789/-=-,4903/122424=4.005%
8863,cc861568_in,"Dhanteras 2017: Puja tithi, timings and Muhurat",,Religion,,delay,all,False,False,3,2017-10-16 12:51:04,apoorvs,11670/-=-,422/10486=4.024%
8864,603c8a48_in,Varun Dhawan all set for a grand debut at Madame Tussauds,,News_Entertainment.Bollywood,,delay,all,False,False,3,2017-10-16 12:51:34,apoorvs,182342/-=-,3841/155117=2.476%
8865,d21fb383_in,"KRK takes a dig at Kangana, shares 'proof' of his 'relationship' with Kareena",,News_Entertainment,,delay,all,False,False,3,2017-10-16 12:52:12,apoorvs,112955/-=-,4814/110858=4.342%
8866,5ef09bcd_in,"Hashim Amla breaks Virat Kohli's ODI record, again",,News_Sports.Cricket,,delay,all,False,False,3,2017-10-16 12:52:31,apoorvs,2349374/-=-,57749/2077033=2.78%
8867,7858ae83_in,Rabri Devi skips ED summons for a fourth time,,News_Politics,,delay,all,False,False,3,2017-10-16 12:53:09,apoorvs,300971/-=-,5932/272373=2.178%
8868,71e9ff5a_in,Bigg Boss 11: Evicted contestant Sshivani Dugra makes a major revelation,,News_Entertainment.TV,,delay,all,False,False,3,2017-10-16 12:53:26,apoorvs,43868/-=-,2362/39559=5.971%
8869,73495bbf_in,"Aarushi's murder case: Parents Rajesh Talwar, Nupur Talwar released",,Crime,,delay,all,False,False,3,2017-10-16 12:53:52,apoorvs,86160/-=-,2270/58021=3.912%
8870,3f695fe8_in,Green Diwali: Celebrate the festival of lights in these 5 eco-friendly ways,,Religion,,delay,all,False,False,3,2017-10-16 12:54:35,apoorvs,39044/-=-,10075/35673=28.24%
8871,982b0a5a_in,Is our luggage safe in flights? Video shows otherwise,,Travel,,delay,all,False,False,3,2017-10-16 12:55:06,apoorvs,47529/-=-,2434/46595=5.224%
8872,9ce34d4f_in,'Jumlon ki baarish': Rahul Gandhi on today's massive BJP event in Gujarat,,News_Politics,,delay,all,False,False,3,2017-10-16 12:55:32,apoorvs,20927/-=-,746/18645=4.001%
8873,225ecbef_in,"BJP का प्रचार करेंगे सलमान खान, बहन के ससुर के लिए करेंगे रोड शो",,News_Entertainment.Bollywood,,delay,all,False,False,3,2017-10-16 13:03:48,apoorvs,346965/-=-,16937/319909=5.294%
8874,6bfe352d_in,दीपावली: आज बाजारों में होगी धनवर्षा,,Business,,delay,all,False,False,3,2017-10-16 13:04:09,apoorvs,85/-=-,-/78=-
8875,42ff2ca7_in,"एयर एशिया की फ्लाइट अचानक 22 हजार फीट नीचे आई, वापस ऑस्ट्रेलिया बुलाया",,Others_Plane_Crash,,delay,all,False,False,3,2017-10-16 13:04:24,apoorvs,10539/-=-,680/10132=6.711%
8876,25fe88fe_in,"Bigg Boss 11: बॉलीवुड डेब्यू की तैयारी में ऑस्ट्रेलियाई ब्यूटी क्वीन लुसिंडा निकोलस, देखें तस्वीरें",,News_Entertainment.TV,,delay,all,False,False,3,2017-10-16 13:09:57,apoorvs,10290/-=-,633/9805=6.456%
8877,710f308b_in,OnePlus 3 and 3T users receive first Android Oreo based Open Beta channel release,,Technology,,delay,all,False,False,3,2017-10-16 13:25:34,apoorvs,37258/-=-,1265/32712=3.867%
8878,b7490dd5_in,11-year-old dies of starvation as her family did not have Aadhaar-linked ration card,,Others,,delay,all,False,False,3,2017-10-16 13:25:49,apoorvs,203353/-=-,3487/195056=1.788%
8879,3f985d2f_in,"गॉर्जियस लुक में दिखी संजय दत्त की बेटी, शेयर की बोल्ड PHOTOS",,News_Entertainment.Bollywood,,delay,all,False,False,3,2017-10-16 13:40:39,apoorvs,101693/-=-,6705/85490=7.843%
8880,ab4d846b_in,दिशा पाटनी के लेटेस्ट फोटोशूट की तस्वीरें सोशल मीडिया पर हो रहीं वायरल,,News_Entertainment.Bollywood,,delay,all,False,False,3,2017-10-16 13:40:54,apoorvs,865697/-=-,38849/836896=4.642%
8881,a2c1fb1c_in,"पीएम मोदी का हमला- कांग्रेस इतना गिर सकती है, ऐसा कभी सोचा नहीं था",,News_Politics,,delay,all,False,False,3,2017-10-16 13:41:11,apoorvs,368/-=-,11/325=3.385%
8882,3b48b67e_in,"जब रोहित शर्मा ने मिशेल मैक्‍लेनघन से बुलवाई हिन्‍दी, देखें मजेदार विडियो",,News_Sports.Cricket,,delay,all,False,False,3,2017-10-16 13:41:33,apoorvs,20995/-=-,1207/18747=6.438%
8883,17baf8c7_in,"कश्‍मीर: 3 दिन में पकड़े गए तीन स्‍थानीय आतंकी, IG बोले- बाकी सरेंडर कर दें",,Others_Terrorism,,delay,all,False,False,3,2017-10-16 13:41:43,apoorvs,10/-=-,-/9=-
8884,b4361e6c_in,"वीड‍ियो: भ‍िड़ीं श‍िवसेना की दो मह‍िला पार्षद, दोनों को चाह‍िए था एक ही काम का श्रेय",,News_Politics,,delay,all,False,False,3,2017-10-16 13:41:58,apoorvs,55/-=-,4/57=7.018%
8885,b73fc4d_in,यौन उत्पीड़न: कॉमेडियन मल्लिका दुआ ने बयां किया दर्द,,Crime,,delay,all,False,False,3,2017-10-16 13:42:12,apoorvs,7110/-=-,274/6791=4.035%
8886,7b4c72c6_in,"बैंक या फोन से आधार नंबर जोड़ना है तो ध्‍यान रखें ये बातें, वरना साफ हो सकता है जमा पैसा",,Technology,,delay,all,False,False,3,2017-10-16 15:19:47,apoorvs,20985/-=-,983/19929=4.933%
8887,b8be82d_in,"Anushka Sharma, Virat Kohli are lost in each other's eyes in this dreamy pic",,News_Entertainment,,delay,all,False,False,3,2017-10-16 15:36:11,apoorvs,24997/-=-,275/14553=1.89%
8888,b8be82d_in,"Anushka Sharma, Virat Kohli are lost in each other's eyes in this dreamy pic",,News_Entertainment,,delay,all,False,False,3,2017-10-16 15:37:23,apoorvs,96428/-=-,2174/74075=2.935%
8889,b8be82d_in,"Anushka Sharma, Virat Kohli are lost in each other's eyes in this dreamy pic",,News_Entertainment,,delay,all,False,False,3,2017-10-16 15:39:11,apoorvs,390414/-=-,7483/336600=2.223%
8890,27f2377_in,Facing Wi-Fi issues after iOS 11 update? Here's how you can fix it,,Technology,,delay,all,False,False,3,2017-10-16 16:25:25,apoorvs,7001/-=-,134/4815=2.783%
8891,27f2377_in,Facing Wi-Fi issues after iOS 11 update? Here's how you can fix it,,Technology,,delay,all,False,False,3,2017-10-16 16:26:31,apoorvs,3814/-=-,73/2419=3.018%
8892,27f2377_in,Facing Wi-Fi issues after iOS 11 update? Here's how you can fix it,,Technology,,delay,all,False,False,3,2017-10-16 16:32:51,apoorvs,23474/-=-,432/17704=2.44%
8893,b8be82d_in,"Anushka Sharma, Virat Kohli are lost in each other's eyes in this dreamy pic",,News_Entertainment,,delay,all,False,False,3,2017-10-16 16:37:09,apoorvs,526749/-=-,11229/534009=2.103%
8894,27f2377_in,Facing Wi-Fi issues after iOS 11 update? Here's how you can fix it,,Technology,,delay,all,False,False,3,2017-10-16 16:37:10,apoorvs,6010/-=-,189/5879=3.215%
8895,27f2377_in,Facing Wi-Fi issues after iOS 11 update? Here's how you can fix it,,Technology,,delay,all,False,False,3,2017-10-16 16:40:14,apoorvs,31219/-=-,761/29821=2.552%
8896,113750a1_in,एक-दूसरे को न्यूड तस्वीरें क्यों भेज रही लड़कियां?,,Others,,delay,all,False,False,3,2017-10-17 02:41:27,utsavm,742685/-=-,39253/656890=5.976%
8897,714c00d6_in,"सदाबहार मंदिरा बेदी एक बार फिर उतरीं पूल में, अपनी इन अदाओं से लगा रही हैं पानी में 'आग'",,News_Entertainment,,delay,all,False,False,3,2017-10-17 02:41:45,utsavm,293919/-=-,21986/246934=8.904%
8898,5fc5ba8b_in,"13 एमपी कैमरा के साथ हॉनर का यह फोन हुआ लॉन्च, जानें कीमत",,Technology,,delay,all,False,False,3,2017-10-17 02:41:53,utsavm,7295/-=-,363/6397=5.675%
8899,6014b73d_in,64GB इंटरनल स्टोरेज से लैस स्मार्टफ़ोन की आपकी तलाश ख़त्म होती है यहाँ,,Technology,,delay,all,False,False,3,2017-10-17 02:42:04,utsavm,435/-=-,17/373=4.558%
8900,7864e6ca_in,Samsung ने अपने इन शानदार स्मार्टफोन्स की कीमतें घटाई,,Technology,,delay,all,False,False,3,2017-10-17 02:42:44,utsavm,181472/-=-,9338/137774=6.778%
8901,be444d27_in,"धनतेरस 2017: पूजा में गलती से भी ना करें ये गलती, रखें सावधानी",,Religion,,delay,all,False,False,3,2017-10-17 02:43:20,utsavm,3125/-=-,144/2798=5.147%
8902,3360d850_in,"भविष्यफल: शुक्र तोड़ रहे हैं मंगल की कमर, संबंधों पर पड़ेगा प्रभाव",,Others,,delay,all,False,False,3,2017-10-17 02:43:40,utsavm,11449/-=-,332/9644=3.443%
8903,5f449cd1_in,"मंगलवार: धनतेरस को बन रह है महायोग, इन राशियों की खुलेगें किस्मत के दरवाजे",,Others,,delay,all,False,False,3,2017-10-17 02:43:45,utsavm,2460802/-=-,91982/2186606=4.207%
8904,b2dafb0a_in,मंगलवार 17 अक्टूबर को पेट्रोल-डीजल की कीमत,,Business,,delay,all,False,False,3,2017-10-17 02:43:56,utsavm,14416/-=-,654/14901=4.389%
8905,54dce503_in,मैंने रेप नहीं किया बल्‍कि लड़की कमरे में आई और ...,,Crime,,delay,all,False,False,3,2017-10-17 02:45:42,utsavm,3084159/-=-,141347/2719285=5.198%
8906,71ef40a7_in,कहा-मां कार चला रही थी और उसका हाथ मेरी स्‍कर्ट में था,,Crime,,delay,all,False,False,3,2017-10-17 02:47:42,utsavm,1774297/-=-,62086/1702565=3.647%
8907,dcca7396_in,"किसी की परवाह किए बिना एक-दूसरे की आंखों में डूबे विराट-अनुष्का, तस्वीर हो गई वायरल",,News_Entertainment,,delay,all,False,False,3,2017-10-17 02:47:49,utsavm,6463/-=-,197/5405=3.645%
8908,c517f1ea_in,फेसबुक फ्रेंड बन 18 लड़कियों के साथ किया प्यार सेक्स धोखा,,Crime,,delay,all,False,False,3,2017-10-17 02:47:56,utsavm,2934799/-=-,86229/2710856=3.181%
8909,f74ba5fb_in,"ससुर के साथ बंद कमरे में सुहागरात मना रही थी बहू, पति ने छुपकर देखी करतूत",,Crime,,delay,all,False,False,3,2017-10-17 02:48:09,utsavm,480699/-=-,33390/422208=7.908%
8910,efad01f0_in,"विराट ने खोला राज, बताया किस पाकिस्‍तानी बॉलर से लगता है डर",,News_Sports,,delay,all,False,False,3,2017-10-17 02:48:17,utsavm,3626/-=-,100/3075=3.252%
8911,6b0eae86_in,"Airtel's Latest Offer: Get iPhone 7 At Rs 7,777",Iphone Lowest Price,Technology,,immediately,all,True,False,3,2017-10-17 02:57:29,utsavm,7467595/-=-,256387/5580544=4.594%
8912,d5c1b191_in,"अमीर बन सकते हैं या नहीं, इन 5 तरीकों से करें पता",,Business,,delay,all,False,False,3,2017-10-17 03:09:35,utsavm,282/-=-,2/249=0.8032%
8913,cf7670bc_in,"बिना जिम जाए भी घट सकता है टमी फैट, आजमाएं ये उपाय",,Health,,delay,all,False,False,3,2017-10-17 03:09:43,utsavm,9424/-=-,361/7928=4.553%
8914,13cad0c9_in,"नौकरी तलाशने वालों के खुशखबरी, इस एप के जरिए ढूंढ सकेंगे Job",,Others,,delay,all,False,False,3,2017-10-17 03:09:50,utsavm,6554/-=-,182/5387=3.379%
8915,b581575c_in,"कंपनी ने लॉन्च किया नया बीटा वर्जन, जानें कितना बदल जाएगा आपका वॉट्सऐप",,Technology,,delay,all,False,False,3,2017-10-17 03:09:58,utsavm,298363/-=-,16656/255714=6.514%
8916,9e26f471_in,"सैमसंग ने 5000 रुपए कम की इन 3 फोन की कीमत, अब मिल रहे इतने में",,Technology,,delay,all,False,False,3,2017-10-17 03:10:07,utsavm,359998/-=-,18404/297703=6.182%
8917,b462de09_in,"Refurbished Phone: 10 मॉडल्स इतने सस्ते कहीं नहीं मिलेंगे, ये है ऑफर",,Technology,,delay,all,False,False,3,2017-10-17 03:10:27,utsavm,1274161/-=-,36039/1161883=3.102%
8918,646f6d62_in,"आज लॉन्च होगा BSNL और माइक्रोमैक्स का 4G फीचर फोन, ऐसे होंगे फीचर्स",,Technology,,delay,all,False,False,3,2017-10-17 03:10:38,utsavm,567705/-=-,31180/477167=6.534%
8919,344aeb43_in,"जीमेल पर वापस आ जाएगा किसी को भेजा गया ई-मेल, ये है तरीका",,Technology,,delay,all,False,False,3,2017-10-17 03:13:02,utsavm,4982/-=-,231/4504=5.129%
8920,67b9e40a_in,फिर से इंटरनेट पर छाया ईशा गुप्ता का हॉट अंदाज़,,News_Entertainment,,delay,all,False,False,3,2017-10-17 03:13:51,utsavm,80662/-=-,4092/72748=5.625%
8921,7e133b56_in,आखिर पूछताछ में क्यों हुई हनीप्रीत की तू-तू मैं-मैं?,,Crime,,delay,all,False,False,3,2017-10-17 03:14:55,utsavm,5749/-=-,295/5179=5.696%
8922,7960ae09_in,"9998 रुपए में खरीदें 32 इंच का HD TV, पेन ड्राइव से डायरेक्ट चलेगी मूवी",फ्लिपकार्ट SALE,Technology,,immediately,all,True,False,3,2017-10-17 03:18:22,utsavm,3281117/-=-,157962/3109715=5.08%
8923,d85ed02e_in,"Samsung Galaxy S8+, Galaxy A5, Galaxy A7 (2017) Price in India Slashed",,Technology,,delay,all,False,False,3,2017-10-17 03:49:34,utsavm,432465/-=-,13300/279312=4.762%
8924,d880407f_in,"Paytm and other portals see surge in festive season hotels, flights bookings",,Travel,,delay,all,False,False,3,2017-10-17 03:49:44,utsavm,18839/-=-,341/12330=2.766%
8925,4ff0eb10_in,Diwali 2017: Top 5 Best Flagship Camera Smartphones,,Technology,,delay,all,False,False,3,2017-10-17 03:50:00,utsavm,54062/-=-,2078/35502=5.853%
8926,1f3a889e_in,Beware! Does your mobile or PC support WiFi? They are under possible attack,,Technology,,delay,all,False,False,3,2017-10-17 03:50:16,utsavm,8784/-=-,243/5801=4.189%
8927,30544d19_in,Honor 9i vs Xiaomi Mi A1: Stock Android meets minimal bezels,,Technology,,delay,all,False,False,3,2017-10-17 03:50:25,utsavm,80476/-=-,1823/52992=3.44%
8928,6aa4f9b4_in,IOCL Technician Apprentice Recruitment Begins! Apply Online,,Others,,delay,all,False,False,3,2017-10-17 04:20:02,utsavm,454910/-=-,14760/312572=4.722%
8929,3a9cf57b_in,Xiaomi Mi MIX 2 to Go on Sale for the First Time in India Today,,Technology,,delay,all,False,False,3,2017-10-17 04:20:09,utsavm,661452/-=-,24652/444730=5.543%
8930,a102089a_in,Exclusive: Gauri Lankesh killer caught on cam in big breakthrough,,Crime,,delay,all,False,False,3,2017-10-17 04:20:16,utsavm,342134/-=-,11528/226803=5.083%
8931,ec2a483e_in,Kareena Kapoor And Baby Taimur Return Home For Diwali. See Pics,,News_Entertainment,,delay,all,False,False,3,2017-10-17 04:20:25,utsavm,1077362/-=-,24020/773701=3.105%
8932,ab3cb6e5_in,"Xiaomi Redmi Note 5, Redmi 5 Details Leaked; Launch Expected Soon",,Technology,,delay,all,False,False,3,2017-10-17 04:21:09,utsavm,426849/-=-,17114/266575=6.42%
8933,e2b7b18b_in,"On Dhanteras wishing one of India's greatest dhan Kumble a happy birthday, tweets Sehwag",,News_Sports,,delay,all,False,False,3,2017-10-17 04:25:31,utsavm,441354/-=-,9016/300513=3%
8934,a9a3fa24_in,Anushka Sharma and Virat Kohli look gorgeous together - See latest pics,,News_Entertainment,,delay,all,False,False,3,2017-10-17 04:25:40,utsavm,15000/-=-,373/10181=3.664%
