id,entry_id,title,push_title,category,city,push_type,push_os,push_entire,test_mode,status,insert_time,operator,Receive/Send,Click/Show
21970,c79baf0d_ru,Племяннице Скрипаля отказали в британской визе,,Others,,delay,all,False,0,3,2018-04-06 16:39:27,anastasijaf,-/-=-,-/-=-
21971,c87122e3_ru,Шесть человек погибли при пожаре в Приморье,,Others,,delay,all,False,0,3,2018-04-07 02:05:29,leiz,11/-=-,-/12=-
21972,212e0e6f_ru,Илон Маск испугался «бессмертного Гитлера»,,Others,,delay,all,False,0,3,2018-04-07 02:07:23,leiz,-/-=-,-/-=-
21973,3eab9c25_ru,Сына Шона Пенна и Робин Райт выпустили из тюрьмы,,News_Entertainment,,delay,all,False,0,3,2018-04-07 02:09:05,leiz,-/-=-,-/-=-
21974,429aaec6_ru,Bloomberg назвало самого богатого человека Европы,,Others,,delay,all,False,0,3,2018-04-07 02:13:45,leiz,-/-=-,-/-=-
21975,a410a691_ru,Российские ученые предложили запускать грузы с Марса при помощи тросов,,Technology,,delay,all,False,0,3,2018-04-07 02:16:09,leiz,-/-=-,-/-=-
21981,c2353f5f_ru,Сбежавшие с фермы козы застряли на краю моста,,Others,,delay,all,False,0,3,2018-04-07 04:59:52,leiz,-/-=-,-/-=-
21982,1c3cad5c_ru,В Канаде в результате ДТП погибли несколько хоккеистов,,Others,,delay,all,False,0,3,2018-04-07 05:03:11,leiz,-/-=-,-/-=-
21983,e759c91f_ru,Эксперт оценила важность российского газа для Европы,,Others,,delay,all,False,0,3,2018-04-07 05:05:32,leiz,-/-=-,-/-=-
21984,d355ac3e_ru,В свой день рождения Юлия Самойлова исполнит песню для «Евровидения»,,News_Entertainment,,delay,all,False,0,3,2018-04-07 05:09:13,leiz,-/-=-,-/-=-
21985,f6f01de8_ru,"Опубликовано видео начала ""распада"" Африки надвое",,Others,,delay,all,False,0,3,2018-04-07 05:13:15,leiz,12/-=-,-/12=-
21991,b739ff3f_ru," Как праздновать, когда Крестный ход, приметы и традиции",Пасха 2018,Others,,immediately,all,True,0,3,2018-04-07 06:53:18,leiz,108/-=-,-/12=-
21993,60fb1622_ru,Facebook разрешит каждому пользователю почувствовать себя Цукербергом,,Technology,,delay,all,False,0,3,2018-04-07 08:09:58,leiz,-/-=-,-/1=-
21994,1cf19cf6_ru,Ибрагимович ополчился на ФИФА,,News_Sports,,delay,all,False,0,3,2018-04-07 08:12:34,leiz,-/-=-,-/-=-
21995,66c3052a_ru,Буффон подарил Глушакову свою футболку с автографом,,News_Sports,,delay,all,False,0,3,2018-04-07 08:16:16,leiz,-/-=-,-/-=-
21996,653cc3ce_ru,В результате ДТП в Канаде погибло 14 хоккеистов,,Others,,delay,all,False,0,3,2018-04-07 08:18:17,leiz,-/-=-,-/-=-
21997,707cb66d_ru,Москва названа самым страдающим от пробок городом в Европе,,Others,,delay,all,False,0,3,2018-04-07 08:21:41,leiz,-/-=-,-/-=-
22003,5558a628_ru,"Странный яд, убитый кот, стертый твит и другие нелепости в деле Скрипалей",,Others,,delay,all,False,0,3,2018-04-07 08:50:25,leiz,-/-=-,-/-=-
22004,7289c7cc_ru,Автомобиль впечатался в жилой дом после ДТП в Подмосковье. Видео,,Others,,delay,all,False,0,3,2018-04-07 08:54:56,leiz,-/-=-,-/-=-
22005,134e0c2e_ru,МЧС отчиталось о проверке торговых центров после пожара в «Зимней вишне»,,Others,,delay,all,False,0,3,2018-04-07 08:59:18,leiz,-/-=-,-/-=-
22006,3ec20dcd_ru,Павел Дуров назвал фейком данные о получении британского гражданства,,Others,,delay,all,False,0,3,2018-04-07 09:02:23,leiz,-/-=-,-/-=-
22007,1a3b0874_ru,Интернет подвергся мировой ботнет-атаке,,Technology,,delay,all,False,0,3,2018-04-07 09:09:04,leiz,-/-=-,-/-=-
22013,e84e757f_ru,Стало известно о планах Пучдемона бежать в Россию,,Others,,delay,all,False,0,3,2018-04-07 10:07:45,leiz,-/-=-,-/-=-
22014,f7f03757_ru,Мужчина провалился под лед на Москве-реке,,Others,,delay,all,False,0,3,2018-04-07 10:09:28,leiz,-/-=-,-/-=-
22015,b8d450ba_ru,В Новгородской области сотрудник полиции присваивал выплаты ветеранам,,Others,,delay,all,False,0,3,2018-04-07 10:11:54,leiz,-/-=-,-/-=-
22016,de86a0f_ru,"Датчане сняли на видео неудачный снос башни, упавшей на городскую библиотеку",,Others,,delay,all,False,0,3,2018-04-07 10:13:47,leiz,-/-=-,-/-=-
22017,df5ead5b_ru,Чудо схождения Благодатного огня: прямая трансляция,,Others,,delay,all,False,0,3,2018-04-07 10:14:46,anastasijaf,-/-=-,-/-=-
22018,c1096596_ru,Экипаж арестованного на Украине судна «Норд» отпустили на свободу,,Others,,delay,all,False,0,3,2018-04-07 10:15:48,anastasijaf,-/-=-,-/-=-
22019,d1d9a089_ru,Экс-коллега Дурова рассказал секреты шифрования сообщений в Telegram,,Others,,delay,all,False,0,3,2018-04-07 10:16:35,anastasijaf,-/-=-,-/-=-
22020,7c85fe6f_ru,В Италии подросток пропагандировал ИГИЛ в Telegram,,Others,,delay,all,False,0,3,2018-04-07 10:16:38,leiz,-/-=-,-/-=-
22021,f52d0981_ru,"Пореченков назвал ""мусорными троллями"" всех критиков Козловского",,News_Entertainment,,delay,all,False,0,3,2018-04-07 10:17:23,anastasijaf,-/-=-,-/-=-
22022,a97aedfb_ru,Появилось полное видео нападения Макгрегора на автобус с бойцами UFC,,Others,,delay,all,False,0,3,2018-04-07 10:18:19,anastasijaf,-/-=-,-/-=-
22023,6af27afb_ru,"Ученые показали место, где мы будем жить на Марсе",,Others,,delay,all,False,0,3,2018-04-07 10:19:37,leiz,-/-=-,-/-=-
22024,aa19b5c0_ru,В мире свирепствуют пожары: ТОП-5 происшествий недели,,Others,,delay,all,False,0,3,2018-04-07 10:21:12,leiz,-/-=-,-/-=-
22026,fd44b2f2_ru,Какие продукты можно и нельзя класть в пасхальную корзину,,Others,,delay,all,False,0,3,2018-04-07 10:22:22,leiz,-/-=-,-/-=-
22037,409ce69_ru,Япония создала первое со времен Второй мировой подразделение морского десанта,,Others,,delay,all,False,0,3,2018-04-07 10:55:58,anastasijaf,-/-=-,-/-=-
22038,d2d17155_ru,"Санкции США бьют по простым американцам, заявили в МИД",,News_Politics,,delay,all,False,0,3,2018-04-07 10:56:59,anastasijaf,-/-=-,-/-=-
22039,3f5ef3bf_ru,Защитники животных требуют расследовать гибель морских свинок и кота Скрипалей,,Others,,delay,all,False,0,3,2018-04-07 10:59:05,anastasijaf,-/-=-,-/-=-
22041,7442820c_ru,Менингит и пневмония: что ждет Россию весной,,Others,,delay,all,False,0,3,2018-04-07 11:02:40,anastasijaf,-/-=-,-/-=-
22045,21d12d25_ru,Посольство России направило МИД Британии ноту о встрече с Джонсоном,,Others,,delay,all,False,0,3,2018-04-07 11:21:40,anastasijaf,-/-=-,-/-=-
22046,ba819059_ru,Благодатный огонь сошел в храме Воскресения Христова в Иерусалиме,,Others,,immediately,all,True,0,3,2018-04-07 11:23:13,anastasijaf,12/-=-,-/12=-
22047,a669118e_ru,Вашингтон заблокировал проект заявления Совбеза ООН по сектору Газа,,Others,,delay,all,False,0,3,2018-04-07 11:44:31,anastasijaf,-/-=-,-/-=-
22050,fd7d5726_ru,Скрипаль заговорил,,Others,,delay,all,False,0,3,2018-04-07 12:25:50,anastasijaf,-/-=-,-/-=-
22052,fcf84d_ru,Минфин США назвал Катерину Тихонову дочерью Путина,,Others,,delay,all,False,0,3,2018-04-07 13:58:54,anastasijaf,-/-=-,-/-=-
22054,6e6a22d3_ru,"СМИ: грузовик въехал в группу людей в Мюнстере, три человека погибли",,Others,,immediately,all,True,0,3,2018-04-07 15:05:37,anastasijaf,-/-=-,-/-=-
22057,317eb475_ru,Макгрегор взял кредит на освобождение под залог,,Others,,delay,all,False,0,3,2018-04-08 02:23:53,alexandr,-/-=-,-/-=-
22058,dd5cfaf5_ru,Дубль Овечкина помог «Вашингтону» выиграть в матче НХЛ,,News_Sports,,delay,all,False,0,3,2018-04-08 02:25:04,alexandr,-/-=-,-/-=-
22059,562e93c4_ru,В России протестировали руку-манипулятор перед установкой на МКС,,Technology,,delay,all,False,0,3,2018-04-08 02:25:40,alexandr,-/-=-,-/-=-
22060,e5c01bde_ru,Власти РФ поздравили с Пасхой православных христиан,,Others,,delay,all,False,0,3,2018-04-08 02:26:17,alexandr,-/-=-,-/-=-
22061,cfe2f775_ru,Путин подписал указ о новых правилах празднования памятных дат,,Others,,delay,all,False,0,3,2018-04-08 02:27:36,alexandr,-/-=-,-/-=-
22062,6bf48cbc_ru,В результате пожара в Trump Tower пять человек пострадали,,Others,,delay,all,False,0,3,2018-04-08 02:28:39,alexandr,-/-=-,-/-=-
22063,f82b771d_ru,Скрипалей предложили переправить в США под чужими именами,,Others,,delay,all,False,0,3,2018-04-08 02:30:47,alexandr,-/-=-,-/-=-
22064,4d32b4b1_ru,Бывший президент Бразилии сдался полиции,,Others,,delay,all,False,0,3,2018-04-08 02:32:20,alexandr,-/-=-,-/-=-
22065,d871c09e_ru,Нурмагомедов пожелал разобраться с напавшим на автобус с бойцами Макгрегором,,Others,,delay,all,False,0,3,2018-04-08 02:33:14,alexandr,12/-=-,-/12=-
22066,8a7c7242_ru,Зидан отказал «Барселоне» в почестях,,News_Sports,,delay,all,False,0,3,2018-04-08 02:34:43,alexandr,-/-=-,-/-=-
22067,c2d18da0_ru,Бойцу Лобову запретили посещать турнир UFC 223,,News_Sports,,delay,all,False,0,3,2018-04-08 02:43:23,alexandr,-/-=-,-/-=-
22068,46565333_ru,Небензя: новые факты могут изменить все дело Скрипаля,,News_Entertainment,,delay,all,False,0,3,2018-04-08 02:44:19,alexandr,41/-=-,-/-=-
22076,bb5ae7de_ru,Что говорят историки о воскресении Христа,"""Даже апостолы не поверили""",Others,,immediately,all,True,0,3,2018-04-08 07:20:24,alexandr,13/-=-,-/13=-
22077,f3e199c2_ru,Направлявшийся на Украину сухогруз разрушил исторический особняк с рестораном,,Others,,delay,all,False,0,3,2018-04-08 07:31:33,xinyunx,36/-=-,-/-=-
22078,4b64634f_ru,"Угроза для жизни. 12 бытовых вещей, которые могут вызвать рак",,Others,,delay,all,False,0,3,2018-04-08 07:32:14,xinyunx,3/-=-,-/4=-
22079,7abdebc1_ru,Украина пообещала выпустить моряков с «Норда» из страны,,Others,,delay,all,False,0,3,2018-04-08 07:46:26,xinyunx,-/-=-,-/-=-
22080,3e9b1ce3_ru,Иранские власти не выпускают пассажиров «Уральских авиалиний» из Дубая,,Others,,delay,all,False,0,3,2018-04-08 08:19:29,xinyunx,-/-=-,-/-=-
22081,8f8fb7c5_ru,"Гид покупателя. Советы, которые помогут сэкономить в магазине",,Others,,delay,all,False,0,3,2018-04-08 08:24:27,xinyunx,41/-=-,-/-=-
22085,68372f91_ru,"Под Великим Новгородом сгорел жилой дом, погибли пять человек",,Others,,delay,all,False,0,3,2018-04-08 10:34:13,aleksandrak,-/-=-,-/-=-
22086,744598a_ru,"Украина гарантирует морякам ""Норда"" переход границы с Россией",,Others,,delay,all,False,0,3,2018-04-08 10:36:01,aleksandrak,-/-=-,-/-=-
22088,994fc598_ru,День войск противовоздушной обороны,,Others,,delay,all,False,0,3,2018-04-08 10:39:30,aleksandrak,-/-=-,-/-=-
22089,977e8ad6_ru,Норвежскому лыжнику Клэбо подарили оленя,,Others,,delay,all,False,0,3,2018-04-08 10:41:37,aleksandrak,-/-=-,-/-=-
22093,7b49139_ru,"В Крыму электричка столкнулась с автобусом, пять человек погибли",,Others,,delay,all,False,0,3,2018-04-08 10:51:28,aleksandrak,-/-=-,-/-=-
22094,715502db_ru,Видео: Машина провалилась под землю в Ростове,,Others,,delay,all,False,0,3,2018-04-08 11:50:07,borisf,-/-=-,-/-=-
22095,ffb12f78_ru,Можно ли вообще приготовить вкусное блюдо в микроволновке?,,Others,,delay,all,False,0,3,2018-04-08 12:05:37,borisf,-/-=-,-/-=-
22096,a1403744_ru,"Не то, что вы ждали: АВТОВАЗ рассказал о новой LADA Granta",,Auto,,delay,all,False,0,3,2018-04-08 13:57:40,borisf,73/-=-,-/-=-
22097,c9f7b7df_ru,Какой штраф предусмотрен за просроченный бинт в аптечке,,Others,,delay,all,False,0,3,2018-04-08 13:59:09,borisf,-/-=-,-/-=-
22098,76cfb290_ru,Почему не принято посещать кладбище на Пасху?,,Others,,delay,all,False,0,3,2018-04-08 14:05:03,borisf,-/-=-,-/-=-
22100,f14ec424_ru,Цукерберг рассказал об ужесточении правил в Facebook,,Others,,delay,all,False,0,3,2018-04-08 14:19:06,aleksandrak,-/-=-,-/-=-
22106,78892562_ru,Пьяные школьники залезли на Эрмитаж по фасаду,,Others,,delay,all,False,0,3,2018-04-08 14:26:40,aleksandrak,-/-=-,-/-=-
22108,834a39e1_ru,Трамп обвинил Путина и Иран после сообщений о химатаке в Сирии,,News_Politics,,delay,all,False,0,3,2018-04-08 14:35:55,borisf,-/-=-,-/-=-
22109,b7a1244b_ru,Яйца всего мира: как отмечают Пасху за рубежом,,Others,,delay,all,False,0,3,2018-04-08 14:36:49,borisf,-/-=-,-/-=-
22111,63a82aea_ru,«Россия 24» рассказала о сожжении кота Скрипаля из огнемета,,Others,,delay,all,False,0,3,2018-04-08 14:38:10,borisf,-/-=-,-/-=-
22112,3d93df99_ru,Скрипали могут получить новые личности в США,,Others,,delay,all,False,0,3,2018-04-08 14:42:22,borisf,-/-=-,-/-=-
22113,c690581f_ru,Смартфоны iPhone и Samsung резко подешевели в России,,Technology,,delay,all,False,0,3,2018-04-08 14:45:52,borisf,-/-=-,-/-=-
22120,c99a079b_ru,В США отделение полиции приняло на работу котенка,,Others,,delay,all,False,0,3,2018-04-08 16:41:12,borisf,40/-=-,-/-=-
22124,e86451c7_ru,Груда искореженного металла: маршрутка с людьми перевернулась несколько раз,,Others,,delay,all,False,0,3,2018-04-08 17:05:55,alexandr,-/-=-,-/-=-
22125,3bf30539_ru,Названы худшие фильмы лучших режиссеров,,News_Entertainment,,delay,all,False,0,3,2018-04-08 17:06:41,alexandr,72/-=-,-/-=-
22129,a30a9d9c_ru,Британцев защитят от «Новичка» трехметровыми заборами,,Others,,delay,all,False,0,3,2018-04-08 18:34:16,aleksandrak,-/-=-,-/-=-
22132,1f31cdc3_ru,Почти две трети россиян поддерживают ядерную энергетику,,Others,,delay,all,False,0,3,2018-04-09 02:03:39,alexandr,-/-=-,-/-=-
22133,70113a88_ru,Роспотребнадзор предупредил о начале активности клещей в России,,Others,,delay,all,False,0,3,2018-04-09 02:04:42,alexandr,-/-=-,-/-=-
22134,17b850db_ru,Минтранс настроен значительно увеличить штраф за задержку вылета,,Others,,delay,all,False,0,3,2018-04-09 02:05:31,alexandr,-/-=-,-/-=-
22135,1dbf98b3_ru,Минстрой поручил проверить соблюдение норм размещения детских комнат в ТЦ,,Others,,delay,all,False,0,3,2018-04-09 02:06:09,alexandr,-/-=-,-/-=-
22136,e61a9df5_ru,Разработчик «Новичка» перечислил способные произвести яд страны,,Others,,delay,all,False,0,3,2018-04-09 02:07:55,alexandr,-/-=-,-/-=-
22137,f5f6c879_ru,Китай запретил ввоз в КНДР материалов для оружия массового уничтожения,,News_Politics,,delay,all,False,0,3,2018-04-09 02:08:39,alexandr,-/-=-,-/-=-
22138,7dbf5f1d_ru,На нарушающий законы физики двигатель дали денег,,Science,,delay,all,False,0,3,2018-04-09 02:14:48,alexandr,-/-=-,-/-=-
22139,bafe88ad_ru,Скончалась актриса Лейла Абашидзе,,News_Entertainment,,delay,all,False,0,3,2018-04-09 02:16:16,alexandr,-/-=-,-/72=-
22145,a343c7a6_ru,В ближайшие дни в России снова пойдет снег,Прогноз погоды,Others,,immediately,all,True,0,3,2018-04-09 06:27:01,alexandr,42/-=-,-/113=-
22153,c21a4676_ru,Стала известна судьба проекта МММ после смерти Мавроди,,Others,,delay,all,False,0,3,2018-04-09 08:03:17,xinyunx,-/-=-,-/-=-
22154,7b2b69c0_ru,"Не квартира, а сказка. 7 последних тенденций в интерьере",,Others,,delay,all,False,0,3,2018-04-09 08:06:37,xinyunx,-/-=-,-/-=-
22155,f8649e4f_ru,"В Госдепе рассказали, что будет со странами, нарушившими антироссийские санкции",,Others,,delay,all,False,0,3,2018-04-09 08:06:48,xinyunx,-/-=-,-/-=-
22156,61a11bd7_ru,Ковальчук объявил об уходе из СКА,,News_Sports,,delay,all,False,0,3,2018-04-09 08:10:20,borisf,-/-=-,-/-=-
22157,9fe8127f_ru,Тулееву предложили новую должность в Кузбассе,,Others,,delay,all,False,0,3,2018-04-09 08:12:26,borisf,-/-=-,-/-=-
22158,586b49ef_ru,YouTube обвинили в шпионаже за миллионами детей,,Others,,delay,all,False,0,3,2018-04-09 08:13:07,borisf,-/-=-,-/-=-
22159,86110e1e_ru,США опасаются новых покушений на российских перебежчиков за рубежом,,Others,,delay,all,False,0,3,2018-04-09 08:18:06,xinyunx,-/-=-,-/-=-
22160,b1d62daf_ru,Сколько сока в «стопроцентном» соке?,,Others,,delay,all,False,0,3,2018-04-09 08:23:08,borisf,-/-=-,-/-=-
22161,6ecf0c12_ru,Рубль резко падает к евро и доллару,,Business,,delay,all,False,0,3,2018-04-09 08:27:28,borisf,2/-=-,-/-=-
22162,27745fda_ru,Go West: люди бегут из Прибалтики,,News_Politics,,delay,all,False,0,3,2018-04-09 08:33:46,xinyunx,-/-=-,-/-=-
22163,33c0e377_ru,Опубликовано видео ракетного удара по сирийской авиабазе,,News_Politics,,delay,all,False,0,3,2018-04-09 08:59:21,xinyunx,-/-=-,-/73=-
22164,2afc1658_ru,"Умер голос ""Винни-Пуха"" и ""Утиных историй""",,News_Entertainment,,delay,all,False,0,3,2018-04-09 09:42:54,aleksandrak,-/-=-,-/-=-
22165,2d62e1db_ru,Российские моряки без денег застряли в Намибии,,Others,,delay,all,False,0,3,2018-04-09 09:44:36,aleksandrak,-/-=-,-/-=-
22167,e9e17c40_ru,К чему приведёт ликвидация «прожиточного минимума»?,,Others,,delay,all,False,0,3,2018-04-09 09:46:46,aleksandrak,2/-=-,-/2=-
22168,91218f62_ru,Сайт знакомств Tinder используют для игры в слова,,Others,,delay,all,False,0,3,2018-04-09 09:48:13,aleksandrak,-/-=-,-/-=-
22172,d5436b27_ru,Туризм: популярные направления на майские праздники,,Others,,delay,all,False,0,3,2018-04-09 09:53:32,aleksandrak,-/-=-,-/-=-
22173,8e343b64_ru,"Вести.net: в соцсети ""ВКонтакте"" появятся голосовые звонки",,Technology,,delay,all,False,0,3,2018-04-09 09:54:34,aleksandrak,-/-=-,-/-=-
22174,4b91618_ru,Сколько россияне сэкономили на налогах,,Others,,delay,all,False,0,3,2018-04-09 09:56:00,aleksandrak,-/-=-,-/-=-
22176,f90099e8_ru,Тулееву предложили новую должность,,Others,,delay,all,False,0,3,2018-04-09 10:00:00,aleksandrak,-/-=-,-/-=-
22178,2737c910_ru,"В Берлине синагогу, мечеть и церковь построят в одном здании",,Others,,delay,all,False,0,3,2018-04-09 10:02:31,aleksandrak,-/-=-,-/-=-
22179,1ab4903d_ru,Доказано наличие сложного мышления у неандертальцев,,Others,,delay,all,False,0,3,2018-04-09 10:04:46,aleksandrak,-/-=-,-/-=-
22180,1dea443e_ru,У бактерий найден новый механизм памяти,,Science,,delay,all,False,0,3,2018-04-09 10:06:30,aleksandrak,-/-=-,-/-=-
22181,313780b2_ru,В космосе откроется первый отель,,Others,,delay,all,False,0,3,2018-04-09 10:07:54,aleksandrak,-/-=-,-/-=-
22182,1375b0dd_ru,Российский фондовый рынок рухнул после введения санкций США,,Business,,delay,all,False,0,3,2018-04-09 12:02:57,borisf,-/-=-,-/-=-
22183,67b95be2_ru,Рубль падает рекордными темпами,,Business,,delay,all,False,0,3,2018-04-09 12:05:28,borisf,-/-=-,-/-=-
22184,7cbed2a1_ru,Кремль оценил катастрофический обвал российских бирж из-за санкций США,,Others,,delay,all,False,0,3,2018-04-09 12:08:10,borisf,-/-=-,-/-=-
22185,aa6bf1cf_ru,В России будут продавать дешевые иномарки из Азербайджана,,Auto,,delay,all,False,0,3,2018-04-09 12:10:11,borisf,-/-=-,-/-=-
22196,c2a03388_ru,Уголовное дело возбудили на Урале после госпитализации 13 школьников,,Others,,delay,all,False,0,3,2018-04-09 12:22:40,alexandr,-/-=-,-/-=-
22198,4d240732_ru,Кабмин РФ разработает меры поддержки попавших под санкции США компаний,,Others,,delay,all,False,0,3,2018-04-09 12:23:16,alexandr,-/-=-,-/-=-
22199,18c02a23_ru,Индексы Мосбиржи и РТС ускорили падение до 9–10%,,Business,,delay,all,False,0,3,2018-04-09 12:23:48,alexandr,-/-=-,-/-=-
22201,a2759c18_ru,Курс доллара преодолел отметку в 59 рублей впервые с декабря 2017 года,,Business,,delay,all,False,0,3,2018-04-09 12:24:31,alexandr,-/-=-,-/-=-
22202,c7f161c8_ru,50 богатейших россиян потеряли за день почти $12 млрд,,Business,,delay,all,False,0,3,2018-04-09 12:37:41,borisf,-/-=-,-/-=-
22203,813aba2e_ru,США грозят покарать всех друзей России,,Others,,delay,all,False,0,3,2018-04-09 12:46:27,borisf,-/-=-,-/-=-
22204,1aaccd7e_ru,Рубль дешевеет. Покупать сейчас ли доллары и евро?,,Business,,delay,all,False,0,3,2018-04-09 13:54:55,borisf,-/-=-,-/-=-
22212,ca90735d_ru,Врачи скорой помощи начали забастовку,,Others,,delay,all,False,0,3,2018-04-09 14:32:16,aleksandrak,-/-=-,-/-=-
22213,b9c20b53_ru,"Одному из самолетов ""Аэрофлота"" присвоят имя Хворостовского",,News_Entertainment,,delay,all,False,0,3,2018-04-09 14:34:18,aleksandrak,-/-=-,-/-=-
22215,af32760c_ru,Россия выступила против пересмотра границ космоса,,Others,,delay,all,False,0,3,2018-04-09 14:37:15,aleksandrak,-/-=-,-/-=-
22216,6797145a_ru,Как стать миллионером: 9 советов от Уоррена Баффетта,,Others,,delay,all,False,0,3,2018-04-09 14:39:59,aleksandrak,-/-=-,-/-=-
22218,4d99c845_ru,В РПЦ разрешили не верить в схождение благодатного огня на Пасху,,Others,,delay,all,False,0,3,2018-04-09 14:45:18,aleksandrak,-/-=-,-/-=-
22219,456cb6ca_ru,Назван безотказный способ избежать преждевременной смерти,,Others,,delay,all,False,0,3,2018-04-09 14:46:12,aleksandrak,-/-=-,-/-=-
22220,2e65ac61_ru,Российские туристы назвали самые веселые страны,,Others,,delay,all,False,0,3,2018-04-09 14:46:53,aleksandrak,-/-=-,-/-=-
